{
  "municipio": "Carmen de Areco",
  "numero_boletin": "30º",
  "fecha_boletin": "02/01/2026",
  "boletin_url": "https://sibom.slyt.gba.gob.ar/bulletins/14177",
  "status": "completed",
  "total_normas": 50,
  "normas": [
    {
      "id": "2331016",
      "tipo": "decreto",
      "numero": "1111",
      "titulo": "Decreto Nº 1111",
      "fecha": "Carmen de Areco, 18/07/2025",
      "municipio": "Carmen de Areco",
      "url": "https://sibom.slyt.gba.gob.ar/bulletins/14177/contents/2331016",
      "contenido": "Sistema de Boletín Oficial Municipal | Buenos Aires Provincia\nINICIO\nACERCA DEL SIBOM\nBOLETINES\nMUNICIPIOS\nADMINISTRACION\nSistema de Boletines Oficiales Municipales (SIBOM)\nSistema de Boletines Oficiales Municipales (SIBOM)\nSistema de Boletines Oficiales Municipales (SIBOM)\nSistema de Boletines Oficiales Municipales (SIBOM)\nSistema de Boletines Oficiales Municipales (SIBOM)\nBoletines/Carmen de Areco\nDecreto Nº1111\nDecreto Nº 1111\nPublicado en versión extractada\nCarmen de Areco, 18/07/2025\nLa solicitud presentada por la Sra.\nCISTERNA, NOELIA BEATRIZ\nRedes Sociales\nContacto\nAutoridad de Aplicación\nSecretaría General\nSubsecretaría Legal y Técnica\nGuía Servicios\nPortal de trámites\nExpedientes\nSeguridad Vial\nARBA\nBoletín Oficial\nRegistro de las Personas\nContrataciones\nVer Todos\nPolíticas de privacidad\nUso Interno\nWebmail (gba.gob.ar)\nWebmail HORDE\nSistemas\nGDEBA\nPortal del Empleado\nMesa de Ayuda\nSIAPE",
      "tablas": [],
      "montos_extraidos": [],
      "metadata": {
        "longitud_caracteres": 909,
        "tiene_tablas": false,
        "total_tablas": 0,
        "total_montos": 0
      }
    },
    {
      "id": "2331018",
      "tipo": "decreto",
      "numero": "1112",
      "titulo": "Decreto Nº 1112",
      "fecha": "Carmen de Areco, 18/07/2025",
      "municipio": "Carmen de Areco",
      "url": "https://sibom.slyt.gba.gob.ar/bulletins/14177/contents/2331018",
      "contenido": "Sistema de Boletín Oficial Municipal | Buenos Aires Provincia\nINICIO\nACERCA DEL SIBOM\nBOLETINES\nMUNICIPIOS\nADMINISTRACION\nSistema de Boletines Oficiales Municipales (SIBOM)\nSistema de Boletines Oficiales Municipales (SIBOM)\nSistema de Boletines Oficiales Municipales (SIBOM)\nSistema de Boletines Oficiales Municipales (SIBOM)\nSistema de Boletines Oficiales Municipales (SIBOM)\nBoletines/Carmen de Areco\nDecreto Nº1112\nDecreto Nº 1112\nPublicado en versión extractada\nCarmen de Areco, 18/07/2025\nLa solicitud presentada por la Sra.\nRAINOLDI, MONICA PATRICIA\nRedes Sociales\nContacto\nAutoridad de Aplicación\nSecretaría General\nSubsecretaría Legal y Técnica\nGuía Servicios\nPortal de trámites\nExpedientes\nSeguridad Vial\nARBA\nBoletín Oficial\nRegistro de las Personas\nContrataciones\nVer Todos\nPolíticas de privacidad\nUso Interno\nWebmail (gba.gob.ar)\nWebmail HORDE\nSistemas\nGDEBA\nPortal del Empleado\nMesa de Ayuda\nSIAPE",
      "tablas": [],
      "montos_extraidos": [],
      "metadata": {
        "longitud_caracteres": 910,
        "tiene_tablas": false,
        "total_tablas": 0,
        "total_montos": 0
      }
    },
    {
      "id": "2331019",
      "tipo": "decreto",
      "numero": "1113",
      "titulo": "Decreto Nº 1113",
      "fecha": "Carmen de Areco, 18/07/2025",
      "municipio": "Carmen de Areco",
      "url": "https://sibom.slyt.gba.gob.ar/bulletins/14177/contents/2331019",
      "contenido": "Sistema de Boletín Oficial Municipal | Buenos Aires Provincia\nINICIO\nACERCA DEL SIBOM\nBOLETINES\nMUNICIPIOS\nADMINISTRACION\nSistema de Boletines Oficiales Municipales (SIBOM)\nSistema de Boletines Oficiales Municipales (SIBOM)\nSistema de Boletines Oficiales Municipales (SIBOM)\nSistema de Boletines Oficiales Municipales (SIBOM)\nSistema de Boletines Oficiales Municipales (SIBOM)\nBoletines/Carmen de Areco\nDecreto Nº1113\nDecreto Nº 1113\nPublicado en versión extractada\nCarmen de Areco, 18/07/2025\nLa solicitud presentada por la Sra.\nSECUELO, GLADIS NOEMI\nRedes Sociales\nContacto\nAutoridad de Aplicación\nSecretaría General\nSubsecretaría Legal y Técnica\nGuía Servicios\nPortal de trámites\nExpedientes\nSeguridad Vial\nARBA\nBoletín Oficial\nRegistro de las Personas\nContrataciones\nVer Todos\nPolíticas de privacidad\nUso Interno\nWebmail (gba.gob.ar)\nWebmail HORDE\nSistemas\nGDEBA\nPortal del Empleado\nMesa de Ayuda\nSIAPE",
      "tablas": [],
      "montos_extraidos": [],
      "metadata": {
        "longitud_caracteres": 906,
        "tiene_tablas": false,
        "total_tablas": 0,
        "total_montos": 0
      }
    },
    {
      "id": "2331020",
      "tipo": "decreto",
      "numero": "1114",
      "titulo": "Decreto Nº 1114",
      "fecha": "Carmen de Areco, 18/07/2025",
      "municipio": "Carmen de Areco",
      "url": "https://sibom.slyt.gba.gob.ar/bulletins/14177/contents/2331020",
      "contenido": "Sistema de Boletín Oficial Municipal | Buenos Aires Provincia\nINICIO\nACERCA DEL SIBOM\nBOLETINES\nMUNICIPIOS\nADMINISTRACION\nSistema de Boletines Oficiales Municipales (SIBOM)\nSistema de Boletines Oficiales Municipales (SIBOM)\nSistema de Boletines Oficiales Municipales (SIBOM)\nSistema de Boletines Oficiales Municipales (SIBOM)\nSistema de Boletines Oficiales Municipales (SIBOM)\nBoletines/Carmen de Areco\nDecreto Nº1114\nDecreto Nº 1114\nPublicado en versión extractada\nCarmen de Areco, 18/07/2025\nLa solicitud presentada por el Sr.\nFLORES, JORGE ERALDO\nRedes Sociales\nContacto\nAutoridad de Aplicación\nSecretaría General\nSubsecretaría Legal y Técnica\nGuía Servicios\nPortal de trámites\nExpedientes\nSeguridad Vial\nARBA\nBoletín Oficial\nRegistro de las Personas\nContrataciones\nVer Todos\nPolíticas de privacidad\nUso Interno\nWebmail (gba.gob.ar)\nWebmail HORDE\nSistemas\nGDEBA\nPortal del Empleado\nMesa de Ayuda\nSIAPE",
      "tablas": [],
      "montos_extraidos": [],
      "metadata": {
        "longitud_caracteres": 904,
        "tiene_tablas": false,
        "total_tablas": 0,
        "total_montos": 0
      }
    },
    {
      "id": "2331021",
      "tipo": "decreto",
      "numero": "1115",
      "titulo": "Decreto Nº 1115",
      "fecha": "Carmen de Areco, 18/07/2025",
      "municipio": "Carmen de Areco",
      "url": "https://sibom.slyt.gba.gob.ar/bulletins/14177/contents/2331021",
      "contenido": "Sistema de Boletín Oficial Municipal | Buenos Aires Provincia\nINICIO\nACERCA DEL SIBOM\nBOLETINES\nMUNICIPIOS\nADMINISTRACION\nSistema de Boletines Oficiales Municipales (SIBOM)\nSistema de Boletines Oficiales Municipales (SIBOM)\nSistema de Boletines Oficiales Municipales (SIBOM)\nSistema de Boletines Oficiales Municipales (SIBOM)\nSistema de Boletines Oficiales Municipales (SIBOM)\nBoletines/Carmen de Areco\nDecreto Nº1115\nDecreto Nº 1115\nPublicado en versión extractada\nCarmen de Areco, 18/07/2025\nOtorgase un Subsidio de pesos CUATROCIENTOS NOVENTA Y CINCO MIL ($495.000,00) a la ASOCIACION COOPERADORA DE LA ESCUELA PRIMARIA N°04 de Carmen de Areco para afectarlo a los gastos establecidos en los considerandos del presente decreto - Exp. Adm. N° 4021- 01117-0-2025\nRedes Sociales\nContacto\nAutoridad de Aplicación\nSecretaría General\nSubsecretaría Legal y Técnica\nGuía Servicios\nPortal de trámites\nExpedientes\nSeguridad Vial\nARBA\nBoletín Oficial\nRegistro de las Personas\nContrataciones\nVer Todos\nPolíticas de privacidad\nUso Interno\nWebmail (gba.gob.ar)\nWebmail HORDE\nSistemas\nGDEBA\nPortal del Empleado\nMesa de Ayuda\nSIAPE",
      "tablas": [],
      "montos_extraidos": [
        {
          "municipio": "Areco",
          "boletin": "0",
          "fecha": "Carmen de Areco, 18/07/2025",
          "norma_tipo": "Decreto",
          "norma_numero": "1115",
          "articulo": "S/N",
          "concepto": "ARIA N°04 de Carmen de Areco para afectarlo a los gastos establecidos en los considerandos del prese",
          "monto": 495000.0,
          "moneda": "ARS",
          "texto_completo": "Boletín 0º | Areco | Decreto Nº1115 [ARTÍCULO S/N: $495.000,00]",
          "fuente_url": "https://sibom.slyt.gba.gob.ar/bulletins/14177/contents/2331021"
        }
      ],
      "metadata": {
        "longitud_caracteres": 1118,
        "tiene_tablas": false,
        "total_tablas": 0,
        "total_montos": 1
      }
    },
    {
      "id": "2331022",
      "tipo": "decreto",
      "numero": "1116",
      "titulo": "Decreto Nº 1116",
      "fecha": "Carmen de Areco, 18/07/2025",
      "municipio": "Carmen de Areco",
      "url": "https://sibom.slyt.gba.gob.ar/bulletins/14177/contents/2331022",
      "contenido": "Sistema de Boletín Oficial Municipal | Buenos Aires Provincia\nINICIO\nACERCA DEL SIBOM\nBOLETINES\nMUNICIPIOS\nADMINISTRACION\nSistema de Boletines Oficiales Municipales (SIBOM)\nSistema de Boletines Oficiales Municipales (SIBOM)\nSistema de Boletines Oficiales Municipales (SIBOM)\nSistema de Boletines Oficiales Municipales (SIBOM)\nSistema de Boletines Oficiales Municipales (SIBOM)\nBoletines/Carmen de Areco\nDecreto Nº1116\nDecreto Nº 1116\nPublicado en versión extractada\nCarmen de Areco, 18/07/2025\nDeclarase de\nINTERES MUNICIPAL\n, la jornada organizada por la Secretaria de Derechos Humanos, llamada\nLIGA BONAERENSE DE VIDEOJUEGOS (LC E-SPORTS)\n, a realizarse en el club Jorge Newbery de la ciudad de Carmen de Areco, el día miércoles 23 de julio de 2025.-\nRedes Sociales\nContacto\nAutoridad de Aplicación\nSecretaría General\nSubsecretaría Legal y Técnica\nGuía Servicios\nPortal de trámites\nExpedientes\nSeguridad Vial\nARBA\nBoletín Oficial\nRegistro de las Personas\nContrataciones\nVer Todos\nPolíticas de privacidad\nUso Interno\nWebmail (gba.gob.ar)\nWebmail HORDE\nSistemas\nGDEBA\nPortal del Empleado\nMesa de Ayuda\nSIAPE",
      "tablas": [],
      "montos_extraidos": [],
      "metadata": {
        "longitud_caracteres": 1107,
        "tiene_tablas": false,
        "total_tablas": 0,
        "total_montos": 0
      }
    },
    {
      "id": "2331023",
      "tipo": "decreto",
      "numero": "1117",
      "titulo": "Decreto Nº 1117",
      "fecha": "Carmen de Areco, 21/07/2025",
      "municipio": "Carmen de Areco",
      "url": "https://sibom.slyt.gba.gob.ar/bulletins/14177/contents/2331023",
      "contenido": "Sistema de Boletín Oficial Municipal | Buenos Aires Provincia\nINICIO\nACERCA DEL SIBOM\nBOLETINES\nMUNICIPIOS\nADMINISTRACION\nSistema de Boletines Oficiales Municipales (SIBOM)\nSistema de Boletines Oficiales Municipales (SIBOM)\nSistema de Boletines Oficiales Municipales (SIBOM)\nSistema de Boletines Oficiales Municipales (SIBOM)\nSistema de Boletines Oficiales Municipales (SIBOM)\nBoletines/Carmen de Areco\nDecreto Nº1117\nDecreto Nº 1117\nPublicado en versión extractada\nCarmen de Areco, 21/07/2025\nLa solicitud presentada por la Sra.\nBERARDI, VALERIA AGUSTINA\nRedes Sociales\nContacto\nAutoridad de Aplicación\nSecretaría General\nSubsecretaría Legal y Técnica\nGuía Servicios\nPortal de trámites\nExpedientes\nSeguridad Vial\nARBA\nBoletín Oficial\nRegistro de las Personas\nContrataciones\nVer Todos\nPolíticas de privacidad\nUso Interno\nWebmail (gba.gob.ar)\nWebmail HORDE\nSistemas\nGDEBA\nPortal del Empleado\nMesa de Ayuda\nSIAPE",
      "tablas": [],
      "montos_extraidos": [],
      "metadata": {
        "longitud_caracteres": 910,
        "tiene_tablas": false,
        "total_tablas": 0,
        "total_montos": 0
      }
    },
    {
      "id": "2331024",
      "tipo": "decreto",
      "numero": "1118",
      "titulo": "Decreto Nº 1118",
      "fecha": "Carmen de Areco, 21/07/2025",
      "municipio": "Carmen de Areco",
      "url": "https://sibom.slyt.gba.gob.ar/bulletins/14177/contents/2331024",
      "contenido": "Sistema de Boletín Oficial Municipal | Buenos Aires Provincia\nINICIO\nACERCA DEL SIBOM\nBOLETINES\nMUNICIPIOS\nADMINISTRACION\nSistema de Boletines Oficiales Municipales (SIBOM)\nSistema de Boletines Oficiales Municipales (SIBOM)\nSistema de Boletines Oficiales Municipales (SIBOM)\nSistema de Boletines Oficiales Municipales (SIBOM)\nSistema de Boletines Oficiales Municipales (SIBOM)\nBoletines/Carmen de Areco\nDecreto Nº1118\nDecreto Nº 1118\nPublicado en versión extractada\nCarmen de Areco, 21/07/2025\nLa solicitud presentada por el Sr.\nTABARES, FEDERICO DAMIAN\nRedes Sociales\nContacto\nAutoridad de Aplicación\nSecretaría General\nSubsecretaría Legal y Técnica\nGuía Servicios\nPortal de trámites\nExpedientes\nSeguridad Vial\nARBA\nBoletín Oficial\nRegistro de las Personas\nContrataciones\nVer Todos\nPolíticas de privacidad\nUso Interno\nWebmail (gba.gob.ar)\nWebmail HORDE\nSistemas\nGDEBA\nPortal del Empleado\nMesa de Ayuda\nSIAPE",
      "tablas": [],
      "montos_extraidos": [],
      "metadata": {
        "longitud_caracteres": 908,
        "tiene_tablas": false,
        "total_tablas": 0,
        "total_montos": 0
      }
    },
    {
      "id": "2331025",
      "tipo": "decreto",
      "numero": "1119",
      "titulo": "Decreto Nº 1119",
      "fecha": "Carmen de Areco, 21/07/2025",
      "municipio": "Carmen de Areco",
      "url": "https://sibom.slyt.gba.gob.ar/bulletins/14177/contents/2331025",
      "contenido": "Sistema de Boletín Oficial Municipal | Buenos Aires Provincia\nINICIO\nACERCA DEL SIBOM\nBOLETINES\nMUNICIPIOS\nADMINISTRACION\nSistema de Boletines Oficiales Municipales (SIBOM)\nSistema de Boletines Oficiales Municipales (SIBOM)\nSistema de Boletines Oficiales Municipales (SIBOM)\nSistema de Boletines Oficiales Municipales (SIBOM)\nSistema de Boletines Oficiales Municipales (SIBOM)\nBoletines/Carmen de Areco\nDecreto Nº1119\nDecreto Nº 1119\nPublicado en versión extractada\nCarmen de Areco, 21/07/2025\nLas actividades programadas en el marco de “VACACIONES DE INVIERNO 2025”, desde el día 21 de julio y hasta el 01 de agosto de 2025, con motivo del receso invernal; y; Contrátese, dado que el Municipio no cuenta en la planta con personal profesional afectado y/o dedicado a la tarea descripta en los vistos del presente, a la Sra.\nLOUSTAUNAU, JOSEFINA\npara efectuar el servicio de show circense para la apertura de las vacaciones de invierno, el dia 21 de julio del corriente en plaza Independencia, en un todo de acuerdo con el contrato\nRedes Sociales\nContacto\nAutoridad de Aplicación\nSecretaría General\nSubsecretaría Legal y Técnica\nGuía Servicios\nPortal de trámites\nExpedientes\nSeguridad Vial\nARBA\nBoletín Oficial\nRegistro de las Personas\nContrataciones\nVer Todos\nPolíticas de privacidad\nUso Interno\nWebmail (gba.gob.ar)\nWebmail HORDE\nSistemas\nGDEBA\nPortal del Empleado\nMesa de Ayuda\nSIAPE",
      "tablas": [],
      "montos_extraidos": [],
      "metadata": {
        "longitud_caracteres": 1385,
        "tiene_tablas": false,
        "total_tablas": 0,
        "total_montos": 0
      }
    },
    {
      "id": "2331026",
      "tipo": "decreto",
      "numero": "1120",
      "titulo": "Decreto Nº 1120",
      "fecha": "Carmen de Areco, 21/07/2025",
      "municipio": "Carmen de Areco",
      "url": "https://sibom.slyt.gba.gob.ar/bulletins/14177/contents/2331026",
      "contenido": "Sistema de Boletín Oficial Municipal | Buenos Aires Provincia\nINICIO\nACERCA DEL SIBOM\nBOLETINES\nMUNICIPIOS\nADMINISTRACION\nSistema de Boletines Oficiales Municipales (SIBOM)\nSistema de Boletines Oficiales Municipales (SIBOM)\nSistema de Boletines Oficiales Municipales (SIBOM)\nSistema de Boletines Oficiales Municipales (SIBOM)\nSistema de Boletines Oficiales Municipales (SIBOM)\nBoletines/Carmen de Areco\nDecreto Nº1120\nDecreto Nº 1120\nPublicado en versión extractada\nCarmen de Areco, 21/07/2025\nLa jornada organizada por la Secretaria de Derechos Humanos, llamada\nLIGA BONAERENSE DE VIDEOJUEGOS (LC E-SPORTS)\n, a realizarse en el club Jorge Newbery de la ciudad de Carmen de Areco, el día miércoles 23 de julio de 2025, Contrátese, dado que el Municipio no cuenta en la planta con personal profesional afectado y/o dedicado a la tarea descripta en los vistos del presente, al Sr.\nRUBIO, GASPAR,\npara efectuar el servicio de sonido e iluminación para la LIGA BONAERENSE DE VIDEOJUEGOS a llevarse a cabo en Carmen de Areco, el día 23 de julio del corriente año, en un todo de acuerdo con el contrato\nRedes Sociales\nContacto\nAutoridad de Aplicación\nSecretaría General\nSubsecretaría Legal y Técnica\nGuía Servicios\nPortal de trámites\nExpedientes\nSeguridad Vial\nARBA\nBoletín Oficial\nRegistro de las Personas\nContrataciones\nVer Todos\nPolíticas de privacidad\nUso Interno\nWebmail (gba.gob.ar)\nWebmail HORDE\nSistemas\nGDEBA\nPortal del Empleado\nMesa de Ayuda\nSIAPE",
      "tablas": [],
      "montos_extraidos": [],
      "metadata": {
        "longitud_caracteres": 1451,
        "tiene_tablas": false,
        "total_tablas": 0,
        "total_montos": 0
      }
    },
    {
      "id": "2331027",
      "tipo": "decreto",
      "numero": "1121",
      "titulo": "Decreto Nº 1121",
      "fecha": "Carmen de Areco, 21/07/2025",
      "municipio": "Carmen de Areco",
      "url": "https://sibom.slyt.gba.gob.ar/bulletins/14177/contents/2331027",
      "contenido": "Sistema de Boletín Oficial Municipal | Buenos Aires Provincia\nINICIO\nACERCA DEL SIBOM\nBOLETINES\nMUNICIPIOS\nADMINISTRACION\nSistema de Boletines Oficiales Municipales (SIBOM)\nSistema de Boletines Oficiales Municipales (SIBOM)\nSistema de Boletines Oficiales Municipales (SIBOM)\nSistema de Boletines Oficiales Municipales (SIBOM)\nSistema de Boletines Oficiales Municipales (SIBOM)\nBoletines/Carmen de Areco\nDecreto Nº1121\nDecreto Nº 1121\nPublicado en versión extractada\nCarmen de Areco, 21/07/2025\nOtorgase un Subsidio de pesos TRES MILLONES SETECIENTOS CATORCE MIL SETECIENTOS ($3.714.700,00) a la ASOCIACION COOPERADORA DE LA ESCUELA DE EDUCACIÓN SECUNDARIA AGRARIA N°1 de Tres Sargentos para afectarlo a los gastos establecidos en los considerandos del presente decreto - Exp. Adm. N° 4021- 01129-0-2025\nRedes Sociales\nContacto\nAutoridad de Aplicación\nSecretaría General\nSubsecretaría Legal y Técnica\nGuía Servicios\nPortal de trámites\nExpedientes\nSeguridad Vial\nARBA\nBoletín Oficial\nRegistro de las Personas\nContrataciones\nVer Todos\nPolíticas de privacidad\nUso Interno\nWebmail (gba.gob.ar)\nWebmail HORDE\nSistemas\nGDEBA\nPortal del Empleado\nMesa de Ayuda\nSIAPE",
      "tablas": [],
      "montos_extraidos": [
        {
          "municipio": "Areco",
          "boletin": "0",
          "fecha": "Carmen de Areco, 21/07/2025",
          "norma_tipo": "Decreto",
          "norma_numero": "1121",
          "articulo": "S/N",
          "concepto": "GRARIA N°1 de Tres Sargentos para afectarlo a los gastos esta",
          "monto": 3714700.0,
          "moneda": "ARS",
          "texto_completo": "Boletín 0º | Areco | Decreto Nº1121 [ARTÍCULO S/N: $3.714.700,00]",
          "fuente_url": "https://sibom.slyt.gba.gob.ar/bulletins/14177/contents/2331027"
        }
      ],
      "metadata": {
        "longitud_caracteres": 1157,
        "tiene_tablas": false,
        "total_tablas": 0,
        "total_montos": 1
      }
    },
    {
      "id": "2331028",
      "tipo": "decreto",
      "numero": "1122",
      "titulo": "Decreto Nº 1122",
      "fecha": "Carmen de Areco, 22/07/2025",
      "municipio": "Carmen de Areco",
      "url": "https://sibom.slyt.gba.gob.ar/bulletins/14177/contents/2331028",
      "contenido": "Sistema de Boletín Oficial Municipal | Buenos Aires Provincia\nINICIO\nACERCA DEL SIBOM\nBOLETINES\nMUNICIPIOS\nADMINISTRACION\nSistema de Boletines Oficiales Municipales (SIBOM)\nSistema de Boletines Oficiales Municipales (SIBOM)\nSistema de Boletines Oficiales Municipales (SIBOM)\nSistema de Boletines Oficiales Municipales (SIBOM)\nSistema de Boletines Oficiales Municipales (SIBOM)\nBoletines/Carmen de Areco\nDecreto Nº1122\nDecreto Nº 1122\nPublicado en versión extractada\nCarmen de Areco, 22/07/2025\nPromulgase la Ordenanza Nº 3290 /2025, sancionada por el Honorable Concejo Deliberante de Carmen de Areco con fecha 15/07/2025\nRedes Sociales\nContacto\nAutoridad de Aplicación\nSecretaría General\nSubsecretaría Legal y Técnica\nGuía Servicios\nPortal de trámites\nExpedientes\nSeguridad Vial\nARBA\nBoletín Oficial\nRegistro de las Personas\nContrataciones\nVer Todos\nPolíticas de privacidad\nUso Interno\nWebmail (gba.gob.ar)\nWebmail HORDE\nSistemas\nGDEBA\nPortal del Empleado\nMesa de Ayuda\nSIAPE",
      "tablas": [],
      "montos_extraidos": [],
      "metadata": {
        "longitud_caracteres": 975,
        "tiene_tablas": false,
        "total_tablas": 0,
        "total_montos": 0
      }
    },
    {
      "id": "2331029",
      "tipo": "decreto",
      "numero": "1123",
      "titulo": "Decreto Nº 1123",
      "fecha": "Carmen de Areco, 22/07/2025",
      "municipio": "Carmen de Areco",
      "url": "https://sibom.slyt.gba.gob.ar/bulletins/14177/contents/2331029",
      "contenido": "Sistema de Boletín Oficial Municipal | Buenos Aires Provincia\nINICIO\nACERCA DEL SIBOM\nBOLETINES\nMUNICIPIOS\nADMINISTRACION\nSistema de Boletines Oficiales Municipales (SIBOM)\nSistema de Boletines Oficiales Municipales (SIBOM)\nSistema de Boletines Oficiales Municipales (SIBOM)\nSistema de Boletines Oficiales Municipales (SIBOM)\nSistema de Boletines Oficiales Municipales (SIBOM)\nBoletines/Carmen de Areco\nDecreto Nº1123\nDecreto Nº 1123\nPublicado en versión extractada\nCarmen de Areco, 22/07/2025\nPromulgase la Ordenanza Nº 3291 /2025, sancionada por el Honorable Concejo Deliberante de Carmen de Areco con fecha 15/07/2025\nRedes Sociales\nContacto\nAutoridad de Aplicación\nSecretaría General\nSubsecretaría Legal y Técnica\nGuía Servicios\nPortal de trámites\nExpedientes\nSeguridad Vial\nARBA\nBoletín Oficial\nRegistro de las Personas\nContrataciones\nVer Todos\nPolíticas de privacidad\nUso Interno\nWebmail (gba.gob.ar)\nWebmail HORDE\nSistemas\nGDEBA\nPortal del Empleado\nMesa de Ayuda\nSIAPE",
      "tablas": [],
      "montos_extraidos": [],
      "metadata": {
        "longitud_caracteres": 975,
        "tiene_tablas": false,
        "total_tablas": 0,
        "total_montos": 0
      }
    },
    {
      "id": "2331030",
      "tipo": "decreto",
      "numero": "1124",
      "titulo": "Decreto Nº 1124",
      "fecha": "Carmen de Areco, 22/07/2026",
      "municipio": "Carmen de Areco",
      "url": "https://sibom.slyt.gba.gob.ar/bulletins/14177/contents/2331030",
      "contenido": "Sistema de Boletín Oficial Municipal | Buenos Aires Provincia\nINICIO\nACERCA DEL SIBOM\nBOLETINES\nMUNICIPIOS\nADMINISTRACION\nSistema de Boletines Oficiales Municipales (SIBOM)\nSistema de Boletines Oficiales Municipales (SIBOM)\nSistema de Boletines Oficiales Municipales (SIBOM)\nSistema de Boletines Oficiales Municipales (SIBOM)\nSistema de Boletines Oficiales Municipales (SIBOM)\nBoletines/Carmen de Areco\nDecreto Nº1124\nDecreto Nº 1124\nPublicado en versión extractada\nCarmen de Areco, 22/07/2026\nLa necesidad de contratar el servicio de Instalación y Reparación de cámaras de seguridad;  y; Contrátese, dado que el Municipio no cuenta en la planta con personal profesional afectado y/o dedicado a tal tarea; a la Sra.\nNOCERA, MARIA SOLEDAD,\npara desde el 22 de julio de 2025 al 05 de agosto de 2025, preste el servicio de instalación y reparación de cámaras de seguridad, descripto en los vistos y considerando del presente decreto,  en un todo de acuerdo con el respectivo contrato\nRedes Sociales\nContacto\nAutoridad de Aplicación\nSecretaría General\nSubsecretaría Legal y Técnica\nGuía Servicios\nPortal de trámites\nExpedientes\nSeguridad Vial\nARBA\nBoletín Oficial\nRegistro de las Personas\nContrataciones\nVer Todos\nPolíticas de privacidad\nUso Interno\nWebmail (gba.gob.ar)\nWebmail HORDE\nSistemas\nGDEBA\nPortal del Empleado\nMesa de Ayuda\nSIAPE",
      "tablas": [],
      "montos_extraidos": [],
      "metadata": {
        "longitud_caracteres": 1335,
        "tiene_tablas": false,
        "total_tablas": 0,
        "total_montos": 0
      }
    },
    {
      "id": "2331050",
      "tipo": "decreto",
      "numero": "1125",
      "titulo": "Decreto Nº 1125",
      "fecha": "Carmen de Areco, 22/07/2025",
      "municipio": "Carmen de Areco",
      "url": "https://sibom.slyt.gba.gob.ar/bulletins/14177/contents/2331050",
      "contenido": "Sistema de Boletín Oficial Municipal | Buenos Aires Provincia\nINICIO\nACERCA DEL SIBOM\nBOLETINES\nMUNICIPIOS\nADMINISTRACION\nSistema de Boletines Oficiales Municipales (SIBOM)\nSistema de Boletines Oficiales Municipales (SIBOM)\nSistema de Boletines Oficiales Municipales (SIBOM)\nSistema de Boletines Oficiales Municipales (SIBOM)\nSistema de Boletines Oficiales Municipales (SIBOM)\nBoletines/Carmen de Areco\nDecreto Nº1125\nDecreto Nº 1125\nPublicado en versión extractada\nCarmen de Areco, 22/07/2025\nLa solicitud presentada por la Sra.\nDURANI, LILIANA HAYDEE\nRedes Sociales\nContacto\nAutoridad de Aplicación\nSecretaría General\nSubsecretaría Legal y Técnica\nGuía Servicios\nPortal de trámites\nExpedientes\nSeguridad Vial\nARBA\nBoletín Oficial\nRegistro de las Personas\nContrataciones\nVer Todos\nPolíticas de privacidad\nUso Interno\nWebmail (gba.gob.ar)\nWebmail HORDE\nSistemas\nGDEBA\nPortal del Empleado\nMesa de Ayuda\nSIAPE",
      "tablas": [],
      "montos_extraidos": [],
      "metadata": {
        "longitud_caracteres": 907,
        "tiene_tablas": false,
        "total_tablas": 0,
        "total_montos": 0
      }
    },
    {
      "id": "2331051",
      "tipo": "decreto",
      "numero": "1126",
      "titulo": "Decreto Nº 1126",
      "fecha": "Carmen de Areco, 22/07/2025",
      "municipio": "Carmen de Areco",
      "url": "https://sibom.slyt.gba.gob.ar/bulletins/14177/contents/2331051",
      "contenido": "Sistema de Boletín Oficial Municipal | Buenos Aires Provincia\nINICIO\nACERCA DEL SIBOM\nBOLETINES\nMUNICIPIOS\nADMINISTRACION\nSistema de Boletines Oficiales Municipales (SIBOM)\nSistema de Boletines Oficiales Municipales (SIBOM)\nSistema de Boletines Oficiales Municipales (SIBOM)\nSistema de Boletines Oficiales Municipales (SIBOM)\nSistema de Boletines Oficiales Municipales (SIBOM)\nBoletines/Carmen de Areco\nDecreto Nº1126\nDecreto Nº 1126\nPublicado en versión extractada\nCarmen de Areco, 22/07/2025\nLa solicitud presentada por la Sra.\nTELLERIARTE, MARIA LAURA\nRedes Sociales\nContacto\nAutoridad de Aplicación\nSecretaría General\nSubsecretaría Legal y Técnica\nGuía Servicios\nPortal de trámites\nExpedientes\nSeguridad Vial\nARBA\nBoletín Oficial\nRegistro de las Personas\nContrataciones\nVer Todos\nPolíticas de privacidad\nUso Interno\nWebmail (gba.gob.ar)\nWebmail HORDE\nSistemas\nGDEBA\nPortal del Empleado\nMesa de Ayuda\nSIAPE",
      "tablas": [],
      "montos_extraidos": [],
      "metadata": {
        "longitud_caracteres": 909,
        "tiene_tablas": false,
        "total_tablas": 0,
        "total_montos": 0
      }
    },
    {
      "id": "2331054",
      "tipo": "decreto",
      "numero": "1127",
      "titulo": "Decreto Nº 1127",
      "fecha": "Carmen de Areco, 22/07/2025",
      "municipio": "Carmen de Areco",
      "url": "https://sibom.slyt.gba.gob.ar/bulletins/14177/contents/2331054",
      "contenido": "Sistema de Boletín Oficial Municipal | Buenos Aires Provincia\nINICIO\nACERCA DEL SIBOM\nBOLETINES\nMUNICIPIOS\nADMINISTRACION\nSistema de Boletines Oficiales Municipales (SIBOM)\nSistema de Boletines Oficiales Municipales (SIBOM)\nSistema de Boletines Oficiales Municipales (SIBOM)\nSistema de Boletines Oficiales Municipales (SIBOM)\nSistema de Boletines Oficiales Municipales (SIBOM)\nBoletines/Carmen de Areco\nDecreto Nº1127\nDecreto Nº 1127\nPublicado en versión extractada\nCarmen de Areco, 22/07/2025\nLa solicitud presentada por la Sra.\nCATARINO, NORMA ALCIRA\nRedes Sociales\nContacto\nAutoridad de Aplicación\nSecretaría General\nSubsecretaría Legal y Técnica\nGuía Servicios\nPortal de trámites\nExpedientes\nSeguridad Vial\nARBA\nBoletín Oficial\nRegistro de las Personas\nContrataciones\nVer Todos\nPolíticas de privacidad\nUso Interno\nWebmail (gba.gob.ar)\nWebmail HORDE\nSistemas\nGDEBA\nPortal del Empleado\nMesa de Ayuda\nSIAPE",
      "tablas": [],
      "montos_extraidos": [],
      "metadata": {
        "longitud_caracteres": 907,
        "tiene_tablas": false,
        "total_tablas": 0,
        "total_montos": 0
      }
    },
    {
      "id": "2331056",
      "tipo": "decreto",
      "numero": "1128",
      "titulo": "Decreto Nº 1128",
      "fecha": "Carmen de Areco, 22/07/2026",
      "municipio": "Carmen de Areco",
      "url": "https://sibom.slyt.gba.gob.ar/bulletins/14177/contents/2331056",
      "contenido": "Sistema de Boletín Oficial Municipal | Buenos Aires Provincia\nINICIO\nACERCA DEL SIBOM\nBOLETINES\nMUNICIPIOS\nADMINISTRACION\nSistema de Boletines Oficiales Municipales (SIBOM)\nSistema de Boletines Oficiales Municipales (SIBOM)\nSistema de Boletines Oficiales Municipales (SIBOM)\nSistema de Boletines Oficiales Municipales (SIBOM)\nSistema de Boletines Oficiales Municipales (SIBOM)\nBoletines/Carmen de Areco\nDecreto Nº1128\nDecreto Nº 1128\nPublicado en versión extractada\nCarmen de Areco, 22/07/2026\nLa solicitud presentada por la Sra.\nFERNANDEZ, GUADALUPE FABIANA\nRedes Sociales\nContacto\nAutoridad de Aplicación\nSecretaría General\nSubsecretaría Legal y Técnica\nGuía Servicios\nPortal de trámites\nExpedientes\nSeguridad Vial\nARBA\nBoletín Oficial\nRegistro de las Personas\nContrataciones\nVer Todos\nPolíticas de privacidad\nUso Interno\nWebmail (gba.gob.ar)\nWebmail HORDE\nSistemas\nGDEBA\nPortal del Empleado\nMesa de Ayuda\nSIAPE",
      "tablas": [],
      "montos_extraidos": [],
      "metadata": {
        "longitud_caracteres": 913,
        "tiene_tablas": false,
        "total_tablas": 0,
        "total_montos": 0
      }
    },
    {
      "id": "2331057",
      "tipo": "decreto",
      "numero": "1129",
      "titulo": "Decreto Nº 1129",
      "fecha": "Carmen de Areco, 22/07/2026",
      "municipio": "Carmen de Areco",
      "url": "https://sibom.slyt.gba.gob.ar/bulletins/14177/contents/2331057",
      "contenido": "Sistema de Boletín Oficial Municipal | Buenos Aires Provincia\nINICIO\nACERCA DEL SIBOM\nBOLETINES\nMUNICIPIOS\nADMINISTRACION\nSistema de Boletines Oficiales Municipales (SIBOM)\nSistema de Boletines Oficiales Municipales (SIBOM)\nSistema de Boletines Oficiales Municipales (SIBOM)\nSistema de Boletines Oficiales Municipales (SIBOM)\nSistema de Boletines Oficiales Municipales (SIBOM)\nBoletines/Carmen de Areco\nDecreto Nº1129\nDecreto Nº 1129\nPublicado en versión extractada\nCarmen de Areco, 22/07/2026\nLa solicitud presentada por la Sra.\nNIEVES, ANA MARIA\nRedes Sociales\nContacto\nAutoridad de Aplicación\nSecretaría General\nSubsecretaría Legal y Técnica\nGuía Servicios\nPortal de trámites\nExpedientes\nSeguridad Vial\nARBA\nBoletín Oficial\nRegistro de las Personas\nContrataciones\nVer Todos\nPolíticas de privacidad\nUso Interno\nWebmail (gba.gob.ar)\nWebmail HORDE\nSistemas\nGDEBA\nPortal del Empleado\nMesa de Ayuda\nSIAPE",
      "tablas": [],
      "montos_extraidos": [],
      "metadata": {
        "longitud_caracteres": 902,
        "tiene_tablas": false,
        "total_tablas": 0,
        "total_montos": 0
      }
    },
    {
      "id": "2331058",
      "tipo": "decreto",
      "numero": "1130",
      "titulo": "Decreto Nº 1130",
      "fecha": "Carmen de Areco, 22/07/2025",
      "municipio": "Carmen de Areco",
      "url": "https://sibom.slyt.gba.gob.ar/bulletins/14177/contents/2331058",
      "contenido": "Sistema de Boletín Oficial Municipal | Buenos Aires Provincia\nINICIO\nACERCA DEL SIBOM\nBOLETINES\nMUNICIPIOS\nADMINISTRACION\nSistema de Boletines Oficiales Municipales (SIBOM)\nSistema de Boletines Oficiales Municipales (SIBOM)\nSistema de Boletines Oficiales Municipales (SIBOM)\nSistema de Boletines Oficiales Municipales (SIBOM)\nSistema de Boletines Oficiales Municipales (SIBOM)\nBoletines/Carmen de Areco\nDecreto Nº1130\nDecreto Nº 1130\nPublicado en versión extractada\nCarmen de Areco, 22/07/2025\nLa solicitud presentada por el Sr.\nPEREYRA, MIGUEL ANGEL\nRedes Sociales\nContacto\nAutoridad de Aplicación\nSecretaría General\nSubsecretaría Legal y Técnica\nGuía Servicios\nPortal de trámites\nExpedientes\nSeguridad Vial\nARBA\nBoletín Oficial\nRegistro de las Personas\nContrataciones\nVer Todos\nPolíticas de privacidad\nUso Interno\nWebmail (gba.gob.ar)\nWebmail HORDE\nSistemas\nGDEBA\nPortal del Empleado\nMesa de Ayuda\nSIAPE",
      "tablas": [],
      "montos_extraidos": [],
      "metadata": {
        "longitud_caracteres": 905,
        "tiene_tablas": false,
        "total_tablas": 0,
        "total_montos": 0
      }
    },
    {
      "id": "2331059",
      "tipo": "decreto",
      "numero": "1131",
      "titulo": "Decreto Nº 1131",
      "fecha": "Carmen de Areco, 22/07/2025",
      "municipio": "Carmen de Areco",
      "url": "https://sibom.slyt.gba.gob.ar/bulletins/14177/contents/2331059",
      "contenido": "Sistema de Boletín Oficial Municipal | Buenos Aires Provincia\nINICIO\nACERCA DEL SIBOM\nBOLETINES\nMUNICIPIOS\nADMINISTRACION\nSistema de Boletines Oficiales Municipales (SIBOM)\nSistema de Boletines Oficiales Municipales (SIBOM)\nSistema de Boletines Oficiales Municipales (SIBOM)\nSistema de Boletines Oficiales Municipales (SIBOM)\nSistema de Boletines Oficiales Municipales (SIBOM)\nBoletines/Carmen de Areco\nDecreto Nº1131\nDecreto Nº 1131\nPublicado en versión extractada\nCarmen de Areco, 22/07/2025\nLa solicitud presentada por la Sra.\nGARAY, GERALDIN\nRedes Sociales\nContacto\nAutoridad de Aplicación\nSecretaría General\nSubsecretaría Legal y Técnica\nGuía Servicios\nPortal de trámites\nExpedientes\nSeguridad Vial\nARBA\nBoletín Oficial\nRegistro de las Personas\nContrataciones\nVer Todos\nPolíticas de privacidad\nUso Interno\nWebmail (gba.gob.ar)\nWebmail HORDE\nSistemas\nGDEBA\nPortal del Empleado\nMesa de Ayuda\nSIAPE",
      "tablas": [],
      "montos_extraidos": [],
      "metadata": {
        "longitud_caracteres": 900,
        "tiene_tablas": false,
        "total_tablas": 0,
        "total_montos": 0
      }
    },
    {
      "id": "2331061",
      "tipo": "decreto",
      "numero": "1132",
      "titulo": "Decreto Nº 1132",
      "fecha": "Carmen de Areco, 22/07/2025",
      "municipio": "Carmen de Areco",
      "url": "https://sibom.slyt.gba.gob.ar/bulletins/14177/contents/2331061",
      "contenido": "Sistema de Boletín Oficial Municipal | Buenos Aires Provincia\nINICIO\nACERCA DEL SIBOM\nBOLETINES\nMUNICIPIOS\nADMINISTRACION\nSistema de Boletines Oficiales Municipales (SIBOM)\nSistema de Boletines Oficiales Municipales (SIBOM)\nSistema de Boletines Oficiales Municipales (SIBOM)\nSistema de Boletines Oficiales Municipales (SIBOM)\nSistema de Boletines Oficiales Municipales (SIBOM)\nBoletines/Carmen de Areco\nDecreto Nº1132\nDecreto Nº 1132\nPublicado en versión extractada\nCarmen de Areco, 22/07/2025\nLa licencia anual por vacaciones que se concederá, desde retroactivamente el día 21 de Julio de 2025 y  hasta el día 31 de Julio  del cte. Año inclusive, al\nDIRECTOR DE INCLUSIÓN SOCIAL\nde esta Municipalidad,  Sr.\nCAMPOS, EDUARDO, ROBERTO,\nDesígnese para revisar y firmar todas las solicitudes de gastos, ordenes de recepción y ordenes de compras y todo otro documento que esté a cargo de la Dirección de Inclusión Social de esta Municipalidad, al  Secretario de Derechos Humanos\nSR. IBERBIA, LEONARDO LUIS CAYETANO\ndesde retroactivamente, el dia 21 de Julio de 2025 y  hasta el día 31 de Julio  del cte. Año inclusive\nRedes Sociales\nContacto\nAutoridad de Aplicación\nSecretaría General\nSubsecretaría Legal y Técnica\nGuía Servicios\nPortal de trámites\nExpedientes\nSeguridad Vial\nARBA\nBoletín Oficial\nRegistro de las Personas\nContrataciones\nVer Todos\nPolíticas de privacidad\nUso Interno\nWebmail (gba.gob.ar)\nWebmail HORDE\nSistemas\nGDEBA\nPortal del Empleado\nMesa de Ayuda\nSIAPE",
      "tablas": [],
      "montos_extraidos": [],
      "metadata": {
        "longitud_caracteres": 1467,
        "tiene_tablas": false,
        "total_tablas": 0,
        "total_montos": 0
      }
    },
    {
      "id": "2331063",
      "tipo": "decreto",
      "numero": "1133",
      "titulo": "Decreto Nº 1133",
      "fecha": "Carmen de Areco, 23/07/2025",
      "municipio": "Carmen de Areco",
      "url": "https://sibom.slyt.gba.gob.ar/bulletins/14177/contents/2331063",
      "contenido": "Sistema de Boletín Oficial Municipal | Buenos Aires Provincia\nINICIO\nACERCA DEL SIBOM\nBOLETINES\nMUNICIPIOS\nADMINISTRACION\nSistema de Boletines Oficiales Municipales (SIBOM)\nSistema de Boletines Oficiales Municipales (SIBOM)\nSistema de Boletines Oficiales Municipales (SIBOM)\nSistema de Boletines Oficiales Municipales (SIBOM)\nSistema de Boletines Oficiales Municipales (SIBOM)\nBoletines/Carmen de Areco\nDecreto Nº1133\nDecreto Nº 1133\nPublicado en versión extractada\nCarmen de Areco, 23/07/2025\nLo dispuesto por el art. 130 bis de la Ley Orgánica de las Municipalidades, introducido por la ley 11.838.- Compensase las deudas fiscales de los contribuyentes con las acreencias que a su vez tales contribuyentes tienen para percibir de este Municipio, hasta la suma menor, según el detalle que consta en el ANEXO I\nRedes Sociales\nContacto\nAutoridad de Aplicación\nSecretaría General\nSubsecretaría Legal y Técnica\nGuía Servicios\nPortal de trámites\nExpedientes\nSeguridad Vial\nARBA\nBoletín Oficial\nRegistro de las Personas\nContrataciones\nVer Todos\nPolíticas de privacidad\nUso Interno\nWebmail (gba.gob.ar)\nWebmail HORDE\nSistemas\nGDEBA\nPortal del Empleado\nMesa de Ayuda\nSIAPE",
      "tablas": [],
      "montos_extraidos": [],
      "metadata": {
        "longitud_caracteres": 1165,
        "tiene_tablas": false,
        "total_tablas": 0,
        "total_montos": 0
      }
    },
    {
      "id": "2331064",
      "tipo": "decreto",
      "numero": "1134",
      "titulo": "Decreto Nº 1134",
      "fecha": "Carmen de Areco, 23/07/2025",
      "municipio": "Carmen de Areco",
      "url": "https://sibom.slyt.gba.gob.ar/bulletins/14177/contents/2331064",
      "contenido": "Sistema de Boletín Oficial Municipal | Buenos Aires Provincia\nINICIO\nACERCA DEL SIBOM\nBOLETINES\nMUNICIPIOS\nADMINISTRACION\nSistema de Boletines Oficiales Municipales (SIBOM)\nSistema de Boletines Oficiales Municipales (SIBOM)\nSistema de Boletines Oficiales Municipales (SIBOM)\nSistema de Boletines Oficiales Municipales (SIBOM)\nSistema de Boletines Oficiales Municipales (SIBOM)\nBoletines/Carmen de Areco\nDecreto Nº1134\nDecreto Nº 1134\nPublicado en versión extractada\nCarmen de Areco, 23/07/2025\nLa solicitud presentada por la Sra.\nCABALLERO, JUANA ROSA\nRedes Sociales\nContacto\nAutoridad de Aplicación\nSecretaría General\nSubsecretaría Legal y Técnica\nGuía Servicios\nPortal de trámites\nExpedientes\nSeguridad Vial\nARBA\nBoletín Oficial\nRegistro de las Personas\nContrataciones\nVer Todos\nPolíticas de privacidad\nUso Interno\nWebmail (gba.gob.ar)\nWebmail HORDE\nSistemas\nGDEBA\nPortal del Empleado\nMesa de Ayuda\nSIAPE",
      "tablas": [],
      "montos_extraidos": [],
      "metadata": {
        "longitud_caracteres": 906,
        "tiene_tablas": false,
        "total_tablas": 0,
        "total_montos": 0
      }
    },
    {
      "id": "2331065",
      "tipo": "decreto",
      "numero": "1135",
      "titulo": "Decreto Nº 1135",
      "fecha": "Carmen de Areco, 23/07/2025",
      "municipio": "Carmen de Areco",
      "url": "https://sibom.slyt.gba.gob.ar/bulletins/14177/contents/2331065",
      "contenido": "Sistema de Boletín Oficial Municipal | Buenos Aires Provincia\nINICIO\nACERCA DEL SIBOM\nBOLETINES\nMUNICIPIOS\nADMINISTRACION\nSistema de Boletines Oficiales Municipales (SIBOM)\nSistema de Boletines Oficiales Municipales (SIBOM)\nSistema de Boletines Oficiales Municipales (SIBOM)\nSistema de Boletines Oficiales Municipales (SIBOM)\nSistema de Boletines Oficiales Municipales (SIBOM)\nBoletines/Carmen de Areco\nDecreto Nº1135\nDecreto Nº 1135\nPublicado en versión extractada\nCarmen de Areco, 23/07/2025\nEl Decreto\n1028/2024\n; y contrato celebrado entre la Municipalidad de Carmen de Areco y  la Cooperativa de trabajo\n“AMADO OLMOS LTDA”\ncon fecha 26/06/2024 para realizar la obra “Construcción de 14 viviendas en la localidad de TRES SARGENTOS”; y;\nAféctese en el ejercicio 2025 la suma de UVIS 461.912,38 que se imputara a la sig. Partida:, conf. El art. 42 del Dec. 2980/00 de Rafam\n1110118000-132–24.51.52 – 4.2.1.0\n…………………..…………………………….…. UVIS 461.912,38\nRedes Sociales\nContacto\nAutoridad de Aplicación\nSecretaría General\nSubsecretaría Legal y Técnica\nGuía Servicios\nPortal de trámites\nExpedientes\nSeguridad Vial\nARBA\nBoletín Oficial\nRegistro de las Personas\nContrataciones\nVer Todos\nPolíticas de privacidad\nUso Interno\nWebmail (gba.gob.ar)\nWebmail HORDE\nSistemas\nGDEBA\nPortal del Empleado\nMesa de Ayuda\nSIAPE",
      "tablas": [],
      "montos_extraidos": [],
      "metadata": {
        "longitud_caracteres": 1304,
        "tiene_tablas": false,
        "total_tablas": 0,
        "total_montos": 0
      }
    },
    {
      "id": "2331066",
      "tipo": "decreto",
      "numero": "1136",
      "titulo": "Decreto Nº 1136",
      "fecha": "Carmen de Areco, 23/07/2025",
      "municipio": "Carmen de Areco",
      "url": "https://sibom.slyt.gba.gob.ar/bulletins/14177/contents/2331066",
      "contenido": "Sistema de Boletín Oficial Municipal | Buenos Aires Provincia\nINICIO\nACERCA DEL SIBOM\nBOLETINES\nMUNICIPIOS\nADMINISTRACION\nSistema de Boletines Oficiales Municipales (SIBOM)\nSistema de Boletines Oficiales Municipales (SIBOM)\nSistema de Boletines Oficiales Municipales (SIBOM)\nSistema de Boletines Oficiales Municipales (SIBOM)\nSistema de Boletines Oficiales Municipales (SIBOM)\nBoletines/Carmen de Areco\nDecreto Nº1136\nDecreto Nº 1136\nPublicado en versión extractada\nCarmen de Areco, 23/07/2025\nEl Decreto\n1029/2024\n; y contrato celebrado entre la Municipalidad de Carmen de Areco y  la Cooperativa de trabajo\n“AMADO OLMOS LTDA”\ncon fecha 26/06/2024 para realizar la obra “Construcción de 7 viviendas en la localidad de GOUIN”; y;\nAféctese en el ejercicio 2025 la suma de UVIS 161.860,42que se imputara a la sig. Partida:, conf. El art. 42 del Dec. 2980/00 de Rafam\n1110118000-132–24.51.53 – 4.2.1.0\n…………………..…………………………….…. UVIS 161.860,42\nRedes Sociales\nContacto\nAutoridad de Aplicación\nSecretaría General\nSubsecretaría Legal y Técnica\nGuía Servicios\nPortal de trámites\nExpedientes\nSeguridad Vial\nARBA\nBoletín Oficial\nRegistro de las Personas\nContrataciones\nVer Todos\nPolíticas de privacidad\nUso Interno\nWebmail (gba.gob.ar)\nWebmail HORDE\nSistemas\nGDEBA\nPortal del Empleado\nMesa de Ayuda\nSIAPE",
      "tablas": [],
      "montos_extraidos": [],
      "metadata": {
        "longitud_caracteres": 1293,
        "tiene_tablas": false,
        "total_tablas": 0,
        "total_montos": 0
      }
    },
    {
      "id": "2331067",
      "tipo": "decreto",
      "numero": "1137",
      "titulo": "Decreto Nº 1137",
      "fecha": "Carmen de Areco, 23/07/2025",
      "municipio": "Carmen de Areco",
      "url": "https://sibom.slyt.gba.gob.ar/bulletins/14177/contents/2331067",
      "contenido": "Sistema de Boletín Oficial Municipal | Buenos Aires Provincia\nINICIO\nACERCA DEL SIBOM\nBOLETINES\nMUNICIPIOS\nADMINISTRACION\nSistema de Boletines Oficiales Municipales (SIBOM)\nSistema de Boletines Oficiales Municipales (SIBOM)\nSistema de Boletines Oficiales Municipales (SIBOM)\nSistema de Boletines Oficiales Municipales (SIBOM)\nSistema de Boletines Oficiales Municipales (SIBOM)\nBoletines/Carmen de Areco\nDecreto Nº1137\nDecreto Nº 1137\nPublicado en versión extractada\nCarmen de Areco, 23/07/2025\nLa solicitud presentada por el Sr. ORONEL, FACUNDO ESTEBAN CAYETANO\nRedes Sociales\nContacto\nAutoridad de Aplicación\nSecretaría General\nSubsecretaría Legal y Técnica\nGuía Servicios\nPortal de trámites\nExpedientes\nSeguridad Vial\nARBA\nBoletín Oficial\nRegistro de las Personas\nContrataciones\nVer Todos\nPolíticas de privacidad\nUso Interno\nWebmail (gba.gob.ar)\nWebmail HORDE\nSistemas\nGDEBA\nPortal del Empleado\nMesa de Ayuda\nSIAPE",
      "tablas": [],
      "montos_extraidos": [],
      "metadata": {
        "longitud_caracteres": 916,
        "tiene_tablas": false,
        "total_tablas": 0,
        "total_montos": 0
      }
    },
    {
      "id": "2331068",
      "tipo": "decreto",
      "numero": "1138",
      "titulo": "Decreto Nº 1138",
      "fecha": "Carmen de Areco, 24/07/2025",
      "municipio": "Carmen de Areco",
      "url": "https://sibom.slyt.gba.gob.ar/bulletins/14177/contents/2331068",
      "contenido": "Sistema de Boletín Oficial Municipal | Buenos Aires Provincia\nINICIO\nACERCA DEL SIBOM\nBOLETINES\nMUNICIPIOS\nADMINISTRACION\nSistema de Boletines Oficiales Municipales (SIBOM)\nSistema de Boletines Oficiales Municipales (SIBOM)\nSistema de Boletines Oficiales Municipales (SIBOM)\nSistema de Boletines Oficiales Municipales (SIBOM)\nSistema de Boletines Oficiales Municipales (SIBOM)\nBoletines/Carmen de Areco\nDecreto Nº1138\nDecreto Nº 1138\nPublicado en versión extractada\nCarmen de Areco, 24/07/2025\nLas actividades programadas en el marco de “VACACIONES DE INVIERNO 2025” desde el día 21 de julio y hasta el 03 de agosto de 2025, con motivo del receso invernal.-; y;Contrátese, dado que el Municipio no cuenta en la planta con personal profesional afectado y/o dedicado a la tarea descripta en los vistos del presente, al Sr.\nSORIA, FABIAN IGNACIO,\npara efectuar el servicio de show circense para las vacaciones de invierno, los días 29 y 30 de julio, y 01 de agosto, en un todo de acuerdo con el contrato\nRedes Sociales\nContacto\nAutoridad de Aplicación\nSecretaría General\nSubsecretaría Legal y Técnica\nGuía Servicios\nPortal de trámites\nExpedientes\nSeguridad Vial\nARBA\nBoletín Oficial\nRegistro de las Personas\nContrataciones\nVer Todos\nPolíticas de privacidad\nUso Interno\nWebmail (gba.gob.ar)\nWebmail HORDE\nSistemas\nGDEBA\nPortal del Empleado\nMesa de Ayuda\nSIAPE",
      "tablas": [],
      "montos_extraidos": [],
      "metadata": {
        "longitud_caracteres": 1355,
        "tiene_tablas": false,
        "total_tablas": 0,
        "total_montos": 0
      }
    },
    {
      "id": "2331069",
      "tipo": "decreto",
      "numero": "1139",
      "titulo": "Decreto Nº 1139",
      "fecha": "Carmen de Areco, 24/07/2025",
      "municipio": "Carmen de Areco",
      "url": "https://sibom.slyt.gba.gob.ar/bulletins/14177/contents/2331069",
      "contenido": "Sistema de Boletín Oficial Municipal | Buenos Aires Provincia\nINICIO\nACERCA DEL SIBOM\nBOLETINES\nMUNICIPIOS\nADMINISTRACION\nSistema de Boletines Oficiales Municipales (SIBOM)\nSistema de Boletines Oficiales Municipales (SIBOM)\nSistema de Boletines Oficiales Municipales (SIBOM)\nSistema de Boletines Oficiales Municipales (SIBOM)\nSistema de Boletines Oficiales Municipales (SIBOM)\nBoletines/Carmen de Areco\nDecreto Nº1139\nDecreto Nº 1139\nPublicado en versión extractada\nCarmen de Areco, 24/07/2025\nampliacion\nRedes Sociales\nContacto\nAutoridad de Aplicación\nSecretaría General\nSubsecretaría Legal y Técnica\nGuía Servicios\nPortal de trámites\nExpedientes\nSeguridad Vial\nARBA\nBoletín Oficial\nRegistro de las Personas\nContrataciones\nVer Todos\nPolíticas de privacidad\nUso Interno\nWebmail (gba.gob.ar)\nWebmail HORDE\nSistemas\nGDEBA\nPortal del Empleado\nMesa de Ayuda\nSIAPE",
      "tablas": [],
      "montos_extraidos": [],
      "metadata": {
        "longitud_caracteres": 859,
        "tiene_tablas": false,
        "total_tablas": 0,
        "total_montos": 0
      }
    },
    {
      "id": "2331071",
      "tipo": "decreto",
      "numero": "1140",
      "titulo": "Decreto Nº 1140",
      "fecha": "Carmen de Areco, 24/07/2025",
      "municipio": "Carmen de Areco",
      "url": "https://sibom.slyt.gba.gob.ar/bulletins/14177/contents/2331071",
      "contenido": "Sistema de Boletín Oficial Municipal | Buenos Aires Provincia\nINICIO\nACERCA DEL SIBOM\nBOLETINES\nMUNICIPIOS\nADMINISTRACION\nSistema de Boletines Oficiales Municipales (SIBOM)\nSistema de Boletines Oficiales Municipales (SIBOM)\nSistema de Boletines Oficiales Municipales (SIBOM)\nSistema de Boletines Oficiales Municipales (SIBOM)\nSistema de Boletines Oficiales Municipales (SIBOM)\nBoletines/Carmen de Areco\nDecreto Nº1140\nDecreto Nº 1140\nPublicado en versión extractada\nCarmen de Areco, 24/07/2025\nDeclárese de Interés Municipal,  las actividades programadas en el marco de “VACACIONES DE INVIERNO 2025” desde el día 21 de julio y hasta el 03 de agosto de 2025, con motivo del receso invernal.-\nRedes Sociales\nContacto\nAutoridad de Aplicación\nSecretaría General\nSubsecretaría Legal y Técnica\nGuía Servicios\nPortal de trámites\nExpedientes\nSeguridad Vial\nARBA\nBoletín Oficial\nRegistro de las Personas\nContrataciones\nVer Todos\nPolíticas de privacidad\nUso Interno\nWebmail (gba.gob.ar)\nWebmail HORDE\nSistemas\nGDEBA\nPortal del Empleado\nMesa de Ayuda\nSIAPE",
      "tablas": [],
      "montos_extraidos": [],
      "metadata": {
        "longitud_caracteres": 1045,
        "tiene_tablas": false,
        "total_tablas": 0,
        "total_montos": 0
      }
    },
    {
      "id": "2331073",
      "tipo": "decreto",
      "numero": "1141",
      "titulo": "Decreto Nº 1141",
      "fecha": "Carmen de Areco, 24/07/2025",
      "municipio": "Carmen de Areco",
      "url": "https://sibom.slyt.gba.gob.ar/bulletins/14177/contents/2331073",
      "contenido": "Sistema de Boletín Oficial Municipal | Buenos Aires Provincia\nINICIO\nACERCA DEL SIBOM\nBOLETINES\nMUNICIPIOS\nADMINISTRACION\nSistema de Boletines Oficiales Municipales (SIBOM)\nSistema de Boletines Oficiales Municipales (SIBOM)\nSistema de Boletines Oficiales Municipales (SIBOM)\nSistema de Boletines Oficiales Municipales (SIBOM)\nSistema de Boletines Oficiales Municipales (SIBOM)\nBoletines/Carmen de Areco\nDecreto Nº1141\nDecreto Nº 1141\nPublicado en versión extractada\nCarmen de Areco, 24/07/2025\nDeclárese de Interés Municipal,  las actividades programadas en el marco de “VACACIONES DE INVIERNO 2025” desde el día 21 de julio y hasta el 03 de agosto de 2025, con motivo del receso invernal.-Contrátese, dado que el Municipio no cuenta en la planta con personal profesional afectado y/o dedicado a la tarea descripta en los vistos del presente, al Sr.\nRUBIO, GASPAR,\npara efectuar el servicio de sonido para el\n“Cierre de Vacaciones de Invierno”\na llevarse a cabo en el predio René Favaloro de Carmen de Areco, el día 02 de agosto del corriente año, en un todo de acuerdo con el contrato\nRedes Sociales\nContacto\nAutoridad de Aplicación\nSecretaría General\nSubsecretaría Legal y Técnica\nGuía Servicios\nPortal de trámites\nExpedientes\nSeguridad Vial\nARBA\nBoletín Oficial\nRegistro de las Personas\nContrataciones\nVer Todos\nPolíticas de privacidad\nUso Interno\nWebmail (gba.gob.ar)\nWebmail HORDE\nSistemas\nGDEBA\nPortal del Empleado\nMesa de Ayuda\nSIAPE",
      "tablas": [],
      "montos_extraidos": [],
      "metadata": {
        "longitud_caracteres": 1440,
        "tiene_tablas": false,
        "total_tablas": 0,
        "total_montos": 0
      }
    },
    {
      "id": "2331075",
      "tipo": "decreto",
      "numero": "1142",
      "titulo": "Decreto Nº 1142",
      "fecha": "Carmen de Areco, 24/07/2025",
      "municipio": "Carmen de Areco",
      "url": "https://sibom.slyt.gba.gob.ar/bulletins/14177/contents/2331075",
      "contenido": "Sistema de Boletín Oficial Municipal | Buenos Aires Provincia\nINICIO\nACERCA DEL SIBOM\nBOLETINES\nMUNICIPIOS\nADMINISTRACION\nSistema de Boletines Oficiales Municipales (SIBOM)\nSistema de Boletines Oficiales Municipales (SIBOM)\nSistema de Boletines Oficiales Municipales (SIBOM)\nSistema de Boletines Oficiales Municipales (SIBOM)\nSistema de Boletines Oficiales Municipales (SIBOM)\nBoletines/Carmen de Areco\nDecreto Nº1142\nDecreto Nº 1142\nPublicado en versión extractada\nCarmen de Areco, 24/07/2025\nLa solicitud presentada por la Sra.\nPONTIERI, EVELYN\nRedes Sociales\nContacto\nAutoridad de Aplicación\nSecretaría General\nSubsecretaría Legal y Técnica\nGuía Servicios\nPortal de trámites\nExpedientes\nSeguridad Vial\nARBA\nBoletín Oficial\nRegistro de las Personas\nContrataciones\nVer Todos\nPolíticas de privacidad\nUso Interno\nWebmail (gba.gob.ar)\nWebmail HORDE\nSistemas\nGDEBA\nPortal del Empleado\nMesa de Ayuda\nSIAPE",
      "tablas": [],
      "montos_extraidos": [],
      "metadata": {
        "longitud_caracteres": 901,
        "tiene_tablas": false,
        "total_tablas": 0,
        "total_montos": 0
      }
    },
    {
      "id": "2331079",
      "tipo": "decreto",
      "numero": "1143",
      "titulo": "Decreto Nº 1143",
      "fecha": "Carmen de Areco, 24/07/2025",
      "municipio": "Carmen de Areco",
      "url": "https://sibom.slyt.gba.gob.ar/bulletins/14177/contents/2331079",
      "contenido": "Sistema de Boletín Oficial Municipal | Buenos Aires Provincia\nINICIO\nACERCA DEL SIBOM\nBOLETINES\nMUNICIPIOS\nADMINISTRACION\nSistema de Boletines Oficiales Municipales (SIBOM)\nSistema de Boletines Oficiales Municipales (SIBOM)\nSistema de Boletines Oficiales Municipales (SIBOM)\nSistema de Boletines Oficiales Municipales (SIBOM)\nSistema de Boletines Oficiales Municipales (SIBOM)\nBoletines/Carmen de Areco\nDecreto Nº1143\nDecreto Nº 1143\nPublicado en versión extractada\nCarmen de Areco, 24/07/2025\nLa solicitud presentada por la Sra.\nGODOY, SILVIA SUSANA\nRedes Sociales\nContacto\nAutoridad de Aplicación\nSecretaría General\nSubsecretaría Legal y Técnica\nGuía Servicios\nPortal de trámites\nExpedientes\nSeguridad Vial\nARBA\nBoletín Oficial\nRegistro de las Personas\nContrataciones\nVer Todos\nPolíticas de privacidad\nUso Interno\nWebmail (gba.gob.ar)\nWebmail HORDE\nSistemas\nGDEBA\nPortal del Empleado\nMesa de Ayuda\nSIAPE",
      "tablas": [],
      "montos_extraidos": [],
      "metadata": {
        "longitud_caracteres": 905,
        "tiene_tablas": false,
        "total_tablas": 0,
        "total_montos": 0
      }
    },
    {
      "id": "2331082",
      "tipo": "decreto",
      "numero": "1144",
      "titulo": "Decreto Nº 1144",
      "fecha": "Carmen de Areco, 25/07/2025",
      "municipio": "Carmen de Areco",
      "url": "https://sibom.slyt.gba.gob.ar/bulletins/14177/contents/2331082",
      "contenido": "Sistema de Boletín Oficial Municipal | Buenos Aires Provincia\nINICIO\nACERCA DEL SIBOM\nBOLETINES\nMUNICIPIOS\nADMINISTRACION\nSistema de Boletines Oficiales Municipales (SIBOM)\nSistema de Boletines Oficiales Municipales (SIBOM)\nSistema de Boletines Oficiales Municipales (SIBOM)\nSistema de Boletines Oficiales Municipales (SIBOM)\nSistema de Boletines Oficiales Municipales (SIBOM)\nBoletines/Carmen de Areco\nDecreto Nº1144\nDecreto Nº 1144\nPublicado en versión extractada\nCarmen de Areco, 25/07/2025\nLa licencia anual por vacaciones que se concederá, desde el día 28 de julio de 2025 hasta el día 03 de agosto de 2025 inclusive, a la Contadora Interina Municipal, Sra. Batallón, Alicia Noemí, y;Desígnese en Reemplazo de la Contadora Interina Municipal Batallón, Alicia Noemí, a la Sra.\nCUEVAS, LUISINA DE LOURDES\ndesde el día 28 de julio de 2025 hasta el día 03 de agosto de 2025 inclusive.-\nRedes Sociales\nContacto\nAutoridad de Aplicación\nSecretaría General\nSubsecretaría Legal y Técnica\nGuía Servicios\nPortal de trámites\nExpedientes\nSeguridad Vial\nARBA\nBoletín Oficial\nRegistro de las Personas\nContrataciones\nVer Todos\nPolíticas de privacidad\nUso Interno\nWebmail (gba.gob.ar)\nWebmail HORDE\nSistemas\nGDEBA\nPortal del Empleado\nMesa de Ayuda\nSIAPE",
      "tablas": [],
      "montos_extraidos": [],
      "metadata": {
        "longitud_caracteres": 1241,
        "tiene_tablas": false,
        "total_tablas": 0,
        "total_montos": 0
      }
    },
    {
      "id": "2331085",
      "tipo": "decreto",
      "numero": "1145",
      "titulo": "Decreto Nº 1145",
      "fecha": "Carmen de Areco, 25/07/2025",
      "municipio": "Carmen de Areco",
      "url": "https://sibom.slyt.gba.gob.ar/bulletins/14177/contents/2331085",
      "contenido": "Sistema de Boletín Oficial Municipal | Buenos Aires Provincia\nINICIO\nACERCA DEL SIBOM\nBOLETINES\nMUNICIPIOS\nADMINISTRACION\nSistema de Boletines Oficiales Municipales (SIBOM)\nSistema de Boletines Oficiales Municipales (SIBOM)\nSistema de Boletines Oficiales Municipales (SIBOM)\nSistema de Boletines Oficiales Municipales (SIBOM)\nSistema de Boletines Oficiales Municipales (SIBOM)\nBoletines/Carmen de Areco\nDecreto Nº1145\nDecreto Nº 1145\nPublicado en versión extractada\nCarmen de Areco, 25/07/2025\nLa solicitud presentada por el Sr.\nRUVELLI, BRIAN MARTIN\nRedes Sociales\nContacto\nAutoridad de Aplicación\nSecretaría General\nSubsecretaría Legal y Técnica\nGuía Servicios\nPortal de trámites\nExpedientes\nSeguridad Vial\nARBA\nBoletín Oficial\nRegistro de las Personas\nContrataciones\nVer Todos\nPolíticas de privacidad\nUso Interno\nWebmail (gba.gob.ar)\nWebmail HORDE\nSistemas\nGDEBA\nPortal del Empleado\nMesa de Ayuda\nSIAPE",
      "tablas": [],
      "montos_extraidos": [],
      "metadata": {
        "longitud_caracteres": 905,
        "tiene_tablas": false,
        "total_tablas": 0,
        "total_montos": 0
      }
    },
    {
      "id": "2331088",
      "tipo": "decreto",
      "numero": "1146",
      "titulo": "Decreto Nº 1146",
      "fecha": "Carmen de Areco, 25/07/2025",
      "municipio": "Carmen de Areco",
      "url": "https://sibom.slyt.gba.gob.ar/bulletins/14177/contents/2331088",
      "contenido": "Sistema de Boletín Oficial Municipal | Buenos Aires Provincia\nINICIO\nACERCA DEL SIBOM\nBOLETINES\nMUNICIPIOS\nADMINISTRACION\nSistema de Boletines Oficiales Municipales (SIBOM)\nSistema de Boletines Oficiales Municipales (SIBOM)\nSistema de Boletines Oficiales Municipales (SIBOM)\nSistema de Boletines Oficiales Municipales (SIBOM)\nSistema de Boletines Oficiales Municipales (SIBOM)\nBoletines/Carmen de Areco\nDecreto Nº1146\nDecreto Nº 1146\nPublicado en versión extractada\nCarmen de Areco, 25/07/2025\nAcéptese la renuncia presentada porla Sra.\nONGAY, GABRIELA ANDREA\ny decrétese su cese a partir del día 31 de Julio de 2025.-\nRedes Sociales\nContacto\nAutoridad de Aplicación\nSecretaría General\nSubsecretaría Legal y Técnica\nGuía Servicios\nPortal de trámites\nExpedientes\nSeguridad Vial\nARBA\nBoletín Oficial\nRegistro de las Personas\nContrataciones\nVer Todos\nPolíticas de privacidad\nUso Interno\nWebmail (gba.gob.ar)\nWebmail HORDE\nSistemas\nGDEBA\nPortal del Empleado\nMesa de Ayuda\nSIAPE",
      "tablas": [],
      "montos_extraidos": [],
      "metadata": {
        "longitud_caracteres": 973,
        "tiene_tablas": false,
        "total_tablas": 0,
        "total_montos": 0
      }
    },
    {
      "id": "2331090",
      "tipo": "decreto",
      "numero": "1147",
      "titulo": "Decreto Nº 1147",
      "fecha": "Carmen de Areco, 25/07/2025",
      "municipio": "Carmen de Areco",
      "url": "https://sibom.slyt.gba.gob.ar/bulletins/14177/contents/2331090",
      "contenido": "Sistema de Boletín Oficial Municipal | Buenos Aires Provincia\nINICIO\nACERCA DEL SIBOM\nBOLETINES\nMUNICIPIOS\nADMINISTRACION\nSistema de Boletines Oficiales Municipales (SIBOM)\nSistema de Boletines Oficiales Municipales (SIBOM)\nSistema de Boletines Oficiales Municipales (SIBOM)\nSistema de Boletines Oficiales Municipales (SIBOM)\nSistema de Boletines Oficiales Municipales (SIBOM)\nBoletines/Carmen de Areco\nDecreto Nº1147\nDecreto Nº 1147\nPublicado en versión extractada\nCarmen de Areco, 25/07/2025\nAcéptese la renuncia y dispóngase el cese, a partir del día 31 de Julio de 2025, del Sr.\nLACUNZA, JUSTO IGNACIO\nal Cargo de\nCOORDINADOR DE JUVENTUD\nquien reviste en la jurisdicción 1110114000 –Categoría programática – 26.01.00 - 110 -PERSONAL SUPERIOR, planta política.-\nRedes Sociales\nContacto\nAutoridad de Aplicación\nSecretaría General\nSubsecretaría Legal y Técnica\nGuía Servicios\nPortal de trámites\nExpedientes\nSeguridad Vial\nARBA\nBoletín Oficial\nRegistro de las Personas\nContrataciones\nVer Todos\nPolíticas de privacidad\nUso Interno\nWebmail (gba.gob.ar)\nWebmail HORDE\nSistemas\nGDEBA\nPortal del Empleado\nMesa de Ayuda\nSIAPE",
      "tablas": [],
      "montos_extraidos": [],
      "metadata": {
        "longitud_caracteres": 1119,
        "tiene_tablas": false,
        "total_tablas": 0,
        "total_montos": 0
      }
    },
    {
      "id": "2331094",
      "tipo": "decreto",
      "numero": "1148",
      "titulo": "Decreto Nº 1148",
      "fecha": "Carmen de Areco, 25/07/2025",
      "municipio": "Carmen de Areco",
      "url": "https://sibom.slyt.gba.gob.ar/bulletins/14177/contents/2331094",
      "contenido": "Sistema de Boletín Oficial Municipal | Buenos Aires Provincia\nINICIO\nACERCA DEL SIBOM\nBOLETINES\nMUNICIPIOS\nADMINISTRACION\nSistema de Boletines Oficiales Municipales (SIBOM)\nSistema de Boletines Oficiales Municipales (SIBOM)\nSistema de Boletines Oficiales Municipales (SIBOM)\nSistema de Boletines Oficiales Municipales (SIBOM)\nSistema de Boletines Oficiales Municipales (SIBOM)\nBoletines/Carmen de Areco\nDecreto Nº1148\nDecreto Nº 1148\nPublicado en versión extractada\nCarmen de Areco, 25/07/2025\nLa necesidad de contar con una persona que realice tareas para la Secretaria de Planificación de esta municipalidad,\nDesígnese como personal temporario al Sr.\nMANSILLA FERNANDO EZEQUIEL,\npara efectuar las tareas enunciadas en los vistos del presente decreto.-\nRedes Sociales\nContacto\nAutoridad de Aplicación\nSecretaría General\nSubsecretaría Legal y Técnica\nGuía Servicios\nPortal de trámites\nExpedientes\nSeguridad Vial\nARBA\nBoletín Oficial\nRegistro de las Personas\nContrataciones\nVer Todos\nPolíticas de privacidad\nUso Interno\nWebmail (gba.gob.ar)\nWebmail HORDE\nSistemas\nGDEBA\nPortal del Empleado\nMesa de Ayuda\nSIAPE",
      "tablas": [],
      "montos_extraidos": [],
      "metadata": {
        "longitud_caracteres": 1108,
        "tiene_tablas": false,
        "total_tablas": 0,
        "total_montos": 0
      }
    },
    {
      "id": "2331096",
      "tipo": "decreto",
      "numero": "1149",
      "titulo": "Decreto Nº 1149",
      "fecha": "Carmen de Areco, 25/07/2025",
      "municipio": "Carmen de Areco",
      "url": "https://sibom.slyt.gba.gob.ar/bulletins/14177/contents/2331096",
      "contenido": "Sistema de Boletín Oficial Municipal | Buenos Aires Provincia\nINICIO\nACERCA DEL SIBOM\nBOLETINES\nMUNICIPIOS\nADMINISTRACION\nSistema de Boletines Oficiales Municipales (SIBOM)\nSistema de Boletines Oficiales Municipales (SIBOM)\nSistema de Boletines Oficiales Municipales (SIBOM)\nSistema de Boletines Oficiales Municipales (SIBOM)\nSistema de Boletines Oficiales Municipales (SIBOM)\nBoletines/Carmen de Areco\nDecreto Nº1149\nDecreto Nº 1149\nPublicado en versión extractada\nCarmen de Areco, 25/07/2025\nAcéptese la renuncia presentada por el  Sr.\nPELLATI, JOSE LEONARDO ,\ny decrétese su cese a partirdel día 31 de Julio de 2025.-\nRedes Sociales\nContacto\nAutoridad de Aplicación\nSecretaría General\nSubsecretaría Legal y Técnica\nGuía Servicios\nPortal de trámites\nExpedientes\nSeguridad Vial\nARBA\nBoletín Oficial\nRegistro de las Personas\nContrataciones\nVer Todos\nPolíticas de privacidad\nUso Interno\nWebmail (gba.gob.ar)\nWebmail HORDE\nSistemas\nGDEBA\nPortal del Empleado\nMesa de Ayuda\nSIAPE",
      "tablas": [],
      "montos_extraidos": [],
      "metadata": {
        "longitud_caracteres": 975,
        "tiene_tablas": false,
        "total_tablas": 0,
        "total_montos": 0
      }
    },
    {
      "id": "2331097",
      "tipo": "decreto",
      "numero": "1150",
      "titulo": "Decreto Nº 1150",
      "fecha": "Carmen de Areco, 25/07/2025",
      "municipio": "Carmen de Areco",
      "url": "https://sibom.slyt.gba.gob.ar/bulletins/14177/contents/2331097",
      "contenido": "Sistema de Boletín Oficial Municipal | Buenos Aires Provincia\nINICIO\nACERCA DEL SIBOM\nBOLETINES\nMUNICIPIOS\nADMINISTRACION\nSistema de Boletines Oficiales Municipales (SIBOM)\nSistema de Boletines Oficiales Municipales (SIBOM)\nSistema de Boletines Oficiales Municipales (SIBOM)\nSistema de Boletines Oficiales Municipales (SIBOM)\nSistema de Boletines Oficiales Municipales (SIBOM)\nBoletines/Carmen de Areco\nDecreto Nº1150\nDecreto Nº 1150\nPublicado en versión extractada\nCarmen de Areco, 25/07/2025\nJORNADA LABORAL DE 8HS\nRedes Sociales\nContacto\nAutoridad de Aplicación\nSecretaría General\nSubsecretaría Legal y Técnica\nGuía Servicios\nPortal de trámites\nExpedientes\nSeguridad Vial\nARBA\nBoletín Oficial\nRegistro de las Personas\nContrataciones\nVer Todos\nPolíticas de privacidad\nUso Interno\nWebmail (gba.gob.ar)\nWebmail HORDE\nSistemas\nGDEBA\nPortal del Empleado\nMesa de Ayuda\nSIAPE",
      "tablas": [],
      "montos_extraidos": [],
      "metadata": {
        "longitud_caracteres": 871,
        "tiene_tablas": false,
        "total_tablas": 0,
        "total_montos": 0
      }
    },
    {
      "id": "2331099",
      "tipo": "decreto",
      "numero": "1151",
      "titulo": "Decreto Nº 1151",
      "fecha": "Carmen de Areco, 25/07/2025",
      "municipio": "Carmen de Areco",
      "url": "https://sibom.slyt.gba.gob.ar/bulletins/14177/contents/2331099",
      "contenido": "Sistema de Boletín Oficial Municipal | Buenos Aires Provincia\nINICIO\nACERCA DEL SIBOM\nBOLETINES\nMUNICIPIOS\nADMINISTRACION\nSistema de Boletines Oficiales Municipales (SIBOM)\nSistema de Boletines Oficiales Municipales (SIBOM)\nSistema de Boletines Oficiales Municipales (SIBOM)\nSistema de Boletines Oficiales Municipales (SIBOM)\nSistema de Boletines Oficiales Municipales (SIBOM)\nBoletines/Carmen de Areco\nDecreto Nº1151\nDecreto Nº 1151\nPublicado en versión extractada\nCarmen de Areco, 25/07/2025\nLa necesidad de mantener en óptimas condiciones edilicias el Galpón Cultural y deposito de maquinarias del predio Estación de ferrocarril, Contrátese, desde el 25 de julio de 2025 al 31 de julio de 2025, dado que el Municipio no cuenta en la planta con personal profesional afectado y/o dedicado a la tarea descripta en los vistos del presente, al Sr.\nLEÓN, NATANAEL ANDRES\npara realizar las tareas descriptas ut supra, en un todo de acuerdo con el contrato\nRedes Sociales\nContacto\nAutoridad de Aplicación\nSecretaría General\nSubsecretaría Legal y Técnica\nGuía Servicios\nPortal de trámites\nExpedientes\nSeguridad Vial\nARBA\nBoletín Oficial\nRegistro de las Personas\nContrataciones\nVer Todos\nPolíticas de privacidad\nUso Interno\nWebmail (gba.gob.ar)\nWebmail HORDE\nSistemas\nGDEBA\nPortal del Empleado\nMesa de Ayuda\nSIAPE",
      "tablas": [],
      "montos_extraidos": [],
      "metadata": {
        "longitud_caracteres": 1306,
        "tiene_tablas": false,
        "total_tablas": 0,
        "total_montos": 0
      }
    },
    {
      "id": "2331100",
      "tipo": "decreto",
      "numero": "1152",
      "titulo": "Decreto Nº 1152",
      "fecha": "Carmen de Areco, 25/07/2025",
      "municipio": "Carmen de Areco",
      "url": "https://sibom.slyt.gba.gob.ar/bulletins/14177/contents/2331100",
      "contenido": "Sistema de Boletín Oficial Municipal | Buenos Aires Provincia\nINICIO\nACERCA DEL SIBOM\nBOLETINES\nMUNICIPIOS\nADMINISTRACION\nSistema de Boletines Oficiales Municipales (SIBOM)\nSistema de Boletines Oficiales Municipales (SIBOM)\nSistema de Boletines Oficiales Municipales (SIBOM)\nSistema de Boletines Oficiales Municipales (SIBOM)\nSistema de Boletines Oficiales Municipales (SIBOM)\nBoletines/Carmen de Areco\nDecreto Nº1152\nDecreto Nº 1152\nPublicado en versión extractada\nCarmen de Areco, 25/07/2025\nDeclarase de INTERES MUNICIPAL, El operativo control de tránsito en nuestra ciudad, se llevara adelante el sábado 2 y domingo 3 de Agosto.-\nRedes Sociales\nContacto\nAutoridad de Aplicación\nSecretaría General\nSubsecretaría Legal y Técnica\nGuía Servicios\nPortal de trámites\nExpedientes\nSeguridad Vial\nARBA\nBoletín Oficial\nRegistro de las Personas\nContrataciones\nVer Todos\nPolíticas de privacidad\nUso Interno\nWebmail (gba.gob.ar)\nWebmail HORDE\nSistemas\nGDEBA\nPortal del Empleado\nMesa de Ayuda\nSIAPE",
      "tablas": [],
      "montos_extraidos": [],
      "metadata": {
        "longitud_caracteres": 988,
        "tiene_tablas": false,
        "total_tablas": 0,
        "total_montos": 0
      }
    },
    {
      "id": "2331110",
      "tipo": "decreto",
      "numero": "1153",
      "titulo": "Decreto Nº 1153",
      "fecha": "Carmen de Areco, 25/07/2025",
      "municipio": "Carmen de Areco",
      "url": "https://sibom.slyt.gba.gob.ar/bulletins/14177/contents/2331110",
      "contenido": "Sistema de Boletín Oficial Municipal | Buenos Aires Provincia\nINICIO\nACERCA DEL SIBOM\nBOLETINES\nMUNICIPIOS\nADMINISTRACION\nSistema de Boletines Oficiales Municipales (SIBOM)\nSistema de Boletines Oficiales Municipales (SIBOM)\nSistema de Boletines Oficiales Municipales (SIBOM)\nSistema de Boletines Oficiales Municipales (SIBOM)\nSistema de Boletines Oficiales Municipales (SIBOM)\nBoletines/Carmen de Areco\nDecreto Nº1153\nDecreto Nº 1153\nPublicado en versión extractada\nCarmen de Areco, 25/07/2025\nLa solicitud presentada por la Sra.\nPACHECO, MICAELA VICTORIA\nRedes Sociales\nContacto\nAutoridad de Aplicación\nSecretaría General\nSubsecretaría Legal y Técnica\nGuía Servicios\nPortal de trámites\nExpedientes\nSeguridad Vial\nARBA\nBoletín Oficial\nRegistro de las Personas\nContrataciones\nVer Todos\nPolíticas de privacidad\nUso Interno\nWebmail (gba.gob.ar)\nWebmail HORDE\nSistemas\nGDEBA\nPortal del Empleado\nMesa de Ayuda\nSIAPE",
      "tablas": [],
      "montos_extraidos": [],
      "metadata": {
        "longitud_caracteres": 910,
        "tiene_tablas": false,
        "total_tablas": 0,
        "total_montos": 0
      }
    },
    {
      "id": "2331111",
      "tipo": "decreto",
      "numero": "1154",
      "titulo": "Decreto Nº 1154",
      "fecha": "Carmen de Areco, 25/07/2025",
      "municipio": "Carmen de Areco",
      "url": "https://sibom.slyt.gba.gob.ar/bulletins/14177/contents/2331111",
      "contenido": "Sistema de Boletín Oficial Municipal | Buenos Aires Provincia\nINICIO\nACERCA DEL SIBOM\nBOLETINES\nMUNICIPIOS\nADMINISTRACION\nSistema de Boletines Oficiales Municipales (SIBOM)\nSistema de Boletines Oficiales Municipales (SIBOM)\nSistema de Boletines Oficiales Municipales (SIBOM)\nSistema de Boletines Oficiales Municipales (SIBOM)\nSistema de Boletines Oficiales Municipales (SIBOM)\nBoletines/Carmen de Areco\nDecreto Nº1154\nDecreto Nº 1154\nPublicado en versión extractada\nCarmen de Areco, 25/07/2025\nLa solicitud presentada por la Sra.\nFRITZ, ALEJANDRA CLAUDIA\nRedes Sociales\nContacto\nAutoridad de Aplicación\nSecretaría General\nSubsecretaría Legal y Técnica\nGuía Servicios\nPortal de trámites\nExpedientes\nSeguridad Vial\nARBA\nBoletín Oficial\nRegistro de las Personas\nContrataciones\nVer Todos\nPolíticas de privacidad\nUso Interno\nWebmail (gba.gob.ar)\nWebmail HORDE\nSistemas\nGDEBA\nPortal del Empleado\nMesa de Ayuda\nSIAPE",
      "tablas": [],
      "montos_extraidos": [],
      "metadata": {
        "longitud_caracteres": 909,
        "tiene_tablas": false,
        "total_tablas": 0,
        "total_montos": 0
      }
    },
    {
      "id": "2331114",
      "tipo": "decreto",
      "numero": "1155",
      "titulo": "Decreto Nº 1155",
      "fecha": "Carmen de Areco, 28/07/2025",
      "municipio": "Carmen de Areco",
      "url": "https://sibom.slyt.gba.gob.ar/bulletins/14177/contents/2331114",
      "contenido": "Sistema de Boletín Oficial Municipal | Buenos Aires Provincia\nINICIO\nACERCA DEL SIBOM\nBOLETINES\nMUNICIPIOS\nADMINISTRACION\nSistema de Boletines Oficiales Municipales (SIBOM)\nSistema de Boletines Oficiales Municipales (SIBOM)\nSistema de Boletines Oficiales Municipales (SIBOM)\nSistema de Boletines Oficiales Municipales (SIBOM)\nSistema de Boletines Oficiales Municipales (SIBOM)\nBoletines/Carmen de Areco\nDecreto Nº1155\nDecreto Nº 1155\nPublicado en versión extractada\nCarmen de Areco, 28/07/2025\nLa necesidad de ejecutar obras de bacheo en diversas ubicaciones de la ciudad, Contrátese por el plazo de 60 días contados a partir de la firma del presente contrato, dado que el Municipio no cuenta en la planta con personal profesional afectado y/o dedicado a la tarea descripta en los vistos del presente, a la Empresa\nORO VIAL S. A.\npara realizar las tareas descriptas ut supra, en un todo de acuerdo con el contrato\nRedes Sociales\nContacto\nAutoridad de Aplicación\nSecretaría General\nSubsecretaría Legal y Técnica\nGuía Servicios\nPortal de trámites\nExpedientes\nSeguridad Vial\nARBA\nBoletín Oficial\nRegistro de las Personas\nContrataciones\nVer Todos\nPolíticas de privacidad\nUso Interno\nWebmail (gba.gob.ar)\nWebmail HORDE\nSistemas\nGDEBA\nPortal del Empleado\nMesa de Ayuda\nSIAPE",
      "tablas": [],
      "montos_extraidos": [],
      "metadata": {
        "longitud_caracteres": 1268,
        "tiene_tablas": false,
        "total_tablas": 0,
        "total_montos": 0
      }
    },
    {
      "id": "2331120",
      "tipo": "decreto",
      "numero": "1156",
      "titulo": "Decreto Nº 1156",
      "fecha": "Carmen de Areco, 28/07/2025",
      "municipio": "Carmen de Areco",
      "url": "https://sibom.slyt.gba.gob.ar/bulletins/14177/contents/2331120",
      "contenido": "Sistema de Boletín Oficial Municipal | Buenos Aires Provincia\nINICIO\nACERCA DEL SIBOM\nBOLETINES\nMUNICIPIOS\nADMINISTRACION\nSistema de Boletines Oficiales Municipales (SIBOM)\nSistema de Boletines Oficiales Municipales (SIBOM)\nSistema de Boletines Oficiales Municipales (SIBOM)\nSistema de Boletines Oficiales Municipales (SIBOM)\nSistema de Boletines Oficiales Municipales (SIBOM)\nBoletines/Carmen de Areco\nDecreto Nº1156\nDecreto Nº 1156\nPublicado en versión extractada\nCarmen de Areco, 28/07/2025\nLa solicitud presentada por el Sr.\nSOSA, OCTAVIO ALBERTO\nRedes Sociales\nContacto\nAutoridad de Aplicación\nSecretaría General\nSubsecretaría Legal y Técnica\nGuía Servicios\nPortal de trámites\nExpedientes\nSeguridad Vial\nARBA\nBoletín Oficial\nRegistro de las Personas\nContrataciones\nVer Todos\nPolíticas de privacidad\nUso Interno\nWebmail (gba.gob.ar)\nWebmail HORDE\nSistemas\nGDEBA\nPortal del Empleado\nMesa de Ayuda\nSIAPE",
      "tablas": [],
      "montos_extraidos": [],
      "metadata": {
        "longitud_caracteres": 905,
        "tiene_tablas": false,
        "total_tablas": 0,
        "total_montos": 0
      }
    },
    {
      "id": "2331121",
      "tipo": "decreto",
      "numero": "1157",
      "titulo": "Decreto Nº 1157",
      "fecha": "Carmen de Areco, 28/07/2025",
      "municipio": "Carmen de Areco",
      "url": "https://sibom.slyt.gba.gob.ar/bulletins/14177/contents/2331121",
      "contenido": "Sistema de Boletín Oficial Municipal | Buenos Aires Provincia\nINICIO\nACERCA DEL SIBOM\nBOLETINES\nMUNICIPIOS\nADMINISTRACION\nSistema de Boletines Oficiales Municipales (SIBOM)\nSistema de Boletines Oficiales Municipales (SIBOM)\nSistema de Boletines Oficiales Municipales (SIBOM)\nSistema de Boletines Oficiales Municipales (SIBOM)\nSistema de Boletines Oficiales Municipales (SIBOM)\nBoletines/Carmen de Areco\nDecreto Nº1157\nDecreto Nº 1157\nPublicado en versión extractada\nCarmen de Areco, 28/07/2025\nLa solicitud presentada por el Sr.\nROJO, DYLAN\nRedes Sociales\nContacto\nAutoridad de Aplicación\nSecretaría General\nSubsecretaría Legal y Técnica\nGuía Servicios\nPortal de trámites\nExpedientes\nSeguridad Vial\nARBA\nBoletín Oficial\nRegistro de las Personas\nContrataciones\nVer Todos\nPolíticas de privacidad\nUso Interno\nWebmail (gba.gob.ar)\nWebmail HORDE\nSistemas\nGDEBA\nPortal del Empleado\nMesa de Ayuda\nSIAPE",
      "tablas": [],
      "montos_extraidos": [],
      "metadata": {
        "longitud_caracteres": 895,
        "tiene_tablas": false,
        "total_tablas": 0,
        "total_montos": 0
      }
    },
    {
      "id": "2331123",
      "tipo": "decreto",
      "numero": "1158",
      "titulo": "Decreto Nº 1158",
      "fecha": "Carmen de Areco, 28/07/2025",
      "municipio": "Carmen de Areco",
      "url": "https://sibom.slyt.gba.gob.ar/bulletins/14177/contents/2331123",
      "contenido": "Sistema de Boletín Oficial Municipal | Buenos Aires Provincia\nINICIO\nACERCA DEL SIBOM\nBOLETINES\nMUNICIPIOS\nADMINISTRACION\nSistema de Boletines Oficiales Municipales (SIBOM)\nSistema de Boletines Oficiales Municipales (SIBOM)\nSistema de Boletines Oficiales Municipales (SIBOM)\nSistema de Boletines Oficiales Municipales (SIBOM)\nSistema de Boletines Oficiales Municipales (SIBOM)\nBoletines/Carmen de Areco\nDecreto Nº1158\nDecreto Nº 1158\nPublicado en versión extractada\nCarmen de Areco, 28/07/2025\nLa solicitud presentada por el Sr.\nCABRERA, CARLOS ALBERTO\nRedes Sociales\nContacto\nAutoridad de Aplicación\nSecretaría General\nSubsecretaría Legal y Técnica\nGuía Servicios\nPortal de trámites\nExpedientes\nSeguridad Vial\nARBA\nBoletín Oficial\nRegistro de las Personas\nContrataciones\nVer Todos\nPolíticas de privacidad\nUso Interno\nWebmail (gba.gob.ar)\nWebmail HORDE\nSistemas\nGDEBA\nPortal del Empleado\nMesa de Ayuda\nSIAPE",
      "tablas": [],
      "montos_extraidos": [],
      "metadata": {
        "longitud_caracteres": 907,
        "tiene_tablas": false,
        "total_tablas": 0,
        "total_montos": 0
      }
    },
    {
      "id": "2331124",
      "tipo": "decreto",
      "numero": "1159",
      "titulo": "Decreto Nº 1159",
      "fecha": "Carmen de Areco, 28/07/2025",
      "municipio": "Carmen de Areco",
      "url": "https://sibom.slyt.gba.gob.ar/bulletins/14177/contents/2331124",
      "contenido": "Sistema de Boletín Oficial Municipal | Buenos Aires Provincia\nINICIO\nACERCA DEL SIBOM\nBOLETINES\nMUNICIPIOS\nADMINISTRACION\nSistema de Boletines Oficiales Municipales (SIBOM)\nSistema de Boletines Oficiales Municipales (SIBOM)\nSistema de Boletines Oficiales Municipales (SIBOM)\nSistema de Boletines Oficiales Municipales (SIBOM)\nSistema de Boletines Oficiales Municipales (SIBOM)\nBoletines/Carmen de Areco\nDecreto Nº1159\nDecreto Nº 1159\nPublicado en versión extractada\nCarmen de Areco, 28/07/2025\nLa solicitud presentada por la Sra.\nBANNON, DAIANA ALEJANDRA\nRedes Sociales\nContacto\nAutoridad de Aplicación\nSecretaría General\nSubsecretaría Legal y Técnica\nGuía Servicios\nPortal de trámites\nExpedientes\nSeguridad Vial\nARBA\nBoletín Oficial\nRegistro de las Personas\nContrataciones\nVer Todos\nPolíticas de privacidad\nUso Interno\nWebmail (gba.gob.ar)\nWebmail HORDE\nSistemas\nGDEBA\nPortal del Empleado\nMesa de Ayuda\nSIAPE",
      "tablas": [],
      "montos_extraidos": [],
      "metadata": {
        "longitud_caracteres": 909,
        "tiene_tablas": false,
        "total_tablas": 0,
        "total_montos": 0
      }
    },
    {
      "id": "2331125",
      "tipo": "decreto",
      "numero": "1160",
      "titulo": "Decreto Nº 1160",
      "fecha": "Carmen de Areco, 28/07/2025",
      "municipio": "Carmen de Areco",
      "url": "https://sibom.slyt.gba.gob.ar/bulletins/14177/contents/2331125",
      "contenido": "Sistema de Boletín Oficial Municipal | Buenos Aires Provincia\nINICIO\nACERCA DEL SIBOM\nBOLETINES\nMUNICIPIOS\nADMINISTRACION\nSistema de Boletines Oficiales Municipales (SIBOM)\nSistema de Boletines Oficiales Municipales (SIBOM)\nSistema de Boletines Oficiales Municipales (SIBOM)\nSistema de Boletines Oficiales Municipales (SIBOM)\nSistema de Boletines Oficiales Municipales (SIBOM)\nBoletines/Carmen de Areco\nDecreto Nº1160\nDecreto Nº 1160\nPublicado en versión extractada\nCarmen de Areco, 28/07/2025\nLa solicitud presentada por la Sra.\nCURIA, MARIA BELEN\nRedes Sociales\nContacto\nAutoridad de Aplicación\nSecretaría General\nSubsecretaría Legal y Técnica\nGuía Servicios\nPortal de trámites\nExpedientes\nSeguridad Vial\nARBA\nBoletín Oficial\nRegistro de las Personas\nContrataciones\nVer Todos\nPolíticas de privacidad\nUso Interno\nWebmail (gba.gob.ar)\nWebmail HORDE\nSistemas\nGDEBA\nPortal del Empleado\nMesa de Ayuda\nSIAPE",
      "tablas": [],
      "montos_extraidos": [],
      "metadata": {
        "longitud_caracteres": 903,
        "tiene_tablas": false,
        "total_tablas": 0,
        "total_montos": 0
      }
    }
  ],
  "metadata_boletin": {
    "total_caracteres": 51941,
    "total_tablas": 0,
    "total_montos": 2,
    "fecha_scraping": "2026-01-16T08:03:48Z",
    "version_scraper": "2.0"
  }
}