{
  "municipio": "Carmen de Areco",
  "numero_boletin": "32º",
  "fecha_boletin": "07/01/2026",
  "boletin_url": "https://sibom.slyt.gba.gob.ar/bulletins/14239",
  "status": "completed",
  "total_normas": 50,
  "normas": [
    {
      "id": "2332829",
      "tipo": "decreto",
      "numero": "1223",
      "titulo": "Decreto Nº 1223",
      "fecha": "Carmen de Areco, 01/08/2025",
      "municipio": "Carmen de Areco",
      "url": "https://sibom.slyt.gba.gob.ar/bulletins/14239/contents/2332829",
      "contenido": "Sistema de Boletín Oficial Municipal | Buenos Aires Provincia\nINICIO\nACERCA DEL SIBOM\nBOLETINES\nMUNICIPIOS\nADMINISTRACION\nSistema de Boletines Oficiales Municipales (SIBOM)\nSistema de Boletines Oficiales Municipales (SIBOM)\nSistema de Boletines Oficiales Municipales (SIBOM)\nSistema de Boletines Oficiales Municipales (SIBOM)\nSistema de Boletines Oficiales Municipales (SIBOM)\nBoletines/Carmen de Areco\nDecreto Nº1223\nDecreto Nº 1223\nPublicado en versión extractada\nCarmen de Areco, 01/08/2025\nLa necesidad de contratar el Servicio Profesional Odontológico en el Caps Dr. Rafael Echenique; y Contrátese, dado que el Municipio no cuenta en la planta con personal profesional afectado y/o dedicado a la tarea descripta en los vistos y considerando del presente, desde el 01 de agosto de 2025 y hasta el día 31 de agosto de 2025, a la Sra.\nROCA, MELISA MARIELA; ODONTOLOGA,\nRedes Sociales\nContacto\nAutoridad de Aplicación\nSecretaría General\nSubsecretaría Legal y Técnica\nGuía Servicios\nPortal de trámites\nExpedientes\nSeguridad Vial\nARBA\nBoletín Oficial\nRegistro de las Personas\nContrataciones\nVer Todos\nPolíticas de privacidad\nUso Interno\nWebmail (gba.gob.ar)\nWebmail HORDE\nSistemas\nGDEBA\nPortal del Empleado\nMesa de Ayuda\nSIAPE",
      "tablas": [],
      "montos_extraidos": [],
      "metadata": {
        "longitud_caracteres": 1225,
        "tiene_tablas": false,
        "total_tablas": 0,
        "total_montos": 0
      }
    },
    {
      "id": "2332830",
      "tipo": "decreto",
      "numero": "1224",
      "titulo": "Decreto Nº 1224",
      "fecha": "Carmen de Areco, 01/08/2025",
      "municipio": "Carmen de Areco",
      "url": "https://sibom.slyt.gba.gob.ar/bulletins/14239/contents/2332830",
      "contenido": "Sistema de Boletín Oficial Municipal | Buenos Aires Provincia\nINICIO\nACERCA DEL SIBOM\nBOLETINES\nMUNICIPIOS\nADMINISTRACION\nSistema de Boletines Oficiales Municipales (SIBOM)\nSistema de Boletines Oficiales Municipales (SIBOM)\nSistema de Boletines Oficiales Municipales (SIBOM)\nSistema de Boletines Oficiales Municipales (SIBOM)\nSistema de Boletines Oficiales Municipales (SIBOM)\nBoletines/Carmen de Areco\nDecreto Nº1224\nDecreto Nº 1224\nPublicado en versión extractada\nCarmen de Areco, 01/08/2025\nLa necesidad de contratarel Servicio Profesional de un médico CLINICO para el Caps Gouin; y Contrátese, dado que el Municipio no cuenta en la planta con personal profesional afectado y/o dedicado a la tarea descripta en los vistos y considerando del presente, desde el 01 de agosto de 2025 y hasta el día 31 de agosto de 2025, a la Sra.\nMARTIN, PALOMA, Medica Clínica;\nRedes Sociales\nContacto\nAutoridad de Aplicación\nSecretaría General\nSubsecretaría Legal y Técnica\nGuía Servicios\nPortal de trámites\nExpedientes\nSeguridad Vial\nARBA\nBoletín Oficial\nRegistro de las Personas\nContrataciones\nVer Todos\nPolíticas de privacidad\nUso Interno\nWebmail (gba.gob.ar)\nWebmail HORDE\nSistemas\nGDEBA\nPortal del Empleado\nMesa de Ayuda\nSIAPE",
      "tablas": [],
      "montos_extraidos": [],
      "metadata": {
        "longitud_caracteres": 1217,
        "tiene_tablas": false,
        "total_tablas": 0,
        "total_montos": 0
      }
    },
    {
      "id": "2332916",
      "tipo": "decreto",
      "numero": "1225",
      "titulo": "Decreto Nº 1225",
      "fecha": "Carmen de Areco, 01/08/2025",
      "municipio": "Carmen de Areco",
      "url": "https://sibom.slyt.gba.gob.ar/bulletins/14239/contents/2332916",
      "contenido": "Sistema de Boletín Oficial Municipal | Buenos Aires Provincia\nINICIO\nACERCA DEL SIBOM\nBOLETINES\nMUNICIPIOS\nADMINISTRACION\nSistema de Boletines Oficiales Municipales (SIBOM)\nSistema de Boletines Oficiales Municipales (SIBOM)\nSistema de Boletines Oficiales Municipales (SIBOM)\nSistema de Boletines Oficiales Municipales (SIBOM)\nSistema de Boletines Oficiales Municipales (SIBOM)\nBoletines/Carmen de Areco\nDecreto Nº1225\nDecreto Nº 1225\nPublicado en versión extractada\nCarmen de Areco, 01/08/2025\nLa necesidad de contratarel Servicio Profesional de  una Especialista en Obstetricia para el CAPS Dr. Norberto Cervi; Contrátese, dado que el Municipio no cuenta en la planta con personal profesional afectado y/o dedicado a la tarea descripta en los vistos y considerando del presente, desde el 01 de agosto de 2025 y hasta el día 31 de agosto de 2025, a la Sra.\nMARCHISSIO, MARIA PIA; Especialista en Obstetricia\nRedes Sociales\nContacto\nAutoridad de Aplicación\nSecretaría General\nSubsecretaría Legal y Técnica\nGuía Servicios\nPortal de trámites\nExpedientes\nSeguridad Vial\nARBA\nBoletín Oficial\nRegistro de las Personas\nContrataciones\nVer Todos\nPolíticas de privacidad\nUso Interno\nWebmail (gba.gob.ar)\nWebmail HORDE\nSistemas\nGDEBA\nPortal del Empleado\nMesa de Ayuda\nSIAPE",
      "tablas": [],
      "montos_extraidos": [],
      "metadata": {
        "longitud_caracteres": 1262,
        "tiene_tablas": false,
        "total_tablas": 0,
        "total_montos": 0
      }
    },
    {
      "id": "2332920",
      "tipo": "decreto",
      "numero": "1226",
      "titulo": "Decreto Nº 1226",
      "fecha": "Carmen de Areco, 01/08/2025",
      "municipio": "Carmen de Areco",
      "url": "https://sibom.slyt.gba.gob.ar/bulletins/14239/contents/2332920",
      "contenido": "Sistema de Boletín Oficial Municipal | Buenos Aires Provincia\nINICIO\nACERCA DEL SIBOM\nBOLETINES\nMUNICIPIOS\nADMINISTRACION\nSistema de Boletines Oficiales Municipales (SIBOM)\nSistema de Boletines Oficiales Municipales (SIBOM)\nSistema de Boletines Oficiales Municipales (SIBOM)\nSistema de Boletines Oficiales Municipales (SIBOM)\nSistema de Boletines Oficiales Municipales (SIBOM)\nBoletines/Carmen de Areco\nDecreto Nº1226\nDecreto Nº 1226\nPublicado en versión extractada\nCarmen de Areco, 01/08/2025\nLa necesidad de contratar el Servicio Profesional Odontológico para el CAPS de Tres Sargentos; y;Contrátese, dado que el Municipio no cuenta en la planta con personal profesional afectado y/o dedicado a la tarea descripta en los vistos y considerando del presente,  desde el 01 de agosto de 2025 y hasta el día 31 de agosto de 2025, al Sr.\nGONZALEZ, GASTON OSCAR; ODONTOLOGO\nRedes Sociales\nContacto\nAutoridad de Aplicación\nSecretaría General\nSubsecretaría Legal y Técnica\nGuía Servicios\nPortal de trámites\nExpedientes\nSeguridad Vial\nARBA\nBoletín Oficial\nRegistro de las Personas\nContrataciones\nVer Todos\nPolíticas de privacidad\nUso Interno\nWebmail (gba.gob.ar)\nWebmail HORDE\nSistemas\nGDEBA\nPortal del Empleado\nMesa de Ayuda\nSIAPE",
      "tablas": [],
      "montos_extraidos": [],
      "metadata": {
        "longitud_caracteres": 1223,
        "tiene_tablas": false,
        "total_tablas": 0,
        "total_montos": 0
      }
    },
    {
      "id": "2332922",
      "tipo": "decreto",
      "numero": "1227",
      "titulo": "Decreto Nº 1227",
      "fecha": "Carmen de Areco, 01/08/2025",
      "municipio": "Carmen de Areco",
      "url": "https://sibom.slyt.gba.gob.ar/bulletins/14239/contents/2332922",
      "contenido": "Sistema de Boletín Oficial Municipal | Buenos Aires Provincia\nINICIO\nACERCA DEL SIBOM\nBOLETINES\nMUNICIPIOS\nADMINISTRACION\nSistema de Boletines Oficiales Municipales (SIBOM)\nSistema de Boletines Oficiales Municipales (SIBOM)\nSistema de Boletines Oficiales Municipales (SIBOM)\nSistema de Boletines Oficiales Municipales (SIBOM)\nSistema de Boletines Oficiales Municipales (SIBOM)\nBoletines/Carmen de Areco\nDecreto Nº1227\nDecreto Nº 1227\nPublicado en versión extractada\nCarmen de Areco, 01/08/2025\nLa necesidad de contratar el Servicio Profesional de un médico PATOLOGO para el CAPS Tres Sargentos; y;Contrátese, dado que el Municipio no cuenta en la planta con personal profesional afectado y/o dedicado a la tarea descripta en los vistos y considerando del presente, desde el 01 de agosto de 2025 y hasta el día 31 de agosto de 2025, al Sr.\nFASSI, LEANDRO, Médico Patólogo,\nRedes Sociales\nContacto\nAutoridad de Aplicación\nSecretaría General\nSubsecretaría Legal y Técnica\nGuía Servicios\nPortal de trámites\nExpedientes\nSeguridad Vial\nARBA\nBoletín Oficial\nRegistro de las Personas\nContrataciones\nVer Todos\nPolíticas de privacidad\nUso Interno\nWebmail (gba.gob.ar)\nWebmail HORDE\nSistemas\nGDEBA\nPortal del Empleado\nMesa de Ayuda\nSIAPE",
      "tablas": [],
      "montos_extraidos": [],
      "metadata": {
        "longitud_caracteres": 1226,
        "tiene_tablas": false,
        "total_tablas": 0,
        "total_montos": 0
      }
    },
    {
      "id": "2332927",
      "tipo": "decreto",
      "numero": "1228",
      "titulo": "Decreto Nº 1228",
      "fecha": "Carmen de Areco, 01/08/2025",
      "municipio": "Carmen de Areco",
      "url": "https://sibom.slyt.gba.gob.ar/bulletins/14239/contents/2332927",
      "contenido": "Sistema de Boletín Oficial Municipal | Buenos Aires Provincia\nINICIO\nACERCA DEL SIBOM\nBOLETINES\nMUNICIPIOS\nADMINISTRACION\nSistema de Boletines Oficiales Municipales (SIBOM)\nSistema de Boletines Oficiales Municipales (SIBOM)\nSistema de Boletines Oficiales Municipales (SIBOM)\nSistema de Boletines Oficiales Municipales (SIBOM)\nSistema de Boletines Oficiales Municipales (SIBOM)\nBoletines/Carmen de Areco\nDecreto Nº1228\nDecreto Nº 1228\nPublicado en versión extractada\nCarmen de Areco, 01/08/2025\nLa necesidad de contratar el Servicio Profesional de KINESIOLOGÍA para el Caps Tres Sargentos, y; Contrátese, dado que el Municipio no cuenta en la planta con personal profesional afectado y/o dedicado a la tarea descripta en los vistos y considerando del presente, desde el 01 de agosto de 2025 y hasta el día 31 de agosto de 2025, a la Sra.\nCRIVELLI, ALICIA CRISTINA\nRedes Sociales\nContacto\nAutoridad de Aplicación\nSecretaría General\nSubsecretaría Legal y Técnica\nGuía Servicios\nPortal de trámites\nExpedientes\nSeguridad Vial\nARBA\nBoletín Oficial\nRegistro de las Personas\nContrataciones\nVer Todos\nPolíticas de privacidad\nUso Interno\nWebmail (gba.gob.ar)\nWebmail HORDE\nSistemas\nGDEBA\nPortal del Empleado\nMesa de Ayuda\nSIAPE",
      "tablas": [],
      "montos_extraidos": [],
      "metadata": {
        "longitud_caracteres": 1217,
        "tiene_tablas": false,
        "total_tablas": 0,
        "total_montos": 0
      }
    },
    {
      "id": "2332955",
      "tipo": "decreto",
      "numero": "1229",
      "titulo": "Decreto Nº 1229",
      "fecha": "Carmen de Areco, 01/08/2025",
      "municipio": "Carmen de Areco",
      "url": "https://sibom.slyt.gba.gob.ar/bulletins/14239/contents/2332955",
      "contenido": "Sistema de Boletín Oficial Municipal | Buenos Aires Provincia\nINICIO\nACERCA DEL SIBOM\nBOLETINES\nMUNICIPIOS\nADMINISTRACION\nSistema de Boletines Oficiales Municipales (SIBOM)\nSistema de Boletines Oficiales Municipales (SIBOM)\nSistema de Boletines Oficiales Municipales (SIBOM)\nSistema de Boletines Oficiales Municipales (SIBOM)\nSistema de Boletines Oficiales Municipales (SIBOM)\nBoletines/Carmen de Areco\nDecreto Nº1229\nDecreto Nº 1229\nPublicado en versión extractada\nCarmen de Areco, 01/08/2025\nLa necesidad de contratar el Servicio Profesional de una Especialista en Obstetricia para el CAPS Altos del Canal; y; Contrátese, dado que el Municipio no cuenta en la planta con personal profesional afectado y/o dedicado a la tarea descripta en los vistos y considerando del presente, desde el 01 de agosto de 2025 y hasta el día 31 de agosto de 2025, a la Sra.\nCAPRARULO, MICAELA ARACELI; Especialista en Obstetricia\nRedes Sociales\nContacto\nAutoridad de Aplicación\nSecretaría General\nSubsecretaría Legal y Técnica\nGuía Servicios\nPortal de trámites\nExpedientes\nSeguridad Vial\nARBA\nBoletín Oficial\nRegistro de las Personas\nContrataciones\nVer Todos\nPolíticas de privacidad\nUso Interno\nWebmail (gba.gob.ar)\nWebmail HORDE\nSistemas\nGDEBA\nPortal del Empleado\nMesa de Ayuda\nSIAPE",
      "tablas": [],
      "montos_extraidos": [],
      "metadata": {
        "longitud_caracteres": 1267,
        "tiene_tablas": false,
        "total_tablas": 0,
        "total_montos": 0
      }
    },
    {
      "id": "2332959",
      "tipo": "decreto",
      "numero": "1230",
      "titulo": "Decreto Nº 1230",
      "fecha": "Carmen de Areco, 01/08/2025",
      "municipio": "Carmen de Areco",
      "url": "https://sibom.slyt.gba.gob.ar/bulletins/14239/contents/2332959",
      "contenido": "Sistema de Boletín Oficial Municipal | Buenos Aires Provincia\nINICIO\nACERCA DEL SIBOM\nBOLETINES\nMUNICIPIOS\nADMINISTRACION\nSistema de Boletines Oficiales Municipales (SIBOM)\nSistema de Boletines Oficiales Municipales (SIBOM)\nSistema de Boletines Oficiales Municipales (SIBOM)\nSistema de Boletines Oficiales Municipales (SIBOM)\nSistema de Boletines Oficiales Municipales (SIBOM)\nBoletines/Carmen de Areco\nDecreto Nº1230\nDecreto Nº 1230\nPublicado en versión extractada\nCarmen de Areco, 01/08/2025\nLa necesidad de contratar el Servicio Profesional de un Fonoaudiólogo en el CAPS Tres Sargentos y; Contrátese, dado que el Municipio no cuenta en la planta con personal profesional afectado y/o dedicado a la tarea descripta en los vistos y considerando del presente, desde el 01 de agosto de 2025 y hasta el día 31 de agosto de 2025, a la Sra.\nBERRETTA, KARINA DEL CARMEN; FONOAUDIOLOGA\nRedes Sociales\nContacto\nAutoridad de Aplicación\nSecretaría General\nSubsecretaría Legal y Técnica\nGuía Servicios\nPortal de trámites\nExpedientes\nSeguridad Vial\nARBA\nBoletín Oficial\nRegistro de las Personas\nContrataciones\nVer Todos\nPolíticas de privacidad\nUso Interno\nWebmail (gba.gob.ar)\nWebmail HORDE\nSistemas\nGDEBA\nPortal del Empleado\nMesa de Ayuda\nSIAPE",
      "tablas": [],
      "montos_extraidos": [],
      "metadata": {
        "longitud_caracteres": 1235,
        "tiene_tablas": false,
        "total_tablas": 0,
        "total_montos": 0
      }
    },
    {
      "id": "2332964",
      "tipo": "decreto",
      "numero": "1231",
      "titulo": "Decreto Nº 1231",
      "fecha": "Carmen de Areco, 01/08/2025",
      "municipio": "Carmen de Areco",
      "url": "https://sibom.slyt.gba.gob.ar/bulletins/14239/contents/2332964",
      "contenido": "Sistema de Boletín Oficial Municipal | Buenos Aires Provincia\nINICIO\nACERCA DEL SIBOM\nBOLETINES\nMUNICIPIOS\nADMINISTRACION\nSistema de Boletines Oficiales Municipales (SIBOM)\nSistema de Boletines Oficiales Municipales (SIBOM)\nSistema de Boletines Oficiales Municipales (SIBOM)\nSistema de Boletines Oficiales Municipales (SIBOM)\nSistema de Boletines Oficiales Municipales (SIBOM)\nBoletines/Carmen de Areco\nDecreto Nº1231\nDecreto Nº 1231\nPublicado en versión extractada\nCarmen de Areco, 01/08/2025\nLa necesidad de contratar el Servicio Profesional de un Médico clínico para el Caps Jose Escobedo; y; Contrátese, dado que el Municipio no cuenta en la planta con personal profesional afectado y/o dedicado a la tarea descripta en los vistos y considerando del presente, desde el 01 de agosto de 2025 y hasta el día 31 de agosto de 2025, al Sr.\nARMANASCO, EDUARDO JAVIER, MEDICO CLINICO\nRedes Sociales\nContacto\nAutoridad de Aplicación\nSecretaría General\nSubsecretaría Legal y Técnica\nGuía Servicios\nPortal de trámites\nExpedientes\nSeguridad Vial\nARBA\nBoletín Oficial\nRegistro de las Personas\nContrataciones\nVer Todos\nPolíticas de privacidad\nUso Interno\nWebmail (gba.gob.ar)\nWebmail HORDE\nSistemas\nGDEBA\nPortal del Empleado\nMesa de Ayuda\nSIAPE",
      "tablas": [],
      "montos_extraidos": [],
      "metadata": {
        "longitud_caracteres": 1234,
        "tiene_tablas": false,
        "total_tablas": 0,
        "total_montos": 0
      }
    },
    {
      "id": "2332969",
      "tipo": "decreto",
      "numero": "1232",
      "titulo": "Decreto Nº 1232",
      "fecha": "Carmen de Areco, 01/08/2025",
      "municipio": "Carmen de Areco",
      "url": "https://sibom.slyt.gba.gob.ar/bulletins/14239/contents/2332969",
      "contenido": "Sistema de Boletín Oficial Municipal | Buenos Aires Provincia\nINICIO\nACERCA DEL SIBOM\nBOLETINES\nMUNICIPIOS\nADMINISTRACION\nSistema de Boletines Oficiales Municipales (SIBOM)\nSistema de Boletines Oficiales Municipales (SIBOM)\nSistema de Boletines Oficiales Municipales (SIBOM)\nSistema de Boletines Oficiales Municipales (SIBOM)\nSistema de Boletines Oficiales Municipales (SIBOM)\nBoletines/Carmen de Areco\nDecreto Nº1232\nDecreto Nº 1232\nPublicado en versión extractada\nCarmen de Areco, 01/08/2025\nLa necesidad de contratar el Servicio de Enfermería para el CAPS Dr. Rafael Echenique; Contrátese, dado que el Municipio no cuenta en la planta con personal profesional afectado y/o dedicado a la tarea descripta en los vistos del presente, desde el 01 de agosto de 2025 y hasta el día 31 de agosto de 2025, a la Sra.\nSARDE, PAOLA DANIELA\n,  Enfermera\nRedes Sociales\nContacto\nAutoridad de Aplicación\nSecretaría General\nSubsecretaría Legal y Técnica\nGuía Servicios\nPortal de trámites\nExpedientes\nSeguridad Vial\nARBA\nBoletín Oficial\nRegistro de las Personas\nContrataciones\nVer Todos\nPolíticas de privacidad\nUso Interno\nWebmail (gba.gob.ar)\nWebmail HORDE\nSistemas\nGDEBA\nPortal del Empleado\nMesa de Ayuda\nSIAPE",
      "tablas": [],
      "montos_extraidos": [],
      "metadata": {
        "longitud_caracteres": 1199,
        "tiene_tablas": false,
        "total_tablas": 0,
        "total_montos": 0
      }
    },
    {
      "id": "2332972",
      "tipo": "decreto",
      "numero": "1233",
      "titulo": "Decreto Nº 1233",
      "fecha": "Carmen de Areco, 01/08/2025",
      "municipio": "Carmen de Areco",
      "url": "https://sibom.slyt.gba.gob.ar/bulletins/14239/contents/2332972",
      "contenido": "Sistema de Boletín Oficial Municipal | Buenos Aires Provincia\nINICIO\nACERCA DEL SIBOM\nBOLETINES\nMUNICIPIOS\nADMINISTRACION\nSistema de Boletines Oficiales Municipales (SIBOM)\nSistema de Boletines Oficiales Municipales (SIBOM)\nSistema de Boletines Oficiales Municipales (SIBOM)\nSistema de Boletines Oficiales Municipales (SIBOM)\nSistema de Boletines Oficiales Municipales (SIBOM)\nBoletines/Carmen de Areco\nDecreto Nº1233\nDecreto Nº 1233\nPublicado en versión extractada\nCarmen de Areco, 01/08/2025\nLa necesidad de contratar Servicio de Enfermería para el CAPS Altos del Canal, y;  Contrátese, desde el 01 de agosto de 2025 y hasta el día 31 de agosto de 2025, dado que el Municipio no cuenta en la planta con personal profesional afectado y/o dedicado a la tarea descripta en los vistos del presente, a la Sra.\nCAMPOS, GEORGINA ANABELLA,\nRedes Sociales\nContacto\nAutoridad de Aplicación\nSecretaría General\nSubsecretaría Legal y Técnica\nGuía Servicios\nPortal de trámites\nExpedientes\nSeguridad Vial\nARBA\nBoletín Oficial\nRegistro de las Personas\nContrataciones\nVer Todos\nPolíticas de privacidad\nUso Interno\nWebmail (gba.gob.ar)\nWebmail HORDE\nSistemas\nGDEBA\nPortal del Empleado\nMesa de Ayuda\nSIAPE",
      "tablas": [],
      "montos_extraidos": [],
      "metadata": {
        "longitud_caracteres": 1188,
        "tiene_tablas": false,
        "total_tablas": 0,
        "total_montos": 0
      }
    },
    {
      "id": "2332975",
      "tipo": "decreto",
      "numero": "1234",
      "titulo": "Decreto Nº 1234",
      "fecha": "Carmen de Areco, 01/08/2025",
      "municipio": "Carmen de Areco",
      "url": "https://sibom.slyt.gba.gob.ar/bulletins/14239/contents/2332975",
      "contenido": "Sistema de Boletín Oficial Municipal | Buenos Aires Provincia\nINICIO\nACERCA DEL SIBOM\nBOLETINES\nMUNICIPIOS\nADMINISTRACION\nSistema de Boletines Oficiales Municipales (SIBOM)\nSistema de Boletines Oficiales Municipales (SIBOM)\nSistema de Boletines Oficiales Municipales (SIBOM)\nSistema de Boletines Oficiales Municipales (SIBOM)\nSistema de Boletines Oficiales Municipales (SIBOM)\nBoletines/Carmen de Areco\nDecreto Nº1234\nDecreto Nº 1234\nPublicado en versión extractada\nCarmen de Areco, 01/08/2025\nLa necesidad de contratar Servicio de Enfermería para el CAPS Gouin, y;  Contrátese, desde el 01 de agosto de 2025 y hasta el día 31 de agosto de 2025, dado que el Municipio no cuenta en la planta con personal profesional afectado y/o dedicado a la tarea descripta en los vistos del presente, a la Sra.\nCORREA, JOHANNA IVONNE,\nRedes Sociales\nContacto\nAutoridad de Aplicación\nSecretaría General\nSubsecretaría Legal y Técnica\nGuía Servicios\nPortal de trámites\nExpedientes\nSeguridad Vial\nARBA\nBoletín Oficial\nRegistro de las Personas\nContrataciones\nVer Todos\nPolíticas de privacidad\nUso Interno\nWebmail (gba.gob.ar)\nWebmail HORDE\nSistemas\nGDEBA\nPortal del Empleado\nMesa de Ayuda\nSIAPE",
      "tablas": [],
      "montos_extraidos": [],
      "metadata": {
        "longitud_caracteres": 1175,
        "tiene_tablas": false,
        "total_tablas": 0,
        "total_montos": 0
      }
    },
    {
      "id": "2332993",
      "tipo": "decreto",
      "numero": "1235",
      "titulo": "Decreto Nº 1235",
      "fecha": "Carmen de Areco, 04/08/2025",
      "municipio": "Carmen de Areco",
      "url": "https://sibom.slyt.gba.gob.ar/bulletins/14239/contents/2332993",
      "contenido": "Sistema de Boletín Oficial Municipal | Buenos Aires Provincia\nINICIO\nACERCA DEL SIBOM\nBOLETINES\nMUNICIPIOS\nADMINISTRACION\nSistema de Boletines Oficiales Municipales (SIBOM)\nSistema de Boletines Oficiales Municipales (SIBOM)\nSistema de Boletines Oficiales Municipales (SIBOM)\nSistema de Boletines Oficiales Municipales (SIBOM)\nSistema de Boletines Oficiales Municipales (SIBOM)\nBoletines/Carmen de Areco\nDecreto Nº1235\nDecreto Nº 1235\nPublicado en versión extractada\nCarmen de Areco, 04/08/2025\nLa necesidad de contratar un profesional para el área de obras públicas; y Contrátese, dado que el Municipio no cuenta en la planta con personal profesional afectado y/o dedicado a la tarea descripta en los vistos del presente, desde el 01 de agosto de 2025 al 31 de agosto de 2025, al\nSr. BONGIOVANNI, SANTIAGO, ARQUITECTO\n,\nRedes Sociales\nContacto\nAutoridad de Aplicación\nSecretaría General\nSubsecretaría Legal y Técnica\nGuía Servicios\nPortal de trámites\nExpedientes\nSeguridad Vial\nARBA\nBoletín Oficial\nRegistro de las Personas\nContrataciones\nVer Todos\nPolíticas de privacidad\nUso Interno\nWebmail (gba.gob.ar)\nWebmail HORDE\nSistemas\nGDEBA\nPortal del Empleado\nMesa de Ayuda\nSIAPE",
      "tablas": [],
      "montos_extraidos": [],
      "metadata": {
        "longitud_caracteres": 1174,
        "tiene_tablas": false,
        "total_tablas": 0,
        "total_montos": 0
      }
    },
    {
      "id": "2332996",
      "tipo": "decreto",
      "numero": "1236",
      "titulo": "Decreto Nº 1236",
      "fecha": "Carmen de Areco, 04/08/2025",
      "municipio": "Carmen de Areco",
      "url": "https://sibom.slyt.gba.gob.ar/bulletins/14239/contents/2332996",
      "contenido": "Sistema de Boletín Oficial Municipal | Buenos Aires Provincia\nINICIO\nACERCA DEL SIBOM\nBOLETINES\nMUNICIPIOS\nADMINISTRACION\nSistema de Boletines Oficiales Municipales (SIBOM)\nSistema de Boletines Oficiales Municipales (SIBOM)\nSistema de Boletines Oficiales Municipales (SIBOM)\nSistema de Boletines Oficiales Municipales (SIBOM)\nSistema de Boletines Oficiales Municipales (SIBOM)\nBoletines/Carmen de Areco\nDecreto Nº1236\nDecreto Nº 1236\nPublicado en versión extractada\nCarmen de Areco, 04/08/2025\nLa necesidad de contratar un  servicio de movimiento de tierra; y;Contrátese, desde el 01 de agosto de 2025 al 31 de agosto de 2025, puesto que el Municipio no cuenta en la planta con personal profesional afectado y/o dedicado a tal tarea, al Sr.\nHARISTOY, MARTIN ALFREDO\nRedes Sociales\nContacto\nAutoridad de Aplicación\nSecretaría General\nSubsecretaría Legal y Técnica\nGuía Servicios\nPortal de trámites\nExpedientes\nSeguridad Vial\nARBA\nBoletín Oficial\nRegistro de las Personas\nContrataciones\nVer Todos\nPolíticas de privacidad\nUso Interno\nWebmail (gba.gob.ar)\nWebmail HORDE\nSistemas\nGDEBA\nPortal del Empleado\nMesa de Ayuda\nSIAPE",
      "tablas": [],
      "montos_extraidos": [],
      "metadata": {
        "longitud_caracteres": 1120,
        "tiene_tablas": false,
        "total_tablas": 0,
        "total_montos": 0
      }
    },
    {
      "id": "2332997",
      "tipo": "decreto",
      "numero": "1237",
      "titulo": "Decreto Nº 1237",
      "fecha": "Carmen de Areco, 04/08/2025",
      "municipio": "Carmen de Areco",
      "url": "https://sibom.slyt.gba.gob.ar/bulletins/14239/contents/2332997",
      "contenido": "Sistema de Boletín Oficial Municipal | Buenos Aires Provincia\nINICIO\nACERCA DEL SIBOM\nBOLETINES\nMUNICIPIOS\nADMINISTRACION\nSistema de Boletines Oficiales Municipales (SIBOM)\nSistema de Boletines Oficiales Municipales (SIBOM)\nSistema de Boletines Oficiales Municipales (SIBOM)\nSistema de Boletines Oficiales Municipales (SIBOM)\nSistema de Boletines Oficiales Municipales (SIBOM)\nBoletines/Carmen de Areco\nDecreto Nº1237\nDecreto Nº 1237\nPublicado en versión extractada\nCarmen de Areco, 04/08/2025\nLa necesidad de contratar un  servicio de movimiento de tierra; y;Contrátese, desde el 01 de agosto de 2025 al 31 de agosto de 2025, puesto que el Municipio no cuenta en la planta con personal profesional afectado y/o dedicado a tal tarea, al Sr.\nESPOSITO, JULIO CESAR\nRedes Sociales\nContacto\nAutoridad de Aplicación\nSecretaría General\nSubsecretaría Legal y Técnica\nGuía Servicios\nPortal de trámites\nExpedientes\nSeguridad Vial\nARBA\nBoletín Oficial\nRegistro de las Personas\nContrataciones\nVer Todos\nPolíticas de privacidad\nUso Interno\nWebmail (gba.gob.ar)\nWebmail HORDE\nSistemas\nGDEBA\nPortal del Empleado\nMesa de Ayuda\nSIAPE",
      "tablas": [],
      "montos_extraidos": [],
      "metadata": {
        "longitud_caracteres": 1117,
        "tiene_tablas": false,
        "total_tablas": 0,
        "total_montos": 0
      }
    },
    {
      "id": "2333000",
      "tipo": "decreto",
      "numero": "1238",
      "titulo": "Decreto Nº 1238",
      "fecha": "Carmen de Areco, 04/08/2025",
      "municipio": "Carmen de Areco",
      "url": "https://sibom.slyt.gba.gob.ar/bulletins/14239/contents/2333000",
      "contenido": "Sistema de Boletín Oficial Municipal | Buenos Aires Provincia\nINICIO\nACERCA DEL SIBOM\nBOLETINES\nMUNICIPIOS\nADMINISTRACION\nSistema de Boletines Oficiales Municipales (SIBOM)\nSistema de Boletines Oficiales Municipales (SIBOM)\nSistema de Boletines Oficiales Municipales (SIBOM)\nSistema de Boletines Oficiales Municipales (SIBOM)\nSistema de Boletines Oficiales Municipales (SIBOM)\nBoletines/Carmen de Areco\nDecreto Nº1238\nDecreto Nº 1238\nPublicado en versión extractada\nCarmen de Areco, 04/08/2025\nLa necesidad de contratar un  servicio de movimiento de tierra; y;Contrátese, desde el 01 de agosto de 2025 al 31 de agosto de 2025, puesto que el Municipio no cuenta en la planta con personal profesional afectado y/o dedicado a tal tarea, al Sr.\nCORMILLOT, GUSTAVO DANIEL\nRedes Sociales\nContacto\nAutoridad de Aplicación\nSecretaría General\nSubsecretaría Legal y Técnica\nGuía Servicios\nPortal de trámites\nExpedientes\nSeguridad Vial\nARBA\nBoletín Oficial\nRegistro de las Personas\nContrataciones\nVer Todos\nPolíticas de privacidad\nUso Interno\nWebmail (gba.gob.ar)\nWebmail HORDE\nSistemas\nGDEBA\nPortal del Empleado\nMesa de Ayuda\nSIAPE",
      "tablas": [],
      "montos_extraidos": [],
      "metadata": {
        "longitud_caracteres": 1121,
        "tiene_tablas": false,
        "total_tablas": 0,
        "total_montos": 0
      }
    },
    {
      "id": "2333001",
      "tipo": "decreto",
      "numero": "1239",
      "titulo": "Decreto Nº 1239",
      "fecha": "Carmen de Areco, 04/08/2025",
      "municipio": "Carmen de Areco",
      "url": "https://sibom.slyt.gba.gob.ar/bulletins/14239/contents/2333001",
      "contenido": "Sistema de Boletín Oficial Municipal | Buenos Aires Provincia\nINICIO\nACERCA DEL SIBOM\nBOLETINES\nMUNICIPIOS\nADMINISTRACION\nSistema de Boletines Oficiales Municipales (SIBOM)\nSistema de Boletines Oficiales Municipales (SIBOM)\nSistema de Boletines Oficiales Municipales (SIBOM)\nSistema de Boletines Oficiales Municipales (SIBOM)\nSistema de Boletines Oficiales Municipales (SIBOM)\nBoletines/Carmen de Areco\nDecreto Nº1239\nDecreto Nº 1239\nPublicado en versión extractada\nCarmen de Areco, 04/08/2025\nLa necesidad de contratar  una profesional en el área de Bromatología, y;  Contrátese, dado que el Municipio no cuenta en la planta con personal profesional afectado y/o dedicado a la tarea descripta en los vistos del presente, desde el 01 de agosto de 2025 al 31 de agosto de 2025, a la Sra.\nFERNANDEZ MAUERER, NATALIA PAOLA\n, Veterinaria,\nRedes Sociales\nContacto\nAutoridad de Aplicación\nSecretaría General\nSubsecretaría Legal y Técnica\nGuía Servicios\nPortal de trámites\nExpedientes\nSeguridad Vial\nARBA\nBoletín Oficial\nRegistro de las Personas\nContrataciones\nVer Todos\nPolíticas de privacidad\nUso Interno\nWebmail (gba.gob.ar)\nWebmail HORDE\nSistemas\nGDEBA\nPortal del Empleado\nMesa de Ayuda\nSIAPE",
      "tablas": [],
      "montos_extraidos": [],
      "metadata": {
        "longitud_caracteres": 1189,
        "tiene_tablas": false,
        "total_tablas": 0,
        "total_montos": 0
      }
    },
    {
      "id": "2333002",
      "tipo": "decreto",
      "numero": "1240",
      "titulo": "Decreto Nº 1240",
      "fecha": "Carmen de Areco, 04/08/2025",
      "municipio": "Carmen de Areco",
      "url": "https://sibom.slyt.gba.gob.ar/bulletins/14239/contents/2333002",
      "contenido": "Sistema de Boletín Oficial Municipal | Buenos Aires Provincia\nINICIO\nACERCA DEL SIBOM\nBOLETINES\nMUNICIPIOS\nADMINISTRACION\nSistema de Boletines Oficiales Municipales (SIBOM)\nSistema de Boletines Oficiales Municipales (SIBOM)\nSistema de Boletines Oficiales Municipales (SIBOM)\nSistema de Boletines Oficiales Municipales (SIBOM)\nSistema de Boletines Oficiales Municipales (SIBOM)\nBoletines/Carmen de Areco\nDecreto Nº1240\nDecreto Nº 1240\nPublicado en versión extractada\nCarmen de Areco, 04/08/2025\nLas etapas local y regional de JUEGOS BONAERENSES 2025, a desarrollarse durante los meses de julio, agosto y septiembre del corriente año, y;es necesario contratar servicio de arbitraje de 24 partidos de vóley, a realizarse el día 21 de agosto del corriente en CEF Nº10, Club Recreativo y Club Unión Carmeña, Contrátese, dado que el Municipio no cuenta en la planta con personal profesional afectado y/o dedicado a la tarea descripta en los vistos del presente, a la  Sra.\nD’ANGELO, CECILIA BEATRIZ\n,\nRedes Sociales\nContacto\nAutoridad de Aplicación\nSecretaría General\nSubsecretaría Legal y Técnica\nGuía Servicios\nPortal de trámites\nExpedientes\nSeguridad Vial\nARBA\nBoletín Oficial\nRegistro de las Personas\nContrataciones\nVer Todos\nPolíticas de privacidad\nUso Interno\nWebmail (gba.gob.ar)\nWebmail HORDE\nSistemas\nGDEBA\nPortal del Empleado\nMesa de Ayuda\nSIAPE",
      "tablas": [],
      "montos_extraidos": [],
      "metadata": {
        "longitud_caracteres": 1349,
        "tiene_tablas": false,
        "total_tablas": 0,
        "total_montos": 0
      }
    },
    {
      "id": "2333003",
      "tipo": "decreto",
      "numero": "1241",
      "titulo": "Decreto Nº 1241",
      "fecha": "Carmen de Areco, 04/08/2025",
      "municipio": "Carmen de Areco",
      "url": "https://sibom.slyt.gba.gob.ar/bulletins/14239/contents/2333003",
      "contenido": "Sistema de Boletín Oficial Municipal | Buenos Aires Provincia\nINICIO\nACERCA DEL SIBOM\nBOLETINES\nMUNICIPIOS\nADMINISTRACION\nSistema de Boletines Oficiales Municipales (SIBOM)\nSistema de Boletines Oficiales Municipales (SIBOM)\nSistema de Boletines Oficiales Municipales (SIBOM)\nSistema de Boletines Oficiales Municipales (SIBOM)\nSistema de Boletines Oficiales Municipales (SIBOM)\nBoletines/Carmen de Areco\nDecreto Nº1241\nDecreto Nº 1241\nPublicado en versión extractada\nCarmen de Areco, 04/08/2025\nLa necesidad de contratar un  servicio de volquetes; y;  Contrátese, retroactivamente, puesto que el Municipio no cuenta en la planta con personal profesional afectado y/o dedicado a tal tarea, retroactivamente, a la Firma\nEXPRESO HARISTOY S.A\n. para que realice la obra descripta en los vistos del presente decreto, desde el día 01 de agosto de 2025 y  hasta el 31 de octubre de 2025,\nRedes Sociales\nContacto\nAutoridad de Aplicación\nSecretaría General\nSubsecretaría Legal y Técnica\nGuía Servicios\nPortal de trámites\nExpedientes\nSeguridad Vial\nARBA\nBoletín Oficial\nRegistro de las Personas\nContrataciones\nVer Todos\nPolíticas de privacidad\nUso Interno\nWebmail (gba.gob.ar)\nWebmail HORDE\nSistemas\nGDEBA\nPortal del Empleado\nMesa de Ayuda\nSIAPE",
      "tablas": [],
      "montos_extraidos": [],
      "metadata": {
        "longitud_caracteres": 1234,
        "tiene_tablas": false,
        "total_tablas": 0,
        "total_montos": 0
      }
    },
    {
      "id": "2333004",
      "tipo": "decreto",
      "numero": "1242",
      "titulo": "Decreto Nº 1242",
      "fecha": "Carmen de Areco, 04/08/2025",
      "municipio": "Carmen de Areco",
      "url": "https://sibom.slyt.gba.gob.ar/bulletins/14239/contents/2333004",
      "contenido": "Sistema de Boletín Oficial Municipal | Buenos Aires Provincia\nINICIO\nACERCA DEL SIBOM\nBOLETINES\nMUNICIPIOS\nADMINISTRACION\nSistema de Boletines Oficiales Municipales (SIBOM)\nSistema de Boletines Oficiales Municipales (SIBOM)\nSistema de Boletines Oficiales Municipales (SIBOM)\nSistema de Boletines Oficiales Municipales (SIBOM)\nSistema de Boletines Oficiales Municipales (SIBOM)\nBoletines/Carmen de Areco\nDecreto Nº1242\nDecreto Nº 1242\nPublicado en versión extractada\nCarmen de Areco, 04/08/2025\nLas etapas local y regional de JUEGOS BONAERENSES 2025, a desarrollarse durante los meses de julio, agosto y septiembre del corriente año, y; Que es necesario contratar servicio de arbitraje para 39 partidos de futbol 11, a desarrollarse en el Club Los Vascos y Club Sportsman, los días 25 y 26 de Agosto del corriente Contrátese, dado que el Municipio no cuenta en la planta con personal profesional afectado y/o dedicado a la tarea descripta en los vistos del presente, al  Sr.\nMORENO, DARIO JOSÉ\n,\nRedes Sociales\nContacto\nAutoridad de Aplicación\nSecretaría General\nSubsecretaría Legal y Técnica\nGuía Servicios\nPortal de trámites\nExpedientes\nSeguridad Vial\nARBA\nBoletín Oficial\nRegistro de las Personas\nContrataciones\nVer Todos\nPolíticas de privacidad\nUso Interno\nWebmail (gba.gob.ar)\nWebmail HORDE\nSistemas\nGDEBA\nPortal del Empleado\nMesa de Ayuda\nSIAPE",
      "tablas": [],
      "montos_extraidos": [],
      "metadata": {
        "longitud_caracteres": 1349,
        "tiene_tablas": false,
        "total_tablas": 0,
        "total_montos": 0
      }
    },
    {
      "id": "2333005",
      "tipo": "decreto",
      "numero": "1243",
      "titulo": "Decreto Nº 1243",
      "fecha": "Carmen de Areco, 04/08/2025",
      "municipio": "Carmen de Areco",
      "url": "https://sibom.slyt.gba.gob.ar/bulletins/14239/contents/2333005",
      "contenido": "Sistema de Boletín Oficial Municipal | Buenos Aires Provincia\nINICIO\nACERCA DEL SIBOM\nBOLETINES\nMUNICIPIOS\nADMINISTRACION\nSistema de Boletines Oficiales Municipales (SIBOM)\nSistema de Boletines Oficiales Municipales (SIBOM)\nSistema de Boletines Oficiales Municipales (SIBOM)\nSistema de Boletines Oficiales Municipales (SIBOM)\nSistema de Boletines Oficiales Municipales (SIBOM)\nBoletines/Carmen de Areco\nDecreto Nº1243\nDecreto Nº 1243\nPublicado en versión extractada\nCarmen de Areco, 04/08/2025\nLa necesidad de contratar un  servicio de volquetes con su respectivo camión volcador; y; Contrátese, retroactivamente, puesto que el Municipio no cuenta en la planta con personal profesional afectado y/o dedicado a tal tarea, al Sr.\nCORMILLOT, GUSTAVO DANIEL\npara que preste el servicio descripto Ut supra, desde el 01 de agosto de 2025 al 31 de octubre de 2025, en un todo de acuerdo con el respectivo contrato que se suscribió a  tal efecto.-\nRedes Sociales\nContacto\nAutoridad de Aplicación\nSecretaría General\nSubsecretaría Legal y Técnica\nGuía Servicios\nPortal de trámites\nExpedientes\nSeguridad Vial\nARBA\nBoletín Oficial\nRegistro de las Personas\nContrataciones\nVer Todos\nPolíticas de privacidad\nUso Interno\nWebmail (gba.gob.ar)\nWebmail HORDE\nSistemas\nGDEBA\nPortal del Empleado\nMesa de Ayuda\nSIAPE",
      "tablas": [],
      "montos_extraidos": [],
      "metadata": {
        "longitud_caracteres": 1294,
        "tiene_tablas": false,
        "total_tablas": 0,
        "total_montos": 0
      }
    },
    {
      "id": "2333008",
      "tipo": "decreto",
      "numero": "1244",
      "titulo": "Decreto Nº 1244",
      "fecha": "Carmen de Areco, 04/08/2025",
      "municipio": "Carmen de Areco",
      "url": "https://sibom.slyt.gba.gob.ar/bulletins/14239/contents/2333008",
      "contenido": "Sistema de Boletín Oficial Municipal | Buenos Aires Provincia\nINICIO\nACERCA DEL SIBOM\nBOLETINES\nMUNICIPIOS\nADMINISTRACION\nSistema de Boletines Oficiales Municipales (SIBOM)\nSistema de Boletines Oficiales Municipales (SIBOM)\nSistema de Boletines Oficiales Municipales (SIBOM)\nSistema de Boletines Oficiales Municipales (SIBOM)\nSistema de Boletines Oficiales Municipales (SIBOM)\nBoletines/Carmen de Areco\nDecreto Nº1244\nDecreto Nº 1244\nPublicado en versión extractada\nCarmen de Areco, 04/08/2025\nLa necesidad de contratar el servicio de pintura, y;  Que a tal fin se hace necesario pintar los 2 arcos principales de la ciudad de Carmen de Areco, ubicados en los accesos: Ruta Nacional Nº7 y calle 16 de Julio; Ruta Nacional Nº51 y Av. Bartolome Mitre, Contrátese, por el plazo de 20 dias contados a partir de la firma del presente contrato, dado que el Municipio no cuenta en la planta con personal profesional afectado y/o dedicado a la tarea descripta en los vistos del presente, al Sr.\nPOLTRONIERI, LUCIANO DAMIAN\nRedes Sociales\nContacto\nAutoridad de Aplicación\nSecretaría General\nSubsecretaría Legal y Técnica\nGuía Servicios\nPortal de trámites\nExpedientes\nSeguridad Vial\nARBA\nBoletín Oficial\nRegistro de las Personas\nContrataciones\nVer Todos\nPolíticas de privacidad\nUso Interno\nWebmail (gba.gob.ar)\nWebmail HORDE\nSistemas\nGDEBA\nPortal del Empleado\nMesa de Ayuda\nSIAPE",
      "tablas": [],
      "montos_extraidos": [],
      "metadata": {
        "longitud_caracteres": 1369,
        "tiene_tablas": false,
        "total_tablas": 0,
        "total_montos": 0
      }
    },
    {
      "id": "2333009",
      "tipo": "decreto",
      "numero": "1245",
      "titulo": "Decreto Nº 1245",
      "fecha": "Carmen de Areco, 05/08/2025",
      "municipio": "Carmen de Areco",
      "url": "https://sibom.slyt.gba.gob.ar/bulletins/14239/contents/2333009",
      "contenido": "Sistema de Boletín Oficial Municipal | Buenos Aires Provincia\nINICIO\nACERCA DEL SIBOM\nBOLETINES\nMUNICIPIOS\nADMINISTRACION\nSistema de Boletines Oficiales Municipales (SIBOM)\nSistema de Boletines Oficiales Municipales (SIBOM)\nSistema de Boletines Oficiales Municipales (SIBOM)\nSistema de Boletines Oficiales Municipales (SIBOM)\nSistema de Boletines Oficiales Municipales (SIBOM)\nBoletines/Carmen de Areco\nDecreto Nº1245\nDecreto Nº 1245\nPublicado en versión extractada\nCarmen de Areco, 05/08/2025\nLa necesidad de contar con el servicio de Publicidad, y;  Contrátese, retroactivamente, desde el día 01 de agosto de 2025 y hasta el día 31 de diciembre de 2025, dado que el Municipio no cuenta en la planta con personal profesional afectado y/o dedicado a la tarea descripta en los vistos del presente, al Sr.\nBAUCHWITZ\n,\nIGNACIO\nRedes Sociales\nContacto\nAutoridad de Aplicación\nSecretaría General\nSubsecretaría Legal y Técnica\nGuía Servicios\nPortal de trámites\nExpedientes\nSeguridad Vial\nARBA\nBoletín Oficial\nRegistro de las Personas\nContrataciones\nVer Todos\nPolíticas de privacidad\nUso Interno\nWebmail (gba.gob.ar)\nWebmail HORDE\nSistemas\nGDEBA\nPortal del Empleado\nMesa de Ayuda\nSIAPE",
      "tablas": [],
      "montos_extraidos": [],
      "metadata": {
        "longitud_caracteres": 1178,
        "tiene_tablas": false,
        "total_tablas": 0,
        "total_montos": 0
      }
    },
    {
      "id": "2333010",
      "tipo": "decreto",
      "numero": "1246",
      "titulo": "Decreto Nº 1246",
      "fecha": "Carmen de Areco, 05/08/2025",
      "municipio": "Carmen de Areco",
      "url": "https://sibom.slyt.gba.gob.ar/bulletins/14239/contents/2333010",
      "contenido": "Sistema de Boletín Oficial Municipal | Buenos Aires Provincia\nINICIO\nACERCA DEL SIBOM\nBOLETINES\nMUNICIPIOS\nADMINISTRACION\nSistema de Boletines Oficiales Municipales (SIBOM)\nSistema de Boletines Oficiales Municipales (SIBOM)\nSistema de Boletines Oficiales Municipales (SIBOM)\nSistema de Boletines Oficiales Municipales (SIBOM)\nSistema de Boletines Oficiales Municipales (SIBOM)\nBoletines/Carmen de Areco\nDecreto Nº1246\nDecreto Nº 1246\nPublicado en versión extractada\nCarmen de Areco, 05/08/2025\nEl Convenio  suscripto entre el ORGANISMO PROVINCIAL DE LA NIÑEZ Y ADOLESCENCIA DE LA PROVINCIA DE BS. AS, Y ESTA MUNICIPALIDAD DE CARMEN DE ARECO; Otorgase una Beca   a la persona que figuran en el Anexo I del presente decreto, correspondiente al  mes de julio de 2025.-\nRedes Sociales\nContacto\nAutoridad de Aplicación\nSecretaría General\nSubsecretaría Legal y Técnica\nGuía Servicios\nPortal de trámites\nExpedientes\nSeguridad Vial\nARBA\nBoletín Oficial\nRegistro de las Personas\nContrataciones\nVer Todos\nPolíticas de privacidad\nUso Interno\nWebmail (gba.gob.ar)\nWebmail HORDE\nSistemas\nGDEBA\nPortal del Empleado\nMesa de Ayuda\nSIAPE",
      "tablas": [],
      "montos_extraidos": [],
      "metadata": {
        "longitud_caracteres": 1120,
        "tiene_tablas": false,
        "total_tablas": 0,
        "total_montos": 0
      }
    },
    {
      "id": "2333011",
      "tipo": "decreto",
      "numero": "1247",
      "titulo": "Decreto Nº 1247",
      "fecha": "Carmen de Areco, 05/08/2025",
      "municipio": "Carmen de Areco",
      "url": "https://sibom.slyt.gba.gob.ar/bulletins/14239/contents/2333011",
      "contenido": "Sistema de Boletín Oficial Municipal | Buenos Aires Provincia\nINICIO\nACERCA DEL SIBOM\nBOLETINES\nMUNICIPIOS\nADMINISTRACION\nSistema de Boletines Oficiales Municipales (SIBOM)\nSistema de Boletines Oficiales Municipales (SIBOM)\nSistema de Boletines Oficiales Municipales (SIBOM)\nSistema de Boletines Oficiales Municipales (SIBOM)\nSistema de Boletines Oficiales Municipales (SIBOM)\nBoletines/Carmen de Areco\nDecreto Nº1247\nDecreto Nº 1247\nPublicado en versión extractada\nCarmen de Areco, 05/08/2025\nEl Convenio  suscripto entre el ORGANISMO PROVINCIAL DE LA NIÑEZ Y ADOLESCENCIA DE LA PROVINCIA DE BS. AS, Y ESTA MUNICIPALIDAD DE CARMEN DE ARECO; Otorgase una Beca   a las personas que figuran en el Anexo I del presente decreto, correspondiente al  mes de julio de 2025.-\nRedes Sociales\nContacto\nAutoridad de Aplicación\nSecretaría General\nSubsecretaría Legal y Técnica\nGuía Servicios\nPortal de trámites\nExpedientes\nSeguridad Vial\nARBA\nBoletín Oficial\nRegistro de las Personas\nContrataciones\nVer Todos\nPolíticas de privacidad\nUso Interno\nWebmail (gba.gob.ar)\nWebmail HORDE\nSistemas\nGDEBA\nPortal del Empleado\nMesa de Ayuda\nSIAPE",
      "tablas": [],
      "montos_extraidos": [],
      "metadata": {
        "longitud_caracteres": 1122,
        "tiene_tablas": false,
        "total_tablas": 0,
        "total_montos": 0
      }
    },
    {
      "id": "2333030",
      "tipo": "decreto",
      "numero": "1248",
      "titulo": "Decreto Nº 1248",
      "fecha": "Carmen de Areco, 05/08/2025",
      "municipio": "Carmen de Areco",
      "url": "https://sibom.slyt.gba.gob.ar/bulletins/14239/contents/2333030",
      "contenido": "Sistema de Boletín Oficial Municipal | Buenos Aires Provincia\nINICIO\nACERCA DEL SIBOM\nBOLETINES\nMUNICIPIOS\nADMINISTRACION\nSistema de Boletines Oficiales Municipales (SIBOM)\nSistema de Boletines Oficiales Municipales (SIBOM)\nSistema de Boletines Oficiales Municipales (SIBOM)\nSistema de Boletines Oficiales Municipales (SIBOM)\nSistema de Boletines Oficiales Municipales (SIBOM)\nBoletines/Carmen de Areco\nDecreto Nº1248\nDecreto Nº 1248\nPublicado en versión extractada\nCarmen de Areco, 05/08/2025\nEl programa OPERADORES DE CALLES; y\nOtorgase un incentivo al personal que se detalla en el anexo I  del presente decreto\nRedes Sociales\nContacto\nAutoridad de Aplicación\nSecretaría General\nSubsecretaría Legal y Técnica\nGuía Servicios\nPortal de trámites\nExpedientes\nSeguridad Vial\nARBA\nBoletín Oficial\nRegistro de las Personas\nContrataciones\nVer Todos\nPolíticas de privacidad\nUso Interno\nWebmail (gba.gob.ar)\nWebmail HORDE\nSistemas\nGDEBA\nPortal del Empleado\nMesa de Ayuda\nSIAPE",
      "tablas": [],
      "montos_extraidos": [],
      "metadata": {
        "longitud_caracteres": 969,
        "tiene_tablas": false,
        "total_tablas": 0,
        "total_montos": 0
      }
    },
    {
      "id": "2333072",
      "tipo": "decreto",
      "numero": "1249",
      "titulo": "Decreto Nº 1249",
      "fecha": "Carmen de Areco, 05/08/2025",
      "municipio": "Carmen de Areco",
      "url": "https://sibom.slyt.gba.gob.ar/bulletins/14239/contents/2333072",
      "contenido": "Sistema de Boletín Oficial Municipal | Buenos Aires Provincia\nINICIO\nACERCA DEL SIBOM\nBOLETINES\nMUNICIPIOS\nADMINISTRACION\nSistema de Boletines Oficiales Municipales (SIBOM)\nSistema de Boletines Oficiales Municipales (SIBOM)\nSistema de Boletines Oficiales Municipales (SIBOM)\nSistema de Boletines Oficiales Municipales (SIBOM)\nSistema de Boletines Oficiales Municipales (SIBOM)\nBoletines/Carmen de Areco\nDecreto Nº1249\nDecreto Nº 1249\nPublicado en versión extractada\nCarmen de Areco, 05/08/2025\nEl programa TERRITORIAL BARRIO ADENTRO; y\nOtorgase un incentivo al personal que se detalla en el anexo I del presente decreto, correspondiente al mes de julio de 2025 los cuales se imputarán a la Jurisdicción: 1110114000– 28.04.00-132- Fuente de Financiamiento -5.1.3.0. Becas… $ 793.617,00\nRedes Sociales\nContacto\nAutoridad de Aplicación\nSecretaría General\nSubsecretaría Legal y Técnica\nGuía Servicios\nPortal de trámites\nExpedientes\nSeguridad Vial\nARBA\nBoletín Oficial\nRegistro de las Personas\nContrataciones\nVer Todos\nPolíticas de privacidad\nUso Interno\nWebmail (gba.gob.ar)\nWebmail HORDE\nSistemas\nGDEBA\nPortal del Empleado\nMesa de Ayuda\nSIAPE",
      "tablas": [],
      "montos_extraidos": [
        {
          "municipio": "Areco",
          "boletin": "0",
          "fecha": "Carmen de Areco, 05/08/2025",
          "norma_tipo": "Decreto",
          "norma_numero": "1249",
          "articulo": "S/N",
          "concepto": "28.04.00-132- Fuente de Financiamiento -5.1.3.0. Becas… $ 793.617,00",
          "monto": 793617.0,
          "moneda": "ARS",
          "texto_completo": "Boletín 0º | Areco | Decreto Nº1249 [ARTÍCULO S/N: $793.617,00]",
          "fuente_url": "https://sibom.slyt.gba.gob.ar/bulletins/14239/contents/2333072"
        }
      ],
      "metadata": {
        "longitud_caracteres": 1139,
        "tiene_tablas": false,
        "total_tablas": 0,
        "total_montos": 1
      }
    },
    {
      "id": "2333074",
      "tipo": "decreto",
      "numero": "1250",
      "titulo": "Decreto Nº 1250",
      "fecha": "Carmen de Areco, 05/08/2025",
      "municipio": "Carmen de Areco",
      "url": "https://sibom.slyt.gba.gob.ar/bulletins/14239/contents/2333074",
      "contenido": "Sistema de Boletín Oficial Municipal | Buenos Aires Provincia\nINICIO\nACERCA DEL SIBOM\nBOLETINES\nMUNICIPIOS\nADMINISTRACION\nSistema de Boletines Oficiales Municipales (SIBOM)\nSistema de Boletines Oficiales Municipales (SIBOM)\nSistema de Boletines Oficiales Municipales (SIBOM)\nSistema de Boletines Oficiales Municipales (SIBOM)\nSistema de Boletines Oficiales Municipales (SIBOM)\nBoletines/Carmen de Areco\nDecreto Nº1250\nDecreto Nº 1250\nPublicado en versión extractada\nCarmen de Areco, 05/08/2025\nLa petición de la Coordinadora de Educación\nOtorgase un incentivo al personal que se detalla en el anexo I  del presente decreto, correspondiente al mes de julio de 2025 los cuales se imputarán a la Jurisdicción: 1110114000 – 20.04.00-132- Fuente de Financiamiento-  5.1.3.0. Becas ……… $ 4.354.700,00\nRedes Sociales\nContacto\nAutoridad de Aplicación\nSecretaría General\nSubsecretaría Legal y Técnica\nGuía Servicios\nPortal de trámites\nExpedientes\nSeguridad Vial\nARBA\nBoletín Oficial\nRegistro de las Personas\nContrataciones\nVer Todos\nPolíticas de privacidad\nUso Interno\nWebmail (gba.gob.ar)\nWebmail HORDE\nSistemas\nGDEBA\nPortal del Empleado\nMesa de Ayuda\nSIAPE",
      "tablas": [],
      "montos_extraidos": [
        {
          "municipio": "Areco",
          "boletin": "0",
          "fecha": "Carmen de Areco, 05/08/2025",
          "norma_tipo": "Decreto",
          "norma_numero": "1250",
          "articulo": "S/N",
          "concepto": "20.04.00-132- Fuente de Financiamiento- 5.1.3.0. Becas ……… $ 4.354.700,00",
          "monto": 4354700.0,
          "moneda": "ARS",
          "texto_completo": "Boletín 0º | Areco | Decreto Nº1250 [ARTÍCULO S/N: $4.354.700,00]",
          "fuente_url": "https://sibom.slyt.gba.gob.ar/bulletins/14239/contents/2333074"
        }
      ],
      "metadata": {
        "longitud_caracteres": 1149,
        "tiene_tablas": false,
        "total_tablas": 0,
        "total_montos": 1
      }
    },
    {
      "id": "2333094",
      "tipo": "decreto",
      "numero": "1251",
      "titulo": "Decreto Nº 1251",
      "fecha": "Carmen de Areco, 05/08/2025",
      "municipio": "Carmen de Areco",
      "url": "https://sibom.slyt.gba.gob.ar/bulletins/14239/contents/2333094",
      "contenido": "Sistema de Boletín Oficial Municipal | Buenos Aires Provincia\nINICIO\nACERCA DEL SIBOM\nBOLETINES\nMUNICIPIOS\nADMINISTRACION\nSistema de Boletines Oficiales Municipales (SIBOM)\nSistema de Boletines Oficiales Municipales (SIBOM)\nSistema de Boletines Oficiales Municipales (SIBOM)\nSistema de Boletines Oficiales Municipales (SIBOM)\nSistema de Boletines Oficiales Municipales (SIBOM)\nBoletines/Carmen de Areco\nDecreto Nº1251\nDecreto Nº 1251\nPublicado en versión extractada\nCarmen de Areco, 05/08/2025\nLa petición de la Coordinadora de Educación, Otorgase un incentivo al personal que se detalla en el anexo I  del presente decreto, correspondiente al mes de julio de 2025 los cuales se imputarán a la Jurisdicción: 1110114000 – 20.04.00-132- Fuente de Financiamiento-  5.1.3.0. Becas ……… $ 4.007.800,00\nRedes Sociales\nContacto\nAutoridad de Aplicación\nSecretaría General\nSubsecretaría Legal y Técnica\nGuía Servicios\nPortal de trámites\nExpedientes\nSeguridad Vial\nARBA\nBoletín Oficial\nRegistro de las Personas\nContrataciones\nVer Todos\nPolíticas de privacidad\nUso Interno\nWebmail (gba.gob.ar)\nWebmail HORDE\nSistemas\nGDEBA\nPortal del Empleado\nMesa de Ayuda\nSIAPE",
      "tablas": [],
      "montos_extraidos": [
        {
          "municipio": "Areco",
          "boletin": "0",
          "fecha": "Carmen de Areco, 05/08/2025",
          "norma_tipo": "Decreto",
          "norma_numero": "1251",
          "articulo": "S/N",
          "concepto": "20.04.00-132- Fuente de Financiamiento- 5.1.3.0. Becas ……… $ 4.007.800,00",
          "monto": 4007800.0,
          "moneda": "ARS",
          "texto_completo": "Boletín 0º | Areco | Decreto Nº1251 [ARTÍCULO S/N: $4.007.800,00]",
          "fuente_url": "https://sibom.slyt.gba.gob.ar/bulletins/14239/contents/2333094"
        }
      ],
      "metadata": {
        "longitud_caracteres": 1150,
        "tiene_tablas": false,
        "total_tablas": 0,
        "total_montos": 1
      }
    },
    {
      "id": "2333096",
      "tipo": "decreto",
      "numero": "1252",
      "titulo": "Decreto Nº 1252",
      "fecha": "Carmen de Areco, 05/08/2025",
      "municipio": "Carmen de Areco",
      "url": "https://sibom.slyt.gba.gob.ar/bulletins/14239/contents/2333096",
      "contenido": "Sistema de Boletín Oficial Municipal | Buenos Aires Provincia\nINICIO\nACERCA DEL SIBOM\nBOLETINES\nMUNICIPIOS\nADMINISTRACION\nSistema de Boletines Oficiales Municipales (SIBOM)\nSistema de Boletines Oficiales Municipales (SIBOM)\nSistema de Boletines Oficiales Municipales (SIBOM)\nSistema de Boletines Oficiales Municipales (SIBOM)\nSistema de Boletines Oficiales Municipales (SIBOM)\nBoletines/Carmen de Areco\nDecreto Nº1252\nDecreto Nº 1252\nPublicado en versión extractada\nCarmen de Areco, 05/08/2025\nLa petición del Coordinador de Centro de Día,  Otorgase un incentivo al personal que se detalla en el anexo I  del presente decreto, correspondiente al mes de julio de 2025, los cuales se imputarán a la Jurisdicción: 1110114000– 20.03.00  -132-   5.1.3.0. Becas ………… $1.340.000,00\nRedes Sociales\nContacto\nAutoridad de Aplicación\nSecretaría General\nSubsecretaría Legal y Técnica\nGuía Servicios\nPortal de trámites\nExpedientes\nSeguridad Vial\nARBA\nBoletín Oficial\nRegistro de las Personas\nContrataciones\nVer Todos\nPolíticas de privacidad\nUso Interno\nWebmail (gba.gob.ar)\nWebmail HORDE\nSistemas\nGDEBA\nPortal del Empleado\nMesa de Ayuda\nSIAPE",
      "tablas": [],
      "montos_extraidos": [
        {
          "municipio": "Areco",
          "boletin": "0",
          "fecha": "Carmen de Areco, 05/08/2025",
          "norma_tipo": "Decreto",
          "norma_numero": "1252",
          "articulo": "S/N",
          "concepto": "isdicción: 1110114000– 20.03.00 -132- 5.1.3.0. Becas ………… $1.340.000,00",
          "monto": 1340000.0,
          "moneda": "ARS",
          "texto_completo": "Boletín 0º | Areco | Decreto Nº1252 [ARTÍCULO S/N: $1.340.000,00]",
          "fuente_url": "https://sibom.slyt.gba.gob.ar/bulletins/14239/contents/2333096"
        }
      ],
      "metadata": {
        "longitud_caracteres": 1129,
        "tiene_tablas": false,
        "total_tablas": 0,
        "total_montos": 1
      }
    },
    {
      "id": "2333199",
      "tipo": "decreto",
      "numero": "1253",
      "titulo": "Decreto Nº 1253",
      "fecha": "Carmen de Areco, 05/08/2025",
      "municipio": "Carmen de Areco",
      "url": "https://sibom.slyt.gba.gob.ar/bulletins/14239/contents/2333199",
      "contenido": "Sistema de Boletín Oficial Municipal | Buenos Aires Provincia\nINICIO\nACERCA DEL SIBOM\nBOLETINES\nMUNICIPIOS\nADMINISTRACION\nSistema de Boletines Oficiales Municipales (SIBOM)\nSistema de Boletines Oficiales Municipales (SIBOM)\nSistema de Boletines Oficiales Municipales (SIBOM)\nSistema de Boletines Oficiales Municipales (SIBOM)\nSistema de Boletines Oficiales Municipales (SIBOM)\nBoletines/Carmen de Areco\nDecreto Nº1253\nDecreto Nº 1253\nPublicado en versión extractada\nCarmen de Areco, 05/08/2025\nEl Convenio  suscripto entre el MINISTERIO DE DESARROLLO DE LA COMUNIDAD, Y ESTA MUNICIPALIDAD DE CARMEN DE ARECO; Otorgase una Becas a las personas que figuran en el Anexo I del presente decreto, correspondiente al mes de julio de 2025.-\nRedes Sociales\nContacto\nAutoridad de Aplicación\nSecretaría General\nSubsecretaría Legal y Técnica\nGuía Servicios\nPortal de trámites\nExpedientes\nSeguridad Vial\nARBA\nBoletín Oficial\nRegistro de las Personas\nContrataciones\nVer Todos\nPolíticas de privacidad\nUso Interno\nWebmail (gba.gob.ar)\nWebmail HORDE\nSistemas\nGDEBA\nPortal del Empleado\nMesa de Ayuda\nSIAPE",
      "tablas": [],
      "montos_extraidos": [],
      "metadata": {
        "longitud_caracteres": 1087,
        "tiene_tablas": false,
        "total_tablas": 0,
        "total_montos": 0
      }
    },
    {
      "id": "2333303",
      "tipo": "decreto",
      "numero": "1254",
      "titulo": "Decreto Nº 1254",
      "fecha": "Carmen de Areco, 05/08/2025",
      "municipio": "Carmen de Areco",
      "url": "https://sibom.slyt.gba.gob.ar/bulletins/14239/contents/2333303",
      "contenido": "Sistema de Boletín Oficial Municipal | Buenos Aires Provincia\nINICIO\nACERCA DEL SIBOM\nBOLETINES\nMUNICIPIOS\nADMINISTRACION\nSistema de Boletines Oficiales Municipales (SIBOM)\nSistema de Boletines Oficiales Municipales (SIBOM)\nSistema de Boletines Oficiales Municipales (SIBOM)\nSistema de Boletines Oficiales Municipales (SIBOM)\nSistema de Boletines Oficiales Municipales (SIBOM)\nBoletines/Carmen de Areco\nDecreto Nº1254\nDecreto Nº 1254\nPublicado en versión extractada\nCarmen de Areco, 05/08/2025\nLa Ordenanza N° 2019/04 promulgada por medio del Decreto 341/2004; y;\nOtorgase una Beca de Pesos:\nDOCE MIL\n($12.000,00) correspondiente al mes de julio, del presente año en un todo de acuerdo a lo planteado en los considerandos del presente decreto  y a la Ordenanza N° 2019/04\nRedes Sociales\nContacto\nAutoridad de Aplicación\nSecretaría General\nSubsecretaría Legal y Técnica\nGuía Servicios\nPortal de trámites\nExpedientes\nSeguridad Vial\nARBA\nBoletín Oficial\nRegistro de las Personas\nContrataciones\nVer Todos\nPolíticas de privacidad\nUso Interno\nWebmail (gba.gob.ar)\nWebmail HORDE\nSistemas\nGDEBA\nPortal del Empleado\nMesa de Ayuda\nSIAPE",
      "tablas": [],
      "montos_extraidos": [
        {
          "municipio": "Areco",
          "boletin": "0",
          "fecha": "Carmen de Areco, 05/08/2025",
          "norma_tipo": "Ordenanza",
          "norma_numero": "2019/04",
          "articulo": "S/N",
          "concepto": "Otorgase una Beca de Pesos:",
          "monto": 12000.0,
          "moneda": "ARS",
          "texto_completo": "Boletín 0º | Areco | Ordenanza Nº2019/04 [ARTÍCULO S/N: $12.000,00]",
          "fuente_url": "https://sibom.slyt.gba.gob.ar/bulletins/14239/contents/2333303"
        }
      ],
      "metadata": {
        "longitud_caracteres": 1126,
        "tiene_tablas": false,
        "total_tablas": 0,
        "total_montos": 1
      }
    },
    {
      "id": "2333304",
      "tipo": "decreto",
      "numero": "1255",
      "titulo": "Decreto Nº 1255",
      "fecha": "Carmen de Areco, 05/08/2025",
      "municipio": "Carmen de Areco",
      "url": "https://sibom.slyt.gba.gob.ar/bulletins/14239/contents/2333304",
      "contenido": "Sistema de Boletín Oficial Municipal | Buenos Aires Provincia\nINICIO\nACERCA DEL SIBOM\nBOLETINES\nMUNICIPIOS\nADMINISTRACION\nSistema de Boletines Oficiales Municipales (SIBOM)\nSistema de Boletines Oficiales Municipales (SIBOM)\nSistema de Boletines Oficiales Municipales (SIBOM)\nSistema de Boletines Oficiales Municipales (SIBOM)\nSistema de Boletines Oficiales Municipales (SIBOM)\nBoletines/Carmen de Areco\nDecreto Nº1255\nDecreto Nº 1255\nPublicado en versión extractada\nCarmen de Areco, 05/08/2025\nLa Ordenanza N° 3085/21 promulgada por medio del Decreto 1735/2021; y; Otorgase una Beca de Pesos:\nDOCE MIL\n($12.000,00) correspondiente al mes de julio del presente año en un todo de acuerdo a lo planteado en los considerandos del presente decreto y a la Ordenanza N° 3085/2021\nRedes Sociales\nContacto\nAutoridad de Aplicación\nSecretaría General\nSubsecretaría Legal y Técnica\nGuía Servicios\nPortal de trámites\nExpedientes\nSeguridad Vial\nARBA\nBoletín Oficial\nRegistro de las Personas\nContrataciones\nVer Todos\nPolíticas de privacidad\nUso Interno\nWebmail (gba.gob.ar)\nWebmail HORDE\nSistemas\nGDEBA\nPortal del Empleado\nMesa de Ayuda\nSIAPE",
      "tablas": [],
      "montos_extraidos": [
        {
          "municipio": "Areco",
          "boletin": "0",
          "fecha": "Carmen de Areco, 05/08/2025",
          "norma_tipo": "Ordenanza",
          "norma_numero": "3085/21",
          "articulo": "S/N",
          "concepto": "por medio del Decreto 1735/2021; y; Otorgase una Beca de Pesos:",
          "monto": 12000.0,
          "moneda": "ARS",
          "texto_completo": "Boletín 0º | Areco | Ordenanza Nº3085/21 [ARTÍCULO S/N: $12.000,00]",
          "fuente_url": "https://sibom.slyt.gba.gob.ar/bulletins/14239/contents/2333304"
        }
      ],
      "metadata": {
        "longitud_caracteres": 1127,
        "tiene_tablas": false,
        "total_tablas": 0,
        "total_montos": 1
      }
    },
    {
      "id": "2333306",
      "tipo": "decreto",
      "numero": "1256",
      "titulo": "Decreto Nº 1256",
      "fecha": "Carmen de Areco, 05/08/2025",
      "municipio": "Carmen de Areco",
      "url": "https://sibom.slyt.gba.gob.ar/bulletins/14239/contents/2333306",
      "contenido": "Sistema de Boletín Oficial Municipal | Buenos Aires Provincia\nINICIO\nACERCA DEL SIBOM\nBOLETINES\nMUNICIPIOS\nADMINISTRACION\nSistema de Boletines Oficiales Municipales (SIBOM)\nSistema de Boletines Oficiales Municipales (SIBOM)\nSistema de Boletines Oficiales Municipales (SIBOM)\nSistema de Boletines Oficiales Municipales (SIBOM)\nSistema de Boletines Oficiales Municipales (SIBOM)\nBoletines/Carmen de Areco\nDecreto Nº1256\nDecreto Nº 1256\nPublicado en versión extractada\nCarmen de Areco, 05/08/2025\nLos talleres Deportivos que se brindan para todos y todas las vecinas de nuestra Localidad, de Tres Sargentos y Gouin; y; Páguese a las personas que figuran en el Anexo I del presente decreto, correspondiente al mes de julio de 2025, un canon por servicio de capacitación\nRedes Sociales\nContacto\nAutoridad de Aplicación\nSecretaría General\nSubsecretaría Legal y Técnica\nGuía Servicios\nPortal de trámites\nExpedientes\nSeguridad Vial\nARBA\nBoletín Oficial\nRegistro de las Personas\nContrataciones\nVer Todos\nPolíticas de privacidad\nUso Interno\nWebmail (gba.gob.ar)\nWebmail HORDE\nSistemas\nGDEBA\nPortal del Empleado\nMesa de Ayuda\nSIAPE",
      "tablas": [],
      "montos_extraidos": [],
      "metadata": {
        "longitud_caracteres": 1120,
        "tiene_tablas": false,
        "total_tablas": 0,
        "total_montos": 0
      }
    },
    {
      "id": "2333308",
      "tipo": "decreto",
      "numero": "1257",
      "titulo": "Decreto Nº 1257",
      "fecha": "Carmen de Areco, 05/08/2025",
      "municipio": "Carmen de Areco",
      "url": "https://sibom.slyt.gba.gob.ar/bulletins/14239/contents/2333308",
      "contenido": "Sistema de Boletín Oficial Municipal | Buenos Aires Provincia\nINICIO\nACERCA DEL SIBOM\nBOLETINES\nMUNICIPIOS\nADMINISTRACION\nSistema de Boletines Oficiales Municipales (SIBOM)\nSistema de Boletines Oficiales Municipales (SIBOM)\nSistema de Boletines Oficiales Municipales (SIBOM)\nSistema de Boletines Oficiales Municipales (SIBOM)\nSistema de Boletines Oficiales Municipales (SIBOM)\nBoletines/Carmen de Areco\nDecreto Nº1257\nDecreto Nº 1257\nPublicado en versión extractada\nCarmen de Areco, 05/08/2025\nLa necesidad de mantener en condiciones los Establecimientos Educativos, y;  Contrátese, por el plazo de 10 dias contados a partir de la firma del acta de inicio de obra ,dado que el Municipio no cuenta en la planta con personal profesional afectado y/o dedicado a la tarea descripta en los vistos del presente, a la COOPERATIVA DE TRABAJO EL HORNERO LIMITADA\nRedes Sociales\nContacto\nAutoridad de Aplicación\nSecretaría General\nSubsecretaría Legal y Técnica\nGuía Servicios\nPortal de trámites\nExpedientes\nSeguridad Vial\nARBA\nBoletín Oficial\nRegistro de las Personas\nContrataciones\nVer Todos\nPolíticas de privacidad\nUso Interno\nWebmail (gba.gob.ar)\nWebmail HORDE\nSistemas\nGDEBA\nPortal del Empleado\nMesa de Ayuda\nSIAPE",
      "tablas": [],
      "montos_extraidos": [],
      "metadata": {
        "longitud_caracteres": 1208,
        "tiene_tablas": false,
        "total_tablas": 0,
        "total_montos": 0
      }
    },
    {
      "id": "2333309",
      "tipo": "decreto",
      "numero": "1258",
      "titulo": "Decreto Nº 1258",
      "fecha": "Carmen de Areco, 05/08/2025",
      "municipio": "Carmen de Areco",
      "url": "https://sibom.slyt.gba.gob.ar/bulletins/14239/contents/2333309",
      "contenido": "Sistema de Boletín Oficial Municipal | Buenos Aires Provincia\nINICIO\nACERCA DEL SIBOM\nBOLETINES\nMUNICIPIOS\nADMINISTRACION\nSistema de Boletines Oficiales Municipales (SIBOM)\nSistema de Boletines Oficiales Municipales (SIBOM)\nSistema de Boletines Oficiales Municipales (SIBOM)\nSistema de Boletines Oficiales Municipales (SIBOM)\nSistema de Boletines Oficiales Municipales (SIBOM)\nBoletines/Carmen de Areco\nDecreto Nº1258\nDecreto Nº 1258\nPublicado en versión extractada\nCarmen de Areco, 05/08/2025\nLa solicitud presentada por la Sra.\nARGUELLO, AILIN\nRedes Sociales\nContacto\nAutoridad de Aplicación\nSecretaría General\nSubsecretaría Legal y Técnica\nGuía Servicios\nPortal de trámites\nExpedientes\nSeguridad Vial\nARBA\nBoletín Oficial\nRegistro de las Personas\nContrataciones\nVer Todos\nPolíticas de privacidad\nUso Interno\nWebmail (gba.gob.ar)\nWebmail HORDE\nSistemas\nGDEBA\nPortal del Empleado\nMesa de Ayuda\nSIAPE",
      "tablas": [],
      "montos_extraidos": [],
      "metadata": {
        "longitud_caracteres": 900,
        "tiene_tablas": false,
        "total_tablas": 0,
        "total_montos": 0
      }
    },
    {
      "id": "2333310",
      "tipo": "decreto",
      "numero": "1259",
      "titulo": "Decreto Nº 1259",
      "fecha": "Carmen de Areco, 05/08/2025",
      "municipio": "Carmen de Areco",
      "url": "https://sibom.slyt.gba.gob.ar/bulletins/14239/contents/2333310",
      "contenido": "Sistema de Boletín Oficial Municipal | Buenos Aires Provincia\nINICIO\nACERCA DEL SIBOM\nBOLETINES\nMUNICIPIOS\nADMINISTRACION\nSistema de Boletines Oficiales Municipales (SIBOM)\nSistema de Boletines Oficiales Municipales (SIBOM)\nSistema de Boletines Oficiales Municipales (SIBOM)\nSistema de Boletines Oficiales Municipales (SIBOM)\nSistema de Boletines Oficiales Municipales (SIBOM)\nBoletines/Carmen de Areco\nDecreto Nº1259\nDecreto Nº 1259\nPublicado en versión extractada\nCarmen de Areco, 05/08/2025\nLa solicitud presentada por la Sra.\nALDERETE, JESSICA\nRedes Sociales\nContacto\nAutoridad de Aplicación\nSecretaría General\nSubsecretaría Legal y Técnica\nGuía Servicios\nPortal de trámites\nExpedientes\nSeguridad Vial\nARBA\nBoletín Oficial\nRegistro de las Personas\nContrataciones\nVer Todos\nPolíticas de privacidad\nUso Interno\nWebmail (gba.gob.ar)\nWebmail HORDE\nSistemas\nGDEBA\nPortal del Empleado\nMesa de Ayuda\nSIAPE",
      "tablas": [],
      "montos_extraidos": [],
      "metadata": {
        "longitud_caracteres": 902,
        "tiene_tablas": false,
        "total_tablas": 0,
        "total_montos": 0
      }
    },
    {
      "id": "2333311",
      "tipo": "decreto",
      "numero": "1260",
      "titulo": "Decreto Nº 1260",
      "fecha": "Carmen de Areco, 05/08/2025",
      "municipio": "Carmen de Areco",
      "url": "https://sibom.slyt.gba.gob.ar/bulletins/14239/contents/2333311",
      "contenido": "Sistema de Boletín Oficial Municipal | Buenos Aires Provincia\nINICIO\nACERCA DEL SIBOM\nBOLETINES\nMUNICIPIOS\nADMINISTRACION\nSistema de Boletines Oficiales Municipales (SIBOM)\nSistema de Boletines Oficiales Municipales (SIBOM)\nSistema de Boletines Oficiales Municipales (SIBOM)\nSistema de Boletines Oficiales Municipales (SIBOM)\nSistema de Boletines Oficiales Municipales (SIBOM)\nBoletines/Carmen de Areco\nDecreto Nº1260\nDecreto Nº 1260\nPublicado en versión extractada\nCarmen de Areco, 05/08/2025\nLa solicitud presentada por la Sra.\nFERNANDEZ, SONIA ESTER\nRedes Sociales\nContacto\nAutoridad de Aplicación\nSecretaría General\nSubsecretaría Legal y Técnica\nGuía Servicios\nPortal de trámites\nExpedientes\nSeguridad Vial\nARBA\nBoletín Oficial\nRegistro de las Personas\nContrataciones\nVer Todos\nPolíticas de privacidad\nUso Interno\nWebmail (gba.gob.ar)\nWebmail HORDE\nSistemas\nGDEBA\nPortal del Empleado\nMesa de Ayuda\nSIAPE",
      "tablas": [],
      "montos_extraidos": [],
      "metadata": {
        "longitud_caracteres": 907,
        "tiene_tablas": false,
        "total_tablas": 0,
        "total_montos": 0
      }
    },
    {
      "id": "2333312",
      "tipo": "decreto",
      "numero": "1260",
      "titulo": "Decreto Nº 1260",
      "fecha": "Carmen de Areco, 05/08/2025",
      "municipio": "Carmen de Areco",
      "url": "https://sibom.slyt.gba.gob.ar/bulletins/14239/contents/2333312",
      "contenido": "Sistema de Boletín Oficial Municipal | Buenos Aires Provincia\nINICIO\nACERCA DEL SIBOM\nBOLETINES\nMUNICIPIOS\nADMINISTRACION\nSistema de Boletines Oficiales Municipales (SIBOM)\nSistema de Boletines Oficiales Municipales (SIBOM)\nSistema de Boletines Oficiales Municipales (SIBOM)\nSistema de Boletines Oficiales Municipales (SIBOM)\nSistema de Boletines Oficiales Municipales (SIBOM)\nBoletines/Carmen de Areco\nDecreto Nº1260\nDecreto Nº 1260\nPublicado en versión extractada\nCarmen de Areco, 05/08/2025\nLa solicitud presentada por la Sra.\nFERNANDEZ, SONIA ESTER\nRedes Sociales\nContacto\nAutoridad de Aplicación\nSecretaría General\nSubsecretaría Legal y Técnica\nGuía Servicios\nPortal de trámites\nExpedientes\nSeguridad Vial\nARBA\nBoletín Oficial\nRegistro de las Personas\nContrataciones\nVer Todos\nPolíticas de privacidad\nUso Interno\nWebmail (gba.gob.ar)\nWebmail HORDE\nSistemas\nGDEBA\nPortal del Empleado\nMesa de Ayuda\nSIAPE",
      "tablas": [],
      "montos_extraidos": [],
      "metadata": {
        "longitud_caracteres": 907,
        "tiene_tablas": false,
        "total_tablas": 0,
        "total_montos": 0
      }
    },
    {
      "id": "2333314",
      "tipo": "decreto",
      "numero": "1261",
      "titulo": "Decreto Nº 1261",
      "fecha": "Carmen de Areco, 05/08/2025",
      "municipio": "Carmen de Areco",
      "url": "https://sibom.slyt.gba.gob.ar/bulletins/14239/contents/2333314",
      "contenido": "Sistema de Boletín Oficial Municipal | Buenos Aires Provincia\nINICIO\nACERCA DEL SIBOM\nBOLETINES\nMUNICIPIOS\nADMINISTRACION\nSistema de Boletines Oficiales Municipales (SIBOM)\nSistema de Boletines Oficiales Municipales (SIBOM)\nSistema de Boletines Oficiales Municipales (SIBOM)\nSistema de Boletines Oficiales Municipales (SIBOM)\nSistema de Boletines Oficiales Municipales (SIBOM)\nBoletines/Carmen de Areco\nDecreto Nº1261\nDecreto Nº 1261\nPublicado en versión extractada\nCarmen de Areco, 05/08/2025\nLa solicitud presentada por la Sra.\nMURNA, TERESA INES\nRedes Sociales\nContacto\nAutoridad de Aplicación\nSecretaría General\nSubsecretaría Legal y Técnica\nGuía Servicios\nPortal de trámites\nExpedientes\nSeguridad Vial\nARBA\nBoletín Oficial\nRegistro de las Personas\nContrataciones\nVer Todos\nPolíticas de privacidad\nUso Interno\nWebmail (gba.gob.ar)\nWebmail HORDE\nSistemas\nGDEBA\nPortal del Empleado\nMesa de Ayuda\nSIAPE",
      "tablas": [],
      "montos_extraidos": [],
      "metadata": {
        "longitud_caracteres": 903,
        "tiene_tablas": false,
        "total_tablas": 0,
        "total_montos": 0
      }
    },
    {
      "id": "2333321",
      "tipo": "decreto",
      "numero": "1262",
      "titulo": "Decreto Nº 1262",
      "fecha": "Carmen de Areco, 06/08/2025",
      "municipio": "Carmen de Areco",
      "url": "https://sibom.slyt.gba.gob.ar/bulletins/14239/contents/2333321",
      "contenido": "Sistema de Boletín Oficial Municipal | Buenos Aires Provincia\nINICIO\nACERCA DEL SIBOM\nBOLETINES\nMUNICIPIOS\nADMINISTRACION\nSistema de Boletines Oficiales Municipales (SIBOM)\nSistema de Boletines Oficiales Municipales (SIBOM)\nSistema de Boletines Oficiales Municipales (SIBOM)\nSistema de Boletines Oficiales Municipales (SIBOM)\nSistema de Boletines Oficiales Municipales (SIBOM)\nBoletines/Carmen de Areco\nDecreto Nº1262\nDecreto Nº 1262\nPublicado en versión extractada\nCarmen de Areco, 06/08/2025\nLa necesidad de contratar el servicio de herrería, Contrátese, por el plazo de 07 días contados a partir de la firma del presente contrato, dado que el Municipio no cuenta en la planta con personal profesional afectado y/o dedicado a la tarea descripta en los vistos del presente, al Sr.\nESCOBEDO, MARIO ANDRES\nRedes Sociales\nContacto\nAutoridad de Aplicación\nSecretaría General\nSubsecretaría Legal y Técnica\nGuía Servicios\nPortal de trámites\nExpedientes\nSeguridad Vial\nARBA\nBoletín Oficial\nRegistro de las Personas\nContrataciones\nVer Todos\nPolíticas de privacidad\nUso Interno\nWebmail (gba.gob.ar)\nWebmail HORDE\nSistemas\nGDEBA\nPortal del Empleado\nMesa de Ayuda\nSIAPE",
      "tablas": [],
      "montos_extraidos": [],
      "metadata": {
        "longitud_caracteres": 1159,
        "tiene_tablas": false,
        "total_tablas": 0,
        "total_montos": 0
      }
    },
    {
      "id": "2333323",
      "tipo": "decreto",
      "numero": "1263",
      "titulo": "Decreto Nº 1263",
      "fecha": "Carmen de Areco, 06/08/2025",
      "municipio": "Carmen de Areco",
      "url": "https://sibom.slyt.gba.gob.ar/bulletins/14239/contents/2333323",
      "contenido": "Sistema de Boletín Oficial Municipal | Buenos Aires Provincia\nINICIO\nACERCA DEL SIBOM\nBOLETINES\nMUNICIPIOS\nADMINISTRACION\nSistema de Boletines Oficiales Municipales (SIBOM)\nSistema de Boletines Oficiales Municipales (SIBOM)\nSistema de Boletines Oficiales Municipales (SIBOM)\nSistema de Boletines Oficiales Municipales (SIBOM)\nSistema de Boletines Oficiales Municipales (SIBOM)\nBoletines/Carmen de Areco\nDecreto Nº1263\nDecreto Nº 1263\nPublicado en versión extractada\nCarmen de Areco, 06/08/2025\nEl Decreto\n1972/2024\n; y contrato celebrado entre la Municipalidad de Carmen de Areco y  la Cooperativa de trabajo\n“\nEL HORNERO LIMITADA”,\ncon fecha 01/11/2024 para realizar la obra “VESTUARIOS CEF Nº10”; y;\nAféctese en el ejercicio 2025 la suma de pesos $17.506.289,58 que se imputara a la sig. Partida:, conf. El art. 42 del Dec. 2980/00 de Rafam\n1110103000-132–18.01.00 – 4.2.1.0\n…………………..…………………………….…. $ 17.506.289,58\nRedes Sociales\nContacto\nAutoridad de Aplicación\nSecretaría General\nSubsecretaría Legal y Técnica\nGuía Servicios\nPortal de trámites\nExpedientes\nSeguridad Vial\nARBA\nBoletín Oficial\nRegistro de las Personas\nContrataciones\nVer Todos\nPolíticas de privacidad\nUso Interno\nWebmail (gba.gob.ar)\nWebmail HORDE\nSistemas\nGDEBA\nPortal del Empleado\nMesa de Ayuda\nSIAPE",
      "tablas": [],
      "montos_extraidos": [
        {
          "municipio": "Areco",
          "boletin": "0",
          "fecha": "Carmen de Areco, 06/08/2025",
          "norma_tipo": "Decreto",
          "norma_numero": "1263",
          "articulo": "S/N",
          "concepto": "con fecha 01/11/2024 para realizar la obra “VESTUARIOS CEF Nº10”; y;",
          "monto": 17506289.58,
          "moneda": "ARS",
          "texto_completo": "Boletín 0º | Areco | Decreto Nº1263 [ARTÍCULO S/N: $17.506.289,58]",
          "fuente_url": "https://sibom.slyt.gba.gob.ar/bulletins/14239/contents/2333323"
        },
        {
          "municipio": "Areco",
          "boletin": "0",
          "fecha": "Carmen de Areco, 06/08/2025",
          "norma_tipo": "Decreto",
          "norma_numero": "1263",
          "articulo": "S/N",
          "concepto": "con fecha 01/11/2024 para realizar la obra “VESTUARIOS CEF Nº10”; y;",
          "monto": 17506289.58,
          "moneda": "ARS",
          "texto_completo": "Boletín 0º | Areco | Decreto Nº1263 [ARTÍCULO S/N: $17.506.289,58]",
          "fuente_url": "https://sibom.slyt.gba.gob.ar/bulletins/14239/contents/2333323"
        }
      ],
      "metadata": {
        "longitud_caracteres": 1271,
        "tiene_tablas": false,
        "total_tablas": 0,
        "total_montos": 2
      }
    },
    {
      "id": "2333326",
      "tipo": "decreto",
      "numero": "1264",
      "titulo": "Decreto Nº 1264",
      "fecha": "Carmen de Areco, 06/08/2025",
      "municipio": "Carmen de Areco",
      "url": "https://sibom.slyt.gba.gob.ar/bulletins/14239/contents/2333326",
      "contenido": "Sistema de Boletín Oficial Municipal | Buenos Aires Provincia\nINICIO\nACERCA DEL SIBOM\nBOLETINES\nMUNICIPIOS\nADMINISTRACION\nSistema de Boletines Oficiales Municipales (SIBOM)\nSistema de Boletines Oficiales Municipales (SIBOM)\nSistema de Boletines Oficiales Municipales (SIBOM)\nSistema de Boletines Oficiales Municipales (SIBOM)\nSistema de Boletines Oficiales Municipales (SIBOM)\nBoletines/Carmen de Areco\nDecreto Nº1264\nDecreto Nº 1264\nPublicado en versión extractada\nCarmen de Areco, 06/08/2025\nLa necesidad de contratar el servicio de construcción de bienes de dominio publico, y Contrátese, por el plazo de 10 días contados a partir del acta de inicio de obra, dado que el Municipio no cuenta en la planta con personal profesional afectado y/o dedicado a la tarea descripta en los vistos del presente,\nVIAL DS S.A,\nRedes Sociales\nContacto\nAutoridad de Aplicación\nSecretaría General\nSubsecretaría Legal y Técnica\nGuía Servicios\nPortal de trámites\nExpedientes\nSeguridad Vial\nARBA\nBoletín Oficial\nRegistro de las Personas\nContrataciones\nVer Todos\nPolíticas de privacidad\nUso Interno\nWebmail (gba.gob.ar)\nWebmail HORDE\nSistemas\nGDEBA\nPortal del Empleado\nMesa de Ayuda\nSIAPE",
      "tablas": [],
      "montos_extraidos": [],
      "metadata": {
        "longitud_caracteres": 1170,
        "tiene_tablas": false,
        "total_tablas": 0,
        "total_montos": 0
      }
    },
    {
      "id": "2333328",
      "tipo": "decreto",
      "numero": "1265",
      "titulo": "Decreto Nº 1265",
      "fecha": "Carmen de Areco, 06/08/2025",
      "municipio": "Carmen de Areco",
      "url": "https://sibom.slyt.gba.gob.ar/bulletins/14239/contents/2333328",
      "contenido": "Sistema de Boletín Oficial Municipal | Buenos Aires Provincia\nINICIO\nACERCA DEL SIBOM\nBOLETINES\nMUNICIPIOS\nADMINISTRACION\nSistema de Boletines Oficiales Municipales (SIBOM)\nSistema de Boletines Oficiales Municipales (SIBOM)\nSistema de Boletines Oficiales Municipales (SIBOM)\nSistema de Boletines Oficiales Municipales (SIBOM)\nSistema de Boletines Oficiales Municipales (SIBOM)\nBoletines/Carmen de Areco\nDecreto Nº1265\nDecreto Nº 1265\nPublicado en versión extractada\nCarmen de Areco, 06/08/2025\nLos  talleres Culturales 2025 que se brindan para todos y todas las vecinas de nuestra Localidad, de Tres Sargentos y Gouin; y; Páguese a las personas que figuran en el Anexo I del presente decreto, correspondiente al mes de Julio, un canon por servicio de capacitación\nRedes Sociales\nContacto\nAutoridad de Aplicación\nSecretaría General\nSubsecretaría Legal y Técnica\nGuía Servicios\nPortal de trámites\nExpedientes\nSeguridad Vial\nARBA\nBoletín Oficial\nRegistro de las Personas\nContrataciones\nVer Todos\nPolíticas de privacidad\nUso Interno\nWebmail (gba.gob.ar)\nWebmail HORDE\nSistemas\nGDEBA\nPortal del Empleado\nMesa de Ayuda\nSIAPE",
      "tablas": [],
      "montos_extraidos": [],
      "metadata": {
        "longitud_caracteres": 1118,
        "tiene_tablas": false,
        "total_tablas": 0,
        "total_montos": 0
      }
    },
    {
      "id": "2333335",
      "tipo": "decreto",
      "numero": "1266",
      "titulo": "Decreto Nº 1266",
      "fecha": "Carmen de Areco, 06/08/2025",
      "municipio": "Carmen de Areco",
      "url": "https://sibom.slyt.gba.gob.ar/bulletins/14239/contents/2333335",
      "contenido": "Sistema de Boletín Oficial Municipal | Buenos Aires Provincia\nINICIO\nACERCA DEL SIBOM\nBOLETINES\nMUNICIPIOS\nADMINISTRACION\nSistema de Boletines Oficiales Municipales (SIBOM)\nSistema de Boletines Oficiales Municipales (SIBOM)\nSistema de Boletines Oficiales Municipales (SIBOM)\nSistema de Boletines Oficiales Municipales (SIBOM)\nSistema de Boletines Oficiales Municipales (SIBOM)\nBoletines/Carmen de Areco\nDecreto Nº1266\nDecreto Nº 1266\nPublicado en versión extractada\nCarmen de Areco, 06/08/2025\nLa nota presentada por la ASOCIACION COOPERADORA DEL JARDIN DE INFANTES Nº905  de Carmen de Areco – Exp. Adm. N° 4021- 01229-0-2025, y;Otorgase un Subsidio de pesos QUINIENTOS OCHENTA Y NUEVE MIL NOVECIENTOS NOVENTA Y NUEVE ($589.999,00) a la ASOCIACION COOPERADORA DEL JARDIN DE INFANTES Nº905 de Carmen de Areco para afectarlo a los gastos establecidos en los considerandos del presente decreto - Exp. Adm. N° 4021- 01229-0-2025\nRedes Sociales\nContacto\nAutoridad de Aplicación\nSecretaría General\nSubsecretaría Legal y Técnica\nGuía Servicios\nPortal de trámites\nExpedientes\nSeguridad Vial\nARBA\nBoletín Oficial\nRegistro de las Personas\nContrataciones\nVer Todos\nPolíticas de privacidad\nUso Interno\nWebmail (gba.gob.ar)\nWebmail HORDE\nSistemas\nGDEBA\nPortal del Empleado\nMesa de Ayuda\nSIAPE",
      "tablas": [],
      "montos_extraidos": [
        {
          "municipio": "Areco",
          "boletin": "0",
          "fecha": "Carmen de Areco, 06/08/2025",
          "norma_tipo": "Decreto",
          "norma_numero": "1266",
          "articulo": "S/N",
          "concepto": "TES Nº905 de Carmen de Areco para afectarlo a los gastos establecidos en l",
          "monto": 589999.0,
          "moneda": "ARS",
          "texto_completo": "Boletín 0º | Areco | Decreto Nº1266 [ARTÍCULO S/N: $589.999,00]",
          "fuente_url": "https://sibom.slyt.gba.gob.ar/bulletins/14239/contents/2333335"
        }
      ],
      "metadata": {
        "longitud_caracteres": 1279,
        "tiene_tablas": false,
        "total_tablas": 0,
        "total_montos": 1
      }
    },
    {
      "id": "2333337",
      "tipo": "decreto",
      "numero": "1267",
      "titulo": "Decreto Nº 1267",
      "fecha": "Carmen de Areco, 07/08/2025",
      "municipio": "Carmen de Areco",
      "url": "https://sibom.slyt.gba.gob.ar/bulletins/14239/contents/2333337",
      "contenido": "Sistema de Boletín Oficial Municipal | Buenos Aires Provincia\nINICIO\nACERCA DEL SIBOM\nBOLETINES\nMUNICIPIOS\nADMINISTRACION\nSistema de Boletines Oficiales Municipales (SIBOM)\nSistema de Boletines Oficiales Municipales (SIBOM)\nSistema de Boletines Oficiales Municipales (SIBOM)\nSistema de Boletines Oficiales Municipales (SIBOM)\nSistema de Boletines Oficiales Municipales (SIBOM)\nBoletines/Carmen de Areco\nDecreto Nº1267\nDecreto Nº 1267\nPublicado en versión extractada\nCarmen de Areco, 07/08/2025\nEl Registro de la Propiedad de la Pcia. De Bs As y la necesidad de contar con su servicio de información registral; y Autorícese a la Contadora Municipal a realizar el pago al Registro de la Propiedad de la Pcia. De Bs. As, correspondiente al servicio de información registral, el cual se imputará a la Jurisdicción 000118000-110-25.03.00-3.8.9.0, por un monto de  pesos $ 110.000,00 (pesos ciento diez mil).-\nRedes Sociales\nContacto\nAutoridad de Aplicación\nSecretaría General\nSubsecretaría Legal y Técnica\nGuía Servicios\nPortal de trámites\nExpedientes\nSeguridad Vial\nARBA\nBoletín Oficial\nRegistro de las Personas\nContrataciones\nVer Todos\nPolíticas de privacidad\nUso Interno\nWebmail (gba.gob.ar)\nWebmail HORDE\nSistemas\nGDEBA\nPortal del Empleado\nMesa de Ayuda\nSIAPE",
      "tablas": [],
      "montos_extraidos": [
        {
          "municipio": "Areco",
          "boletin": "0",
          "fecha": "Carmen de Areco, 07/08/2025",
          "norma_tipo": "Decreto",
          "norma_numero": "1267",
          "articulo": "S/N",
          "concepto": "risdicción 000118000-110-25.03.00-3.8.9.0, por un monto de pesos $ 110.000,00 (pesos ciento diez mil).-",
          "monto": 110000.0,
          "moneda": "ARS",
          "texto_completo": "Boletín 0º | Areco | Decreto Nº1267 [ARTÍCULO S/N: $110.000,00]",
          "fuente_url": "https://sibom.slyt.gba.gob.ar/bulletins/14239/contents/2333337"
        }
      ],
      "metadata": {
        "longitud_caracteres": 1258,
        "tiene_tablas": false,
        "total_tablas": 0,
        "total_montos": 1
      }
    },
    {
      "id": "2333338",
      "tipo": "decreto",
      "numero": "1268",
      "titulo": "Decreto Nº 1268",
      "fecha": "Carmen de Areco, 07/08/2025",
      "municipio": "Carmen de Areco",
      "url": "https://sibom.slyt.gba.gob.ar/bulletins/14239/contents/2333338",
      "contenido": "Sistema de Boletín Oficial Municipal | Buenos Aires Provincia\nINICIO\nACERCA DEL SIBOM\nBOLETINES\nMUNICIPIOS\nADMINISTRACION\nSistema de Boletines Oficiales Municipales (SIBOM)\nSistema de Boletines Oficiales Municipales (SIBOM)\nSistema de Boletines Oficiales Municipales (SIBOM)\nSistema de Boletines Oficiales Municipales (SIBOM)\nSistema de Boletines Oficiales Municipales (SIBOM)\nBoletines/Carmen de Areco\nDecreto Nº1268\nDecreto Nº 1268\nPublicado en versión extractada\nCarmen de Areco, 07/08/2025\nDeclárese de Interés Municipal, la celebración del “Mes de las niñeces”, en el cual se realizaran actividades por parte de la Dirección de Niñez y Adolescencia, desde el día 11 al 31 de Agosto del corriente\nRedes Sociales\nContacto\nAutoridad de Aplicación\nSecretaría General\nSubsecretaría Legal y Técnica\nGuía Servicios\nPortal de trámites\nExpedientes\nSeguridad Vial\nARBA\nBoletín Oficial\nRegistro de las Personas\nContrataciones\nVer Todos\nPolíticas de privacidad\nUso Interno\nWebmail (gba.gob.ar)\nWebmail HORDE\nSistemas\nGDEBA\nPortal del Empleado\nMesa de Ayuda\nSIAPE",
      "tablas": [],
      "montos_extraidos": [],
      "metadata": {
        "longitud_caracteres": 1055,
        "tiene_tablas": false,
        "total_tablas": 0,
        "total_montos": 0
      }
    },
    {
      "id": "2333340",
      "tipo": "decreto",
      "numero": "1269",
      "titulo": "Decreto Nº 1269",
      "fecha": "Carmen de Areco, 07/08/2026",
      "municipio": "Carmen de Areco",
      "url": "https://sibom.slyt.gba.gob.ar/bulletins/14239/contents/2333340",
      "contenido": "Sistema de Boletín Oficial Municipal | Buenos Aires Provincia\nINICIO\nACERCA DEL SIBOM\nBOLETINES\nMUNICIPIOS\nADMINISTRACION\nSistema de Boletines Oficiales Municipales (SIBOM)\nSistema de Boletines Oficiales Municipales (SIBOM)\nSistema de Boletines Oficiales Municipales (SIBOM)\nSistema de Boletines Oficiales Municipales (SIBOM)\nSistema de Boletines Oficiales Municipales (SIBOM)\nBoletines/Carmen de Areco\nDecreto Nº1269\nDecreto Nº 1269\nPublicado en versión extractada\nCarmen de Areco, 07/08/2026\nLa solicitud presentada por la Sra.\nACOSTA, LUCIANA IVON\nRedes Sociales\nContacto\nAutoridad de Aplicación\nSecretaría General\nSubsecretaría Legal y Técnica\nGuía Servicios\nPortal de trámites\nExpedientes\nSeguridad Vial\nARBA\nBoletín Oficial\nRegistro de las Personas\nContrataciones\nVer Todos\nPolíticas de privacidad\nUso Interno\nWebmail (gba.gob.ar)\nWebmail HORDE\nSistemas\nGDEBA\nPortal del Empleado\nMesa de Ayuda\nSIAPE",
      "tablas": [],
      "montos_extraidos": [],
      "metadata": {
        "longitud_caracteres": 905,
        "tiene_tablas": false,
        "total_tablas": 0,
        "total_montos": 0
      }
    },
    {
      "id": "2333341",
      "tipo": "decreto",
      "numero": "1270",
      "titulo": "Decreto Nº 1270",
      "fecha": "Carmen de Areco, 07/08/2025",
      "municipio": "Carmen de Areco",
      "url": "https://sibom.slyt.gba.gob.ar/bulletins/14239/contents/2333341",
      "contenido": "Sistema de Boletín Oficial Municipal | Buenos Aires Provincia\nINICIO\nACERCA DEL SIBOM\nBOLETINES\nMUNICIPIOS\nADMINISTRACION\nSistema de Boletines Oficiales Municipales (SIBOM)\nSistema de Boletines Oficiales Municipales (SIBOM)\nSistema de Boletines Oficiales Municipales (SIBOM)\nSistema de Boletines Oficiales Municipales (SIBOM)\nSistema de Boletines Oficiales Municipales (SIBOM)\nBoletines/Carmen de Areco\nDecreto Nº1270\nDecreto Nº 1270\nPublicado en versión extractada\nCarmen de Areco, 07/08/2025\nLa solicitud presentada por el Sr.\nFORD\nHUICI, CLAUDIO CESAR\nRedes Sociales\nContacto\nAutoridad de Aplicación\nSecretaría General\nSubsecretaría Legal y Técnica\nGuía Servicios\nPortal de trámites\nExpedientes\nSeguridad Vial\nARBA\nBoletín Oficial\nRegistro de las Personas\nContrataciones\nVer Todos\nPolíticas de privacidad\nUso Interno\nWebmail (gba.gob.ar)\nWebmail HORDE\nSistemas\nGDEBA\nPortal del Empleado\nMesa de Ayuda\nSIAPE",
      "tablas": [],
      "montos_extraidos": [],
      "metadata": {
        "longitud_caracteres": 909,
        "tiene_tablas": false,
        "total_tablas": 0,
        "total_montos": 0
      }
    },
    {
      "id": "2333343",
      "tipo": "decreto",
      "numero": "1271",
      "titulo": "Decreto Nº 1271",
      "fecha": "Carmen de Areco, 07/08/2025",
      "municipio": "Carmen de Areco",
      "url": "https://sibom.slyt.gba.gob.ar/bulletins/14239/contents/2333343",
      "contenido": "Sistema de Boletín Oficial Municipal | Buenos Aires Provincia\nINICIO\nACERCA DEL SIBOM\nBOLETINES\nMUNICIPIOS\nADMINISTRACION\nSistema de Boletines Oficiales Municipales (SIBOM)\nSistema de Boletines Oficiales Municipales (SIBOM)\nSistema de Boletines Oficiales Municipales (SIBOM)\nSistema de Boletines Oficiales Municipales (SIBOM)\nSistema de Boletines Oficiales Municipales (SIBOM)\nBoletines/Carmen de Areco\nDecreto Nº1271\nDecreto Nº 1271\nPublicado en versión extractada\nCarmen de Areco, 07/08/2025\nLa solicitud presentada por el Sr.\nCASTRO, JESUS NAZARENO\nRedes Sociales\nContacto\nAutoridad de Aplicación\nSecretaría General\nSubsecretaría Legal y Técnica\nGuía Servicios\nPortal de trámites\nExpedientes\nSeguridad Vial\nARBA\nBoletín Oficial\nRegistro de las Personas\nContrataciones\nVer Todos\nPolíticas de privacidad\nUso Interno\nWebmail (gba.gob.ar)\nWebmail HORDE\nSistemas\nGDEBA\nPortal del Empleado\nMesa de Ayuda\nSIAPE",
      "tablas": [],
      "montos_extraidos": [],
      "metadata": {
        "longitud_caracteres": 906,
        "tiene_tablas": false,
        "total_tablas": 0,
        "total_montos": 0
      }
    }
  ],
  "metadata_boletin": {
    "total_caracteres": 57157,
    "total_tablas": 0,
    "total_montos": 10,
    "fecha_scraping": "2026-01-16T07:58:11Z",
    "version_scraper": "2.0"
  }
}