{
  "municipio": "Carmen de Areco",
  "numero_boletin": "33º",
  "fecha_boletin": "12/01/2026",
  "boletin_url": "https://sibom.slyt.gba.gob.ar/bulletins/14250",
  "status": "completed",
  "total_normas": 100,
  "normas": [
    {
      "id": "2333543",
      "tipo": "decreto",
      "numero": "1272",
      "titulo": "Decreto Nº 1272",
      "fecha": "Carmen de Areco, 07/08/2025",
      "municipio": "Carmen de Areco",
      "url": "https://sibom.slyt.gba.gob.ar/bulletins/14250/contents/2333543",
      "contenido": "Sistema de Boletín Oficial Municipal | Buenos Aires Provincia\nINICIO\nACERCA DEL SIBOM\nBOLETINES\nMUNICIPIOS\nADMINISTRACION\nSistema de Boletines Oficiales Municipales (SIBOM)\nSistema de Boletines Oficiales Municipales (SIBOM)\nSistema de Boletines Oficiales Municipales (SIBOM)\nSistema de Boletines Oficiales Municipales (SIBOM)\nSistema de Boletines Oficiales Municipales (SIBOM)\nBoletines/Carmen de Areco\nDecreto Nº1272\nDecreto Nº 1272\nPublicado en versión extractada\nCarmen de Areco, 07/08/2025\nLa solicitud presentada por la Sra.\nACEVEDO, MARIA ELVIRA\nRedes Sociales\nContacto\nAutoridad de Aplicación\nSecretaría General\nSubsecretaría Legal y Técnica\nGuía Servicios\nPortal de trámites\nExpedientes\nSeguridad Vial\nARBA\nBoletín Oficial\nRegistro de las Personas\nContrataciones\nVer Todos\nPolíticas de privacidad\nUso Interno\nWebmail (gba.gob.ar)\nWebmail HORDE\nSistemas\nGDEBA\nPortal del Empleado\nMesa de Ayuda\nSIAPE",
      "tablas": [],
      "montos_extraidos": [],
      "metadata": {
        "longitud_caracteres": 906,
        "tiene_tablas": false,
        "total_tablas": 0,
        "total_montos": 0
      }
    },
    {
      "id": "2333550",
      "tipo": "decreto",
      "numero": "1273",
      "titulo": "Decreto Nº 1273",
      "fecha": "Carmen de Areco, 07/08/2025",
      "municipio": "Carmen de Areco",
      "url": "https://sibom.slyt.gba.gob.ar/bulletins/14250/contents/2333550",
      "contenido": "Sistema de Boletín Oficial Municipal | Buenos Aires Provincia\nINICIO\nACERCA DEL SIBOM\nBOLETINES\nMUNICIPIOS\nADMINISTRACION\nSistema de Boletines Oficiales Municipales (SIBOM)\nSistema de Boletines Oficiales Municipales (SIBOM)\nSistema de Boletines Oficiales Municipales (SIBOM)\nSistema de Boletines Oficiales Municipales (SIBOM)\nSistema de Boletines Oficiales Municipales (SIBOM)\nBoletines/Carmen de Areco\nDecreto Nº1273\nDecreto Nº 1273\nPublicado en versión extractada\nCarmen de Areco, 07/08/2025\nLa solicitud presentada por la Sra.\nFONTAN, BARBARA AYELEN\nRedes Sociales\nContacto\nAutoridad de Aplicación\nSecretaría General\nSubsecretaría Legal y Técnica\nGuía Servicios\nPortal de trámites\nExpedientes\nSeguridad Vial\nARBA\nBoletín Oficial\nRegistro de las Personas\nContrataciones\nVer Todos\nPolíticas de privacidad\nUso Interno\nWebmail (gba.gob.ar)\nWebmail HORDE\nSistemas\nGDEBA\nPortal del Empleado\nMesa de Ayuda\nSIAPE",
      "tablas": [],
      "montos_extraidos": [],
      "metadata": {
        "longitud_caracteres": 907,
        "tiene_tablas": false,
        "total_tablas": 0,
        "total_montos": 0
      }
    },
    {
      "id": "2333555",
      "tipo": "decreto",
      "numero": "1274",
      "titulo": "Decreto Nº 1274",
      "fecha": "Carmen de Areco, 07/08/2025",
      "municipio": "Carmen de Areco",
      "url": "https://sibom.slyt.gba.gob.ar/bulletins/14250/contents/2333555",
      "contenido": "Sistema de Boletín Oficial Municipal | Buenos Aires Provincia\nINICIO\nACERCA DEL SIBOM\nBOLETINES\nMUNICIPIOS\nADMINISTRACION\nSistema de Boletines Oficiales Municipales (SIBOM)\nSistema de Boletines Oficiales Municipales (SIBOM)\nSistema de Boletines Oficiales Municipales (SIBOM)\nSistema de Boletines Oficiales Municipales (SIBOM)\nSistema de Boletines Oficiales Municipales (SIBOM)\nBoletines/Carmen de Areco\nDecreto Nº1274\nDecreto Nº 1274\nPublicado en versión extractada\nCarmen de Areco, 07/08/2025\nLa\nLey 13163 y la creación del\nFondo de Fortalecimiento de Programas Sociales; Otorgase una Becas a las personas que figuran en el Anexo I del presente decreto, correspondiente al mes de julio de 2025.-\nRedes Sociales\nContacto\nAutoridad de Aplicación\nSecretaría General\nSubsecretaría Legal y Técnica\nGuía Servicios\nPortal de trámites\nExpedientes\nSeguridad Vial\nARBA\nBoletín Oficial\nRegistro de las Personas\nContrataciones\nVer Todos\nPolíticas de privacidad\nUso Interno\nWebmail (gba.gob.ar)\nWebmail HORDE\nSistemas\nGDEBA\nPortal del Empleado\nMesa de Ayuda\nSIAPE",
      "tablas": [],
      "montos_extraidos": [],
      "metadata": {
        "longitud_caracteres": 1051,
        "tiene_tablas": false,
        "total_tablas": 0,
        "total_montos": 0
      }
    },
    {
      "id": "2333558",
      "tipo": "decreto",
      "numero": "1275",
      "titulo": "Decreto Nº 1275",
      "fecha": "Carmen de Areco, 07/08/2025",
      "municipio": "Carmen de Areco",
      "url": "https://sibom.slyt.gba.gob.ar/bulletins/14250/contents/2333558",
      "contenido": "Sistema de Boletín Oficial Municipal | Buenos Aires Provincia\nINICIO\nACERCA DEL SIBOM\nBOLETINES\nMUNICIPIOS\nADMINISTRACION\nSistema de Boletines Oficiales Municipales (SIBOM)\nSistema de Boletines Oficiales Municipales (SIBOM)\nSistema de Boletines Oficiales Municipales (SIBOM)\nSistema de Boletines Oficiales Municipales (SIBOM)\nSistema de Boletines Oficiales Municipales (SIBOM)\nBoletines/Carmen de Areco\nDecreto Nº1275\nDecreto Nº 1275\nPublicado en versión extractada\nCarmen de Areco, 07/08/2025\nLa solicitud presentada por la Sra.\nGUERRERO,  ESTELA CRISTINA\nRedes Sociales\nContacto\nAutoridad de Aplicación\nSecretaría General\nSubsecretaría Legal y Técnica\nGuía Servicios\nPortal de trámites\nExpedientes\nSeguridad Vial\nARBA\nBoletín Oficial\nRegistro de las Personas\nContrataciones\nVer Todos\nPolíticas de privacidad\nUso Interno\nWebmail (gba.gob.ar)\nWebmail HORDE\nSistemas\nGDEBA\nPortal del Empleado\nMesa de Ayuda\nSIAPE",
      "tablas": [],
      "montos_extraidos": [],
      "metadata": {
        "longitud_caracteres": 911,
        "tiene_tablas": false,
        "total_tablas": 0,
        "total_montos": 0
      }
    },
    {
      "id": "2333560",
      "tipo": "decreto",
      "numero": "1276",
      "titulo": "Decreto Nº 1276",
      "fecha": "Carmen de Areco, 07/08/2025",
      "municipio": "Carmen de Areco",
      "url": "https://sibom.slyt.gba.gob.ar/bulletins/14250/contents/2333560",
      "contenido": "Sistema de Boletín Oficial Municipal | Buenos Aires Provincia\nINICIO\nACERCA DEL SIBOM\nBOLETINES\nMUNICIPIOS\nADMINISTRACION\nSistema de Boletines Oficiales Municipales (SIBOM)\nSistema de Boletines Oficiales Municipales (SIBOM)\nSistema de Boletines Oficiales Municipales (SIBOM)\nSistema de Boletines Oficiales Municipales (SIBOM)\nSistema de Boletines Oficiales Municipales (SIBOM)\nBoletines/Carmen de Areco\nDecreto Nº1276\nDecreto Nº 1276\nPublicado en versión extractada\nCarmen de Areco, 07/08/2025\nLa solicitud presentada por la Sra.\nMESA, MARIA LUZ\nRedes Sociales\nContacto\nAutoridad de Aplicación\nSecretaría General\nSubsecretaría Legal y Técnica\nGuía Servicios\nPortal de trámites\nExpedientes\nSeguridad Vial\nARBA\nBoletín Oficial\nRegistro de las Personas\nContrataciones\nVer Todos\nPolíticas de privacidad\nUso Interno\nWebmail (gba.gob.ar)\nWebmail HORDE\nSistemas\nGDEBA\nPortal del Empleado\nMesa de Ayuda\nSIAPE",
      "tablas": [],
      "montos_extraidos": [],
      "metadata": {
        "longitud_caracteres": 900,
        "tiene_tablas": false,
        "total_tablas": 0,
        "total_montos": 0
      }
    },
    {
      "id": "2333575",
      "tipo": "decreto",
      "numero": "1277",
      "titulo": "Decreto Nº 1277",
      "fecha": "Carmen de Areco, 07/08/2025",
      "municipio": "Carmen de Areco",
      "url": "https://sibom.slyt.gba.gob.ar/bulletins/14250/contents/2333575",
      "contenido": "Sistema de Boletín Oficial Municipal | Buenos Aires Provincia\nINICIO\nACERCA DEL SIBOM\nBOLETINES\nMUNICIPIOS\nADMINISTRACION\nSistema de Boletines Oficiales Municipales (SIBOM)\nSistema de Boletines Oficiales Municipales (SIBOM)\nSistema de Boletines Oficiales Municipales (SIBOM)\nSistema de Boletines Oficiales Municipales (SIBOM)\nSistema de Boletines Oficiales Municipales (SIBOM)\nBoletines/Carmen de Areco\nDecreto Nº1277\nDecreto Nº 1277\nPublicado en versión extractada\nCarmen de Areco, 07/08/2025\nSumario Administrativo\nRedes Sociales\nContacto\nAutoridad de Aplicación\nSecretaría General\nSubsecretaría Legal y Técnica\nGuía Servicios\nPortal de trámites\nExpedientes\nSeguridad Vial\nARBA\nBoletín Oficial\nRegistro de las Personas\nContrataciones\nVer Todos\nPolíticas de privacidad\nUso Interno\nWebmail (gba.gob.ar)\nWebmail HORDE\nSistemas\nGDEBA\nPortal del Empleado\nMesa de Ayuda\nSIAPE",
      "tablas": [],
      "montos_extraidos": [],
      "metadata": {
        "longitud_caracteres": 871,
        "tiene_tablas": false,
        "total_tablas": 0,
        "total_montos": 0
      }
    },
    {
      "id": "2333578",
      "tipo": "decreto",
      "numero": "1278",
      "titulo": "Decreto Nº 1278",
      "fecha": "Carmen de Areco, 07/08/2025",
      "municipio": "Carmen de Areco",
      "url": "https://sibom.slyt.gba.gob.ar/bulletins/14250/contents/2333578",
      "contenido": "Sistema de Boletín Oficial Municipal | Buenos Aires Provincia\nINICIO\nACERCA DEL SIBOM\nBOLETINES\nMUNICIPIOS\nADMINISTRACION\nSistema de Boletines Oficiales Municipales (SIBOM)\nSistema de Boletines Oficiales Municipales (SIBOM)\nSistema de Boletines Oficiales Municipales (SIBOM)\nSistema de Boletines Oficiales Municipales (SIBOM)\nSistema de Boletines Oficiales Municipales (SIBOM)\nBoletines/Carmen de Areco\nDecreto Nº1278\nDecreto Nº 1278\nPublicado en versión extractada\nCarmen de Areco, 07/08/2025\nDeclárese de Interés Municipal el acto de\nTOMA DE FIRMAS DE ESCRITURAS SOCIALES\n, que tendrá lugar el próximo 08 de agosto del corriente, a las 12:00 hrs, en el recinto del concejo deliberante de la municipalidad de Carmen de Areco.-\nRedes Sociales\nContacto\nAutoridad de Aplicación\nSecretaría General\nSubsecretaría Legal y Técnica\nGuía Servicios\nPortal de trámites\nExpedientes\nSeguridad Vial\nARBA\nBoletín Oficial\nRegistro de las Personas\nContrataciones\nVer Todos\nPolíticas de privacidad\nUso Interno\nWebmail (gba.gob.ar)\nWebmail HORDE\nSistemas\nGDEBA\nPortal del Empleado\nMesa de Ayuda\nSIAPE",
      "tablas": [],
      "montos_extraidos": [],
      "metadata": {
        "longitud_caracteres": 1082,
        "tiene_tablas": false,
        "total_tablas": 0,
        "total_montos": 0
      }
    },
    {
      "id": "2333579",
      "tipo": "decreto",
      "numero": "1279",
      "titulo": "Decreto Nº 1279",
      "fecha": "Carmen de Areco, 08/08/2025",
      "municipio": "Carmen de Areco",
      "url": "https://sibom.slyt.gba.gob.ar/bulletins/14250/contents/2333579",
      "contenido": "Sistema de Boletín Oficial Municipal | Buenos Aires Provincia\nINICIO\nACERCA DEL SIBOM\nBOLETINES\nMUNICIPIOS\nADMINISTRACION\nSistema de Boletines Oficiales Municipales (SIBOM)\nSistema de Boletines Oficiales Municipales (SIBOM)\nSistema de Boletines Oficiales Municipales (SIBOM)\nSistema de Boletines Oficiales Municipales (SIBOM)\nSistema de Boletines Oficiales Municipales (SIBOM)\nBoletines/Carmen de Areco\nDecreto Nº1279\nDecreto Nº 1279\nPublicado en versión extractada\nCarmen de Areco, 08/08/2025\nLa solicitud presentada por la Sra.\nFONTAN, YESICA ROMINA\nRedes Sociales\nContacto\nAutoridad de Aplicación\nSecretaría General\nSubsecretaría Legal y Técnica\nGuía Servicios\nPortal de trámites\nExpedientes\nSeguridad Vial\nARBA\nBoletín Oficial\nRegistro de las Personas\nContrataciones\nVer Todos\nPolíticas de privacidad\nUso Interno\nWebmail (gba.gob.ar)\nWebmail HORDE\nSistemas\nGDEBA\nPortal del Empleado\nMesa de Ayuda\nSIAPE",
      "tablas": [],
      "montos_extraidos": [],
      "metadata": {
        "longitud_caracteres": 906,
        "tiene_tablas": false,
        "total_tablas": 0,
        "total_montos": 0
      }
    },
    {
      "id": "2333581",
      "tipo": "decreto",
      "numero": "1280",
      "titulo": "Decreto Nº 1280",
      "fecha": "Carmen de Areco, 08/08/2025",
      "municipio": "Carmen de Areco",
      "url": "https://sibom.slyt.gba.gob.ar/bulletins/14250/contents/2333581",
      "contenido": "Sistema de Boletín Oficial Municipal | Buenos Aires Provincia\nINICIO\nACERCA DEL SIBOM\nBOLETINES\nMUNICIPIOS\nADMINISTRACION\nSistema de Boletines Oficiales Municipales (SIBOM)\nSistema de Boletines Oficiales Municipales (SIBOM)\nSistema de Boletines Oficiales Municipales (SIBOM)\nSistema de Boletines Oficiales Municipales (SIBOM)\nSistema de Boletines Oficiales Municipales (SIBOM)\nBoletines/Carmen de Areco\nDecreto Nº1280\nDecreto Nº 1280\nPublicado en versión extractada\nCarmen de Areco, 08/08/2025\nLa solicitud presentada por la Sra.\nLUNA, JORGELINA MARIA NOEL\nRedes Sociales\nContacto\nAutoridad de Aplicación\nSecretaría General\nSubsecretaría Legal y Técnica\nGuía Servicios\nPortal de trámites\nExpedientes\nSeguridad Vial\nARBA\nBoletín Oficial\nRegistro de las Personas\nContrataciones\nVer Todos\nPolíticas de privacidad\nUso Interno\nWebmail (gba.gob.ar)\nWebmail HORDE\nSistemas\nGDEBA\nPortal del Empleado\nMesa de Ayuda\nSIAPE",
      "tablas": [],
      "montos_extraidos": [],
      "metadata": {
        "longitud_caracteres": 911,
        "tiene_tablas": false,
        "total_tablas": 0,
        "total_montos": 0
      }
    },
    {
      "id": "2333588",
      "tipo": "decreto",
      "numero": "1281",
      "titulo": "Decreto Nº 1281",
      "fecha": "Carmen de Areco, 08/08/2025",
      "municipio": "Carmen de Areco",
      "url": "https://sibom.slyt.gba.gob.ar/bulletins/14250/contents/2333588",
      "contenido": "Sistema de Boletín Oficial Municipal | Buenos Aires Provincia\nINICIO\nACERCA DEL SIBOM\nBOLETINES\nMUNICIPIOS\nADMINISTRACION\nSistema de Boletines Oficiales Municipales (SIBOM)\nSistema de Boletines Oficiales Municipales (SIBOM)\nSistema de Boletines Oficiales Municipales (SIBOM)\nSistema de Boletines Oficiales Municipales (SIBOM)\nSistema de Boletines Oficiales Municipales (SIBOM)\nBoletines/Carmen de Areco\nDecreto Nº1281\nDecreto Nº 1281\nPublicado en versión extractada\nCarmen de Areco, 08/08/2025\nLa necesidad de realizar las tareas de limpieza de zanjas y alcantarillas en distintos puntos de la ciudad y pintura de espacios públicos (cordones, plazoletas y plazas). Contrátese, retroactivamente, puesto que el municipio no cuenta en la planta con personal profesional afectado y/o dedicado a tal tarea, a la Cooperativa de Trabajo ARRAIGO LTDA,  para realizar desde el día 01 de agosto de 2025 y hasta el día 31 de agosto de 2025,\nRedes Sociales\nContacto\nAutoridad de Aplicación\nSecretaría General\nSubsecretaría Legal y Técnica\nGuía Servicios\nPortal de trámites\nExpedientes\nSeguridad Vial\nARBA\nBoletín Oficial\nRegistro de las Personas\nContrataciones\nVer Todos\nPolíticas de privacidad\nUso Interno\nWebmail (gba.gob.ar)\nWebmail HORDE\nSistemas\nGDEBA\nPortal del Empleado\nMesa de Ayuda\nSIAPE",
      "tablas": [],
      "montos_extraidos": [],
      "metadata": {
        "longitud_caracteres": 1284,
        "tiene_tablas": false,
        "total_tablas": 0,
        "total_montos": 0
      }
    },
    {
      "id": "2333591",
      "tipo": "decreto",
      "numero": "1282",
      "titulo": "Decreto Nº 1282",
      "fecha": "Carmen de Areco, 08/08/2025",
      "municipio": "Carmen de Areco",
      "url": "https://sibom.slyt.gba.gob.ar/bulletins/14250/contents/2333591",
      "contenido": "Sistema de Boletín Oficial Municipal | Buenos Aires Provincia\nINICIO\nACERCA DEL SIBOM\nBOLETINES\nMUNICIPIOS\nADMINISTRACION\nSistema de Boletines Oficiales Municipales (SIBOM)\nSistema de Boletines Oficiales Municipales (SIBOM)\nSistema de Boletines Oficiales Municipales (SIBOM)\nSistema de Boletines Oficiales Municipales (SIBOM)\nSistema de Boletines Oficiales Municipales (SIBOM)\nBoletines/Carmen de Areco\nDecreto Nº1282\nDecreto Nº 1282\nPublicado en versión extractada\nCarmen de Areco, 08/08/2025\nLa necesidad de realizar las tareas de recolección de ramas y residuos, escombros, zanjeos, parquización de espacios públicos, mantenimiento de calles linderas, poda, colocación de tubos,  en la localidad de Carmen de Areco, Gouin y Tres Sargentos, : Contrátese, retroactivamente, puesto que el municipio no cuenta en la planta con personal profesional afectado y/o dedicado a tal tarea, a la Cooperativa de Trabajo ARRAIGO LTDA, para realizar desde el día 01 de agosto de 2025 y hasta el día 31 de agosto de 2025\nRedes Sociales\nContacto\nAutoridad de Aplicación\nSecretaría General\nSubsecretaría Legal y Técnica\nGuía Servicios\nPortal de trámites\nExpedientes\nSeguridad Vial\nARBA\nBoletín Oficial\nRegistro de las Personas\nContrataciones\nVer Todos\nPolíticas de privacidad\nUso Interno\nWebmail (gba.gob.ar)\nWebmail HORDE\nSistemas\nGDEBA\nPortal del Empleado\nMesa de Ayuda\nSIAPE",
      "tablas": [],
      "montos_extraidos": [],
      "metadata": {
        "longitud_caracteres": 1362,
        "tiene_tablas": false,
        "total_tablas": 0,
        "total_montos": 0
      }
    },
    {
      "id": "2333593",
      "tipo": "decreto",
      "numero": "1283",
      "titulo": "Decreto Nº 1283",
      "fecha": "Carmen de Areco, 08/08/2025",
      "municipio": "Carmen de Areco",
      "url": "https://sibom.slyt.gba.gob.ar/bulletins/14250/contents/2333593",
      "contenido": "Sistema de Boletín Oficial Municipal | Buenos Aires Provincia\nINICIO\nACERCA DEL SIBOM\nBOLETINES\nMUNICIPIOS\nADMINISTRACION\nSistema de Boletines Oficiales Municipales (SIBOM)\nSistema de Boletines Oficiales Municipales (SIBOM)\nSistema de Boletines Oficiales Municipales (SIBOM)\nSistema de Boletines Oficiales Municipales (SIBOM)\nSistema de Boletines Oficiales Municipales (SIBOM)\nBoletines/Carmen de Areco\nDecreto Nº1283\nDecreto Nº 1283\nPublicado en versión extractada\nCarmen de Areco, 08/08/2025\nDese de baja, a partir del 31 de Julio de 2025, como Delegada del Instituto de Previsión Social de la Provincia de Buenos a la Sra.\nONGAY, GABRIELA ANDREA,\nDesígnese a la Sra.\nGUTIERREZ, CAROLINA MARICEL\ncomo delegado ante el Instituto de Previsión Social de la Pcia. De Bs. As., a partir del 01 de Agosto de 2025.-\nRedes Sociales\nContacto\nAutoridad de Aplicación\nSecretaría General\nSubsecretaría Legal y Técnica\nGuía Servicios\nPortal de trámites\nExpedientes\nSeguridad Vial\nARBA\nBoletín Oficial\nRegistro de las Personas\nContrataciones\nVer Todos\nPolíticas de privacidad\nUso Interno\nWebmail (gba.gob.ar)\nWebmail HORDE\nSistemas\nGDEBA\nPortal del Empleado\nMesa de Ayuda\nSIAPE",
      "tablas": [],
      "montos_extraidos": [],
      "metadata": {
        "longitud_caracteres": 1164,
        "tiene_tablas": false,
        "total_tablas": 0,
        "total_montos": 0
      }
    },
    {
      "id": "2333595",
      "tipo": "decreto",
      "numero": "1284",
      "titulo": "Decreto Nº 1284",
      "fecha": "Carmen de Areco, 08/08/2025",
      "municipio": "Carmen de Areco",
      "url": "https://sibom.slyt.gba.gob.ar/bulletins/14250/contents/2333595",
      "contenido": "Sistema de Boletín Oficial Municipal | Buenos Aires Provincia\nINICIO\nACERCA DEL SIBOM\nBOLETINES\nMUNICIPIOS\nADMINISTRACION\nSistema de Boletines Oficiales Municipales (SIBOM)\nSistema de Boletines Oficiales Municipales (SIBOM)\nSistema de Boletines Oficiales Municipales (SIBOM)\nSistema de Boletines Oficiales Municipales (SIBOM)\nSistema de Boletines Oficiales Municipales (SIBOM)\nBoletines/Carmen de Areco\nDecreto Nº1284\nDecreto Nº 1284\nPublicado en versión extractada\nCarmen de Areco, 08/08/2025\nEl Decreto N° 31/2024; y Establézcase desde el mes de Agosto de 2025 y hasta el 31 de Diciembre del cte. año, escala salarial equivalente a 40 horas semanales,  al Sr.\nMORENO, MAURO JAVIER,\nquien reviste en la jurisdicción 1110117000 –Categoría programática – 16.01.00 - 110 -PERSONAL SUPERIOR, planta política\nRedes Sociales\nContacto\nAutoridad de Aplicación\nSecretaría General\nSubsecretaría Legal y Técnica\nGuía Servicios\nPortal de trámites\nExpedientes\nSeguridad Vial\nARBA\nBoletín Oficial\nRegistro de las Personas\nContrataciones\nVer Todos\nPolíticas de privacidad\nUso Interno\nWebmail (gba.gob.ar)\nWebmail HORDE\nSistemas\nGDEBA\nPortal del Empleado\nMesa de Ayuda\nSIAPE",
      "tablas": [],
      "montos_extraidos": [],
      "metadata": {
        "longitud_caracteres": 1159,
        "tiene_tablas": false,
        "total_tablas": 0,
        "total_montos": 0
      }
    },
    {
      "id": "2333599",
      "tipo": "decreto",
      "numero": "1285",
      "titulo": "Decreto Nº 1285",
      "fecha": "Carmen de Areco, 11/08/2025",
      "municipio": "Carmen de Areco",
      "url": "https://sibom.slyt.gba.gob.ar/bulletins/14250/contents/2333599",
      "contenido": "Sistema de Boletín Oficial Municipal | Buenos Aires Provincia\nINICIO\nACERCA DEL SIBOM\nBOLETINES\nMUNICIPIOS\nADMINISTRACION\nSistema de Boletines Oficiales Municipales (SIBOM)\nSistema de Boletines Oficiales Municipales (SIBOM)\nSistema de Boletines Oficiales Municipales (SIBOM)\nSistema de Boletines Oficiales Municipales (SIBOM)\nSistema de Boletines Oficiales Municipales (SIBOM)\nBoletines/Carmen de Areco\nDecreto Nº1285\nDecreto Nº 1285\nPublicado en versión extractada\nCarmen de Areco, 11/08/2025\nDeclárese de\nINTERES MUNICIPAL\nlos festejos en conmemoración del N°175 Aniversario del paso a la inmortalidad del Gral. JOSÉ DE SAN MARTÍN, el próximo 18 de Agosto de 2025.-\nRedes Sociales\nContacto\nAutoridad de Aplicación\nSecretaría General\nSubsecretaría Legal y Técnica\nGuía Servicios\nPortal de trámites\nExpedientes\nSeguridad Vial\nARBA\nBoletín Oficial\nRegistro de las Personas\nContrataciones\nVer Todos\nPolíticas de privacidad\nUso Interno\nWebmail (gba.gob.ar)\nWebmail HORDE\nSistemas\nGDEBA\nPortal del Empleado\nMesa de Ayuda\nSIAPE",
      "tablas": [],
      "montos_extraidos": [],
      "metadata": {
        "longitud_caracteres": 1022,
        "tiene_tablas": false,
        "total_tablas": 0,
        "total_montos": 0
      }
    },
    {
      "id": "2333623",
      "tipo": "decreto",
      "numero": "1286",
      "titulo": "Decreto Nº 1286",
      "fecha": "Carmen de Areco, 11/08/2025",
      "municipio": "Carmen de Areco",
      "url": "https://sibom.slyt.gba.gob.ar/bulletins/14250/contents/2333623",
      "contenido": "Sistema de Boletín Oficial Municipal | Buenos Aires Provincia\nINICIO\nACERCA DEL SIBOM\nBOLETINES\nMUNICIPIOS\nADMINISTRACION\nSistema de Boletines Oficiales Municipales (SIBOM)\nSistema de Boletines Oficiales Municipales (SIBOM)\nSistema de Boletines Oficiales Municipales (SIBOM)\nSistema de Boletines Oficiales Municipales (SIBOM)\nSistema de Boletines Oficiales Municipales (SIBOM)\nBoletines/Carmen de Areco\nDecreto Nº1286\nDecreto Nº 1286\nPublicado en versión extractada\nCarmen de Areco, 11/08/2025\nLa solicitud presentada por la Sra.\nABACA, VALERIA ROXANA\nRedes Sociales\nContacto\nAutoridad de Aplicación\nSecretaría General\nSubsecretaría Legal y Técnica\nGuía Servicios\nPortal de trámites\nExpedientes\nSeguridad Vial\nARBA\nBoletín Oficial\nRegistro de las Personas\nContrataciones\nVer Todos\nPolíticas de privacidad\nUso Interno\nWebmail (gba.gob.ar)\nWebmail HORDE\nSistemas\nGDEBA\nPortal del Empleado\nMesa de Ayuda\nSIAPE",
      "tablas": [],
      "montos_extraidos": [],
      "metadata": {
        "longitud_caracteres": 906,
        "tiene_tablas": false,
        "total_tablas": 0,
        "total_montos": 0
      }
    },
    {
      "id": "2333628",
      "tipo": "decreto",
      "numero": "1287",
      "titulo": "Decreto Nº 1287",
      "fecha": "Carmen de Areco, 11/08/2025",
      "municipio": "Carmen de Areco",
      "url": "https://sibom.slyt.gba.gob.ar/bulletins/14250/contents/2333628",
      "contenido": "Sistema de Boletín Oficial Municipal | Buenos Aires Provincia\nINICIO\nACERCA DEL SIBOM\nBOLETINES\nMUNICIPIOS\nADMINISTRACION\nSistema de Boletines Oficiales Municipales (SIBOM)\nSistema de Boletines Oficiales Municipales (SIBOM)\nSistema de Boletines Oficiales Municipales (SIBOM)\nSistema de Boletines Oficiales Municipales (SIBOM)\nSistema de Boletines Oficiales Municipales (SIBOM)\nBoletines/Carmen de Areco\nDecreto Nº1287\nDecreto Nº 1287\nPublicado en versión extractada\nCarmen de Areco, 11/08/2025\nEl contrato celebrado entre la Municipalidad de Carmen de Areco y la Empresa YPF RUTAS para la Implementación de la Tarjeta YPF RUTAS para la carga de combustibles y lubricantes para vehículos municipales, y la Ord. N° 3067/2021; y;\nAbónese a la Empresa YPF S.A. , la factura N° N° 2172B00099331 de fecha 31/07/25, que ascienden a la suma de $ 95.514,75, los cuales se imputarán a la Jurisdicción: 1110103000– 01.00.00-110-   3.5.9.0……… $ 95.514,75\nRedes Sociales\nContacto\nAutoridad de Aplicación\nSecretaría General\nSubsecretaría Legal y Técnica\nGuía Servicios\nPortal de trámites\nExpedientes\nSeguridad Vial\nARBA\nBoletín Oficial\nRegistro de las Personas\nContrataciones\nVer Todos\nPolíticas de privacidad\nUso Interno\nWebmail (gba.gob.ar)\nWebmail HORDE\nSistemas\nGDEBA\nPortal del Empleado\nMesa de Ayuda\nSIAPE",
      "tablas": [],
      "montos_extraidos": [
        {
          "municipio": "Areco",
          "boletin": "0",
          "fecha": "Carmen de Areco, 11/08/2025",
          "norma_tipo": "Decreto",
          "norma_numero": "1287",
          "articulo": "S/N",
          "concepto": "Boletines Oficiales Municipales (SIBOM) Boletines/Carmen de Areco Decreto Nº1287 Decreto",
          "monto": 95514.75,
          "moneda": "ARS",
          "texto_completo": "Boletín 0º | Areco | Decreto Nº1287 [ARTÍCULO S/N: $95.514,75]",
          "fuente_url": "https://sibom.slyt.gba.gob.ar/bulletins/14250/contents/2333628"
        },
        {
          "municipio": "Areco",
          "boletin": "0",
          "fecha": "Carmen de Areco, 11/08/2025",
          "norma_tipo": "Norma",
          "norma_numero": "S/N",
          "articulo": "S/N",
          "concepto": "87 Publicado en versión extractada Carmen de Areco, 11/08/2025 El",
          "monto": 95514.75,
          "moneda": "ARS",
          "texto_completo": "Boletín 0º | Areco | Norma NºS/N [ARTÍCULO S/N: $95.514,75]",
          "fuente_url": "https://sibom.slyt.gba.gob.ar/bulletins/14250/contents/2333628"
        }
      ],
      "metadata": {
        "longitud_caracteres": 1297,
        "tiene_tablas": false,
        "total_tablas": 0,
        "total_montos": 2
      }
    },
    {
      "id": "2333659",
      "tipo": "decreto",
      "numero": "1288",
      "titulo": "Decreto Nº 1288",
      "fecha": "Carmen de Areco, 11/08/2025",
      "municipio": "Carmen de Areco",
      "url": "https://sibom.slyt.gba.gob.ar/bulletins/14250/contents/2333659",
      "contenido": "Sistema de Boletín Oficial Municipal | Buenos Aires Provincia\nINICIO\nACERCA DEL SIBOM\nBOLETINES\nMUNICIPIOS\nADMINISTRACION\nSistema de Boletines Oficiales Municipales (SIBOM)\nSistema de Boletines Oficiales Municipales (SIBOM)\nSistema de Boletines Oficiales Municipales (SIBOM)\nSistema de Boletines Oficiales Municipales (SIBOM)\nSistema de Boletines Oficiales Municipales (SIBOM)\nBoletines/Carmen de Areco\nDecreto Nº1288\nDecreto Nº 1288\nPublicado en versión extractada\nCarmen de Areco, 11/08/2025\n:\nLa nota del Secretario de Gobierno solicitando la adquisición de un Tacógrafo DIGITA PRINTER RPM y SENSOR DE CARDAN, destinados a ser instalados en la combi AG103SF.; y;\nRedes Sociales\nContacto\nAutoridad de Aplicación\nSecretaría General\nSubsecretaría Legal y Técnica\nGuía Servicios\nPortal de trámites\nExpedientes\nSeguridad Vial\nARBA\nBoletín Oficial\nRegistro de las Personas\nContrataciones\nVer Todos\nPolíticas de privacidad\nUso Interno\nWebmail (gba.gob.ar)\nWebmail HORDE\nSistemas\nGDEBA\nPortal del Empleado\nMesa de Ayuda\nSIAPE",
      "tablas": [],
      "montos_extraidos": [],
      "metadata": {
        "longitud_caracteres": 1020,
        "tiene_tablas": false,
        "total_tablas": 0,
        "total_montos": 0
      }
    },
    {
      "id": "2333662",
      "tipo": "decreto",
      "numero": "1289",
      "titulo": "Decreto Nº 1289",
      "fecha": "Carmen de Areco, 11/08/2025",
      "municipio": "Carmen de Areco",
      "url": "https://sibom.slyt.gba.gob.ar/bulletins/14250/contents/2333662",
      "contenido": "Sistema de Boletín Oficial Municipal | Buenos Aires Provincia\nINICIO\nACERCA DEL SIBOM\nBOLETINES\nMUNICIPIOS\nADMINISTRACION\nSistema de Boletines Oficiales Municipales (SIBOM)\nSistema de Boletines Oficiales Municipales (SIBOM)\nSistema de Boletines Oficiales Municipales (SIBOM)\nSistema de Boletines Oficiales Municipales (SIBOM)\nSistema de Boletines Oficiales Municipales (SIBOM)\nBoletines/Carmen de Areco\nDecreto Nº1289\nDecreto Nº 1289\nPublicado en versión extractada\nCarmen de Areco, 11/08/2025\nLa nota de la Coordinadora de “Centro de Dia” solicitando la adquisición de un Tacógrafo DIGITA PRINTER RPM y SENSOR DE CARDAN, destinados a ser instalados en la combi AB133VJ.; y;  Adquiérase, a RELOJERIA RIO CUARTO  S.A.S, a través de contratación por compra directa, Art. 156º inc. 6º de la LOM, un Tacógrafo DIGITA PRINTER RPM y SENSOR DE CARDAN.-\nRedes Sociales\nContacto\nAutoridad de Aplicación\nSecretaría General\nSubsecretaría Legal y Técnica\nGuía Servicios\nPortal de trámites\nExpedientes\nSeguridad Vial\nARBA\nBoletín Oficial\nRegistro de las Personas\nContrataciones\nVer Todos\nPolíticas de privacidad\nUso Interno\nWebmail (gba.gob.ar)\nWebmail HORDE\nSistemas\nGDEBA\nPortal del Empleado\nMesa de Ayuda\nSIAPE",
      "tablas": [],
      "montos_extraidos": [],
      "metadata": {
        "longitud_caracteres": 1200,
        "tiene_tablas": false,
        "total_tablas": 0,
        "total_montos": 0
      }
    },
    {
      "id": "2333667",
      "tipo": "decreto",
      "numero": "1290",
      "titulo": "Decreto Nº 1290",
      "fecha": "Carmen de Areco, 11/08/2025",
      "municipio": "Carmen de Areco",
      "url": "https://sibom.slyt.gba.gob.ar/bulletins/14250/contents/2333667",
      "contenido": "Sistema de Boletín Oficial Municipal | Buenos Aires Provincia\nINICIO\nACERCA DEL SIBOM\nBOLETINES\nMUNICIPIOS\nADMINISTRACION\nSistema de Boletines Oficiales Municipales (SIBOM)\nSistema de Boletines Oficiales Municipales (SIBOM)\nSistema de Boletines Oficiales Municipales (SIBOM)\nSistema de Boletines Oficiales Municipales (SIBOM)\nSistema de Boletines Oficiales Municipales (SIBOM)\nBoletines/Carmen de Areco\nDecreto Nº1290\nDecreto Nº 1290\nPublicado en versión extractada\nCarmen de Areco, 11/08/2025\nDeclarase de\nINTERES MUNICIPAL\n, la inauguración del parador que en adelante será terminal de ómnibus en Ruta Nacional 7º, el próximo 14 de agosto de 2025 a las 11:30 hrs.\nRedes Sociales\nContacto\nAutoridad de Aplicación\nSecretaría General\nSubsecretaría Legal y Técnica\nGuía Servicios\nPortal de trámites\nExpedientes\nSeguridad Vial\nARBA\nBoletín Oficial\nRegistro de las Personas\nContrataciones\nVer Todos\nPolíticas de privacidad\nUso Interno\nWebmail (gba.gob.ar)\nWebmail HORDE\nSistemas\nGDEBA\nPortal del Empleado\nMesa de Ayuda\nSIAPE",
      "tablas": [],
      "montos_extraidos": [],
      "metadata": {
        "longitud_caracteres": 1020,
        "tiene_tablas": false,
        "total_tablas": 0,
        "total_montos": 0
      }
    },
    {
      "id": "2333671",
      "tipo": "decreto",
      "numero": "1291",
      "titulo": "Decreto Nº 1291",
      "fecha": "Carmen de Areco, 12/08/2025",
      "municipio": "Carmen de Areco",
      "url": "https://sibom.slyt.gba.gob.ar/bulletins/14250/contents/2333671",
      "contenido": "Sistema de Boletín Oficial Municipal | Buenos Aires Provincia\nINICIO\nACERCA DEL SIBOM\nBOLETINES\nMUNICIPIOS\nADMINISTRACION\nSistema de Boletines Oficiales Municipales (SIBOM)\nSistema de Boletines Oficiales Municipales (SIBOM)\nSistema de Boletines Oficiales Municipales (SIBOM)\nSistema de Boletines Oficiales Municipales (SIBOM)\nSistema de Boletines Oficiales Municipales (SIBOM)\nBoletines/Carmen de Areco\nDecreto Nº1291\nDecreto Nº 1291\nPublicado en versión extractada\nCarmen de Areco, 12/08/2025\nOtorgase un Subsidio de PESOS QUINIENTOS MIL ($500.000,00) a la\nASOCIACION ARGENTINO FUTBOL CLUB, DE CARMEN DE ARECO; EXP. ADM. N° 4021-01245-0-2025.-\nRedes Sociales\nContacto\nAutoridad de Aplicación\nSecretaría General\nSubsecretaría Legal y Técnica\nGuía Servicios\nPortal de trámites\nExpedientes\nSeguridad Vial\nARBA\nBoletín Oficial\nRegistro de las Personas\nContrataciones\nVer Todos\nPolíticas de privacidad\nUso Interno\nWebmail (gba.gob.ar)\nWebmail HORDE\nSistemas\nGDEBA\nPortal del Empleado\nMesa de Ayuda\nSIAPE",
      "tablas": [],
      "montos_extraidos": [
        {
          "municipio": "Areco",
          "boletin": "0",
          "fecha": "Carmen de Areco, 12/08/2025",
          "norma_tipo": "Decreto",
          "norma_numero": "1291",
          "articulo": "S/N",
          "concepto": "Otorgase un Subsidio de PESOS QUINIENTOS MIL ($500.000,00) a la",
          "monto": 500000.0,
          "moneda": "ARS",
          "texto_completo": "Boletín 0º | Areco | Decreto Nº1291 [ARTÍCULO S/N: $500.000,00]",
          "fuente_url": "https://sibom.slyt.gba.gob.ar/bulletins/14250/contents/2333671"
        }
      ],
      "metadata": {
        "longitud_caracteres": 999,
        "tiene_tablas": false,
        "total_tablas": 0,
        "total_montos": 1
      }
    },
    {
      "id": "2333677",
      "tipo": "decreto",
      "numero": "1292",
      "titulo": "Decreto Nº 1292",
      "fecha": "Carmen de Areco, 12/08/2025",
      "municipio": "Carmen de Areco",
      "url": "https://sibom.slyt.gba.gob.ar/bulletins/14250/contents/2333677",
      "contenido": "Sistema de Boletín Oficial Municipal | Buenos Aires Provincia\nINICIO\nACERCA DEL SIBOM\nBOLETINES\nMUNICIPIOS\nADMINISTRACION\nSistema de Boletines Oficiales Municipales (SIBOM)\nSistema de Boletines Oficiales Municipales (SIBOM)\nSistema de Boletines Oficiales Municipales (SIBOM)\nSistema de Boletines Oficiales Municipales (SIBOM)\nSistema de Boletines Oficiales Municipales (SIBOM)\nBoletines/Carmen de Areco\nDecreto Nº1292\nDecreto Nº 1292\nPublicado en versión extractada\nCarmen de Areco, 12/08/2025\nDeclárese de Interés Municipal la celebración de las fiestas Patronales de San Agustín de la localidad de Gouin, partido de Carmen de Areco, el día 31 de agosto del corriente año.\nRedes Sociales\nContacto\nAutoridad de Aplicación\nSecretaría General\nSubsecretaría Legal y Técnica\nGuía Servicios\nPortal de trámites\nExpedientes\nSeguridad Vial\nARBA\nBoletín Oficial\nRegistro de las Personas\nContrataciones\nVer Todos\nPolíticas de privacidad\nUso Interno\nWebmail (gba.gob.ar)\nWebmail HORDE\nSistemas\nGDEBA\nPortal del Empleado\nMesa de Ayuda\nSIAPE",
      "tablas": [],
      "montos_extraidos": [],
      "metadata": {
        "longitud_caracteres": 1028,
        "tiene_tablas": false,
        "total_tablas": 0,
        "total_montos": 0
      }
    },
    {
      "id": "2333700",
      "tipo": "decreto",
      "numero": "1293",
      "titulo": "Decreto Nº 1293",
      "fecha": "Carmen de Areco, 12/08/2025",
      "municipio": "Carmen de Areco",
      "url": "https://sibom.slyt.gba.gob.ar/bulletins/14250/contents/2333700",
      "contenido": "Sistema de Boletín Oficial Municipal | Buenos Aires Provincia\nINICIO\nACERCA DEL SIBOM\nBOLETINES\nMUNICIPIOS\nADMINISTRACION\nSistema de Boletines Oficiales Municipales (SIBOM)\nSistema de Boletines Oficiales Municipales (SIBOM)\nSistema de Boletines Oficiales Municipales (SIBOM)\nSistema de Boletines Oficiales Municipales (SIBOM)\nSistema de Boletines Oficiales Municipales (SIBOM)\nBoletines/Carmen de Areco\nDecreto Nº1293\nDecreto Nº 1293\nPublicado en versión extractada\nCarmen de Areco, 12/08/2025\nLa necesidad de mantener en óptimas condiciones el Cine Teatro “Italia” de nuestra localidad, y;  Contrátese, desde el 12 d agosto del 2025 al 22 de agosto de 2025,dado que el Municipio no cuenta en la planta con personal profesional afectado y/o dedicado a la tarea descripta en los vistos del presente, al Sr.\nRUBIO, GASPAR\nRedes Sociales\nContacto\nAutoridad de Aplicación\nSecretaría General\nSubsecretaría Legal y Técnica\nGuía Servicios\nPortal de trámites\nExpedientes\nSeguridad Vial\nARBA\nBoletín Oficial\nRegistro de las Personas\nContrataciones\nVer Todos\nPolíticas de privacidad\nUso Interno\nWebmail (gba.gob.ar)\nWebmail HORDE\nSistemas\nGDEBA\nPortal del Empleado\nMesa de Ayuda\nSIAPE",
      "tablas": [],
      "montos_extraidos": [],
      "metadata": {
        "longitud_caracteres": 1174,
        "tiene_tablas": false,
        "total_tablas": 0,
        "total_montos": 0
      }
    },
    {
      "id": "2333732",
      "tipo": "decreto",
      "numero": "1294",
      "titulo": "Decreto Nº 1294",
      "fecha": "Carmen de Areco, 12/08/2025",
      "municipio": "Carmen de Areco",
      "url": "https://sibom.slyt.gba.gob.ar/bulletins/14250/contents/2333732",
      "contenido": "Sistema de Boletín Oficial Municipal | Buenos Aires Provincia\nINICIO\nACERCA DEL SIBOM\nBOLETINES\nMUNICIPIOS\nADMINISTRACION\nSistema de Boletines Oficiales Municipales (SIBOM)\nSistema de Boletines Oficiales Municipales (SIBOM)\nSistema de Boletines Oficiales Municipales (SIBOM)\nSistema de Boletines Oficiales Municipales (SIBOM)\nSistema de Boletines Oficiales Municipales (SIBOM)\nBoletines/Carmen de Areco\nDecreto Nº1294\nDecreto Nº 1294\nPublicado en versión extractada\nCarmen de Areco, 12/08/2025\nLa solicitud presentada por la Sra.\nSPINELLI, WANDA GISELA\nRedes Sociales\nContacto\nAutoridad de Aplicación\nSecretaría General\nSubsecretaría Legal y Técnica\nGuía Servicios\nPortal de trámites\nExpedientes\nSeguridad Vial\nARBA\nBoletín Oficial\nRegistro de las Personas\nContrataciones\nVer Todos\nPolíticas de privacidad\nUso Interno\nWebmail (gba.gob.ar)\nWebmail HORDE\nSistemas\nGDEBA\nPortal del Empleado\nMesa de Ayuda\nSIAPE",
      "tablas": [],
      "montos_extraidos": [],
      "metadata": {
        "longitud_caracteres": 907,
        "tiene_tablas": false,
        "total_tablas": 0,
        "total_montos": 0
      }
    },
    {
      "id": "2333739",
      "tipo": "decreto",
      "numero": "1295",
      "titulo": "Decreto Nº 1295",
      "fecha": "Carmen de Areco, 12/08/2025",
      "municipio": "Carmen de Areco",
      "url": "https://sibom.slyt.gba.gob.ar/bulletins/14250/contents/2333739",
      "contenido": "Sistema de Boletín Oficial Municipal | Buenos Aires Provincia\nINICIO\nACERCA DEL SIBOM\nBOLETINES\nMUNICIPIOS\nADMINISTRACION\nSistema de Boletines Oficiales Municipales (SIBOM)\nSistema de Boletines Oficiales Municipales (SIBOM)\nSistema de Boletines Oficiales Municipales (SIBOM)\nSistema de Boletines Oficiales Municipales (SIBOM)\nSistema de Boletines Oficiales Municipales (SIBOM)\nBoletines/Carmen de Areco\nDecreto Nº1295\nDecreto Nº 1295\nPublicado en versión extractada\nCarmen de Areco, 12/08/2025\nEl expediente administrativo  N° 4021-01262-0-2025,  por medio de la cual la  SOCIEDAD DE FOMENTO DEL BARRIO MARIN ARECO solicita la inscripción como Entidad de Bien Público. Que dicha entidad posee, Acta constitutiva , Estatuto y designación de autoridades.-  Inscríbase a la SOCIEDAD DE FOMENTO DEL BARRIO MARIN al REGISTRO DE ENTIDADES DE BIEN PUBLICO de esta Municipalidad con todos los derechos y deberes que ello implica dicha asociación\nRedes Sociales\nContacto\nAutoridad de Aplicación\nSecretaría General\nSubsecretaría Legal y Técnica\nGuía Servicios\nPortal de trámites\nExpedientes\nSeguridad Vial\nARBA\nBoletín Oficial\nRegistro de las Personas\nContrataciones\nVer Todos\nPolíticas de privacidad\nUso Interno\nWebmail (gba.gob.ar)\nWebmail HORDE\nSistemas\nGDEBA\nPortal del Empleado\nMesa de Ayuda\nSIAPE",
      "tablas": [],
      "montos_extraidos": [],
      "metadata": {
        "longitud_caracteres": 1292,
        "tiene_tablas": false,
        "total_tablas": 0,
        "total_montos": 0
      }
    },
    {
      "id": "2333741",
      "tipo": "decreto",
      "numero": "1296",
      "titulo": "Decreto Nº 1296",
      "fecha": "Carmen de Areco, 13/08/2024",
      "municipio": "Carmen de Areco",
      "url": "https://sibom.slyt.gba.gob.ar/bulletins/14250/contents/2333741",
      "contenido": "Sistema de Boletín Oficial Municipal | Buenos Aires Provincia\nINICIO\nACERCA DEL SIBOM\nBOLETINES\nMUNICIPIOS\nADMINISTRACION\nSistema de Boletines Oficiales Municipales (SIBOM)\nSistema de Boletines Oficiales Municipales (SIBOM)\nSistema de Boletines Oficiales Municipales (SIBOM)\nSistema de Boletines Oficiales Municipales (SIBOM)\nSistema de Boletines Oficiales Municipales (SIBOM)\nBoletines/Carmen de Areco\nDecreto Nº1296\nDecreto Nº 1296\nPublicado en versión extractada\nCarmen de Areco, 13/08/2024\nDeclarase de INTERES MUNICIPAL, la “CARRERA DE CUPECITAS” de la ACTC (Asociación de Cupecitas del Turismo Carretera) a realizarse los días 13 y 14 de septiembre, haciendo largada desde el Balneario Municipal\nRedes Sociales\nContacto\nAutoridad de Aplicación\nSecretaría General\nSubsecretaría Legal y Técnica\nGuía Servicios\nPortal de trámites\nExpedientes\nSeguridad Vial\nARBA\nBoletín Oficial\nRegistro de las Personas\nContrataciones\nVer Todos\nPolíticas de privacidad\nUso Interno\nWebmail (gba.gob.ar)\nWebmail HORDE\nSistemas\nGDEBA\nPortal del Empleado\nMesa de Ayuda\nSIAPE",
      "tablas": [],
      "montos_extraidos": [],
      "metadata": {
        "longitud_caracteres": 1056,
        "tiene_tablas": false,
        "total_tablas": 0,
        "total_montos": 0
      }
    },
    {
      "id": "2333785",
      "tipo": "decreto",
      "numero": "1297",
      "titulo": "Decreto Nº 1297",
      "fecha": "Carmen de Areco, 13/08/2025",
      "municipio": "Carmen de Areco",
      "url": "https://sibom.slyt.gba.gob.ar/bulletins/14250/contents/2333785",
      "contenido": "Sistema de Boletín Oficial Municipal | Buenos Aires Provincia\nINICIO\nACERCA DEL SIBOM\nBOLETINES\nMUNICIPIOS\nADMINISTRACION\nSistema de Boletines Oficiales Municipales (SIBOM)\nSistema de Boletines Oficiales Municipales (SIBOM)\nSistema de Boletines Oficiales Municipales (SIBOM)\nSistema de Boletines Oficiales Municipales (SIBOM)\nSistema de Boletines Oficiales Municipales (SIBOM)\nBoletines/Carmen de Areco\nDecreto Nº1297\nDecreto Nº 1297\nPublicado en versión extractada\nCarmen de Areco, 13/08/2025\nEl decreto N° 1014/2025 Contrato CRIVELLI, ALICIA CRISTINA; y; Corríjase el numero de decreto 1014/2024  Contrato CRIVELLI, ALICIA CRISTINA a decreto Nº 1015/2025.-\nRedes Sociales\nContacto\nAutoridad de Aplicación\nSecretaría General\nSubsecretaría Legal y Técnica\nGuía Servicios\nPortal de trámites\nExpedientes\nSeguridad Vial\nARBA\nBoletín Oficial\nRegistro de las Personas\nContrataciones\nVer Todos\nPolíticas de privacidad\nUso Interno\nWebmail (gba.gob.ar)\nWebmail HORDE\nSistemas\nGDEBA\nPortal del Empleado\nMesa de Ayuda\nSIAPE",
      "tablas": [],
      "montos_extraidos": [],
      "metadata": {
        "longitud_caracteres": 1013,
        "tiene_tablas": false,
        "total_tablas": 0,
        "total_montos": 0
      }
    },
    {
      "id": "2334103",
      "tipo": "decreto",
      "numero": "1298",
      "titulo": "Decreto Nº 1298",
      "fecha": "Carmen de Areco, 13/08/2025",
      "municipio": "Carmen de Areco",
      "url": "https://sibom.slyt.gba.gob.ar/bulletins/14250/contents/2334103",
      "contenido": "Sistema de Boletín Oficial Municipal | Buenos Aires Provincia\nINICIO\nACERCA DEL SIBOM\nBOLETINES\nMUNICIPIOS\nADMINISTRACION\nSistema de Boletines Oficiales Municipales (SIBOM)\nSistema de Boletines Oficiales Municipales (SIBOM)\nSistema de Boletines Oficiales Municipales (SIBOM)\nSistema de Boletines Oficiales Municipales (SIBOM)\nSistema de Boletines Oficiales Municipales (SIBOM)\nBoletines/Carmen de Areco\nDecreto Nº1298\nDecreto Nº 1298\nPublicado en versión extractada\nCarmen de Areco, 13/08/2025\nDeclarase de INTERES MUNICIPAL, la actividad territorial de la Coordinación de Mujeres y Diversidades\n“RED CON VOS EN LA CANCHA”,\na realizarse los días sábados de cada mes, desde el 13 de agosto al 10 de noviembre del corriente año, en el estadio “Malvinas Argentinas”.\nRedes Sociales\nContacto\nAutoridad de Aplicación\nSecretaría General\nSubsecretaría Legal y Técnica\nGuía Servicios\nPortal de trámites\nExpedientes\nSeguridad Vial\nARBA\nBoletín Oficial\nRegistro de las Personas\nContrataciones\nVer Todos\nPolíticas de privacidad\nUso Interno\nWebmail (gba.gob.ar)\nWebmail HORDE\nSistemas\nGDEBA\nPortal del Empleado\nMesa de Ayuda\nSIAPE",
      "tablas": [],
      "montos_extraidos": [],
      "metadata": {
        "longitud_caracteres": 1118,
        "tiene_tablas": false,
        "total_tablas": 0,
        "total_montos": 0
      }
    },
    {
      "id": "2334105",
      "tipo": "decreto",
      "numero": "1299",
      "titulo": "Decreto Nº 1299",
      "fecha": "Carmen de Areco, 13/08/2025",
      "municipio": "Carmen de Areco",
      "url": "https://sibom.slyt.gba.gob.ar/bulletins/14250/contents/2334105",
      "contenido": "Sistema de Boletín Oficial Municipal | Buenos Aires Provincia\nINICIO\nACERCA DEL SIBOM\nBOLETINES\nMUNICIPIOS\nADMINISTRACION\nSistema de Boletines Oficiales Municipales (SIBOM)\nSistema de Boletines Oficiales Municipales (SIBOM)\nSistema de Boletines Oficiales Municipales (SIBOM)\nSistema de Boletines Oficiales Municipales (SIBOM)\nSistema de Boletines Oficiales Municipales (SIBOM)\nBoletines/Carmen de Areco\nDecreto Nº1299\nDecreto Nº 1299\nPublicado en versión extractada\nCarmen de Areco, 13/08/2025\nLa solicitud presentada por la Sra.\nCASCO, BRENDA GISELA\nRedes Sociales\nContacto\nAutoridad de Aplicación\nSecretaría General\nSubsecretaría Legal y Técnica\nGuía Servicios\nPortal de trámites\nExpedientes\nSeguridad Vial\nARBA\nBoletín Oficial\nRegistro de las Personas\nContrataciones\nVer Todos\nPolíticas de privacidad\nUso Interno\nWebmail (gba.gob.ar)\nWebmail HORDE\nSistemas\nGDEBA\nPortal del Empleado\nMesa de Ayuda\nSIAPE",
      "tablas": [],
      "montos_extraidos": [],
      "metadata": {
        "longitud_caracteres": 905,
        "tiene_tablas": false,
        "total_tablas": 0,
        "total_montos": 0
      }
    },
    {
      "id": "2334110",
      "tipo": "decreto",
      "numero": "1300",
      "titulo": "Decreto Nº 1300",
      "fecha": "Carmen de Areco, 13/08/2025",
      "municipio": "Carmen de Areco",
      "url": "https://sibom.slyt.gba.gob.ar/bulletins/14250/contents/2334110",
      "contenido": "Sistema de Boletín Oficial Municipal | Buenos Aires Provincia\nINICIO\nACERCA DEL SIBOM\nBOLETINES\nMUNICIPIOS\nADMINISTRACION\nSistema de Boletines Oficiales Municipales (SIBOM)\nSistema de Boletines Oficiales Municipales (SIBOM)\nSistema de Boletines Oficiales Municipales (SIBOM)\nSistema de Boletines Oficiales Municipales (SIBOM)\nSistema de Boletines Oficiales Municipales (SIBOM)\nBoletines/Carmen de Areco\nDecreto Nº1300\nDecreto Nº 1300\nPublicado en versión extractada\nCarmen de Areco, 13/08/2025\nLa solicitud presentada por la Sra.\nMARINO, ROCIO CRISTAL\nRedes Sociales\nContacto\nAutoridad de Aplicación\nSecretaría General\nSubsecretaría Legal y Técnica\nGuía Servicios\nPortal de trámites\nExpedientes\nSeguridad Vial\nARBA\nBoletín Oficial\nRegistro de las Personas\nContrataciones\nVer Todos\nPolíticas de privacidad\nUso Interno\nWebmail (gba.gob.ar)\nWebmail HORDE\nSistemas\nGDEBA\nPortal del Empleado\nMesa de Ayuda\nSIAPE",
      "tablas": [],
      "montos_extraidos": [],
      "metadata": {
        "longitud_caracteres": 906,
        "tiene_tablas": false,
        "total_tablas": 0,
        "total_montos": 0
      }
    },
    {
      "id": "2334111",
      "tipo": "decreto",
      "numero": "1301",
      "titulo": "Decreto Nº 1301",
      "fecha": "Carmen de Areco, 13/08/2025",
      "municipio": "Carmen de Areco",
      "url": "https://sibom.slyt.gba.gob.ar/bulletins/14250/contents/2334111",
      "contenido": "Sistema de Boletín Oficial Municipal | Buenos Aires Provincia\nINICIO\nACERCA DEL SIBOM\nBOLETINES\nMUNICIPIOS\nADMINISTRACION\nSistema de Boletines Oficiales Municipales (SIBOM)\nSistema de Boletines Oficiales Municipales (SIBOM)\nSistema de Boletines Oficiales Municipales (SIBOM)\nSistema de Boletines Oficiales Municipales (SIBOM)\nSistema de Boletines Oficiales Municipales (SIBOM)\nBoletines/Carmen de Areco\nDecreto Nº1301\nDecreto Nº 1301\nPublicado en versión extractada\nCarmen de Areco, 13/08/2025\nLa solicitud presentada por la Sra.\nBALCAZA, MARIA DEL CARMEN\nRedes Sociales\nContacto\nAutoridad de Aplicación\nSecretaría General\nSubsecretaría Legal y Técnica\nGuía Servicios\nPortal de trámites\nExpedientes\nSeguridad Vial\nARBA\nBoletín Oficial\nRegistro de las Personas\nContrataciones\nVer Todos\nPolíticas de privacidad\nUso Interno\nWebmail (gba.gob.ar)\nWebmail HORDE\nSistemas\nGDEBA\nPortal del Empleado\nMesa de Ayuda\nSIAPE",
      "tablas": [],
      "montos_extraidos": [],
      "metadata": {
        "longitud_caracteres": 910,
        "tiene_tablas": false,
        "total_tablas": 0,
        "total_montos": 0
      }
    },
    {
      "id": "2334113",
      "tipo": "decreto",
      "numero": "1302",
      "titulo": "Decreto Nº 1302",
      "fecha": "Carmen de Areco, 13/08/2025",
      "municipio": "Carmen de Areco",
      "url": "https://sibom.slyt.gba.gob.ar/bulletins/14250/contents/2334113",
      "contenido": "Sistema de Boletín Oficial Municipal | Buenos Aires Provincia\nINICIO\nACERCA DEL SIBOM\nBOLETINES\nMUNICIPIOS\nADMINISTRACION\nSistema de Boletines Oficiales Municipales (SIBOM)\nSistema de Boletines Oficiales Municipales (SIBOM)\nSistema de Boletines Oficiales Municipales (SIBOM)\nSistema de Boletines Oficiales Municipales (SIBOM)\nSistema de Boletines Oficiales Municipales (SIBOM)\nBoletines/Carmen de Areco\nDecreto Nº1302\nDecreto Nº 1302\nPublicado en versión extractada\nCarmen de Areco, 13/08/2025\nLa solicitud presentada por la Sra.\nFARIAS, ERICA IRENE\nRedes Sociales\nContacto\nAutoridad de Aplicación\nSecretaría General\nSubsecretaría Legal y Técnica\nGuía Servicios\nPortal de trámites\nExpedientes\nSeguridad Vial\nARBA\nBoletín Oficial\nRegistro de las Personas\nContrataciones\nVer Todos\nPolíticas de privacidad\nUso Interno\nWebmail (gba.gob.ar)\nWebmail HORDE\nSistemas\nGDEBA\nPortal del Empleado\nMesa de Ayuda\nSIAPE",
      "tablas": [],
      "montos_extraidos": [],
      "metadata": {
        "longitud_caracteres": 904,
        "tiene_tablas": false,
        "total_tablas": 0,
        "total_montos": 0
      }
    },
    {
      "id": "2334118",
      "tipo": "decreto",
      "numero": "1303",
      "titulo": "Decreto Nº 1303",
      "fecha": "Carmen de Areco, 13/08/2025",
      "municipio": "Carmen de Areco",
      "url": "https://sibom.slyt.gba.gob.ar/bulletins/14250/contents/2334118",
      "contenido": "Sistema de Boletín Oficial Municipal | Buenos Aires Provincia\nINICIO\nACERCA DEL SIBOM\nBOLETINES\nMUNICIPIOS\nADMINISTRACION\nSistema de Boletines Oficiales Municipales (SIBOM)\nSistema de Boletines Oficiales Municipales (SIBOM)\nSistema de Boletines Oficiales Municipales (SIBOM)\nSistema de Boletines Oficiales Municipales (SIBOM)\nSistema de Boletines Oficiales Municipales (SIBOM)\nBoletines/Carmen de Areco\nDecreto Nº1303\nDecreto Nº 1303\nPublicado en versión extractada\nCarmen de Areco, 13/08/2025\nLa solicitud presentada por la Sra.\nGIMENEZ\nVIDELA, GERALDINE\nRedes Sociales\nContacto\nAutoridad de Aplicación\nSecretaría General\nSubsecretaría Legal y Técnica\nGuía Servicios\nPortal de trámites\nExpedientes\nSeguridad Vial\nARBA\nBoletín Oficial\nRegistro de las Personas\nContrataciones\nVer Todos\nPolíticas de privacidad\nUso Interno\nWebmail (gba.gob.ar)\nWebmail HORDE\nSistemas\nGDEBA\nPortal del Empleado\nMesa de Ayuda\nSIAPE",
      "tablas": [],
      "montos_extraidos": [],
      "metadata": {
        "longitud_caracteres": 910,
        "tiene_tablas": false,
        "total_tablas": 0,
        "total_montos": 0
      }
    },
    {
      "id": "2334208",
      "tipo": "decreto",
      "numero": "1304",
      "titulo": "Decreto Nº 1304",
      "fecha": "Carmen de Areco, 13/08/2025",
      "municipio": "Carmen de Areco",
      "url": "https://sibom.slyt.gba.gob.ar/bulletins/14250/contents/2334208",
      "contenido": "Sistema de Boletín Oficial Municipal | Buenos Aires Provincia\nINICIO\nACERCA DEL SIBOM\nBOLETINES\nMUNICIPIOS\nADMINISTRACION\nSistema de Boletines Oficiales Municipales (SIBOM)\nSistema de Boletines Oficiales Municipales (SIBOM)\nSistema de Boletines Oficiales Municipales (SIBOM)\nSistema de Boletines Oficiales Municipales (SIBOM)\nSistema de Boletines Oficiales Municipales (SIBOM)\nBoletines/Carmen de Areco\nDecreto Nº1304\nDecreto Nº 1304\nPublicado en versión extractada\nCarmen de Areco, 13/08/2025\nLa solicitud presentada por la Sra.\nAGUILAR, MARIA TERESA\nRedes Sociales\nContacto\nAutoridad de Aplicación\nSecretaría General\nSubsecretaría Legal y Técnica\nGuía Servicios\nPortal de trámites\nExpedientes\nSeguridad Vial\nARBA\nBoletín Oficial\nRegistro de las Personas\nContrataciones\nVer Todos\nPolíticas de privacidad\nUso Interno\nWebmail (gba.gob.ar)\nWebmail HORDE\nSistemas\nGDEBA\nPortal del Empleado\nMesa de Ayuda\nSIAPE",
      "tablas": [],
      "montos_extraidos": [],
      "metadata": {
        "longitud_caracteres": 906,
        "tiene_tablas": false,
        "total_tablas": 0,
        "total_montos": 0
      }
    },
    {
      "id": "2334211",
      "tipo": "decreto",
      "numero": "1305",
      "titulo": "Decreto Nº 1305",
      "fecha": "Carmen de Areco, 13/08/2025",
      "municipio": "Carmen de Areco",
      "url": "https://sibom.slyt.gba.gob.ar/bulletins/14250/contents/2334211",
      "contenido": "Sistema de Boletín Oficial Municipal | Buenos Aires Provincia\nINICIO\nACERCA DEL SIBOM\nBOLETINES\nMUNICIPIOS\nADMINISTRACION\nSistema de Boletines Oficiales Municipales (SIBOM)\nSistema de Boletines Oficiales Municipales (SIBOM)\nSistema de Boletines Oficiales Municipales (SIBOM)\nSistema de Boletines Oficiales Municipales (SIBOM)\nSistema de Boletines Oficiales Municipales (SIBOM)\nBoletines/Carmen de Areco\nDecreto Nº1305\nDecreto Nº 1305\nPublicado en versión extractada\nCarmen de Areco, 13/08/2025\nLa solicitud presentada por la Sra.\nCARDENAS, YAMILA ESTEFANIA\nRedes Sociales\nContacto\nAutoridad de Aplicación\nSecretaría General\nSubsecretaría Legal y Técnica\nGuía Servicios\nPortal de trámites\nExpedientes\nSeguridad Vial\nARBA\nBoletín Oficial\nRegistro de las Personas\nContrataciones\nVer Todos\nPolíticas de privacidad\nUso Interno\nWebmail (gba.gob.ar)\nWebmail HORDE\nSistemas\nGDEBA\nPortal del Empleado\nMesa de Ayuda\nSIAPE",
      "tablas": [],
      "montos_extraidos": [],
      "metadata": {
        "longitud_caracteres": 911,
        "tiene_tablas": false,
        "total_tablas": 0,
        "total_montos": 0
      }
    },
    {
      "id": "2334212",
      "tipo": "decreto",
      "numero": "1306",
      "titulo": "Decreto Nº 1306",
      "fecha": "Carmen de Areco, 13/08/2025",
      "municipio": "Carmen de Areco",
      "url": "https://sibom.slyt.gba.gob.ar/bulletins/14250/contents/2334212",
      "contenido": "Sistema de Boletín Oficial Municipal | Buenos Aires Provincia\nINICIO\nACERCA DEL SIBOM\nBOLETINES\nMUNICIPIOS\nADMINISTRACION\nSistema de Boletines Oficiales Municipales (SIBOM)\nSistema de Boletines Oficiales Municipales (SIBOM)\nSistema de Boletines Oficiales Municipales (SIBOM)\nSistema de Boletines Oficiales Municipales (SIBOM)\nSistema de Boletines Oficiales Municipales (SIBOM)\nBoletines/Carmen de Areco\nDecreto Nº1306\nDecreto Nº 1306\nPublicado en versión extractada\nCarmen de Areco, 13/08/2025\nLa solicitud presentada por la Sra.\nSEGOVIA, CRISTINA ELISABET\nRedes Sociales\nContacto\nAutoridad de Aplicación\nSecretaría General\nSubsecretaría Legal y Técnica\nGuía Servicios\nPortal de trámites\nExpedientes\nSeguridad Vial\nARBA\nBoletín Oficial\nRegistro de las Personas\nContrataciones\nVer Todos\nPolíticas de privacidad\nUso Interno\nWebmail (gba.gob.ar)\nWebmail HORDE\nSistemas\nGDEBA\nPortal del Empleado\nMesa de Ayuda\nSIAPE",
      "tablas": [],
      "montos_extraidos": [],
      "metadata": {
        "longitud_caracteres": 911,
        "tiene_tablas": false,
        "total_tablas": 0,
        "total_montos": 0
      }
    },
    {
      "id": "2334214",
      "tipo": "decreto",
      "numero": "1307",
      "titulo": "Decreto Nº 1307",
      "fecha": "Carmen de Areco, 13/08/2025",
      "municipio": "Carmen de Areco",
      "url": "https://sibom.slyt.gba.gob.ar/bulletins/14250/contents/2334214",
      "contenido": "Sistema de Boletín Oficial Municipal | Buenos Aires Provincia\nINICIO\nACERCA DEL SIBOM\nBOLETINES\nMUNICIPIOS\nADMINISTRACION\nSistema de Boletines Oficiales Municipales (SIBOM)\nSistema de Boletines Oficiales Municipales (SIBOM)\nSistema de Boletines Oficiales Municipales (SIBOM)\nSistema de Boletines Oficiales Municipales (SIBOM)\nSistema de Boletines Oficiales Municipales (SIBOM)\nBoletines/Carmen de Areco\nDecreto Nº1307\nDecreto Nº 1307\nPublicado en versión extractada\nCarmen de Areco, 13/08/2025\nLa solicitud presentada por la Sra.\nFERNANDEZ, VANESA\nRedes Sociales\nContacto\nAutoridad de Aplicación\nSecretaría General\nSubsecretaría Legal y Técnica\nGuía Servicios\nPortal de trámites\nExpedientes\nSeguridad Vial\nARBA\nBoletín Oficial\nRegistro de las Personas\nContrataciones\nVer Todos\nPolíticas de privacidad\nUso Interno\nWebmail (gba.gob.ar)\nWebmail HORDE\nSistemas\nGDEBA\nPortal del Empleado\nMesa de Ayuda\nSIAPE",
      "tablas": [],
      "montos_extraidos": [],
      "metadata": {
        "longitud_caracteres": 902,
        "tiene_tablas": false,
        "total_tablas": 0,
        "total_montos": 0
      }
    },
    {
      "id": "2334216",
      "tipo": "decreto",
      "numero": "1308",
      "titulo": "Decreto Nº 1308",
      "fecha": "Carmen de Areco, 13/08/2025",
      "municipio": "Carmen de Areco",
      "url": "https://sibom.slyt.gba.gob.ar/bulletins/14250/contents/2334216",
      "contenido": "Sistema de Boletín Oficial Municipal | Buenos Aires Provincia\nINICIO\nACERCA DEL SIBOM\nBOLETINES\nMUNICIPIOS\nADMINISTRACION\nSistema de Boletines Oficiales Municipales (SIBOM)\nSistema de Boletines Oficiales Municipales (SIBOM)\nSistema de Boletines Oficiales Municipales (SIBOM)\nSistema de Boletines Oficiales Municipales (SIBOM)\nSistema de Boletines Oficiales Municipales (SIBOM)\nBoletines/Carmen de Areco\nDecreto Nº1308\nDecreto Nº 1308\nPublicado en versión extractada\nCarmen de Areco, 13/08/2025\nLa solicitud presentada por la Sra.\nESPOSITO, MARIA DEL CARMEN\nRedes Sociales\nContacto\nAutoridad de Aplicación\nSecretaría General\nSubsecretaría Legal y Técnica\nGuía Servicios\nPortal de trámites\nExpedientes\nSeguridad Vial\nARBA\nBoletín Oficial\nRegistro de las Personas\nContrataciones\nVer Todos\nPolíticas de privacidad\nUso Interno\nWebmail (gba.gob.ar)\nWebmail HORDE\nSistemas\nGDEBA\nPortal del Empleado\nMesa de Ayuda\nSIAPE",
      "tablas": [],
      "montos_extraidos": [],
      "metadata": {
        "longitud_caracteres": 911,
        "tiene_tablas": false,
        "total_tablas": 0,
        "total_montos": 0
      }
    },
    {
      "id": "2334219",
      "tipo": "decreto",
      "numero": "1309",
      "titulo": "Decreto Nº 1309",
      "fecha": "Carmen de Areco, 13/08/2025",
      "municipio": "Carmen de Areco",
      "url": "https://sibom.slyt.gba.gob.ar/bulletins/14250/contents/2334219",
      "contenido": "Sistema de Boletín Oficial Municipal | Buenos Aires Provincia\nINICIO\nACERCA DEL SIBOM\nBOLETINES\nMUNICIPIOS\nADMINISTRACION\nSistema de Boletines Oficiales Municipales (SIBOM)\nSistema de Boletines Oficiales Municipales (SIBOM)\nSistema de Boletines Oficiales Municipales (SIBOM)\nSistema de Boletines Oficiales Municipales (SIBOM)\nSistema de Boletines Oficiales Municipales (SIBOM)\nBoletines/Carmen de Areco\nDecreto Nº1309\nDecreto Nº 1309\nPublicado en versión extractada\nCarmen de Areco, 13/08/2025\nLa solicitud presentada por el Sr.\nMALDONADO, PABLO IGNACIO\nRedes Sociales\nContacto\nAutoridad de Aplicación\nSecretaría General\nSubsecretaría Legal y Técnica\nGuía Servicios\nPortal de trámites\nExpedientes\nSeguridad Vial\nARBA\nBoletín Oficial\nRegistro de las Personas\nContrataciones\nVer Todos\nPolíticas de privacidad\nUso Interno\nWebmail (gba.gob.ar)\nWebmail HORDE\nSistemas\nGDEBA\nPortal del Empleado\nMesa de Ayuda\nSIAPE",
      "tablas": [],
      "montos_extraidos": [],
      "metadata": {
        "longitud_caracteres": 908,
        "tiene_tablas": false,
        "total_tablas": 0,
        "total_montos": 0
      }
    },
    {
      "id": "2334220",
      "tipo": "decreto",
      "numero": "1310",
      "titulo": "Decreto Nº 1310",
      "fecha": "Carmen de Areco, 13/08/2025",
      "municipio": "Carmen de Areco",
      "url": "https://sibom.slyt.gba.gob.ar/bulletins/14250/contents/2334220",
      "contenido": "Sistema de Boletín Oficial Municipal | Buenos Aires Provincia\nINICIO\nACERCA DEL SIBOM\nBOLETINES\nMUNICIPIOS\nADMINISTRACION\nSistema de Boletines Oficiales Municipales (SIBOM)\nSistema de Boletines Oficiales Municipales (SIBOM)\nSistema de Boletines Oficiales Municipales (SIBOM)\nSistema de Boletines Oficiales Municipales (SIBOM)\nSistema de Boletines Oficiales Municipales (SIBOM)\nBoletines/Carmen de Areco\nDecreto Nº1310\nDecreto Nº 1310\nPublicado en versión extractada\nCarmen de Areco, 13/08/2025\nLo dispuesto por el art. 130 bis de la Ley Orgánica de las Municipalidades, introducido por la ley 11.838.-\nCompensase las deudas fiscales de los contribuyentes con las acreencias que a su vez tales contribuyentes tienen para percibir de este Municipio, hasta la suma menor, según el detalle que consta en el ANEXO I\nRedes Sociales\nContacto\nAutoridad de Aplicación\nSecretaría General\nSubsecretaría Legal y Técnica\nGuía Servicios\nPortal de trámites\nExpedientes\nSeguridad Vial\nARBA\nBoletín Oficial\nRegistro de las Personas\nContrataciones\nVer Todos\nPolíticas de privacidad\nUso Interno\nWebmail (gba.gob.ar)\nWebmail HORDE\nSistemas\nGDEBA\nPortal del Empleado\nMesa de Ayuda\nSIAPE",
      "tablas": [],
      "montos_extraidos": [],
      "metadata": {
        "longitud_caracteres": 1165,
        "tiene_tablas": false,
        "total_tablas": 0,
        "total_montos": 0
      }
    },
    {
      "id": "2334224",
      "tipo": "decreto",
      "numero": "1311",
      "titulo": "Decreto Nº 1311",
      "fecha": "Carmen de Areco, 14/08/2025",
      "municipio": "Carmen de Areco",
      "url": "https://sibom.slyt.gba.gob.ar/bulletins/14250/contents/2334224",
      "contenido": "Sistema de Boletín Oficial Municipal | Buenos Aires Provincia\nINICIO\nACERCA DEL SIBOM\nBOLETINES\nMUNICIPIOS\nADMINISTRACION\nSistema de Boletines Oficiales Municipales (SIBOM)\nSistema de Boletines Oficiales Municipales (SIBOM)\nSistema de Boletines Oficiales Municipales (SIBOM)\nSistema de Boletines Oficiales Municipales (SIBOM)\nSistema de Boletines Oficiales Municipales (SIBOM)\nBoletines/Carmen de Areco\nDecreto Nº1311\nDecreto Nº 1311\nPublicado en versión extractada\nCarmen de Areco, 14/08/2025\nOtorgase un Subsidio de pesos TRESCIENTOS SESENTA MIL ($360.000,00) al ASOCIACIÓN COOPERADORA CENTRO DE CAPACITACIÓN, INFORMACIÓN E INVESTIGACIÓN EDUCATIVA (CIIE) de Carmen de Areco  - Exp. Adm. N° 4021- 01286-0-2025\nRedes Sociales\nContacto\nAutoridad de Aplicación\nSecretaría General\nSubsecretaría Legal y Técnica\nGuía Servicios\nPortal de trámites\nExpedientes\nSeguridad Vial\nARBA\nBoletín Oficial\nRegistro de las Personas\nContrataciones\nVer Todos\nPolíticas de privacidad\nUso Interno\nWebmail (gba.gob.ar)\nWebmail HORDE\nSistemas\nGDEBA\nPortal del Empleado\nMesa de Ayuda\nSIAPE",
      "tablas": [],
      "montos_extraidos": [
        {
          "municipio": "Areco",
          "boletin": "0",
          "fecha": "Carmen de Areco, 14/08/2025",
          "norma_tipo": "Decreto",
          "norma_numero": "1311",
          "articulo": "S/N",
          "concepto": "Otorgase un Subsidio de pesos TRESCIENTOS SESENTA MIL ($360.000,00) al ASOCIACIÓN COOPERADORA CENTRO DE CAPACITACIÓN, IN",
          "monto": 360000.0,
          "moneda": "ARS",
          "texto_completo": "Boletín 0º | Areco | Decreto Nº1311 [ARTÍCULO S/N: $360.000,00]",
          "fuente_url": "https://sibom.slyt.gba.gob.ar/bulletins/14250/contents/2334224"
        }
      ],
      "metadata": {
        "longitud_caracteres": 1065,
        "tiene_tablas": false,
        "total_tablas": 0,
        "total_montos": 1
      }
    },
    {
      "id": "2334228",
      "tipo": "decreto",
      "numero": "1312",
      "titulo": "Decreto Nº 1312",
      "fecha": "Carmen de Areco, 14/08/2025",
      "municipio": "Carmen de Areco",
      "url": "https://sibom.slyt.gba.gob.ar/bulletins/14250/contents/2334228",
      "contenido": "Sistema de Boletín Oficial Municipal | Buenos Aires Provincia\nINICIO\nACERCA DEL SIBOM\nBOLETINES\nMUNICIPIOS\nADMINISTRACION\nSistema de Boletines Oficiales Municipales (SIBOM)\nSistema de Boletines Oficiales Municipales (SIBOM)\nSistema de Boletines Oficiales Municipales (SIBOM)\nSistema de Boletines Oficiales Municipales (SIBOM)\nSistema de Boletines Oficiales Municipales (SIBOM)\nBoletines/Carmen de Areco\nDecreto Nº1312\nDecreto Nº 1312\nPublicado en versión extractada\nCarmen de Areco, 14/08/2025\nLa celebración del “Mes de las niñeces”, en el cual se realizaran actividades por parte de la Dirección de Niñez y Adolescencia, desde el día 11 al 31 de Agosto del corriente; y; Contrátese, dado que el Municipio no cuenta en la planta con personal profesional afectado y/o dedicado a la tarea descripta en los vistos del presente, a la Sra.\nLANFRANCO, MURIEL SOLANGE,\npara efectuar el servicio de espectáculo infantil para el festival del día del niño, el día 17 de agosto del corriente en el predio de la Estación\nRedes Sociales\nContacto\nAutoridad de Aplicación\nSecretaría General\nSubsecretaría Legal y Técnica\nGuía Servicios\nPortal de trámites\nExpedientes\nSeguridad Vial\nARBA\nBoletín Oficial\nRegistro de las Personas\nContrataciones\nVer Todos\nPolíticas de privacidad\nUso Interno\nWebmail (gba.gob.ar)\nWebmail HORDE\nSistemas\nGDEBA\nPortal del Empleado\nMesa de Ayuda\nSIAPE",
      "tablas": [],
      "montos_extraidos": [],
      "metadata": {
        "longitud_caracteres": 1364,
        "tiene_tablas": false,
        "total_tablas": 0,
        "total_montos": 0
      }
    },
    {
      "id": "2334229",
      "tipo": "decreto",
      "numero": "1313",
      "titulo": "Decreto Nº 1313",
      "fecha": "Carmen de Areco, 14/08/2025",
      "municipio": "Carmen de Areco",
      "url": "https://sibom.slyt.gba.gob.ar/bulletins/14250/contents/2334229",
      "contenido": "Sistema de Boletín Oficial Municipal | Buenos Aires Provincia\nINICIO\nACERCA DEL SIBOM\nBOLETINES\nMUNICIPIOS\nADMINISTRACION\nSistema de Boletines Oficiales Municipales (SIBOM)\nSistema de Boletines Oficiales Municipales (SIBOM)\nSistema de Boletines Oficiales Municipales (SIBOM)\nSistema de Boletines Oficiales Municipales (SIBOM)\nSistema de Boletines Oficiales Municipales (SIBOM)\nBoletines/Carmen de Areco\nDecreto Nº1313\nDecreto Nº 1313\nPublicado en versión extractada\nCarmen de Areco, 14/08/2025\nDesígnese a la Sra.\nLUNA, PATRICIA ALEJANDRA,\na realizar las funciones como inspector de Transito, para efectuar las inspecciones correspondientes, desde el día 14 de agosto de 2025.\nRedes Sociales\nContacto\nAutoridad de Aplicación\nSecretaría General\nSubsecretaría Legal y Técnica\nGuía Servicios\nPortal de trámites\nExpedientes\nSeguridad Vial\nARBA\nBoletín Oficial\nRegistro de las Personas\nContrataciones\nVer Todos\nPolíticas de privacidad\nUso Interno\nWebmail (gba.gob.ar)\nWebmail HORDE\nSistemas\nGDEBA\nPortal del Empleado\nMesa de Ayuda\nSIAPE",
      "tablas": [],
      "montos_extraidos": [],
      "metadata": {
        "longitud_caracteres": 1031,
        "tiene_tablas": false,
        "total_tablas": 0,
        "total_montos": 0
      }
    },
    {
      "id": "2334232",
      "tipo": "decreto",
      "numero": "1314",
      "titulo": "Decreto Nº 1314",
      "fecha": "Carmen de Areco, 14/08/2025",
      "municipio": "Carmen de Areco",
      "url": "https://sibom.slyt.gba.gob.ar/bulletins/14250/contents/2334232",
      "contenido": "Sistema de Boletín Oficial Municipal | Buenos Aires Provincia\nINICIO\nACERCA DEL SIBOM\nBOLETINES\nMUNICIPIOS\nADMINISTRACION\nSistema de Boletines Oficiales Municipales (SIBOM)\nSistema de Boletines Oficiales Municipales (SIBOM)\nSistema de Boletines Oficiales Municipales (SIBOM)\nSistema de Boletines Oficiales Municipales (SIBOM)\nSistema de Boletines Oficiales Municipales (SIBOM)\nBoletines/Carmen de Areco\nDecreto Nº1314\nDecreto Nº 1314\nPublicado en versión extractada\nCarmen de Areco, 14/08/2025\nDesígnese a la Sra.\nSOSA, SOLEDAD NELIDA BEATRIZ,\na realizar las funciones como inspector de Transito, para efectuar las inspecciones correspondientes, desde el día 14 de agosto de 2025.\nRedes Sociales\nContacto\nAutoridad de Aplicación\nSecretaría General\nSubsecretaría Legal y Técnica\nGuía Servicios\nPortal de trámites\nExpedientes\nSeguridad Vial\nARBA\nBoletín Oficial\nRegistro de las Personas\nContrataciones\nVer Todos\nPolíticas de privacidad\nUso Interno\nWebmail (gba.gob.ar)\nWebmail HORDE\nSistemas\nGDEBA\nPortal del Empleado\nMesa de Ayuda\nSIAPE",
      "tablas": [],
      "montos_extraidos": [],
      "metadata": {
        "longitud_caracteres": 1035,
        "tiene_tablas": false,
        "total_tablas": 0,
        "total_montos": 0
      }
    },
    {
      "id": "2334246",
      "tipo": "decreto",
      "numero": "1315",
      "titulo": "Decreto Nº 1315",
      "fecha": "Carmen de Areco, 18/08/2025",
      "municipio": "Carmen de Areco",
      "url": "https://sibom.slyt.gba.gob.ar/bulletins/14250/contents/2334246",
      "contenido": "Sistema de Boletín Oficial Municipal | Buenos Aires Provincia\nINICIO\nACERCA DEL SIBOM\nBOLETINES\nMUNICIPIOS\nADMINISTRACION\nSistema de Boletines Oficiales Municipales (SIBOM)\nSistema de Boletines Oficiales Municipales (SIBOM)\nSistema de Boletines Oficiales Municipales (SIBOM)\nSistema de Boletines Oficiales Municipales (SIBOM)\nSistema de Boletines Oficiales Municipales (SIBOM)\nBoletines/Carmen de Areco\nDecreto Nº1315\nDecreto Nº 1315\nPublicado en versión extractada\nCarmen de Areco, 18/08/2025\nConceder la  licencia sin goce de haberes, desde el  día 18 de Agosto de 2025  y hasta el día 18 de Octubre de 2025, inclusive, al agente Municipal Sr.\nORSI, LUCIA FERNANDA\n,\nRedes Sociales\nContacto\nAutoridad de Aplicación\nSecretaría General\nSubsecretaría Legal y Técnica\nGuía Servicios\nPortal de trámites\nExpedientes\nSeguridad Vial\nARBA\nBoletín Oficial\nRegistro de las Personas\nContrataciones\nVer Todos\nPolíticas de privacidad\nUso Interno\nWebmail (gba.gob.ar)\nWebmail HORDE\nSistemas\nGDEBA\nPortal del Empleado\nMesa de Ayuda\nSIAPE",
      "tablas": [],
      "montos_extraidos": [],
      "metadata": {
        "longitud_caracteres": 1023,
        "tiene_tablas": false,
        "total_tablas": 0,
        "total_montos": 0
      }
    },
    {
      "id": "2334248",
      "tipo": "decreto",
      "numero": "1316",
      "titulo": "Decreto Nº 1316",
      "fecha": "Carmen de Areco, 18/08/2025",
      "municipio": "Carmen de Areco",
      "url": "https://sibom.slyt.gba.gob.ar/bulletins/14250/contents/2334248",
      "contenido": "Sistema de Boletín Oficial Municipal | Buenos Aires Provincia\nINICIO\nACERCA DEL SIBOM\nBOLETINES\nMUNICIPIOS\nADMINISTRACION\nSistema de Boletines Oficiales Municipales (SIBOM)\nSistema de Boletines Oficiales Municipales (SIBOM)\nSistema de Boletines Oficiales Municipales (SIBOM)\nSistema de Boletines Oficiales Municipales (SIBOM)\nSistema de Boletines Oficiales Municipales (SIBOM)\nBoletines/Carmen de Areco\nDecreto Nº1316\nDecreto Nº 1316\nPublicado en versión extractada\nCarmen de Areco, 18/08/2025\nLa solicitud presentada por la Sra.\nGARCIA, VERONICA ROCIO\nRedes Sociales\nContacto\nAutoridad de Aplicación\nSecretaría General\nSubsecretaría Legal y Técnica\nGuía Servicios\nPortal de trámites\nExpedientes\nSeguridad Vial\nARBA\nBoletín Oficial\nRegistro de las Personas\nContrataciones\nVer Todos\nPolíticas de privacidad\nUso Interno\nWebmail (gba.gob.ar)\nWebmail HORDE\nSistemas\nGDEBA\nPortal del Empleado\nMesa de Ayuda\nSIAPE",
      "tablas": [],
      "montos_extraidos": [],
      "metadata": {
        "longitud_caracteres": 907,
        "tiene_tablas": false,
        "total_tablas": 0,
        "total_montos": 0
      }
    },
    {
      "id": "2334250",
      "tipo": "decreto",
      "numero": "1317",
      "titulo": "Decreto Nº 1317",
      "fecha": "Carmen de Areco, 20/08/2025",
      "municipio": "Carmen de Areco",
      "url": "https://sibom.slyt.gba.gob.ar/bulletins/14250/contents/2334250",
      "contenido": "Sistema de Boletín Oficial Municipal | Buenos Aires Provincia\nINICIO\nACERCA DEL SIBOM\nBOLETINES\nMUNICIPIOS\nADMINISTRACION\nSistema de Boletines Oficiales Municipales (SIBOM)\nSistema de Boletines Oficiales Municipales (SIBOM)\nSistema de Boletines Oficiales Municipales (SIBOM)\nSistema de Boletines Oficiales Municipales (SIBOM)\nSistema de Boletines Oficiales Municipales (SIBOM)\nBoletines/Carmen de Areco\nDecreto Nº1317\nDecreto Nº 1317\nPublicado en versión extractada\nCarmen de Areco, 20/08/2025\nLo dispuesto por el art. 130 bis de la Ley Orgánica de las Municipalidades, introducido por la ley 11.838.-\nCompensase las deudas fiscales de los contribuyentes con las acreencias que a su vez tales contribuyentes tienen para percibir de este Municipio, hasta la suma menor, según el detalle que consta en el ANEXO\nRedes Sociales\nContacto\nAutoridad de Aplicación\nSecretaría General\nSubsecretaría Legal y Técnica\nGuía Servicios\nPortal de trámites\nExpedientes\nSeguridad Vial\nARBA\nBoletín Oficial\nRegistro de las Personas\nContrataciones\nVer Todos\nPolíticas de privacidad\nUso Interno\nWebmail (gba.gob.ar)\nWebmail HORDE\nSistemas\nGDEBA\nPortal del Empleado\nMesa de Ayuda\nSIAPE",
      "tablas": [],
      "montos_extraidos": [],
      "metadata": {
        "longitud_caracteres": 1163,
        "tiene_tablas": false,
        "total_tablas": 0,
        "total_montos": 0
      }
    },
    {
      "id": "2334253",
      "tipo": "decreto",
      "numero": "1318",
      "titulo": "Decreto Nº 1318",
      "fecha": "Carmen de Areco, 20/08/2025",
      "municipio": "Carmen de Areco",
      "url": "https://sibom.slyt.gba.gob.ar/bulletins/14250/contents/2334253",
      "contenido": "Sistema de Boletín Oficial Municipal | Buenos Aires Provincia\nINICIO\nACERCA DEL SIBOM\nBOLETINES\nMUNICIPIOS\nADMINISTRACION\nSistema de Boletines Oficiales Municipales (SIBOM)\nSistema de Boletines Oficiales Municipales (SIBOM)\nSistema de Boletines Oficiales Municipales (SIBOM)\nSistema de Boletines Oficiales Municipales (SIBOM)\nSistema de Boletines Oficiales Municipales (SIBOM)\nBoletines/Carmen de Areco\nDecreto Nº1318\nDecreto Nº 1318\nPublicado en versión extractada\nCarmen de Areco, 20/08/2025\ncredito de ayuda social\nRedes Sociales\nContacto\nAutoridad de Aplicación\nSecretaría General\nSubsecretaría Legal y Técnica\nGuía Servicios\nPortal de trámites\nExpedientes\nSeguridad Vial\nARBA\nBoletín Oficial\nRegistro de las Personas\nContrataciones\nVer Todos\nPolíticas de privacidad\nUso Interno\nWebmail (gba.gob.ar)\nWebmail HORDE\nSistemas\nGDEBA\nPortal del Empleado\nMesa de Ayuda\nSIAPE",
      "tablas": [],
      "montos_extraidos": [],
      "metadata": {
        "longitud_caracteres": 872,
        "tiene_tablas": false,
        "total_tablas": 0,
        "total_montos": 0
      }
    },
    {
      "id": "2334254",
      "tipo": "decreto",
      "numero": "1319",
      "titulo": "Decreto Nº 1319",
      "fecha": "Carmen de Areco, 20/08/2025",
      "municipio": "Carmen de Areco",
      "url": "https://sibom.slyt.gba.gob.ar/bulletins/14250/contents/2334254",
      "contenido": "Sistema de Boletín Oficial Municipal | Buenos Aires Provincia\nINICIO\nACERCA DEL SIBOM\nBOLETINES\nMUNICIPIOS\nADMINISTRACION\nSistema de Boletines Oficiales Municipales (SIBOM)\nSistema de Boletines Oficiales Municipales (SIBOM)\nSistema de Boletines Oficiales Municipales (SIBOM)\nSistema de Boletines Oficiales Municipales (SIBOM)\nSistema de Boletines Oficiales Municipales (SIBOM)\nBoletines/Carmen de Areco\nDecreto Nº1319\nDecreto Nº 1319\nPublicado en versión extractada\nCarmen de Areco, 20/08/2025\ncredito de ayuda social\nRedes Sociales\nContacto\nAutoridad de Aplicación\nSecretaría General\nSubsecretaría Legal y Técnica\nGuía Servicios\nPortal de trámites\nExpedientes\nSeguridad Vial\nARBA\nBoletín Oficial\nRegistro de las Personas\nContrataciones\nVer Todos\nPolíticas de privacidad\nUso Interno\nWebmail (gba.gob.ar)\nWebmail HORDE\nSistemas\nGDEBA\nPortal del Empleado\nMesa de Ayuda\nSIAPE",
      "tablas": [],
      "montos_extraidos": [],
      "metadata": {
        "longitud_caracteres": 872,
        "tiene_tablas": false,
        "total_tablas": 0,
        "total_montos": 0
      }
    },
    {
      "id": "2334256",
      "tipo": "decreto",
      "numero": "1320",
      "titulo": "Decreto Nº 1320",
      "fecha": "Carmen de Areco, 20/08/2025",
      "municipio": "Carmen de Areco",
      "url": "https://sibom.slyt.gba.gob.ar/bulletins/14250/contents/2334256",
      "contenido": "Sistema de Boletín Oficial Municipal | Buenos Aires Provincia\nINICIO\nACERCA DEL SIBOM\nBOLETINES\nMUNICIPIOS\nADMINISTRACION\nSistema de Boletines Oficiales Municipales (SIBOM)\nSistema de Boletines Oficiales Municipales (SIBOM)\nSistema de Boletines Oficiales Municipales (SIBOM)\nSistema de Boletines Oficiales Municipales (SIBOM)\nSistema de Boletines Oficiales Municipales (SIBOM)\nBoletines/Carmen de Areco\nDecreto Nº1320\nDecreto Nº 1320\nPublicado en versión extractada\nCarmen de Areco, 20/08/2025\ncredito de ayuda social\nRedes Sociales\nContacto\nAutoridad de Aplicación\nSecretaría General\nSubsecretaría Legal y Técnica\nGuía Servicios\nPortal de trámites\nExpedientes\nSeguridad Vial\nARBA\nBoletín Oficial\nRegistro de las Personas\nContrataciones\nVer Todos\nPolíticas de privacidad\nUso Interno\nWebmail (gba.gob.ar)\nWebmail HORDE\nSistemas\nGDEBA\nPortal del Empleado\nMesa de Ayuda\nSIAPE",
      "tablas": [],
      "montos_extraidos": [],
      "metadata": {
        "longitud_caracteres": 872,
        "tiene_tablas": false,
        "total_tablas": 0,
        "total_montos": 0
      }
    },
    {
      "id": "2334260",
      "tipo": "decreto",
      "numero": "1321",
      "titulo": "Decreto Nº 1321",
      "fecha": "Carmen de Areco, 20/08/2025",
      "municipio": "Carmen de Areco",
      "url": "https://sibom.slyt.gba.gob.ar/bulletins/14250/contents/2334260",
      "contenido": "Sistema de Boletín Oficial Municipal | Buenos Aires Provincia\nINICIO\nACERCA DEL SIBOM\nBOLETINES\nMUNICIPIOS\nADMINISTRACION\nSistema de Boletines Oficiales Municipales (SIBOM)\nSistema de Boletines Oficiales Municipales (SIBOM)\nSistema de Boletines Oficiales Municipales (SIBOM)\nSistema de Boletines Oficiales Municipales (SIBOM)\nSistema de Boletines Oficiales Municipales (SIBOM)\nBoletines/Carmen de Areco\nDecreto Nº1321\nDecreto Nº 1321\nPublicado en versión extractada\nCarmen de Areco, 20/08/2025\ncredito de ayuda social\nRedes Sociales\nContacto\nAutoridad de Aplicación\nSecretaría General\nSubsecretaría Legal y Técnica\nGuía Servicios\nPortal de trámites\nExpedientes\nSeguridad Vial\nARBA\nBoletín Oficial\nRegistro de las Personas\nContrataciones\nVer Todos\nPolíticas de privacidad\nUso Interno\nWebmail (gba.gob.ar)\nWebmail HORDE\nSistemas\nGDEBA\nPortal del Empleado\nMesa de Ayuda\nSIAPE",
      "tablas": [],
      "montos_extraidos": [],
      "metadata": {
        "longitud_caracteres": 872,
        "tiene_tablas": false,
        "total_tablas": 0,
        "total_montos": 0
      }
    },
    {
      "id": "2334276",
      "tipo": "decreto",
      "numero": "1322",
      "titulo": "Decreto Nº 1322",
      "fecha": "Carmen de Areco, 20/08/2025",
      "municipio": "Carmen de Areco",
      "url": "https://sibom.slyt.gba.gob.ar/bulletins/14250/contents/2334276",
      "contenido": "Sistema de Boletín Oficial Municipal | Buenos Aires Provincia\nINICIO\nACERCA DEL SIBOM\nBOLETINES\nMUNICIPIOS\nADMINISTRACION\nSistema de Boletines Oficiales Municipales (SIBOM)\nSistema de Boletines Oficiales Municipales (SIBOM)\nSistema de Boletines Oficiales Municipales (SIBOM)\nSistema de Boletines Oficiales Municipales (SIBOM)\nSistema de Boletines Oficiales Municipales (SIBOM)\nBoletines/Carmen de Areco\nDecreto Nº1322\nDecreto Nº 1322\nPublicado en versión extractada\nCarmen de Areco, 20/08/2025\nLa habilitación del Centro de Día “Inés Maria Enjo” en el Ministerio de Salud de la Provincia de Buenos Aires; y; Autorícese a la Contadora Municipal a realizar el pago al Ministerio de la Salud de la Provincia de Buenos Aires\nRedes Sociales\nContacto\nAutoridad de Aplicación\nSecretaría General\nSubsecretaría Legal y Técnica\nGuía Servicios\nPortal de trámites\nExpedientes\nSeguridad Vial\nARBA\nBoletín Oficial\nRegistro de las Personas\nContrataciones\nVer Todos\nPolíticas de privacidad\nUso Interno\nWebmail (gba.gob.ar)\nWebmail HORDE\nSistemas\nGDEBA\nPortal del Empleado\nMesa de Ayuda\nSIAPE",
      "tablas": [],
      "montos_extraidos": [],
      "metadata": {
        "longitud_caracteres": 1075,
        "tiene_tablas": false,
        "total_tablas": 0,
        "total_montos": 0
      }
    },
    {
      "id": "2334311",
      "tipo": "decreto",
      "numero": "1323",
      "titulo": "Decreto Nº 1323",
      "fecha": "Carmen de Areco, 21/08/2025",
      "municipio": "Carmen de Areco",
      "url": "https://sibom.slyt.gba.gob.ar/bulletins/14250/contents/2334311",
      "contenido": "Sistema de Boletín Oficial Municipal | Buenos Aires Provincia\nINICIO\nACERCA DEL SIBOM\nBOLETINES\nMUNICIPIOS\nADMINISTRACION\nSistema de Boletines Oficiales Municipales (SIBOM)\nSistema de Boletines Oficiales Municipales (SIBOM)\nSistema de Boletines Oficiales Municipales (SIBOM)\nSistema de Boletines Oficiales Municipales (SIBOM)\nSistema de Boletines Oficiales Municipales (SIBOM)\nBoletines/Carmen de Areco\nDecreto Nº1323\nDecreto Nº 1323\nPublicado en versión extractada\nCarmen de Areco, 21/08/2025\nLas etapas local y regional de JUEGOS BONAERENSES 2025, a desarrollarse durante los meses de julio, agosto y septiembre del corriente año, y Contrátese, dado que el Municipio no cuenta en la planta con personal profesional afectado y/o dedicado a la tarea descripta en los vistos del presente, al Sr.\nFUSERO, JOSE LUIS\n,\npara efectuar el servicio de traslado de pasajeros, el 28 de agosto\nRedes Sociales\nContacto\nAutoridad de Aplicación\nSecretaría General\nSubsecretaría Legal y Técnica\nGuía Servicios\nPortal de trámites\nExpedientes\nSeguridad Vial\nARBA\nBoletín Oficial\nRegistro de las Personas\nContrataciones\nVer Todos\nPolíticas de privacidad\nUso Interno\nWebmail (gba.gob.ar)\nWebmail HORDE\nSistemas\nGDEBA\nPortal del Empleado\nMesa de Ayuda\nSIAPE",
      "tablas": [],
      "montos_extraidos": [],
      "metadata": {
        "longitud_caracteres": 1237,
        "tiene_tablas": false,
        "total_tablas": 0,
        "total_montos": 0
      }
    },
    {
      "id": "2334313",
      "tipo": "decreto",
      "numero": "1324",
      "titulo": "Decreto Nº 1324",
      "fecha": "Carmen de Areco, 21/08/2025",
      "municipio": "Carmen de Areco",
      "url": "https://sibom.slyt.gba.gob.ar/bulletins/14250/contents/2334313",
      "contenido": "Sistema de Boletín Oficial Municipal | Buenos Aires Provincia\nINICIO\nACERCA DEL SIBOM\nBOLETINES\nMUNICIPIOS\nADMINISTRACION\nSistema de Boletines Oficiales Municipales (SIBOM)\nSistema de Boletines Oficiales Municipales (SIBOM)\nSistema de Boletines Oficiales Municipales (SIBOM)\nSistema de Boletines Oficiales Municipales (SIBOM)\nSistema de Boletines Oficiales Municipales (SIBOM)\nBoletines/Carmen de Areco\nDecreto Nº1324\nDecreto Nº 1324\nPublicado en versión extractada\nCarmen de Areco, 21/08/2025\nLa solicitud presentada por la Sra.\nBORDON, PAOLA BEATRIZ\nRedes Sociales\nContacto\nAutoridad de Aplicación\nSecretaría General\nSubsecretaría Legal y Técnica\nGuía Servicios\nPortal de trámites\nExpedientes\nSeguridad Vial\nARBA\nBoletín Oficial\nRegistro de las Personas\nContrataciones\nVer Todos\nPolíticas de privacidad\nUso Interno\nWebmail (gba.gob.ar)\nWebmail HORDE\nSistemas\nGDEBA\nPortal del Empleado\nMesa de Ayuda\nSIAPE",
      "tablas": [],
      "montos_extraidos": [],
      "metadata": {
        "longitud_caracteres": 906,
        "tiene_tablas": false,
        "total_tablas": 0,
        "total_montos": 0
      }
    },
    {
      "id": "2334315",
      "tipo": "decreto",
      "numero": "1325",
      "titulo": "Decreto Nº 1325",
      "fecha": "Carmen de Areco, 21/08/2025",
      "municipio": "Carmen de Areco",
      "url": "https://sibom.slyt.gba.gob.ar/bulletins/14250/contents/2334315",
      "contenido": "Sistema de Boletín Oficial Municipal | Buenos Aires Provincia\nINICIO\nACERCA DEL SIBOM\nBOLETINES\nMUNICIPIOS\nADMINISTRACION\nSistema de Boletines Oficiales Municipales (SIBOM)\nSistema de Boletines Oficiales Municipales (SIBOM)\nSistema de Boletines Oficiales Municipales (SIBOM)\nSistema de Boletines Oficiales Municipales (SIBOM)\nSistema de Boletines Oficiales Municipales (SIBOM)\nBoletines/Carmen de Areco\nDecreto Nº1325\nDecreto Nº 1325\nPublicado en versión extractada\nCarmen de Areco, 21/08/2025\nLa solicitud presentada por la Sra.\nBERARDI, VALERIA AGUSTINA\nRedes Sociales\nContacto\nAutoridad de Aplicación\nSecretaría General\nSubsecretaría Legal y Técnica\nGuía Servicios\nPortal de trámites\nExpedientes\nSeguridad Vial\nARBA\nBoletín Oficial\nRegistro de las Personas\nContrataciones\nVer Todos\nPolíticas de privacidad\nUso Interno\nWebmail (gba.gob.ar)\nWebmail HORDE\nSistemas\nGDEBA\nPortal del Empleado\nMesa de Ayuda\nSIAPE",
      "tablas": [],
      "montos_extraidos": [],
      "metadata": {
        "longitud_caracteres": 910,
        "tiene_tablas": false,
        "total_tablas": 0,
        "total_montos": 0
      }
    },
    {
      "id": "2334316",
      "tipo": "decreto",
      "numero": "1326",
      "titulo": "Decreto Nº 1326",
      "fecha": "Carmen de Areco, 21/08/2025",
      "municipio": "Carmen de Areco",
      "url": "https://sibom.slyt.gba.gob.ar/bulletins/14250/contents/2334316",
      "contenido": "Sistema de Boletín Oficial Municipal | Buenos Aires Provincia\nINICIO\nACERCA DEL SIBOM\nBOLETINES\nMUNICIPIOS\nADMINISTRACION\nSistema de Boletines Oficiales Municipales (SIBOM)\nSistema de Boletines Oficiales Municipales (SIBOM)\nSistema de Boletines Oficiales Municipales (SIBOM)\nSistema de Boletines Oficiales Municipales (SIBOM)\nSistema de Boletines Oficiales Municipales (SIBOM)\nBoletines/Carmen de Areco\nDecreto Nº1326\nDecreto Nº 1326\nPublicado en versión extractada\nCarmen de Areco, 21/08/2025\nLa solicitud presentada por la Sra.\nMALDONADO, ROSA MARGARITA\nRedes Sociales\nContacto\nAutoridad de Aplicación\nSecretaría General\nSubsecretaría Legal y Técnica\nGuía Servicios\nPortal de trámites\nExpedientes\nSeguridad Vial\nARBA\nBoletín Oficial\nRegistro de las Personas\nContrataciones\nVer Todos\nPolíticas de privacidad\nUso Interno\nWebmail (gba.gob.ar)\nWebmail HORDE\nSistemas\nGDEBA\nPortal del Empleado\nMesa de Ayuda\nSIAPE",
      "tablas": [],
      "montos_extraidos": [],
      "metadata": {
        "longitud_caracteres": 910,
        "tiene_tablas": false,
        "total_tablas": 0,
        "total_montos": 0
      }
    },
    {
      "id": "2334318",
      "tipo": "decreto",
      "numero": "1327",
      "titulo": "Decreto Nº 1327",
      "fecha": "Carmen de Areco, 21/08/2025",
      "municipio": "Carmen de Areco",
      "url": "https://sibom.slyt.gba.gob.ar/bulletins/14250/contents/2334318",
      "contenido": "Sistema de Boletín Oficial Municipal | Buenos Aires Provincia\nINICIO\nACERCA DEL SIBOM\nBOLETINES\nMUNICIPIOS\nADMINISTRACION\nSistema de Boletines Oficiales Municipales (SIBOM)\nSistema de Boletines Oficiales Municipales (SIBOM)\nSistema de Boletines Oficiales Municipales (SIBOM)\nSistema de Boletines Oficiales Municipales (SIBOM)\nSistema de Boletines Oficiales Municipales (SIBOM)\nBoletines/Carmen de Areco\nDecreto Nº1327\nDecreto Nº 1327\nPublicado en versión extractada\nCarmen de Areco, 21/08/2025\nLa solicitud presentada por la Sra.\nGOMEZ, CLAUDIA PATRICIA\nRedes Sociales\nContacto\nAutoridad de Aplicación\nSecretaría General\nSubsecretaría Legal y Técnica\nGuía Servicios\nPortal de trámites\nExpedientes\nSeguridad Vial\nARBA\nBoletín Oficial\nRegistro de las Personas\nContrataciones\nVer Todos\nPolíticas de privacidad\nUso Interno\nWebmail (gba.gob.ar)\nWebmail HORDE\nSistemas\nGDEBA\nPortal del Empleado\nMesa de Ayuda\nSIAPE",
      "tablas": [],
      "montos_extraidos": [],
      "metadata": {
        "longitud_caracteres": 908,
        "tiene_tablas": false,
        "total_tablas": 0,
        "total_montos": 0
      }
    },
    {
      "id": "2334319",
      "tipo": "decreto",
      "numero": "1328",
      "titulo": "Decreto Nº 1328",
      "fecha": "Carmen de Areco, 21/08/2025",
      "municipio": "Carmen de Areco",
      "url": "https://sibom.slyt.gba.gob.ar/bulletins/14250/contents/2334319",
      "contenido": "Sistema de Boletín Oficial Municipal | Buenos Aires Provincia\nINICIO\nACERCA DEL SIBOM\nBOLETINES\nMUNICIPIOS\nADMINISTRACION\nSistema de Boletines Oficiales Municipales (SIBOM)\nSistema de Boletines Oficiales Municipales (SIBOM)\nSistema de Boletines Oficiales Municipales (SIBOM)\nSistema de Boletines Oficiales Municipales (SIBOM)\nSistema de Boletines Oficiales Municipales (SIBOM)\nBoletines/Carmen de Areco\nDecreto Nº1328\nDecreto Nº 1328\nPublicado en versión extractada\nCarmen de Areco, 21/08/2025\nLa solicitud presentada por la Sra.\nVASSE, TOMASA MERCEDES\nRedes Sociales\nContacto\nAutoridad de Aplicación\nSecretaría General\nSubsecretaría Legal y Técnica\nGuía Servicios\nPortal de trámites\nExpedientes\nSeguridad Vial\nARBA\nBoletín Oficial\nRegistro de las Personas\nContrataciones\nVer Todos\nPolíticas de privacidad\nUso Interno\nWebmail (gba.gob.ar)\nWebmail HORDE\nSistemas\nGDEBA\nPortal del Empleado\nMesa de Ayuda\nSIAPE",
      "tablas": [],
      "montos_extraidos": [],
      "metadata": {
        "longitud_caracteres": 907,
        "tiene_tablas": false,
        "total_tablas": 0,
        "total_montos": 0
      }
    },
    {
      "id": "2334321",
      "tipo": "decreto",
      "numero": "1329",
      "titulo": "Decreto Nº 1329",
      "fecha": "Carmen de Areco, 21/08/2025",
      "municipio": "Carmen de Areco",
      "url": "https://sibom.slyt.gba.gob.ar/bulletins/14250/contents/2334321",
      "contenido": "Sistema de Boletín Oficial Municipal | Buenos Aires Provincia\nINICIO\nACERCA DEL SIBOM\nBOLETINES\nMUNICIPIOS\nADMINISTRACION\nSistema de Boletines Oficiales Municipales (SIBOM)\nSistema de Boletines Oficiales Municipales (SIBOM)\nSistema de Boletines Oficiales Municipales (SIBOM)\nSistema de Boletines Oficiales Municipales (SIBOM)\nSistema de Boletines Oficiales Municipales (SIBOM)\nBoletines/Carmen de Areco\nDecreto Nº1329\nDecreto Nº 1329\nPublicado en versión extractada\nCarmen de Areco, 21/08/2025\nLa solicitud presentada por la Sra.\nRICCI, CLAUDIA LORENA\nRedes Sociales\nContacto\nAutoridad de Aplicación\nSecretaría General\nSubsecretaría Legal y Técnica\nGuía Servicios\nPortal de trámites\nExpedientes\nSeguridad Vial\nARBA\nBoletín Oficial\nRegistro de las Personas\nContrataciones\nVer Todos\nPolíticas de privacidad\nUso Interno\nWebmail (gba.gob.ar)\nWebmail HORDE\nSistemas\nGDEBA\nPortal del Empleado\nMesa de Ayuda\nSIAPE",
      "tablas": [],
      "montos_extraidos": [],
      "metadata": {
        "longitud_caracteres": 906,
        "tiene_tablas": false,
        "total_tablas": 0,
        "total_montos": 0
      }
    },
    {
      "id": "2334333",
      "tipo": "decreto",
      "numero": "1330",
      "titulo": "Decreto Nº 1330",
      "fecha": "Carmen de Areco, 21/08/2025",
      "municipio": "Carmen de Areco",
      "url": "https://sibom.slyt.gba.gob.ar/bulletins/14250/contents/2334333",
      "contenido": "Sistema de Boletín Oficial Municipal | Buenos Aires Provincia\nINICIO\nACERCA DEL SIBOM\nBOLETINES\nMUNICIPIOS\nADMINISTRACION\nSistema de Boletines Oficiales Municipales (SIBOM)\nSistema de Boletines Oficiales Municipales (SIBOM)\nSistema de Boletines Oficiales Municipales (SIBOM)\nSistema de Boletines Oficiales Municipales (SIBOM)\nSistema de Boletines Oficiales Municipales (SIBOM)\nBoletines/Carmen de Areco\nDecreto Nº1330\nDecreto Nº 1330\nPublicado en versión extractada\nCarmen de Areco, 21/08/2025\nLa solicitud presentada por la Sra.\nALFONSO, MARIA CLARA\nRedes Sociales\nContacto\nAutoridad de Aplicación\nSecretaría General\nSubsecretaría Legal y Técnica\nGuía Servicios\nPortal de trámites\nExpedientes\nSeguridad Vial\nARBA\nBoletín Oficial\nRegistro de las Personas\nContrataciones\nVer Todos\nPolíticas de privacidad\nUso Interno\nWebmail (gba.gob.ar)\nWebmail HORDE\nSistemas\nGDEBA\nPortal del Empleado\nMesa de Ayuda\nSIAPE",
      "tablas": [],
      "montos_extraidos": [],
      "metadata": {
        "longitud_caracteres": 905,
        "tiene_tablas": false,
        "total_tablas": 0,
        "total_montos": 0
      }
    },
    {
      "id": "2334335",
      "tipo": "decreto",
      "numero": "1331",
      "titulo": "Decreto Nº 1331",
      "fecha": "Carmen de Areco, 21/08/2025",
      "municipio": "Carmen de Areco",
      "url": "https://sibom.slyt.gba.gob.ar/bulletins/14250/contents/2334335",
      "contenido": "Sistema de Boletín Oficial Municipal | Buenos Aires Provincia\nINICIO\nACERCA DEL SIBOM\nBOLETINES\nMUNICIPIOS\nADMINISTRACION\nSistema de Boletines Oficiales Municipales (SIBOM)\nSistema de Boletines Oficiales Municipales (SIBOM)\nSistema de Boletines Oficiales Municipales (SIBOM)\nSistema de Boletines Oficiales Municipales (SIBOM)\nSistema de Boletines Oficiales Municipales (SIBOM)\nBoletines/Carmen de Areco\nDecreto Nº1331\nDecreto Nº 1331\nPublicado en versión extractada\nCarmen de Areco, 21/08/2025\nLa solicitud presentada por la Sra.\nDEL VALLE ROJAS, VIOLETA\nRedes Sociales\nContacto\nAutoridad de Aplicación\nSecretaría General\nSubsecretaría Legal y Técnica\nGuía Servicios\nPortal de trámites\nExpedientes\nSeguridad Vial\nARBA\nBoletín Oficial\nRegistro de las Personas\nContrataciones\nVer Todos\nPolíticas de privacidad\nUso Interno\nWebmail (gba.gob.ar)\nWebmail HORDE\nSistemas\nGDEBA\nPortal del Empleado\nMesa de Ayuda\nSIAPE",
      "tablas": [],
      "montos_extraidos": [],
      "metadata": {
        "longitud_caracteres": 909,
        "tiene_tablas": false,
        "total_tablas": 0,
        "total_montos": 0
      }
    },
    {
      "id": "2334338",
      "tipo": "decreto",
      "numero": "1332",
      "titulo": "Decreto Nº 1332",
      "fecha": "Carmen de Areco, 21/08/2025",
      "municipio": "Carmen de Areco",
      "url": "https://sibom.slyt.gba.gob.ar/bulletins/14250/contents/2334338",
      "contenido": "Sistema de Boletín Oficial Municipal | Buenos Aires Provincia\nINICIO\nACERCA DEL SIBOM\nBOLETINES\nMUNICIPIOS\nADMINISTRACION\nSistema de Boletines Oficiales Municipales (SIBOM)\nSistema de Boletines Oficiales Municipales (SIBOM)\nSistema de Boletines Oficiales Municipales (SIBOM)\nSistema de Boletines Oficiales Municipales (SIBOM)\nSistema de Boletines Oficiales Municipales (SIBOM)\nBoletines/Carmen de Areco\nDecreto Nº1332\nDecreto Nº 1332\nPublicado en versión extractada\nCarmen de Areco, 21/08/2025\nLa solicitud presentada por la Sra.\nCUELLAR, CINTIA FLORIANA\nRedes Sociales\nContacto\nAutoridad de Aplicación\nSecretaría General\nSubsecretaría Legal y Técnica\nGuía Servicios\nPortal de trámites\nExpedientes\nSeguridad Vial\nARBA\nBoletín Oficial\nRegistro de las Personas\nContrataciones\nVer Todos\nPolíticas de privacidad\nUso Interno\nWebmail (gba.gob.ar)\nWebmail HORDE\nSistemas\nGDEBA\nPortal del Empleado\nMesa de Ayuda\nSIAPE",
      "tablas": [],
      "montos_extraidos": [],
      "metadata": {
        "longitud_caracteres": 909,
        "tiene_tablas": false,
        "total_tablas": 0,
        "total_montos": 0
      }
    },
    {
      "id": "2334339",
      "tipo": "decreto",
      "numero": "1333",
      "titulo": "Decreto Nº 1333",
      "fecha": "Carmen de Areco, 21/08/2025",
      "municipio": "Carmen de Areco",
      "url": "https://sibom.slyt.gba.gob.ar/bulletins/14250/contents/2334339",
      "contenido": "Sistema de Boletín Oficial Municipal | Buenos Aires Provincia\nINICIO\nACERCA DEL SIBOM\nBOLETINES\nMUNICIPIOS\nADMINISTRACION\nSistema de Boletines Oficiales Municipales (SIBOM)\nSistema de Boletines Oficiales Municipales (SIBOM)\nSistema de Boletines Oficiales Municipales (SIBOM)\nSistema de Boletines Oficiales Municipales (SIBOM)\nSistema de Boletines Oficiales Municipales (SIBOM)\nBoletines/Carmen de Areco\nDecreto Nº1333\nDecreto Nº 1333\nPublicado en versión extractada\nCarmen de Areco, 21/08/2025\nLa solicitud presentada por la Sra.\nMALONE RIVERO, AILEN\nRedes Sociales\nContacto\nAutoridad de Aplicación\nSecretaría General\nSubsecretaría Legal y Técnica\nGuía Servicios\nPortal de trámites\nExpedientes\nSeguridad Vial\nARBA\nBoletín Oficial\nRegistro de las Personas\nContrataciones\nVer Todos\nPolíticas de privacidad\nUso Interno\nWebmail (gba.gob.ar)\nWebmail HORDE\nSistemas\nGDEBA\nPortal del Empleado\nMesa de Ayuda\nSIAPE",
      "tablas": [],
      "montos_extraidos": [],
      "metadata": {
        "longitud_caracteres": 905,
        "tiene_tablas": false,
        "total_tablas": 0,
        "total_montos": 0
      }
    },
    {
      "id": "2334340",
      "tipo": "decreto",
      "numero": "1334",
      "titulo": "Decreto Nº 1334",
      "fecha": "Carmen de Areco, 21/08/2025",
      "municipio": "Carmen de Areco",
      "url": "https://sibom.slyt.gba.gob.ar/bulletins/14250/contents/2334340",
      "contenido": "Sistema de Boletín Oficial Municipal | Buenos Aires Provincia\nINICIO\nACERCA DEL SIBOM\nBOLETINES\nMUNICIPIOS\nADMINISTRACION\nSistema de Boletines Oficiales Municipales (SIBOM)\nSistema de Boletines Oficiales Municipales (SIBOM)\nSistema de Boletines Oficiales Municipales (SIBOM)\nSistema de Boletines Oficiales Municipales (SIBOM)\nSistema de Boletines Oficiales Municipales (SIBOM)\nBoletines/Carmen de Areco\nDecreto Nº1334\nDecreto Nº 1334\nPublicado en versión extractada\nCarmen de Areco, 21/08/2025\nLa solicitud presentada por la Sra.\nGOMEZ, CLAUDIA YANINA\nRedes Sociales\nContacto\nAutoridad de Aplicación\nSecretaría General\nSubsecretaría Legal y Técnica\nGuía Servicios\nPortal de trámites\nExpedientes\nSeguridad Vial\nARBA\nBoletín Oficial\nRegistro de las Personas\nContrataciones\nVer Todos\nPolíticas de privacidad\nUso Interno\nWebmail (gba.gob.ar)\nWebmail HORDE\nSistemas\nGDEBA\nPortal del Empleado\nMesa de Ayuda\nSIAPE",
      "tablas": [],
      "montos_extraidos": [],
      "metadata": {
        "longitud_caracteres": 906,
        "tiene_tablas": false,
        "total_tablas": 0,
        "total_montos": 0
      }
    },
    {
      "id": "2334342",
      "tipo": "decreto",
      "numero": "1335",
      "titulo": "Decreto Nº 1335",
      "fecha": "Carmen de Areco, 21/08/2025",
      "municipio": "Carmen de Areco",
      "url": "https://sibom.slyt.gba.gob.ar/bulletins/14250/contents/2334342",
      "contenido": "Sistema de Boletín Oficial Municipal | Buenos Aires Provincia\nINICIO\nACERCA DEL SIBOM\nBOLETINES\nMUNICIPIOS\nADMINISTRACION\nSistema de Boletines Oficiales Municipales (SIBOM)\nSistema de Boletines Oficiales Municipales (SIBOM)\nSistema de Boletines Oficiales Municipales (SIBOM)\nSistema de Boletines Oficiales Municipales (SIBOM)\nSistema de Boletines Oficiales Municipales (SIBOM)\nBoletines/Carmen de Areco\nDecreto Nº1335\nDecreto Nº 1335\nPublicado en versión extractada\nCarmen de Areco, 21/08/2025\nLa solicitud presentada por la Sra.\nDIAZ, ROMINA ALEJANDRA\nRedes Sociales\nContacto\nAutoridad de Aplicación\nSecretaría General\nSubsecretaría Legal y Técnica\nGuía Servicios\nPortal de trámites\nExpedientes\nSeguridad Vial\nARBA\nBoletín Oficial\nRegistro de las Personas\nContrataciones\nVer Todos\nPolíticas de privacidad\nUso Interno\nWebmail (gba.gob.ar)\nWebmail HORDE\nSistemas\nGDEBA\nPortal del Empleado\nMesa de Ayuda\nSIAPE",
      "tablas": [],
      "montos_extraidos": [],
      "metadata": {
        "longitud_caracteres": 907,
        "tiene_tablas": false,
        "total_tablas": 0,
        "total_montos": 0
      }
    },
    {
      "id": "2334343",
      "tipo": "decreto",
      "numero": "1336",
      "titulo": "Decreto Nº 1336",
      "fecha": "Carmen de Areco, 21/08/2025",
      "municipio": "Carmen de Areco",
      "url": "https://sibom.slyt.gba.gob.ar/bulletins/14250/contents/2334343",
      "contenido": "Sistema de Boletín Oficial Municipal | Buenos Aires Provincia\nINICIO\nACERCA DEL SIBOM\nBOLETINES\nMUNICIPIOS\nADMINISTRACION\nSistema de Boletines Oficiales Municipales (SIBOM)\nSistema de Boletines Oficiales Municipales (SIBOM)\nSistema de Boletines Oficiales Municipales (SIBOM)\nSistema de Boletines Oficiales Municipales (SIBOM)\nSistema de Boletines Oficiales Municipales (SIBOM)\nBoletines/Carmen de Areco\nDecreto Nº1336\nDecreto Nº 1336\nPublicado en versión extractada\nCarmen de Areco, 21/08/2025\nLa solicitud presentada por la Sra.\nCOLOMBO, ZULMA LILIANA\nRedes Sociales\nContacto\nAutoridad de Aplicación\nSecretaría General\nSubsecretaría Legal y Técnica\nGuía Servicios\nPortal de trámites\nExpedientes\nSeguridad Vial\nARBA\nBoletín Oficial\nRegistro de las Personas\nContrataciones\nVer Todos\nPolíticas de privacidad\nUso Interno\nWebmail (gba.gob.ar)\nWebmail HORDE\nSistemas\nGDEBA\nPortal del Empleado\nMesa de Ayuda\nSIAPE",
      "tablas": [],
      "montos_extraidos": [],
      "metadata": {
        "longitud_caracteres": 907,
        "tiene_tablas": false,
        "total_tablas": 0,
        "total_montos": 0
      }
    },
    {
      "id": "2334345",
      "tipo": "decreto",
      "numero": "1337",
      "titulo": "Decreto Nº 1337",
      "fecha": "Carmen de Areco, 21/08/2025",
      "municipio": "Carmen de Areco",
      "url": "https://sibom.slyt.gba.gob.ar/bulletins/14250/contents/2334345",
      "contenido": "Sistema de Boletín Oficial Municipal | Buenos Aires Provincia\nINICIO\nACERCA DEL SIBOM\nBOLETINES\nMUNICIPIOS\nADMINISTRACION\nSistema de Boletines Oficiales Municipales (SIBOM)\nSistema de Boletines Oficiales Municipales (SIBOM)\nSistema de Boletines Oficiales Municipales (SIBOM)\nSistema de Boletines Oficiales Municipales (SIBOM)\nSistema de Boletines Oficiales Municipales (SIBOM)\nBoletines/Carmen de Areco\nDecreto Nº1337\nDecreto Nº 1337\nPublicado en versión extractada\nCarmen de Areco, 21/08/2025\nLa solicitud presentada por la Sra.\nRODRIGUEZ, MARIA CLOTILDE\nRedes Sociales\nContacto\nAutoridad de Aplicación\nSecretaría General\nSubsecretaría Legal y Técnica\nGuía Servicios\nPortal de trámites\nExpedientes\nSeguridad Vial\nARBA\nBoletín Oficial\nRegistro de las Personas\nContrataciones\nVer Todos\nPolíticas de privacidad\nUso Interno\nWebmail (gba.gob.ar)\nWebmail HORDE\nSistemas\nGDEBA\nPortal del Empleado\nMesa de Ayuda\nSIAPE",
      "tablas": [],
      "montos_extraidos": [],
      "metadata": {
        "longitud_caracteres": 910,
        "tiene_tablas": false,
        "total_tablas": 0,
        "total_montos": 0
      }
    },
    {
      "id": "2334346",
      "tipo": "decreto",
      "numero": "1338",
      "titulo": "Decreto Nº 1338",
      "fecha": "Carmen de Areco, 21/08/2024",
      "municipio": "Carmen de Areco",
      "url": "https://sibom.slyt.gba.gob.ar/bulletins/14250/contents/2334346",
      "contenido": "Sistema de Boletín Oficial Municipal | Buenos Aires Provincia\nINICIO\nACERCA DEL SIBOM\nBOLETINES\nMUNICIPIOS\nADMINISTRACION\nSistema de Boletines Oficiales Municipales (SIBOM)\nSistema de Boletines Oficiales Municipales (SIBOM)\nSistema de Boletines Oficiales Municipales (SIBOM)\nSistema de Boletines Oficiales Municipales (SIBOM)\nSistema de Boletines Oficiales Municipales (SIBOM)\nBoletines/Carmen de Areco\nDecreto Nº1338\nDecreto Nº 1338\nPublicado en versión extractada\nCarmen de Areco, 21/08/2024\nLa solicitud presentada por la Sra.\nLITTERINI, EVA HAYDEE\nRedes Sociales\nContacto\nAutoridad de Aplicación\nSecretaría General\nSubsecretaría Legal y Técnica\nGuía Servicios\nPortal de trámites\nExpedientes\nSeguridad Vial\nARBA\nBoletín Oficial\nRegistro de las Personas\nContrataciones\nVer Todos\nPolíticas de privacidad\nUso Interno\nWebmail (gba.gob.ar)\nWebmail HORDE\nSistemas\nGDEBA\nPortal del Empleado\nMesa de Ayuda\nSIAPE",
      "tablas": [],
      "montos_extraidos": [],
      "metadata": {
        "longitud_caracteres": 906,
        "tiene_tablas": false,
        "total_tablas": 0,
        "total_montos": 0
      }
    },
    {
      "id": "2334347",
      "tipo": "decreto",
      "numero": "1339",
      "titulo": "Decreto Nº 1339",
      "fecha": "Carmen de Areco, 21/08/2025",
      "municipio": "Carmen de Areco",
      "url": "https://sibom.slyt.gba.gob.ar/bulletins/14250/contents/2334347",
      "contenido": "Sistema de Boletín Oficial Municipal | Buenos Aires Provincia\nINICIO\nACERCA DEL SIBOM\nBOLETINES\nMUNICIPIOS\nADMINISTRACION\nSistema de Boletines Oficiales Municipales (SIBOM)\nSistema de Boletines Oficiales Municipales (SIBOM)\nSistema de Boletines Oficiales Municipales (SIBOM)\nSistema de Boletines Oficiales Municipales (SIBOM)\nSistema de Boletines Oficiales Municipales (SIBOM)\nBoletines/Carmen de Areco\nDecreto Nº1339\nDecreto Nº 1339\nPublicado en versión extractada\nCarmen de Areco, 21/08/2025\nLa solicitud presentada por la Sra.\nKRUGER, MARTA\nRedes Sociales\nContacto\nAutoridad de Aplicación\nSecretaría General\nSubsecretaría Legal y Técnica\nGuía Servicios\nPortal de trámites\nExpedientes\nSeguridad Vial\nARBA\nBoletín Oficial\nRegistro de las Personas\nContrataciones\nVer Todos\nPolíticas de privacidad\nUso Interno\nWebmail (gba.gob.ar)\nWebmail HORDE\nSistemas\nGDEBA\nPortal del Empleado\nMesa de Ayuda\nSIAPE",
      "tablas": [],
      "montos_extraidos": [],
      "metadata": {
        "longitud_caracteres": 898,
        "tiene_tablas": false,
        "total_tablas": 0,
        "total_montos": 0
      }
    },
    {
      "id": "2334349",
      "tipo": "decreto",
      "numero": "1340",
      "titulo": "Decreto Nº 1340",
      "fecha": "Carmen de Areco, 21/08/2025",
      "municipio": "Carmen de Areco",
      "url": "https://sibom.slyt.gba.gob.ar/bulletins/14250/contents/2334349",
      "contenido": "Sistema de Boletín Oficial Municipal | Buenos Aires Provincia\nINICIO\nACERCA DEL SIBOM\nBOLETINES\nMUNICIPIOS\nADMINISTRACION\nSistema de Boletines Oficiales Municipales (SIBOM)\nSistema de Boletines Oficiales Municipales (SIBOM)\nSistema de Boletines Oficiales Municipales (SIBOM)\nSistema de Boletines Oficiales Municipales (SIBOM)\nSistema de Boletines Oficiales Municipales (SIBOM)\nBoletines/Carmen de Areco\nDecreto Nº1340\nDecreto Nº 1340\nPublicado en versión extractada\nCarmen de Areco, 21/08/2025\nLa solicitud presentada por el Sr.\nSCHAEFER, LEANDRO RODRIGO\nRedes Sociales\nContacto\nAutoridad de Aplicación\nSecretaría General\nSubsecretaría Legal y Técnica\nGuía Servicios\nPortal de trámites\nExpedientes\nSeguridad Vial\nARBA\nBoletín Oficial\nRegistro de las Personas\nContrataciones\nVer Todos\nPolíticas de privacidad\nUso Interno\nWebmail (gba.gob.ar)\nWebmail HORDE\nSistemas\nGDEBA\nPortal del Empleado\nMesa de Ayuda\nSIAPE",
      "tablas": [],
      "montos_extraidos": [],
      "metadata": {
        "longitud_caracteres": 909,
        "tiene_tablas": false,
        "total_tablas": 0,
        "total_montos": 0
      }
    },
    {
      "id": "2334351",
      "tipo": "decreto",
      "numero": "1341",
      "titulo": "Decreto Nº 1341",
      "fecha": "Carmen de Areco, 21/08/2025",
      "municipio": "Carmen de Areco",
      "url": "https://sibom.slyt.gba.gob.ar/bulletins/14250/contents/2334351",
      "contenido": "Sistema de Boletín Oficial Municipal | Buenos Aires Provincia\nINICIO\nACERCA DEL SIBOM\nBOLETINES\nMUNICIPIOS\nADMINISTRACION\nSistema de Boletines Oficiales Municipales (SIBOM)\nSistema de Boletines Oficiales Municipales (SIBOM)\nSistema de Boletines Oficiales Municipales (SIBOM)\nSistema de Boletines Oficiales Municipales (SIBOM)\nSistema de Boletines Oficiales Municipales (SIBOM)\nBoletines/Carmen de Areco\nDecreto Nº1341\nDecreto Nº 1341\nPublicado en versión extractada\nCarmen de Areco, 21/08/2025\nLa solicitud presentada por el Sr.\nMAGARIÑOS, GABRIEL OMAR\nRedes Sociales\nContacto\nAutoridad de Aplicación\nSecretaría General\nSubsecretaría Legal y Técnica\nGuía Servicios\nPortal de trámites\nExpedientes\nSeguridad Vial\nARBA\nBoletín Oficial\nRegistro de las Personas\nContrataciones\nVer Todos\nPolíticas de privacidad\nUso Interno\nWebmail (gba.gob.ar)\nWebmail HORDE\nSistemas\nGDEBA\nPortal del Empleado\nMesa de Ayuda\nSIAPE",
      "tablas": [],
      "montos_extraidos": [],
      "metadata": {
        "longitud_caracteres": 907,
        "tiene_tablas": false,
        "total_tablas": 0,
        "total_montos": 0
      }
    },
    {
      "id": "2334353",
      "tipo": "decreto",
      "numero": "1342",
      "titulo": "Decreto Nº 1342",
      "fecha": "Carmen de Areco, 21/08/2025",
      "municipio": "Carmen de Areco",
      "url": "https://sibom.slyt.gba.gob.ar/bulletins/14250/contents/2334353",
      "contenido": "Sistema de Boletín Oficial Municipal | Buenos Aires Provincia\nINICIO\nACERCA DEL SIBOM\nBOLETINES\nMUNICIPIOS\nADMINISTRACION\nSistema de Boletines Oficiales Municipales (SIBOM)\nSistema de Boletines Oficiales Municipales (SIBOM)\nSistema de Boletines Oficiales Municipales (SIBOM)\nSistema de Boletines Oficiales Municipales (SIBOM)\nSistema de Boletines Oficiales Municipales (SIBOM)\nBoletines/Carmen de Areco\nDecreto Nº1342\nDecreto Nº 1342\nPublicado en versión extractada\nCarmen de Areco, 21/08/2025\nLa solicitud presentada por el Sr.\nLOPEZ, JORGE LUIS\nRedes Sociales\nContacto\nAutoridad de Aplicación\nSecretaría General\nSubsecretaría Legal y Técnica\nGuía Servicios\nPortal de trámites\nExpedientes\nSeguridad Vial\nARBA\nBoletín Oficial\nRegistro de las Personas\nContrataciones\nVer Todos\nPolíticas de privacidad\nUso Interno\nWebmail (gba.gob.ar)\nWebmail HORDE\nSistemas\nGDEBA\nPortal del Empleado\nMesa de Ayuda\nSIAPE",
      "tablas": [],
      "montos_extraidos": [],
      "metadata": {
        "longitud_caracteres": 901,
        "tiene_tablas": false,
        "total_tablas": 0,
        "total_montos": 0
      }
    },
    {
      "id": "2334354",
      "tipo": "decreto",
      "numero": "1343",
      "titulo": "Decreto Nº 1343",
      "fecha": "Carmen de Areco, 21/08/2025",
      "municipio": "Carmen de Areco",
      "url": "https://sibom.slyt.gba.gob.ar/bulletins/14250/contents/2334354",
      "contenido": "Sistema de Boletín Oficial Municipal | Buenos Aires Provincia\nINICIO\nACERCA DEL SIBOM\nBOLETINES\nMUNICIPIOS\nADMINISTRACION\nSistema de Boletines Oficiales Municipales (SIBOM)\nSistema de Boletines Oficiales Municipales (SIBOM)\nSistema de Boletines Oficiales Municipales (SIBOM)\nSistema de Boletines Oficiales Municipales (SIBOM)\nSistema de Boletines Oficiales Municipales (SIBOM)\nBoletines/Carmen de Areco\nDecreto Nº1343\nDecreto Nº 1343\nPublicado en versión extractada\nCarmen de Areco, 21/08/2025\nLa solicitud presentada por el Sr.\nPUCHETA, ROBERTO RUBEN\nRedes Sociales\nContacto\nAutoridad de Aplicación\nSecretaría General\nSubsecretaría Legal y Técnica\nGuía Servicios\nPortal de trámites\nExpedientes\nSeguridad Vial\nARBA\nBoletín Oficial\nRegistro de las Personas\nContrataciones\nVer Todos\nPolíticas de privacidad\nUso Interno\nWebmail (gba.gob.ar)\nWebmail HORDE\nSistemas\nGDEBA\nPortal del Empleado\nMesa de Ayuda\nSIAPE",
      "tablas": [],
      "montos_extraidos": [],
      "metadata": {
        "longitud_caracteres": 906,
        "tiene_tablas": false,
        "total_tablas": 0,
        "total_montos": 0
      }
    },
    {
      "id": "2334380",
      "tipo": "decreto",
      "numero": "1344",
      "titulo": "Decreto Nº 1344",
      "fecha": "Carmen de Areco, 21/08/2025",
      "municipio": "Carmen de Areco",
      "url": "https://sibom.slyt.gba.gob.ar/bulletins/14250/contents/2334380",
      "contenido": "Sistema de Boletín Oficial Municipal | Buenos Aires Provincia\nINICIO\nACERCA DEL SIBOM\nBOLETINES\nMUNICIPIOS\nADMINISTRACION\nSistema de Boletines Oficiales Municipales (SIBOM)\nSistema de Boletines Oficiales Municipales (SIBOM)\nSistema de Boletines Oficiales Municipales (SIBOM)\nSistema de Boletines Oficiales Municipales (SIBOM)\nSistema de Boletines Oficiales Municipales (SIBOM)\nBoletines/Carmen de Areco\nDecreto Nº1344\nDecreto Nº 1344\nPublicado en versión extractada\nCarmen de Areco, 21/08/2025\nLa solicitud presentada por el Sr.\nFERNANDEZ, ANDRES GUSTAVO\nRedes Sociales\nContacto\nAutoridad de Aplicación\nSecretaría General\nSubsecretaría Legal y Técnica\nGuía Servicios\nPortal de trámites\nExpedientes\nSeguridad Vial\nARBA\nBoletín Oficial\nRegistro de las Personas\nContrataciones\nVer Todos\nPolíticas de privacidad\nUso Interno\nWebmail (gba.gob.ar)\nWebmail HORDE\nSistemas\nGDEBA\nPortal del Empleado\nMesa de Ayuda\nSIAPE",
      "tablas": [],
      "montos_extraidos": [],
      "metadata": {
        "longitud_caracteres": 909,
        "tiene_tablas": false,
        "total_tablas": 0,
        "total_montos": 0
      }
    },
    {
      "id": "2334384",
      "tipo": "decreto",
      "numero": "1345",
      "titulo": "Decreto Nº 1345",
      "fecha": "Carmen de Areco, 21/08/2025",
      "municipio": "Carmen de Areco",
      "url": "https://sibom.slyt.gba.gob.ar/bulletins/14250/contents/2334384",
      "contenido": "Sistema de Boletín Oficial Municipal | Buenos Aires Provincia\nINICIO\nACERCA DEL SIBOM\nBOLETINES\nMUNICIPIOS\nADMINISTRACION\nSistema de Boletines Oficiales Municipales (SIBOM)\nSistema de Boletines Oficiales Municipales (SIBOM)\nSistema de Boletines Oficiales Municipales (SIBOM)\nSistema de Boletines Oficiales Municipales (SIBOM)\nSistema de Boletines Oficiales Municipales (SIBOM)\nBoletines/Carmen de Areco\nDecreto Nº1345\nDecreto Nº 1345\nPublicado en versión extractada\nCarmen de Areco, 21/08/2025\nLa solicitud presentada por la Sra.\nROMERO, NANCY\nRedes Sociales\nContacto\nAutoridad de Aplicación\nSecretaría General\nSubsecretaría Legal y Técnica\nGuía Servicios\nPortal de trámites\nExpedientes\nSeguridad Vial\nARBA\nBoletín Oficial\nRegistro de las Personas\nContrataciones\nVer Todos\nPolíticas de privacidad\nUso Interno\nWebmail (gba.gob.ar)\nWebmail HORDE\nSistemas\nGDEBA\nPortal del Empleado\nMesa de Ayuda\nSIAPE",
      "tablas": [],
      "montos_extraidos": [],
      "metadata": {
        "longitud_caracteres": 898,
        "tiene_tablas": false,
        "total_tablas": 0,
        "total_montos": 0
      }
    },
    {
      "id": "2334385",
      "tipo": "decreto",
      "numero": "1346",
      "titulo": "Decreto Nº 1346",
      "fecha": "Carmen de Areco, 21/08/2025",
      "municipio": "Carmen de Areco",
      "url": "https://sibom.slyt.gba.gob.ar/bulletins/14250/contents/2334385",
      "contenido": "Sistema de Boletín Oficial Municipal | Buenos Aires Provincia\nINICIO\nACERCA DEL SIBOM\nBOLETINES\nMUNICIPIOS\nADMINISTRACION\nSistema de Boletines Oficiales Municipales (SIBOM)\nSistema de Boletines Oficiales Municipales (SIBOM)\nSistema de Boletines Oficiales Municipales (SIBOM)\nSistema de Boletines Oficiales Municipales (SIBOM)\nSistema de Boletines Oficiales Municipales (SIBOM)\nBoletines/Carmen de Areco\nDecreto Nº1346\nDecreto Nº 1346\nPublicado en versión extractada\nCarmen de Areco, 21/08/2025\nPromulgase la Ordenanza Nº 3296 /2025, sancionada por el Honorable Concejo Deliberante de Carmen de Areco con fecha 12/08/2025\nRedes Sociales\nContacto\nAutoridad de Aplicación\nSecretaría General\nSubsecretaría Legal y Técnica\nGuía Servicios\nPortal de trámites\nExpedientes\nSeguridad Vial\nARBA\nBoletín Oficial\nRegistro de las Personas\nContrataciones\nVer Todos\nPolíticas de privacidad\nUso Interno\nWebmail (gba.gob.ar)\nWebmail HORDE\nSistemas\nGDEBA\nPortal del Empleado\nMesa de Ayuda\nSIAPE",
      "tablas": [],
      "montos_extraidos": [],
      "metadata": {
        "longitud_caracteres": 975,
        "tiene_tablas": false,
        "total_tablas": 0,
        "total_montos": 0
      }
    },
    {
      "id": "2334387",
      "tipo": "decreto",
      "numero": "1347",
      "titulo": "Decreto Nº 1347",
      "fecha": "Carmen de Areco, 21/08/2025",
      "municipio": "Carmen de Areco",
      "url": "https://sibom.slyt.gba.gob.ar/bulletins/14250/contents/2334387",
      "contenido": "Sistema de Boletín Oficial Municipal | Buenos Aires Provincia\nINICIO\nACERCA DEL SIBOM\nBOLETINES\nMUNICIPIOS\nADMINISTRACION\nSistema de Boletines Oficiales Municipales (SIBOM)\nSistema de Boletines Oficiales Municipales (SIBOM)\nSistema de Boletines Oficiales Municipales (SIBOM)\nSistema de Boletines Oficiales Municipales (SIBOM)\nSistema de Boletines Oficiales Municipales (SIBOM)\nBoletines/Carmen de Areco\nDecreto Nº1347\nDecreto Nº 1347\nPublicado en versión extractada\nCarmen de Areco, 21/08/2025\nLa solicitud presentada por la Sra.\nSOSA, MARCELINA\nRedes Sociales\nContacto\nAutoridad de Aplicación\nSecretaría General\nSubsecretaría Legal y Técnica\nGuía Servicios\nPortal de trámites\nExpedientes\nSeguridad Vial\nARBA\nBoletín Oficial\nRegistro de las Personas\nContrataciones\nVer Todos\nPolíticas de privacidad\nUso Interno\nWebmail (gba.gob.ar)\nWebmail HORDE\nSistemas\nGDEBA\nPortal del Empleado\nMesa de Ayuda\nSIAPE",
      "tablas": [],
      "montos_extraidos": [],
      "metadata": {
        "longitud_caracteres": 900,
        "tiene_tablas": false,
        "total_tablas": 0,
        "total_montos": 0
      }
    },
    {
      "id": "2334859",
      "tipo": "decreto",
      "numero": "1348",
      "titulo": "Decreto Nº 1348",
      "fecha": "Carmen de Areco, 22/08/2025",
      "municipio": "Carmen de Areco",
      "url": "https://sibom.slyt.gba.gob.ar/bulletins/14250/contents/2334859",
      "contenido": "Sistema de Boletín Oficial Municipal | Buenos Aires Provincia\nINICIO\nACERCA DEL SIBOM\nBOLETINES\nMUNICIPIOS\nADMINISTRACION\nSistema de Boletines Oficiales Municipales (SIBOM)\nSistema de Boletines Oficiales Municipales (SIBOM)\nSistema de Boletines Oficiales Municipales (SIBOM)\nSistema de Boletines Oficiales Municipales (SIBOM)\nSistema de Boletines Oficiales Municipales (SIBOM)\nBoletines/Carmen de Areco\nDecreto Nº1348\nDecreto Nº 1348\nPublicado en versión extractada\nCarmen de Areco, 22/08/2025\nLos fondos remitidos por el MINISTERIO DE MUJERES Y DIVERSIDADES DE LA PCIA. DE BUENOS AIRES en el marco del Programa “YENDO”, EX2023-38678210-GDEBA-DSTAMMPGYDSGP\nAutorizase a la Contadora Interina Municipal, Sra. Batallón, Alicia a devolver al MINISTERIO DE MUJERES Y DIVERSIDADES DE LA PCIA. DE BUENOS AIRES; la suma de Pesos SEIS MIL OCHOCIENTOS ($6.800,00) sobrantes del Programa “YENDO”, EX2023-38678210-GDEBA-DSTAMMPGYDSGP.\nRedes Sociales\nContacto\nAutoridad de Aplicación\nSecretaría General\nSubsecretaría Legal y Técnica\nGuía Servicios\nPortal de trámites\nExpedientes\nSeguridad Vial\nARBA\nBoletín Oficial\nRegistro de las Personas\nContrataciones\nVer Todos\nPolíticas de privacidad\nUso Interno\nWebmail (gba.gob.ar)\nWebmail HORDE\nSistemas\nGDEBA\nPortal del Empleado\nMesa de Ayuda\nSIAPE",
      "tablas": [],
      "montos_extraidos": [
        {
          "municipio": "Areco",
          "boletin": "0",
          "fecha": "Carmen de Areco, 22/08/2025",
          "norma_tipo": "Decreto",
          "norma_numero": "1348",
          "articulo": "S/N",
          "concepto": "a suma de Pesos SEIS MIL OCHOCIENTOS ($6.800,00) sobrantes del Programa “YENDO”, EX2023-38678210-GDEBA-DSTAMMPGYDSGP.",
          "monto": 6800.0,
          "moneda": "ARS",
          "texto_completo": "Boletín 0º | Areco | Decreto Nº1348 [ARTÍCULO S/N: $6.800,00]",
          "fuente_url": "https://sibom.slyt.gba.gob.ar/bulletins/14250/contents/2334859"
        }
      ],
      "metadata": {
        "longitud_caracteres": 1278,
        "tiene_tablas": false,
        "total_tablas": 0,
        "total_montos": 1
      }
    },
    {
      "id": "2334860",
      "tipo": "decreto",
      "numero": "1349",
      "titulo": "Decreto Nº 1349",
      "fecha": "Carmen de Areco, 22/08/2025",
      "municipio": "Carmen de Areco",
      "url": "https://sibom.slyt.gba.gob.ar/bulletins/14250/contents/2334860",
      "contenido": "Sistema de Boletín Oficial Municipal | Buenos Aires Provincia\nINICIO\nACERCA DEL SIBOM\nBOLETINES\nMUNICIPIOS\nADMINISTRACION\nSistema de Boletines Oficiales Municipales (SIBOM)\nSistema de Boletines Oficiales Municipales (SIBOM)\nSistema de Boletines Oficiales Municipales (SIBOM)\nSistema de Boletines Oficiales Municipales (SIBOM)\nSistema de Boletines Oficiales Municipales (SIBOM)\nBoletines/Carmen de Areco\nDecreto Nº1349\nDecreto Nº 1349\nPublicado en versión extractada\nCarmen de Areco, 22/08/2025\nLos fondos remitidos por la Dirección Provincial de Infraestructura Municipal en el marco del Convenio para la obra “CIUDAD ACCESIBLE – CONSTRUCCIÓN DE RAMPA” EX2024-25811418-GDEBA-DGALMIYSPGP\nAutorizase a la Contadora Interina Municipal, Sra. Batallón, Alicia a devolver a la DIRECCION PROVINCIAL DE INFRAESTRUCTURA MUNICIPAL; la suma de Pesos CIENTO SESENTA MIL QUINIENTOS NOVENTA Y SEIS CON 59/100 ($160.596,59) del monto actualizado correspondiente anticipo financiero del Convenio suscrito para la implementación de la obra “CIUDAD ACCESIBLE – CONSTRUCCIÓN DE RAMPA”  EX2024-25811418-GDEBA-DGALMIYSPGP\nRedes Sociales\nContacto\nAutoridad de Aplicación\nSecretaría General\nSubsecretaría Legal y Técnica\nGuía Servicios\nPortal de trámites\nExpedientes\nSeguridad Vial\nARBA\nBoletín Oficial\nRegistro de las Personas\nContrataciones\nVer Todos\nPolíticas de privacidad\nUso Interno\nWebmail (gba.gob.ar)\nWebmail HORDE\nSistemas\nGDEBA\nPortal del Empleado\nMesa de Ayuda\nSIAPE",
      "tablas": [],
      "montos_extraidos": [
        {
          "municipio": "Areco",
          "boletin": "0",
          "fecha": "Carmen de Areco, 22/08/2025",
          "norma_tipo": "Decreto",
          "norma_numero": "1349",
          "articulo": "S/N",
          "concepto": "ENTOS NOVENTA Y SEIS CON 59/100 ($160.596,59) del monto actualizado correspondiente anticipo financiero del Convenio suscrito para la implementación d",
          "monto": 160596.59,
          "moneda": "ARS",
          "texto_completo": "Boletín 0º | Areco | Decreto Nº1349 [ARTÍCULO S/N: $160.596,59]",
          "fuente_url": "https://sibom.slyt.gba.gob.ar/bulletins/14250/contents/2334860"
        }
      ],
      "metadata": {
        "longitud_caracteres": 1455,
        "tiene_tablas": false,
        "total_tablas": 0,
        "total_montos": 1
      }
    },
    {
      "id": "2334862",
      "tipo": "decreto",
      "numero": "1350",
      "titulo": "Decreto Nº 1350",
      "fecha": "Carmen de Areco, 22/08/2025",
      "municipio": "Carmen de Areco",
      "url": "https://sibom.slyt.gba.gob.ar/bulletins/14250/contents/2334862",
      "contenido": "Sistema de Boletín Oficial Municipal | Buenos Aires Provincia\nINICIO\nACERCA DEL SIBOM\nBOLETINES\nMUNICIPIOS\nADMINISTRACION\nSistema de Boletines Oficiales Municipales (SIBOM)\nSistema de Boletines Oficiales Municipales (SIBOM)\nSistema de Boletines Oficiales Municipales (SIBOM)\nSistema de Boletines Oficiales Municipales (SIBOM)\nSistema de Boletines Oficiales Municipales (SIBOM)\nBoletines/Carmen de Areco\nDecreto Nº1350\nDecreto Nº 1350\nPublicado en versión extractada\nCarmen de Areco, 22/08/2025\nEl convenio de Cooperación Recíproca entre la\nUniversidad de Buenos Aires y el Municipio de Carmen de Areco, y la Ord. N° 3283/2025; y;\nAbónese a la Universidad de Buenos Aires, la suma de $7.942.472,12 retroactivo correspondiente al mes de mayo de 2025, los cuales se imputarán a la Jurisdicción: 1110103000– 18.04.00-132- Fuente de Financiamiento-  5.3.4.0……… $7.942.472,12\nRedes Sociales\nContacto\nAutoridad de Aplicación\nSecretaría General\nSubsecretaría Legal y Técnica\nGuía Servicios\nPortal de trámites\nExpedientes\nSeguridad Vial\nARBA\nBoletín Oficial\nRegistro de las Personas\nContrataciones\nVer Todos\nPolíticas de privacidad\nUso Interno\nWebmail (gba.gob.ar)\nWebmail HORDE\nSistemas\nGDEBA\nPortal del Empleado\nMesa de Ayuda\nSIAPE",
      "tablas": [],
      "montos_extraidos": [
        {
          "municipio": "Areco",
          "boletin": "0",
          "fecha": "Carmen de Areco, 22/08/2025",
          "norma_tipo": "Decreto",
          "norma_numero": "1350",
          "articulo": "S/N",
          "concepto": "Boletines Oficiales Municipales (SIBOM) Sistema de Boletines Oficiales Municipales (SIBOM)",
          "monto": 7942472.12,
          "moneda": "ARS",
          "texto_completo": "Boletín 0º | Areco | Decreto Nº1350 [ARTÍCULO S/N: $7.942.472,12]",
          "fuente_url": "https://sibom.slyt.gba.gob.ar/bulletins/14250/contents/2334862"
        },
        {
          "municipio": "Areco",
          "boletin": "0",
          "fecha": "Carmen de Areco, 22/08/2025",
          "norma_tipo": "Decreto",
          "norma_numero": "1350",
          "articulo": "S/N",
          "concepto": "Municipales (SIBOM) Boletines/Carmen de Areco Decreto Nº1350 Decreto Nº 1350",
          "monto": 7942472.12,
          "moneda": "ARS",
          "texto_completo": "Boletín 0º | Areco | Decreto Nº1350 [ARTÍCULO S/N: $7.942.472,12]",
          "fuente_url": "https://sibom.slyt.gba.gob.ar/bulletins/14250/contents/2334862"
        }
      ],
      "metadata": {
        "longitud_caracteres": 1224,
        "tiene_tablas": false,
        "total_tablas": 0,
        "total_montos": 2
      }
    },
    {
      "id": "2334863",
      "tipo": "decreto",
      "numero": "1351",
      "titulo": "Decreto Nº 1351",
      "fecha": "Carmen de Areco, 22/08/2025",
      "municipio": "Carmen de Areco",
      "url": "https://sibom.slyt.gba.gob.ar/bulletins/14250/contents/2334863",
      "contenido": "Sistema de Boletín Oficial Municipal | Buenos Aires Provincia\nINICIO\nACERCA DEL SIBOM\nBOLETINES\nMUNICIPIOS\nADMINISTRACION\nSistema de Boletines Oficiales Municipales (SIBOM)\nSistema de Boletines Oficiales Municipales (SIBOM)\nSistema de Boletines Oficiales Municipales (SIBOM)\nSistema de Boletines Oficiales Municipales (SIBOM)\nSistema de Boletines Oficiales Municipales (SIBOM)\nBoletines/Carmen de Areco\nDecreto Nº1351\nDecreto Nº 1351\nPublicado en versión extractada\nCarmen de Areco, 22/08/2025\nEl Decreto\n517/2025\n; y  Autorizase a la Contadora Interina Municipal, Sra. Batallón, Alicia a abonar a la Cooperativa de trabajo\n“AMADO OLMOS LTDA”\nla suma de\nPESOS\nUN MILLON DOSCIENTOS SESENTA Y UN MIL QUINIENTOS NOVENTA Y UNO CON 29/100 (\n$ 1.261.591,29) correspondiente a la redeterminación de precio, que el Instituto de la Vivienda de la Pcia. De Bs. As, aprobó sobre el Certificado de Avance de Obras N° 8, abonado con fecha 15/4/2025.-\nRedes Sociales\nContacto\nAutoridad de Aplicación\nSecretaría General\nSubsecretaría Legal y Técnica\nGuía Servicios\nPortal de trámites\nExpedientes\nSeguridad Vial\nARBA\nBoletín Oficial\nRegistro de las Personas\nContrataciones\nVer Todos\nPolíticas de privacidad\nUso Interno\nWebmail (gba.gob.ar)\nWebmail HORDE\nSistemas\nGDEBA\nPortal del Empleado\nMesa de Ayuda\nSIAPE",
      "tablas": [],
      "montos_extraidos": [
        {
          "municipio": "Areco",
          "boletin": "0",
          "fecha": "Carmen de Areco, 22/08/2025",
          "norma_tipo": "Decreto",
          "norma_numero": "1351",
          "articulo": "S/N",
          "concepto": "unicipales (SIBOM) Sistema de Boletines Oficiales Municipales (SIBOM) Sistema de",
          "monto": 1261591.29,
          "moneda": "ARS",
          "texto_completo": "Boletín 0º | Areco | Decreto Nº1351 [ARTÍCULO S/N: $1.261.591,29]",
          "fuente_url": "https://sibom.slyt.gba.gob.ar/bulletins/14250/contents/2334863"
        }
      ],
      "metadata": {
        "longitud_caracteres": 1292,
        "tiene_tablas": false,
        "total_tablas": 0,
        "total_montos": 1
      }
    },
    {
      "id": "2334867",
      "tipo": "decreto",
      "numero": "1352",
      "titulo": "Decreto Nº 1352",
      "fecha": "Carmen de Areco, 22/08/2025",
      "municipio": "Carmen de Areco",
      "url": "https://sibom.slyt.gba.gob.ar/bulletins/14250/contents/2334867",
      "contenido": "Sistema de Boletín Oficial Municipal | Buenos Aires Provincia\nINICIO\nACERCA DEL SIBOM\nBOLETINES\nMUNICIPIOS\nADMINISTRACION\nSistema de Boletines Oficiales Municipales (SIBOM)\nSistema de Boletines Oficiales Municipales (SIBOM)\nSistema de Boletines Oficiales Municipales (SIBOM)\nSistema de Boletines Oficiales Municipales (SIBOM)\nSistema de Boletines Oficiales Municipales (SIBOM)\nBoletines/Carmen de Areco\nDecreto Nº1352\nDecreto Nº 1352\nPublicado en versión extractada\nCarmen de Areco, 22/08/2025\nEl Decreto\n685/2025\n; y\n°)\n:\nAutorizase a la Contadora Interina Municipal, Sra. Batallón, Alicia a abonar a la Cooperativa de trabajo\n“AMADO OLMOS LTDA”\n, la suma de\nPESOS\nUN MILLON DOSCIENTOS UN MIL SETECIENTOS VEINTE CON 07/100 (\n$ 1.201.720,07) correspondiente a la redeterminación de precio, que el Instituto de la Vivienda de la Pcia. De Bs. As, aprobó sobre el Certificado de Avance de Obras N° 9, abonado con fecha 8/5/2025.-\nRedes Sociales\nContacto\nAutoridad de Aplicación\nSecretaría General\nSubsecretaría Legal y Técnica\nGuía Servicios\nPortal de trámites\nExpedientes\nSeguridad Vial\nARBA\nBoletín Oficial\nRegistro de las Personas\nContrataciones\nVer Todos\nPolíticas de privacidad\nUso Interno\nWebmail (gba.gob.ar)\nWebmail HORDE\nSistemas\nGDEBA\nPortal del Empleado\nMesa de Ayuda\nSIAPE",
      "tablas": [],
      "montos_extraidos": [
        {
          "municipio": "Areco",
          "boletin": "0",
          "fecha": "Carmen de Areco, 22/08/2025",
          "norma_tipo": "Decreto",
          "norma_numero": "1352",
          "articulo": "S/N",
          "concepto": "ales (SIBOM) Sistema de Boletines Oficiales Municipales (SIBOM) Sistema de",
          "monto": 1201720.07,
          "moneda": "ARS",
          "texto_completo": "Boletín 0º | Areco | Decreto Nº1352 [ARTÍCULO S/N: $1.201.720,07]",
          "fuente_url": "https://sibom.slyt.gba.gob.ar/bulletins/14250/contents/2334867"
        }
      ],
      "metadata": {
        "longitud_caracteres": 1281,
        "tiene_tablas": false,
        "total_tablas": 0,
        "total_montos": 1
      }
    },
    {
      "id": "2334872",
      "tipo": "decreto",
      "numero": "1353",
      "titulo": "Decreto Nº 1353",
      "fecha": "Carmen de Areco, 22/08/2025",
      "municipio": "Carmen de Areco",
      "url": "https://sibom.slyt.gba.gob.ar/bulletins/14250/contents/2334872",
      "contenido": "Sistema de Boletín Oficial Municipal | Buenos Aires Provincia\nINICIO\nACERCA DEL SIBOM\nBOLETINES\nMUNICIPIOS\nADMINISTRACION\nSistema de Boletines Oficiales Municipales (SIBOM)\nSistema de Boletines Oficiales Municipales (SIBOM)\nSistema de Boletines Oficiales Municipales (SIBOM)\nSistema de Boletines Oficiales Municipales (SIBOM)\nSistema de Boletines Oficiales Municipales (SIBOM)\nBoletines/Carmen de Areco\nDecreto Nº1353\nDecreto Nº 1353\nPublicado en versión extractada\nCarmen de Areco, 22/08/2025\nEl Decreto\n756/2025\n; y Autorizase a la Contadora Interina Municipal, Sra. Batallón, Alicia a abonar a la Cooperativa de trabajo\n“AMADO OLMOS LTDA”\nla suma de\nPESOS\nUN MILLON DIECISIETE MIL QUINIENTOS CINCUENTA Y CUATRO CON 52/100 (\n$ 1.017.554,52) correspondiente a la redeterminación de precio, que el Instituto de la Vivienda de la Pcia. De Bs. As, aprobó sobre el Certificado de Avance de Obras N° 10, abonado con fecha 29/5/2025.-\nRedes Sociales\nContacto\nAutoridad de Aplicación\nSecretaría General\nSubsecretaría Legal y Técnica\nGuía Servicios\nPortal de trámites\nExpedientes\nSeguridad Vial\nARBA\nBoletín Oficial\nRegistro de las Personas\nContrataciones\nVer Todos\nPolíticas de privacidad\nUso Interno\nWebmail (gba.gob.ar)\nWebmail HORDE\nSistemas\nGDEBA\nPortal del Empleado\nMesa de Ayuda\nSIAPE",
      "tablas": [],
      "montos_extraidos": [
        {
          "municipio": "Areco",
          "boletin": "0",
          "fecha": "Carmen de Areco, 22/08/2025",
          "norma_tipo": "Decreto",
          "norma_numero": "1353",
          "articulo": "S/N",
          "concepto": "Municipales (SIBOM) Sistema de Boletines Oficiales Municipales (SIBOM) Sistema de",
          "monto": 1017554.52,
          "moneda": "ARS",
          "texto_completo": "Boletín 0º | Areco | Decreto Nº1353 [ARTÍCULO S/N: $1.017.554,52]",
          "fuente_url": "https://sibom.slyt.gba.gob.ar/bulletins/14250/contents/2334872"
        }
      ],
      "metadata": {
        "longitud_caracteres": 1284,
        "tiene_tablas": false,
        "total_tablas": 0,
        "total_montos": 1
      }
    },
    {
      "id": "2335031",
      "tipo": "decreto",
      "numero": "1354",
      "titulo": "Decreto Nº 1354",
      "fecha": "Carmen de Areco, 22/08/2025",
      "municipio": "Carmen de Areco",
      "url": "https://sibom.slyt.gba.gob.ar/bulletins/14250/contents/2335031",
      "contenido": "Sistema de Boletín Oficial Municipal | Buenos Aires Provincia\nINICIO\nACERCA DEL SIBOM\nBOLETINES\nMUNICIPIOS\nADMINISTRACION\nSistema de Boletines Oficiales Municipales (SIBOM)\nSistema de Boletines Oficiales Municipales (SIBOM)\nSistema de Boletines Oficiales Municipales (SIBOM)\nSistema de Boletines Oficiales Municipales (SIBOM)\nSistema de Boletines Oficiales Municipales (SIBOM)\nBoletines/Carmen de Areco\nDecreto Nº1354\nDecreto Nº 1354\nPublicado en versión extractada\nCarmen de Areco, 22/08/2025\nEl Decreto\n1071/2025\n; y Autorizase a la Contadora Interina Municipal, Sra. Batallón, Alicia a abonar a la Cooperativa de trabajo\n“AMADO OLMOS LTDA”\n, la suma de\nPESOS\nQUINIENTOS VEINTICINCO MIL CIENTO NOVENTA Y CUATRO CON 19/100 (\n$ 525.194,19) correspondiente a la redeterminación de precio, que el Instituto de la Vivienda de la Pcia. De Bs. As, aprobó sobre el Certificado de Avance de Obras N° 11, abonado con fecha 11/7/2025.-\nRedes Sociales\nContacto\nAutoridad de Aplicación\nSecretaría General\nSubsecretaría Legal y Técnica\nGuía Servicios\nPortal de trámites\nExpedientes\nSeguridad Vial\nARBA\nBoletín Oficial\nRegistro de las Personas\nContrataciones\nVer Todos\nPolíticas de privacidad\nUso Interno\nWebmail (gba.gob.ar)\nWebmail HORDE\nSistemas\nGDEBA\nPortal del Empleado\nMesa de Ayuda\nSIAPE",
      "tablas": [],
      "montos_extraidos": [
        {
          "municipio": "Areco",
          "boletin": "0",
          "fecha": "Carmen de Areco, 22/08/2025",
          "norma_tipo": "Decreto",
          "norma_numero": "1354",
          "articulo": "S/N",
          "concepto": "icipales (SIBOM) Sistema de Boletines Oficiales Municipales (SIBOM) Sistema de",
          "monto": 525194.19,
          "moneda": "ARS",
          "texto_completo": "Boletín 0º | Areco | Decreto Nº1354 [ARTÍCULO S/N: $525.194,19]",
          "fuente_url": "https://sibom.slyt.gba.gob.ar/bulletins/14250/contents/2335031"
        }
      ],
      "metadata": {
        "longitud_caracteres": 1281,
        "tiene_tablas": false,
        "total_tablas": 0,
        "total_montos": 1
      }
    },
    {
      "id": "2335081",
      "tipo": "decreto",
      "numero": "1355",
      "titulo": "Decreto Nº 1355",
      "fecha": "Carmen de Areco, 22/08/2025",
      "municipio": "Carmen de Areco",
      "url": "https://sibom.slyt.gba.gob.ar/bulletins/14250/contents/2335081",
      "contenido": "Sistema de Boletín Oficial Municipal | Buenos Aires Provincia\nINICIO\nACERCA DEL SIBOM\nBOLETINES\nMUNICIPIOS\nADMINISTRACION\nSistema de Boletines Oficiales Municipales (SIBOM)\nSistema de Boletines Oficiales Municipales (SIBOM)\nSistema de Boletines Oficiales Municipales (SIBOM)\nSistema de Boletines Oficiales Municipales (SIBOM)\nSistema de Boletines Oficiales Municipales (SIBOM)\nBoletines/Carmen de Areco\nDecreto Nº1355\nDecreto Nº 1355\nPublicado en versión extractada\nCarmen de Areco, 22/08/2025\nEl Decreto\n1135/2025\n; y Autorizase a la Contadora Interina Municipal, Sra. Batallón, Alicia a abonar a la Cooperativa de trabajo\n“AMADO OLMOS LTDA”\nla suma de\nPESOS\nUN MILLON SEISCIENTOS OCHENTA Y CINCO MIL SEISCIENTOS OCHO CON 09/100 (\n$ 1.685.608,09) correspondiente a la redeterminación de precio, que el Instituto de la Vivienda de la Pcia. De Bs. As, aprobó sobre el Certificado de Avance de Obras N° 12, abonado con fecha 25/7/2025 y 8/8/2025.-\nRedes Sociales\nContacto\nAutoridad de Aplicación\nSecretaría General\nSubsecretaría Legal y Técnica\nGuía Servicios\nPortal de trámites\nExpedientes\nSeguridad Vial\nARBA\nBoletín Oficial\nRegistro de las Personas\nContrataciones\nVer Todos\nPolíticas de privacidad\nUso Interno\nWebmail (gba.gob.ar)\nWebmail HORDE\nSistemas\nGDEBA\nPortal del Empleado\nMesa de Ayuda\nSIAPE",
      "tablas": [],
      "montos_extraidos": [
        {
          "municipio": "Areco",
          "boletin": "0",
          "fecha": "Carmen de Areco, 22/08/2025",
          "norma_tipo": "Decreto",
          "norma_numero": "1355",
          "articulo": "S/N",
          "concepto": "unicipales (SIBOM) Sistema de Boletines Oficiales Municipales (SIBOM) Sistema de",
          "monto": 1685608.09,
          "moneda": "ARS",
          "texto_completo": "Boletín 0º | Areco | Decreto Nº1355 [ARTÍCULO S/N: $1.685.608,09]",
          "fuente_url": "https://sibom.slyt.gba.gob.ar/bulletins/14250/contents/2335081"
        }
      ],
      "metadata": {
        "longitud_caracteres": 1300,
        "tiene_tablas": false,
        "total_tablas": 0,
        "total_montos": 1
      }
    },
    {
      "id": "2335085",
      "tipo": "decreto",
      "numero": "1356",
      "titulo": "Decreto Nº 1356",
      "fecha": "Carmen de Areco, 22/08/2025",
      "municipio": "Carmen de Areco",
      "url": "https://sibom.slyt.gba.gob.ar/bulletins/14250/contents/2335085",
      "contenido": "Sistema de Boletín Oficial Municipal | Buenos Aires Provincia\nINICIO\nACERCA DEL SIBOM\nBOLETINES\nMUNICIPIOS\nADMINISTRACION\nSistema de Boletines Oficiales Municipales (SIBOM)\nSistema de Boletines Oficiales Municipales (SIBOM)\nSistema de Boletines Oficiales Municipales (SIBOM)\nSistema de Boletines Oficiales Municipales (SIBOM)\nSistema de Boletines Oficiales Municipales (SIBOM)\nBoletines/Carmen de Areco\nDecreto Nº1356\nDecreto Nº 1356\nPublicado en versión extractada\nCarmen de Areco, 22/08/2025\nEl Decreto\n757/2025\n; y Autorizase a la Contadora Interina Municipal, Sra. Batallón, Alicia a abonar a la Cooperativa de trabajo\n“AMADO OLMOS LTDA”\n, la suma de\nPESOS\nDOSCIENTOS NUEVE MIL SETECIENTOS TREINTA Y CINCO CON 88/100 (\n$209.735,88) correspondiente a la redeterminación de precio, que el Instituto de la Vivienda de la Pcia. De Bs. As, aprobó sobre el Certificado de Avance de Obras N° 10, abonado con fecha 29/5/2025.-\nRedes Sociales\nContacto\nAutoridad de Aplicación\nSecretaría General\nSubsecretaría Legal y Técnica\nGuía Servicios\nPortal de trámites\nExpedientes\nSeguridad Vial\nARBA\nBoletín Oficial\nRegistro de las Personas\nContrataciones\nVer Todos\nPolíticas de privacidad\nUso Interno\nWebmail (gba.gob.ar)\nWebmail HORDE\nSistemas\nGDEBA\nPortal del Empleado\nMesa de Ayuda\nSIAPE",
      "tablas": [],
      "montos_extraidos": [
        {
          "municipio": "Areco",
          "boletin": "0",
          "fecha": "Carmen de Areco, 22/08/2025",
          "norma_tipo": "Decreto",
          "norma_numero": "1356",
          "articulo": "S/N",
          "concepto": "nicipales (SIBOM) Sistema de Boletines Oficiales Municipales (SIBOM) Sistema de",
          "monto": 209735.88,
          "moneda": "ARS",
          "texto_completo": "Boletín 0º | Areco | Decreto Nº1356 [ARTÍCULO S/N: $209.735,88]",
          "fuente_url": "https://sibom.slyt.gba.gob.ar/bulletins/14250/contents/2335085"
        }
      ],
      "metadata": {
        "longitud_caracteres": 1277,
        "tiene_tablas": false,
        "total_tablas": 0,
        "total_montos": 1
      }
    },
    {
      "id": "2335086",
      "tipo": "decreto",
      "numero": "1357",
      "titulo": "Decreto Nº 1357",
      "fecha": "Carmen de Areco, 22/08/2025",
      "municipio": "Carmen de Areco",
      "url": "https://sibom.slyt.gba.gob.ar/bulletins/14250/contents/2335086",
      "contenido": "Sistema de Boletín Oficial Municipal | Buenos Aires Provincia\nINICIO\nACERCA DEL SIBOM\nBOLETINES\nMUNICIPIOS\nADMINISTRACION\nSistema de Boletines Oficiales Municipales (SIBOM)\nSistema de Boletines Oficiales Municipales (SIBOM)\nSistema de Boletines Oficiales Municipales (SIBOM)\nSistema de Boletines Oficiales Municipales (SIBOM)\nSistema de Boletines Oficiales Municipales (SIBOM)\nBoletines/Carmen de Areco\nDecreto Nº1357\nDecreto Nº 1357\nPublicado en versión extractada\nCarmen de Areco, 22/08/2025\nEl Decreto\n1070/2025\n; y Autorizase a la Contadora Interina Municipal, Sra. Batallón, Alicia a abonar a la Cooperativa de trabajo\n“AMADO OLMOS LTDA”\n, la suma de\nPESOS\nCIENTO SESENTA Y SIETE MIL QUINIENTOS CINCUENTA Y OCHO CON 88/100 (\n$167.558,88) correspondiente a la redeterminación de precio, que el Instituto de la Vivienda de la Pcia. De Bs. As, aprobó sobre el Certificado de Avance de Obras N° 11, abonado con fecha 11/7/2025.-\nRedes Sociales\nContacto\nAutoridad de Aplicación\nSecretaría General\nSubsecretaría Legal y Técnica\nGuía Servicios\nPortal de trámites\nExpedientes\nSeguridad Vial\nARBA\nBoletín Oficial\nRegistro de las Personas\nContrataciones\nVer Todos\nPolíticas de privacidad\nUso Interno\nWebmail (gba.gob.ar)\nWebmail HORDE\nSistemas\nGDEBA\nPortal del Empleado\nMesa de Ayuda\nSIAPE",
      "tablas": [],
      "montos_extraidos": [
        {
          "municipio": "Areco",
          "boletin": "0",
          "fecha": "Carmen de Areco, 22/08/2025",
          "norma_tipo": "Decreto",
          "norma_numero": "1357",
          "articulo": "S/N",
          "concepto": "icipales (SIBOM) Sistema de Boletines Oficiales Municipales (SIBOM) Sistema de",
          "monto": 167558.88,
          "moneda": "ARS",
          "texto_completo": "Boletín 0º | Areco | Decreto Nº1357 [ARTÍCULO S/N: $167.558,88]",
          "fuente_url": "https://sibom.slyt.gba.gob.ar/bulletins/14250/contents/2335086"
        }
      ],
      "metadata": {
        "longitud_caracteres": 1284,
        "tiene_tablas": false,
        "total_tablas": 0,
        "total_montos": 1
      }
    },
    {
      "id": "2335089",
      "tipo": "decreto",
      "numero": "1358",
      "titulo": "Decreto Nº 1358",
      "fecha": "Carmen de Areco, 22/08/2025",
      "municipio": "Carmen de Areco",
      "url": "https://sibom.slyt.gba.gob.ar/bulletins/14250/contents/2335089",
      "contenido": "Sistema de Boletín Oficial Municipal | Buenos Aires Provincia\nINICIO\nACERCA DEL SIBOM\nBOLETINES\nMUNICIPIOS\nADMINISTRACION\nSistema de Boletines Oficiales Municipales (SIBOM)\nSistema de Boletines Oficiales Municipales (SIBOM)\nSistema de Boletines Oficiales Municipales (SIBOM)\nSistema de Boletines Oficiales Municipales (SIBOM)\nSistema de Boletines Oficiales Municipales (SIBOM)\nBoletines/Carmen de Areco\nDecreto Nº1358\nDecreto Nº 1358\nPublicado en versión extractada\nCarmen de Areco, 22/08/2025\nEl Decreto\n1136/2025\n; y Autorizase a la Contadora Interina Municipal, Sra. Batallón, Alicia a abonar a la Cooperativa de trabajo\n“AMADO OLMOS LTDA”\n, la suma de\nPESOS\nOCHENTA Y NUEVE MIL DOSCIENTOS NOVENTA Y CUATRO CON 13/100 (\n$ 89.294,13) correspondiente a la redeterminación de precio, que el Instituto de la Vivienda de la Pcia. De Bs. As, aprobó sobre el Certificado de Avance de Obras N° 12, abonado con fecha 8/8/2025.-\nRedes Sociales\nContacto\nAutoridad de Aplicación\nSecretaría General\nSubsecretaría Legal y Técnica\nGuía Servicios\nPortal de trámites\nExpedientes\nSeguridad Vial\nARBA\nBoletín Oficial\nRegistro de las Personas\nContrataciones\nVer Todos\nPolíticas de privacidad\nUso Interno\nWebmail (gba.gob.ar)\nWebmail HORDE\nSistemas\nGDEBA\nPortal del Empleado\nMesa de Ayuda\nSIAPE",
      "tablas": [],
      "montos_extraidos": [
        {
          "municipio": "Areco",
          "boletin": "0",
          "fecha": "Carmen de Areco, 22/08/2025",
          "norma_tipo": "Decreto",
          "norma_numero": "1358",
          "articulo": "S/N",
          "concepto": "icipales (SIBOM) Sistema de Boletines Oficiales Municipales (SIBOM) Sistema de",
          "monto": 89294.13,
          "moneda": "ARS",
          "texto_completo": "Boletín 0º | Areco | Decreto Nº1358 [ARTÍCULO S/N: $89.294,13]",
          "fuente_url": "https://sibom.slyt.gba.gob.ar/bulletins/14250/contents/2335089"
        }
      ],
      "metadata": {
        "longitud_caracteres": 1276,
        "tiene_tablas": false,
        "total_tablas": 0,
        "total_montos": 1
      }
    },
    {
      "id": "2335101",
      "tipo": "decreto",
      "numero": "1359",
      "titulo": "Decreto Nº 1359",
      "fecha": "Carmen de Areco, 22/08/2025",
      "municipio": "Carmen de Areco",
      "url": "https://sibom.slyt.gba.gob.ar/bulletins/14250/contents/2335101",
      "contenido": "Sistema de Boletín Oficial Municipal | Buenos Aires Provincia\nINICIO\nACERCA DEL SIBOM\nBOLETINES\nMUNICIPIOS\nADMINISTRACION\nSistema de Boletines Oficiales Municipales (SIBOM)\nSistema de Boletines Oficiales Municipales (SIBOM)\nSistema de Boletines Oficiales Municipales (SIBOM)\nSistema de Boletines Oficiales Municipales (SIBOM)\nSistema de Boletines Oficiales Municipales (SIBOM)\nBoletines/Carmen de Areco\nDecreto Nº1359\nDecreto Nº 1359\nPublicado en versión extractada\nCarmen de Areco, 22/08/2025\nLa necesidad de contratar un profesional para el área de obras públicas; y  Contrátese, dado que el Municipio no cuenta en la planta con personal profesional afectado y/o dedicado a la tarea descripta en los vistos del presente, desde el 22 de agosto de 2025 al 31 de diciembre de 2025, al\nSr. BONGIOVANNI, SANTIAGO, ARQUITECTO\n,\npara realizar las tareas descriptas ut supra en un todo de acuerdo con el contrato adjunto.-\nRedes Sociales\nContacto\nAutoridad de Aplicación\nSecretaría General\nSubsecretaría Legal y Técnica\nGuía Servicios\nPortal de trámites\nExpedientes\nSeguridad Vial\nARBA\nBoletín Oficial\nRegistro de las Personas\nContrataciones\nVer Todos\nPolíticas de privacidad\nUso Interno\nWebmail (gba.gob.ar)\nWebmail HORDE\nSistemas\nGDEBA\nPortal del Empleado\nMesa de Ayuda\nSIAPE",
      "tablas": [],
      "montos_extraidos": [],
      "metadata": {
        "longitud_caracteres": 1271,
        "tiene_tablas": false,
        "total_tablas": 0,
        "total_montos": 0
      }
    },
    {
      "id": "2335105",
      "tipo": "decreto",
      "numero": "1360",
      "titulo": "Decreto Nº 1360",
      "fecha": "Carmen de Areco, 22/08/2025",
      "municipio": "Carmen de Areco",
      "url": "https://sibom.slyt.gba.gob.ar/bulletins/14250/contents/2335105",
      "contenido": "Sistema de Boletín Oficial Municipal | Buenos Aires Provincia\nINICIO\nACERCA DEL SIBOM\nBOLETINES\nMUNICIPIOS\nADMINISTRACION\nSistema de Boletines Oficiales Municipales (SIBOM)\nSistema de Boletines Oficiales Municipales (SIBOM)\nSistema de Boletines Oficiales Municipales (SIBOM)\nSistema de Boletines Oficiales Municipales (SIBOM)\nSistema de Boletines Oficiales Municipales (SIBOM)\nBoletines/Carmen de Areco\nDecreto Nº1360\nDecreto Nº 1360\nPublicado en versión extractada\nCarmen de Areco, 22/08/2025\nEl decreto 1847/2024 y; Deléguese en Agente Municipal, Sra.\nDELL’ACQUA VICTORIA DE LOS ÁNGELES\n,  la atención y firma de toda actuación administrativa que débase gestionar ante la Dirección Provincial de Personas Jurídicas de la Provincia de Buenos Aires, y para requerir y gestionar ante escribanos habilitados, los servicios notariales que resulten necesarios o convenientes para la tramitación de gestiones, presentaciones y actos vinculados con dicha Direccion, a partir del 22 de agosto de 2025.-\nRedes Sociales\nContacto\nAutoridad de Aplicación\nSecretaría General\nSubsecretaría Legal y Técnica\nGuía Servicios\nPortal de trámites\nExpedientes\nSeguridad Vial\nARBA\nBoletín Oficial\nRegistro de las Personas\nContrataciones\nVer Todos\nPolíticas de privacidad\nUso Interno\nWebmail (gba.gob.ar)\nWebmail HORDE\nSistemas\nGDEBA\nPortal del Empleado\nMesa de Ayuda\nSIAPE",
      "tablas": [],
      "montos_extraidos": [],
      "metadata": {
        "longitud_caracteres": 1350,
        "tiene_tablas": false,
        "total_tablas": 0,
        "total_montos": 0
      }
    },
    {
      "id": "2335109",
      "tipo": "decreto",
      "numero": "1361",
      "titulo": "Decreto Nº 1361",
      "fecha": "Carmen de Areco, 25/08/2025",
      "municipio": "Carmen de Areco",
      "url": "https://sibom.slyt.gba.gob.ar/bulletins/14250/contents/2335109",
      "contenido": "Sistema de Boletín Oficial Municipal | Buenos Aires Provincia\nINICIO\nACERCA DEL SIBOM\nBOLETINES\nMUNICIPIOS\nADMINISTRACION\nSistema de Boletines Oficiales Municipales (SIBOM)\nSistema de Boletines Oficiales Municipales (SIBOM)\nSistema de Boletines Oficiales Municipales (SIBOM)\nSistema de Boletines Oficiales Municipales (SIBOM)\nSistema de Boletines Oficiales Municipales (SIBOM)\nBoletines/Carmen de Areco\nDecreto Nº1361\nDecreto Nº 1361\nPublicado en versión extractada\nCarmen de Areco, 25/08/2025\nEl Decreto 1360/2025 y; Declárese de interés la tramitación de la Asociación Civil Remedios del Valle (EPI), ETIPSI (El Remanso), y “Juntos se es Mejor”.\nRedes Sociales\nContacto\nAutoridad de Aplicación\nSecretaría General\nSubsecretaría Legal y Técnica\nGuía Servicios\nPortal de trámites\nExpedientes\nSeguridad Vial\nARBA\nBoletín Oficial\nRegistro de las Personas\nContrataciones\nVer Todos\nPolíticas de privacidad\nUso Interno\nWebmail (gba.gob.ar)\nWebmail HORDE\nSistemas\nGDEBA\nPortal del Empleado\nMesa de Ayuda\nSIAPE",
      "tablas": [],
      "montos_extraidos": [],
      "metadata": {
        "longitud_caracteres": 1002,
        "tiene_tablas": false,
        "total_tablas": 0,
        "total_montos": 0
      }
    },
    {
      "id": "2335112",
      "tipo": "decreto",
      "numero": "1362",
      "titulo": "Decreto Nº 1362",
      "fecha": "Carmen de Areco, 25/08/2025",
      "municipio": "Carmen de Areco",
      "url": "https://sibom.slyt.gba.gob.ar/bulletins/14250/contents/2335112",
      "contenido": "Sistema de Boletín Oficial Municipal | Buenos Aires Provincia\nINICIO\nACERCA DEL SIBOM\nBOLETINES\nMUNICIPIOS\nADMINISTRACION\nSistema de Boletines Oficiales Municipales (SIBOM)\nSistema de Boletines Oficiales Municipales (SIBOM)\nSistema de Boletines Oficiales Municipales (SIBOM)\nSistema de Boletines Oficiales Municipales (SIBOM)\nSistema de Boletines Oficiales Municipales (SIBOM)\nBoletines/Carmen de Areco\nDecreto Nº1362\nDecreto Nº 1362\nPublicado en versión extractada\nCarmen de Areco, 25/08/2025\nLas etapas local y regional de JUEGOS BONAERENSES 2025, a desarrollarse durante los meses de julio, agosto y septiembre del corriente año, y; Contrátese, dado que el Municipio no cuenta en la planta con personal profesional afectado y/o dedicado a la tarea descripta en los vistos del presente, al Sr.\nFUSERO, JOSE LUIS\n,\npara efectuar el servicio de traslado de pasajeros, el 29 de agosto, en un todo de acuerdo con el contrato\nRedes Sociales\nContacto\nAutoridad de Aplicación\nSecretaría General\nSubsecretaría Legal y Técnica\nGuía Servicios\nPortal de trámites\nExpedientes\nSeguridad Vial\nARBA\nBoletín Oficial\nRegistro de las Personas\nContrataciones\nVer Todos\nPolíticas de privacidad\nUso Interno\nWebmail (gba.gob.ar)\nWebmail HORDE\nSistemas\nGDEBA\nPortal del Empleado\nMesa de Ayuda\nSIAPE",
      "tablas": [],
      "montos_extraidos": [],
      "metadata": {
        "longitud_caracteres": 1277,
        "tiene_tablas": false,
        "total_tablas": 0,
        "total_montos": 0
      }
    },
    {
      "id": "2335115",
      "tipo": "decreto",
      "numero": "1363",
      "titulo": "Decreto Nº 1363",
      "fecha": "Carmen de Areco, 25/08/2025",
      "municipio": "Carmen de Areco",
      "url": "https://sibom.slyt.gba.gob.ar/bulletins/14250/contents/2335115",
      "contenido": "Sistema de Boletín Oficial Municipal | Buenos Aires Provincia\nINICIO\nACERCA DEL SIBOM\nBOLETINES\nMUNICIPIOS\nADMINISTRACION\nSistema de Boletines Oficiales Municipales (SIBOM)\nSistema de Boletines Oficiales Municipales (SIBOM)\nSistema de Boletines Oficiales Municipales (SIBOM)\nSistema de Boletines Oficiales Municipales (SIBOM)\nSistema de Boletines Oficiales Municipales (SIBOM)\nBoletines/Carmen de Areco\nDecreto Nº1363\nDecreto Nº 1363\nPublicado en versión extractada\nCarmen de Areco, 25/08/2025\nLa solicitud presentada por la Sra.\nLONGOBUCO, BARBARA LISANA\nRedes Sociales\nContacto\nAutoridad de Aplicación\nSecretaría General\nSubsecretaría Legal y Técnica\nGuía Servicios\nPortal de trámites\nExpedientes\nSeguridad Vial\nARBA\nBoletín Oficial\nRegistro de las Personas\nContrataciones\nVer Todos\nPolíticas de privacidad\nUso Interno\nWebmail (gba.gob.ar)\nWebmail HORDE\nSistemas\nGDEBA\nPortal del Empleado\nMesa de Ayuda\nSIAPE",
      "tablas": [],
      "montos_extraidos": [],
      "metadata": {
        "longitud_caracteres": 910,
        "tiene_tablas": false,
        "total_tablas": 0,
        "total_montos": 0
      }
    },
    {
      "id": "2335118",
      "tipo": "decreto",
      "numero": "1364",
      "titulo": "Decreto Nº 1364",
      "fecha": "Carmen de Areco, 25/08/2025",
      "municipio": "Carmen de Areco",
      "url": "https://sibom.slyt.gba.gob.ar/bulletins/14250/contents/2335118",
      "contenido": "Sistema de Boletín Oficial Municipal | Buenos Aires Provincia\nINICIO\nACERCA DEL SIBOM\nBOLETINES\nMUNICIPIOS\nADMINISTRACION\nSistema de Boletines Oficiales Municipales (SIBOM)\nSistema de Boletines Oficiales Municipales (SIBOM)\nSistema de Boletines Oficiales Municipales (SIBOM)\nSistema de Boletines Oficiales Municipales (SIBOM)\nSistema de Boletines Oficiales Municipales (SIBOM)\nBoletines/Carmen de Areco\nDecreto Nº1364\nDecreto Nº 1364\nPublicado en versión extractada\nCarmen de Areco, 25/08/2025\nAcéptese la renuncia y dispóngase el cese, a partir del día 31 de Agosto de 2025, de la Sra.\nRODRIGUEZ, CAROLINA SOL\nal Cargo de\nDIRECTORA DE INGRESOS PÚBLICOS\nquien reviste en la jurisdicción 1110103000 –Categoría programática – 19.00.00 - 110 -PERSONAL SUPERIOR, planta política.-\nRedes Sociales\nContacto\nAutoridad de Aplicación\nSecretaría General\nSubsecretaría Legal y Técnica\nGuía Servicios\nPortal de trámites\nExpedientes\nSeguridad Vial\nARBA\nBoletín Oficial\nRegistro de las Personas\nContrataciones\nVer Todos\nPolíticas de privacidad\nUso Interno\nWebmail (gba.gob.ar)\nWebmail HORDE\nSistemas\nGDEBA\nPortal del Empleado\nMesa de Ayuda\nSIAPE",
      "tablas": [],
      "montos_extraidos": [],
      "metadata": {
        "longitud_caracteres": 1131,
        "tiene_tablas": false,
        "total_tablas": 0,
        "total_montos": 0
      }
    },
    {
      "id": "2335121",
      "tipo": "decreto",
      "numero": "1365",
      "titulo": "Decreto Nº 1365",
      "fecha": "Carmen de Areco, 25/08/2025",
      "municipio": "Carmen de Areco",
      "url": "https://sibom.slyt.gba.gob.ar/bulletins/14250/contents/2335121",
      "contenido": "Sistema de Boletín Oficial Municipal | Buenos Aires Provincia\nINICIO\nACERCA DEL SIBOM\nBOLETINES\nMUNICIPIOS\nADMINISTRACION\nSistema de Boletines Oficiales Municipales (SIBOM)\nSistema de Boletines Oficiales Municipales (SIBOM)\nSistema de Boletines Oficiales Municipales (SIBOM)\nSistema de Boletines Oficiales Municipales (SIBOM)\nSistema de Boletines Oficiales Municipales (SIBOM)\nBoletines/Carmen de Areco\nDecreto Nº1365\nDecreto Nº 1365\nPublicado en versión extractada\nCarmen de Areco, 25/08/2025\nLa solicitud presentada por el Sr.\nHIDALGO, CARLOS FEDERICO\nRedes Sociales\nContacto\nAutoridad de Aplicación\nSecretaría General\nSubsecretaría Legal y Técnica\nGuía Servicios\nPortal de trámites\nExpedientes\nSeguridad Vial\nARBA\nBoletín Oficial\nRegistro de las Personas\nContrataciones\nVer Todos\nPolíticas de privacidad\nUso Interno\nWebmail (gba.gob.ar)\nWebmail HORDE\nSistemas\nGDEBA\nPortal del Empleado\nMesa de Ayuda\nSIAPE",
      "tablas": [],
      "montos_extraidos": [],
      "metadata": {
        "longitud_caracteres": 908,
        "tiene_tablas": false,
        "total_tablas": 0,
        "total_montos": 0
      }
    },
    {
      "id": "2335126",
      "tipo": "decreto",
      "numero": "1366",
      "titulo": "Decreto Nº 1366",
      "fecha": "Carmen de Areco, 25/08/2025",
      "municipio": "Carmen de Areco",
      "url": "https://sibom.slyt.gba.gob.ar/bulletins/14250/contents/2335126",
      "contenido": "Sistema de Boletín Oficial Municipal | Buenos Aires Provincia\nINICIO\nACERCA DEL SIBOM\nBOLETINES\nMUNICIPIOS\nADMINISTRACION\nSistema de Boletines Oficiales Municipales (SIBOM)\nSistema de Boletines Oficiales Municipales (SIBOM)\nSistema de Boletines Oficiales Municipales (SIBOM)\nSistema de Boletines Oficiales Municipales (SIBOM)\nSistema de Boletines Oficiales Municipales (SIBOM)\nBoletines/Carmen de Areco\nDecreto Nº1366\nDecreto Nº 1366\nPublicado en versión extractada\nCarmen de Areco, 25/08/2025\nLa solicitud presentada por el Sr.\nPEREZ, LUIS ALBERTO\nRedes Sociales\nContacto\nAutoridad de Aplicación\nSecretaría General\nSubsecretaría Legal y Técnica\nGuía Servicios\nPortal de trámites\nExpedientes\nSeguridad Vial\nARBA\nBoletín Oficial\nRegistro de las Personas\nContrataciones\nVer Todos\nPolíticas de privacidad\nUso Interno\nWebmail (gba.gob.ar)\nWebmail HORDE\nSistemas\nGDEBA\nPortal del Empleado\nMesa de Ayuda\nSIAPE",
      "tablas": [],
      "montos_extraidos": [],
      "metadata": {
        "longitud_caracteres": 903,
        "tiene_tablas": false,
        "total_tablas": 0,
        "total_montos": 0
      }
    },
    {
      "id": "2335129",
      "tipo": "decreto",
      "numero": "1367",
      "titulo": "Decreto Nº 1367",
      "fecha": "Carmen de Areco, 25/08/2025",
      "municipio": "Carmen de Areco",
      "url": "https://sibom.slyt.gba.gob.ar/bulletins/14250/contents/2335129",
      "contenido": "Sistema de Boletín Oficial Municipal | Buenos Aires Provincia\nINICIO\nACERCA DEL SIBOM\nBOLETINES\nMUNICIPIOS\nADMINISTRACION\nSistema de Boletines Oficiales Municipales (SIBOM)\nSistema de Boletines Oficiales Municipales (SIBOM)\nSistema de Boletines Oficiales Municipales (SIBOM)\nSistema de Boletines Oficiales Municipales (SIBOM)\nSistema de Boletines Oficiales Municipales (SIBOM)\nBoletines/Carmen de Areco\nDecreto Nº1367\nDecreto Nº 1367\nPublicado en versión extractada\nCarmen de Areco, 25/08/2025\nLa solicitud presentada por el Sr.\nROJO, GERARDO GABRIEL\nRedes Sociales\nContacto\nAutoridad de Aplicación\nSecretaría General\nSubsecretaría Legal y Técnica\nGuía Servicios\nPortal de trámites\nExpedientes\nSeguridad Vial\nARBA\nBoletín Oficial\nRegistro de las Personas\nContrataciones\nVer Todos\nPolíticas de privacidad\nUso Interno\nWebmail (gba.gob.ar)\nWebmail HORDE\nSistemas\nGDEBA\nPortal del Empleado\nMesa de Ayuda\nSIAPE",
      "tablas": [],
      "montos_extraidos": [],
      "metadata": {
        "longitud_caracteres": 905,
        "tiene_tablas": false,
        "total_tablas": 0,
        "total_montos": 0
      }
    },
    {
      "id": "2335130",
      "tipo": "decreto",
      "numero": "1368",
      "titulo": "Decreto Nº 1368",
      "fecha": "Carmen de Areco, 25/08/2025",
      "municipio": "Carmen de Areco",
      "url": "https://sibom.slyt.gba.gob.ar/bulletins/14250/contents/2335130",
      "contenido": "Sistema de Boletín Oficial Municipal | Buenos Aires Provincia\nINICIO\nACERCA DEL SIBOM\nBOLETINES\nMUNICIPIOS\nADMINISTRACION\nSistema de Boletines Oficiales Municipales (SIBOM)\nSistema de Boletines Oficiales Municipales (SIBOM)\nSistema de Boletines Oficiales Municipales (SIBOM)\nSistema de Boletines Oficiales Municipales (SIBOM)\nSistema de Boletines Oficiales Municipales (SIBOM)\nBoletines/Carmen de Areco\nDecreto Nº1368\nDecreto Nº 1368\nPublicado en versión extractada\nCarmen de Areco, 25/08/2025\nLa solicitud presentada por la Sra.\nALEGRE, MARIA FERNANDA\nRedes Sociales\nContacto\nAutoridad de Aplicación\nSecretaría General\nSubsecretaría Legal y Técnica\nGuía Servicios\nPortal de trámites\nExpedientes\nSeguridad Vial\nARBA\nBoletín Oficial\nRegistro de las Personas\nContrataciones\nVer Todos\nPolíticas de privacidad\nUso Interno\nWebmail (gba.gob.ar)\nWebmail HORDE\nSistemas\nGDEBA\nPortal del Empleado\nMesa de Ayuda\nSIAPE",
      "tablas": [],
      "montos_extraidos": [],
      "metadata": {
        "longitud_caracteres": 907,
        "tiene_tablas": false,
        "total_tablas": 0,
        "total_montos": 0
      }
    },
    {
      "id": "2335135",
      "tipo": "decreto",
      "numero": "1369",
      "titulo": "Decreto Nº 1369",
      "fecha": "Carmen de Areco, 25/08/2025",
      "municipio": "Carmen de Areco",
      "url": "https://sibom.slyt.gba.gob.ar/bulletins/14250/contents/2335135",
      "contenido": "Sistema de Boletín Oficial Municipal | Buenos Aires Provincia\nINICIO\nACERCA DEL SIBOM\nBOLETINES\nMUNICIPIOS\nADMINISTRACION\nSistema de Boletines Oficiales Municipales (SIBOM)\nSistema de Boletines Oficiales Municipales (SIBOM)\nSistema de Boletines Oficiales Municipales (SIBOM)\nSistema de Boletines Oficiales Municipales (SIBOM)\nSistema de Boletines Oficiales Municipales (SIBOM)\nBoletines/Carmen de Areco\nDecreto Nº1369\nDecreto Nº 1369\nPublicado en versión extractada\nCarmen de Areco, 25/08/2025\nLa solicitud presentada por la Sra.\nFERREIRO, MARIA LORENA\nRedes Sociales\nContacto\nAutoridad de Aplicación\nSecretaría General\nSubsecretaría Legal y Técnica\nGuía Servicios\nPortal de trámites\nExpedientes\nSeguridad Vial\nARBA\nBoletín Oficial\nRegistro de las Personas\nContrataciones\nVer Todos\nPolíticas de privacidad\nUso Interno\nWebmail (gba.gob.ar)\nWebmail HORDE\nSistemas\nGDEBA\nPortal del Empleado\nMesa de Ayuda\nSIAPE",
      "tablas": [],
      "montos_extraidos": [],
      "metadata": {
        "longitud_caracteres": 907,
        "tiene_tablas": false,
        "total_tablas": 0,
        "total_montos": 0
      }
    },
    {
      "id": "2335136",
      "tipo": "decreto",
      "numero": "1370",
      "titulo": "Decreto Nº 1370",
      "fecha": "Carmen de Areco, 25/08/2025",
      "municipio": "Carmen de Areco",
      "url": "https://sibom.slyt.gba.gob.ar/bulletins/14250/contents/2335136",
      "contenido": "Sistema de Boletín Oficial Municipal | Buenos Aires Provincia\nINICIO\nACERCA DEL SIBOM\nBOLETINES\nMUNICIPIOS\nADMINISTRACION\nSistema de Boletines Oficiales Municipales (SIBOM)\nSistema de Boletines Oficiales Municipales (SIBOM)\nSistema de Boletines Oficiales Municipales (SIBOM)\nSistema de Boletines Oficiales Municipales (SIBOM)\nSistema de Boletines Oficiales Municipales (SIBOM)\nBoletines/Carmen de Areco\nDecreto Nº1370\nDecreto Nº 1370\nPublicado en versión extractada\nCarmen de Areco, 25/08/2025\nLa solicitud presentada por la Sra.\nTECHEIRA, MARISOL\nRedes Sociales\nContacto\nAutoridad de Aplicación\nSecretaría General\nSubsecretaría Legal y Técnica\nGuía Servicios\nPortal de trámites\nExpedientes\nSeguridad Vial\nARBA\nBoletín Oficial\nRegistro de las Personas\nContrataciones\nVer Todos\nPolíticas de privacidad\nUso Interno\nWebmail (gba.gob.ar)\nWebmail HORDE\nSistemas\nGDEBA\nPortal del Empleado\nMesa de Ayuda\nSIAPE",
      "tablas": [],
      "montos_extraidos": [],
      "metadata": {
        "longitud_caracteres": 902,
        "tiene_tablas": false,
        "total_tablas": 0,
        "total_montos": 0
      }
    },
    {
      "id": "2335137",
      "tipo": "decreto",
      "numero": "1371",
      "titulo": "Decreto Nº 1371",
      "fecha": "Carmen de Areco, 25/08/2025",
      "municipio": "Carmen de Areco",
      "url": "https://sibom.slyt.gba.gob.ar/bulletins/14250/contents/2335137",
      "contenido": "Sistema de Boletín Oficial Municipal | Buenos Aires Provincia\nINICIO\nACERCA DEL SIBOM\nBOLETINES\nMUNICIPIOS\nADMINISTRACION\nSistema de Boletines Oficiales Municipales (SIBOM)\nSistema de Boletines Oficiales Municipales (SIBOM)\nSistema de Boletines Oficiales Municipales (SIBOM)\nSistema de Boletines Oficiales Municipales (SIBOM)\nSistema de Boletines Oficiales Municipales (SIBOM)\nBoletines/Carmen de Areco\nDecreto Nº1371\nDecreto Nº 1371\nPublicado en versión extractada\nCarmen de Areco, 25/08/2025\nLa solicitud presentada por la Sra.\nAGUIRRE, ANGELES\nRedes Sociales\nContacto\nAutoridad de Aplicación\nSecretaría General\nSubsecretaría Legal y Técnica\nGuía Servicios\nPortal de trámites\nExpedientes\nSeguridad Vial\nARBA\nBoletín Oficial\nRegistro de las Personas\nContrataciones\nVer Todos\nPolíticas de privacidad\nUso Interno\nWebmail (gba.gob.ar)\nWebmail HORDE\nSistemas\nGDEBA\nPortal del Empleado\nMesa de Ayuda\nSIAPE",
      "tablas": [],
      "montos_extraidos": [],
      "metadata": {
        "longitud_caracteres": 901,
        "tiene_tablas": false,
        "total_tablas": 0,
        "total_montos": 0
      }
    }
  ],
  "metadata_boletin": {
    "total_caracteres": 102323,
    "total_tablas": 0,
    "total_montos": 16,
    "fecha_scraping": "2026-01-16T07:55:46Z",
    "version_scraper": "2.0"
  }
}