{
  "municipio": "Carmen de Areco",
  "numero_boletin": "31º",
  "fecha_boletin": "07/01/2026",
  "boletin_url": "https://sibom.slyt.gba.gob.ar/bulletins/14203",
  "status": "completed",
  "total_normas": 62,
  "normas": [
    {
      "id": "2332045",
      "tipo": "decreto",
      "numero": "1161",
      "titulo": "Decreto Nº 1161",
      "fecha": "Carmen de Areco, 29/07/2025",
      "municipio": "Carmen de Areco",
      "url": "https://sibom.slyt.gba.gob.ar/bulletins/14203/contents/2332045",
      "contenido": "Sistema de Boletín Oficial Municipal | Buenos Aires Provincia\nINICIO\nACERCA DEL SIBOM\nBOLETINES\nMUNICIPIOS\nADMINISTRACION\nSistema de Boletines Oficiales Municipales (SIBOM)\nSistema de Boletines Oficiales Municipales (SIBOM)\nSistema de Boletines Oficiales Municipales (SIBOM)\nSistema de Boletines Oficiales Municipales (SIBOM)\nSistema de Boletines Oficiales Municipales (SIBOM)\nBoletines/Carmen de Areco\nDecreto Nº1161\nDecreto Nº 1161\nPublicado en versión extractada\nCarmen de Areco, 29/07/2025\nDispóngase el cese,a partir del día 31 de Julio de 2025, del Sr.\nCAMPOS, EDUARDO, ROBERTO\n,\nen el cargo de\nDIRECTOR DE INCLUSIÓN SOCIAL\n, quien reviste en la jurisdicción 1110114000 –Categoría programática – 19.01.00 - 110 -PERSONAL SUPERIOR, planta política.-\nRedes Sociales\nContacto\nAutoridad de Aplicación\nSecretaría General\nSubsecretaría Legal y Técnica\nGuía Servicios\nPortal de trámites\nExpedientes\nSeguridad Vial\nARBA\nBoletín Oficial\nRegistro de las Personas\nContrataciones\nVer Todos\nPolíticas de privacidad\nUso Interno\nWebmail (gba.gob.ar)\nWebmail HORDE\nSistemas\nGDEBA\nPortal del Empleado\nMesa de Ayuda\nSIAPE",
      "tablas": [],
      "montos_extraidos": [],
      "metadata": {
        "longitud_caracteres": 1109,
        "tiene_tablas": false,
        "total_tablas": 0,
        "total_montos": 0
      }
    },
    {
      "id": "2332048",
      "tipo": "decreto",
      "numero": "1162",
      "titulo": "Decreto Nº 1162",
      "fecha": "Carmen de Areco, 29/07/2025",
      "municipio": "Carmen de Areco",
      "url": "https://sibom.slyt.gba.gob.ar/bulletins/14203/contents/2332048",
      "contenido": "Sistema de Boletín Oficial Municipal | Buenos Aires Provincia\nINICIO\nACERCA DEL SIBOM\nBOLETINES\nMUNICIPIOS\nADMINISTRACION\nSistema de Boletines Oficiales Municipales (SIBOM)\nSistema de Boletines Oficiales Municipales (SIBOM)\nSistema de Boletines Oficiales Municipales (SIBOM)\nSistema de Boletines Oficiales Municipales (SIBOM)\nSistema de Boletines Oficiales Municipales (SIBOM)\nBoletines/Carmen de Areco\nDecreto Nº1162\nDecreto Nº 1162\nPublicado en versión extractada\nCarmen de Areco, 29/07/2025\nDesígnese al Sr.\nCAMPOS, EDUARDO, ROBERTO\n,\ncomo\nDIRECTOR DE OBRAS PÚBLICAS\n,\nquien reviste en la jurisdicción 1110118000 –Categoría programática – 24.01.00 - 110 -PERSONAL SUPERIOR, planta política.-\nRedes Sociales\nContacto\nAutoridad de Aplicación\nSecretaría General\nSubsecretaría Legal y Técnica\nGuía Servicios\nPortal de trámites\nExpedientes\nSeguridad Vial\nARBA\nBoletín Oficial\nRegistro de las Personas\nContrataciones\nVer Todos\nPolíticas de privacidad\nUso Interno\nWebmail (gba.gob.ar)\nWebmail HORDE\nSistemas\nGDEBA\nPortal del Empleado\nMesa de Ayuda\nSIAPE",
      "tablas": [],
      "montos_extraidos": [],
      "metadata": {
        "longitud_caracteres": 1049,
        "tiene_tablas": false,
        "total_tablas": 0,
        "total_montos": 0
      }
    },
    {
      "id": "2332051",
      "tipo": "decreto",
      "numero": "1163",
      "titulo": "Decreto Nº 1163",
      "fecha": "Carmen de Areco, 29/07/2025",
      "municipio": "Carmen de Areco",
      "url": "https://sibom.slyt.gba.gob.ar/bulletins/14203/contents/2332051",
      "contenido": "Sistema de Boletín Oficial Municipal | Buenos Aires Provincia\nINICIO\nACERCA DEL SIBOM\nBOLETINES\nMUNICIPIOS\nADMINISTRACION\nSistema de Boletines Oficiales Municipales (SIBOM)\nSistema de Boletines Oficiales Municipales (SIBOM)\nSistema de Boletines Oficiales Municipales (SIBOM)\nSistema de Boletines Oficiales Municipales (SIBOM)\nSistema de Boletines Oficiales Municipales (SIBOM)\nBoletines/Carmen de Areco\nDecreto Nº1163\nDecreto Nº 1163\nPublicado en versión extractada\nCarmen de Areco, 29/07/2025\nDesígnese al Sr.\nOSCAR, ADRIAN ALBERTO\n,\ncomo\nDIRECTOR DE INCLUSIÓN SOCIAL\n,\nquien reviste en la jurisdicción 1110114000 –Categoría programática – 19.01.00 - 110 -PERSONAL SUPERIOR, planta política.-\nRedes Sociales\nContacto\nAutoridad de Aplicación\nSecretaría General\nSubsecretaría Legal y Técnica\nGuía Servicios\nPortal de trámites\nExpedientes\nSeguridad Vial\nARBA\nBoletín Oficial\nRegistro de las Personas\nContrataciones\nVer Todos\nPolíticas de privacidad\nUso Interno\nWebmail (gba.gob.ar)\nWebmail HORDE\nSistemas\nGDEBA\nPortal del Empleado\nMesa de Ayuda\nSIAPE",
      "tablas": [],
      "montos_extraidos": [],
      "metadata": {
        "longitud_caracteres": 1048,
        "tiene_tablas": false,
        "total_tablas": 0,
        "total_montos": 0
      }
    },
    {
      "id": "2332067",
      "tipo": "decreto",
      "numero": "1164",
      "titulo": "Decreto Nº 1164",
      "fecha": "Carmen de Areco, 29/07/2025",
      "municipio": "Carmen de Areco",
      "url": "https://sibom.slyt.gba.gob.ar/bulletins/14203/contents/2332067",
      "contenido": "Sistema de Boletín Oficial Municipal | Buenos Aires Provincia\nINICIO\nACERCA DEL SIBOM\nBOLETINES\nMUNICIPIOS\nADMINISTRACION\nSistema de Boletines Oficiales Municipales (SIBOM)\nSistema de Boletines Oficiales Municipales (SIBOM)\nSistema de Boletines Oficiales Municipales (SIBOM)\nSistema de Boletines Oficiales Municipales (SIBOM)\nSistema de Boletines Oficiales Municipales (SIBOM)\nBoletines/Carmen de Areco\nDecreto Nº1164\nDecreto Nº 1164\nPublicado en versión extractada\nCarmen de Areco, 29/07/2025\nConceder la  licencia sin goce de haberes, por razones políticas, desdeel  día 01 de Agosto  de 2025  y hasta el día 10 de Diciembre de 2025, inclusive, al agente Municipal Sr.\nRIOS, FATIMA ALDANA\nRedes Sociales\nContacto\nAutoridad de Aplicación\nSecretaría General\nSubsecretaría Legal y Técnica\nGuía Servicios\nPortal de trámites\nExpedientes\nSeguridad Vial\nARBA\nBoletín Oficial\nRegistro de las Personas\nContrataciones\nVer Todos\nPolíticas de privacidad\nUso Interno\nWebmail (gba.gob.ar)\nWebmail HORDE\nSistemas\nGDEBA\nPortal del Empleado\nMesa de Ayuda\nSIAPE",
      "tablas": [],
      "montos_extraidos": [],
      "metadata": {
        "longitud_caracteres": 1045,
        "tiene_tablas": false,
        "total_tablas": 0,
        "total_montos": 0
      }
    },
    {
      "id": "2332071",
      "tipo": "decreto",
      "numero": "1165",
      "titulo": "Decreto Nº 1165",
      "fecha": "Carmen de Areco, 29/07/2025",
      "municipio": "Carmen de Areco",
      "url": "https://sibom.slyt.gba.gob.ar/bulletins/14203/contents/2332071",
      "contenido": "Sistema de Boletín Oficial Municipal | Buenos Aires Provincia\nINICIO\nACERCA DEL SIBOM\nBOLETINES\nMUNICIPIOS\nADMINISTRACION\nSistema de Boletines Oficiales Municipales (SIBOM)\nSistema de Boletines Oficiales Municipales (SIBOM)\nSistema de Boletines Oficiales Municipales (SIBOM)\nSistema de Boletines Oficiales Municipales (SIBOM)\nSistema de Boletines Oficiales Municipales (SIBOM)\nBoletines/Carmen de Areco\nDecreto Nº1165\nDecreto Nº 1165\nPublicado en versión extractada\nCarmen de Areco, 29/07/2025\nDispóngase el cese, a partir del día 31 de Julio de 2025, de la Sra.\nORSI, LUCIA FERNANDA\n,\nal Cargo\nde COORDINADORA\n,\nquien reviste en la jurisdicción 1110114000 –Categoría programática – 19.03.00 - 110 -PERSONAL SUPERIOR, planta política -\nRedes Sociales\nContacto\nAutoridad de Aplicación\nSecretaría General\nSubsecretaría Legal y Técnica\nGuía Servicios\nPortal de trámites\nExpedientes\nSeguridad Vial\nARBA\nBoletín Oficial\nRegistro de las Personas\nContrataciones\nVer Todos\nPolíticas de privacidad\nUso Interno\nWebmail (gba.gob.ar)\nWebmail HORDE\nSistemas\nGDEBA\nPortal del Empleado\nMesa de Ayuda\nSIAPE",
      "tablas": [],
      "montos_extraidos": [],
      "metadata": {
        "longitud_caracteres": 1090,
        "tiene_tablas": false,
        "total_tablas": 0,
        "total_montos": 0
      }
    },
    {
      "id": "2332073",
      "tipo": "decreto",
      "numero": "1166",
      "titulo": "Decreto Nº 1166",
      "fecha": "Carmen de Areco, 29/07/2025",
      "municipio": "Carmen de Areco",
      "url": "https://sibom.slyt.gba.gob.ar/bulletins/14203/contents/2332073",
      "contenido": "Sistema de Boletín Oficial Municipal | Buenos Aires Provincia\nINICIO\nACERCA DEL SIBOM\nBOLETINES\nMUNICIPIOS\nADMINISTRACION\nSistema de Boletines Oficiales Municipales (SIBOM)\nSistema de Boletines Oficiales Municipales (SIBOM)\nSistema de Boletines Oficiales Municipales (SIBOM)\nSistema de Boletines Oficiales Municipales (SIBOM)\nSistema de Boletines Oficiales Municipales (SIBOM)\nBoletines/Carmen de Areco\nDecreto Nº1166\nDecreto Nº 1166\nPublicado en versión extractada\nCarmen de Areco, 29/07/2025\nDesígnese a la Sra.\nRIVAROLA, LUCIA MACARENA\n,\ncomo\nCoordinadora\n,\nquien reviste en la jurisdicción 1110114000 –Categoría programática – 19.03.00 - 110 -PERSONAL SUPERIOR, planta política. -\nRedes Sociales\nContacto\nAutoridad de Aplicación\nSecretaría General\nSubsecretaría Legal y Técnica\nGuía Servicios\nPortal de trámites\nExpedientes\nSeguridad Vial\nARBA\nBoletín Oficial\nRegistro de las Personas\nContrataciones\nVer Todos\nPolíticas de privacidad\nUso Interno\nWebmail (gba.gob.ar)\nWebmail HORDE\nSistemas\nGDEBA\nPortal del Empleado\nMesa de Ayuda\nSIAPE",
      "tablas": [],
      "montos_extraidos": [],
      "metadata": {
        "longitud_caracteres": 1039,
        "tiene_tablas": false,
        "total_tablas": 0,
        "total_montos": 0
      }
    },
    {
      "id": "2332078",
      "tipo": "decreto",
      "numero": "1166",
      "titulo": "Decreto Nº 1166",
      "fecha": "Carmen de Areco, 29/07/2025",
      "municipio": "Carmen de Areco",
      "url": "https://sibom.slyt.gba.gob.ar/bulletins/14203/contents/2332078",
      "contenido": "Sistema de Boletín Oficial Municipal | Buenos Aires Provincia\nINICIO\nACERCA DEL SIBOM\nBOLETINES\nMUNICIPIOS\nADMINISTRACION\nSistema de Boletines Oficiales Municipales (SIBOM)\nSistema de Boletines Oficiales Municipales (SIBOM)\nSistema de Boletines Oficiales Municipales (SIBOM)\nSistema de Boletines Oficiales Municipales (SIBOM)\nSistema de Boletines Oficiales Municipales (SIBOM)\nBoletines/Carmen de Areco\nDecreto Nº1166\nDecreto Nº 1166\nPublicado en versión extractada\nCarmen de Areco, 29/07/2025\nEstablézcase desde el mes de Julio de 2025 y hasta el 31 de Diciembre del cte. año, escala salarial equivalente a 40 horas semanales,  al Sr.\nRISSO, TOMAS JULIAN,\ncomo\nSECRETARIO DE HACIENDA Y FINANZAS\n,,\nquien reviste en la jurisdicción 1110103000 –Categoría programática – 01.00.00 - 110 -PERSONAL SUPERIOR, planta política\nRedes Sociales\nContacto\nAutoridad de Aplicación\nSecretaría General\nSubsecretaría Legal y Técnica\nGuía Servicios\nPortal de trámites\nExpedientes\nSeguridad Vial\nARBA\nBoletín Oficial\nRegistro de las Personas\nContrataciones\nVer Todos\nPolíticas de privacidad\nUso Interno\nWebmail (gba.gob.ar)\nWebmail HORDE\nSistemas\nGDEBA\nPortal del Empleado\nMesa de Ayuda\nSIAPE",
      "tablas": [],
      "montos_extraidos": [],
      "metadata": {
        "longitud_caracteres": 1174,
        "tiene_tablas": false,
        "total_tablas": 0,
        "total_montos": 0
      }
    },
    {
      "id": "2332081",
      "tipo": "decreto",
      "numero": "1168",
      "titulo": "Decreto Nº 1168",
      "fecha": "Carmen de Areco, 29/07/2025",
      "municipio": "Carmen de Areco",
      "url": "https://sibom.slyt.gba.gob.ar/bulletins/14203/contents/2332081",
      "contenido": "Sistema de Boletín Oficial Municipal | Buenos Aires Provincia\nINICIO\nACERCA DEL SIBOM\nBOLETINES\nMUNICIPIOS\nADMINISTRACION\nSistema de Boletines Oficiales Municipales (SIBOM)\nSistema de Boletines Oficiales Municipales (SIBOM)\nSistema de Boletines Oficiales Municipales (SIBOM)\nSistema de Boletines Oficiales Municipales (SIBOM)\nSistema de Boletines Oficiales Municipales (SIBOM)\nBoletines/Carmen de Areco\nDecreto Nº1168\nDecreto Nº 1168\nPublicado en versión extractada\nCarmen de Areco, 29/07/2025\nLo dispuesto por el art. 130 bis de la Ley Orgánica de las Municipalidades, introducido por la ley 11.838.-\nCompensase las deudas fiscales de los contribuyentes con las acreencias que a su vez tales contribuyentes tienen para percibir de este Municipio, hasta la suma menor, según el detalle que consta en el ANEXO I\nRedes Sociales\nContacto\nAutoridad de Aplicación\nSecretaría General\nSubsecretaría Legal y Técnica\nGuía Servicios\nPortal de trámites\nExpedientes\nSeguridad Vial\nARBA\nBoletín Oficial\nRegistro de las Personas\nContrataciones\nVer Todos\nPolíticas de privacidad\nUso Interno\nWebmail (gba.gob.ar)\nWebmail HORDE\nSistemas\nGDEBA\nPortal del Empleado\nMesa de Ayuda\nSIAPE",
      "tablas": [],
      "montos_extraidos": [],
      "metadata": {
        "longitud_caracteres": 1165,
        "tiene_tablas": false,
        "total_tablas": 0,
        "total_montos": 0
      }
    },
    {
      "id": "2332085",
      "tipo": "decreto",
      "numero": "1169",
      "titulo": "Decreto Nº 1169",
      "fecha": "Carmen de Areco, 29/07/2025",
      "municipio": "Carmen de Areco",
      "url": "https://sibom.slyt.gba.gob.ar/bulletins/14203/contents/2332085",
      "contenido": "Sistema de Boletín Oficial Municipal | Buenos Aires Provincia\nINICIO\nACERCA DEL SIBOM\nBOLETINES\nMUNICIPIOS\nADMINISTRACION\nSistema de Boletines Oficiales Municipales (SIBOM)\nSistema de Boletines Oficiales Municipales (SIBOM)\nSistema de Boletines Oficiales Municipales (SIBOM)\nSistema de Boletines Oficiales Municipales (SIBOM)\nSistema de Boletines Oficiales Municipales (SIBOM)\nBoletines/Carmen de Areco\nDecreto Nº1169\nDecreto Nº 1169\nPublicado en versión extractada\nCarmen de Areco, 29/07/2025\nConceder la  licencia sin goce de haberes, desde el  día 01 de Julio  de 2025  y hasta el día 31 de Agosto de 2025, inclusive, al agente Municipal Sr.\nFONTANO, JAZMIN,\nRedes Sociales\nContacto\nAutoridad de Aplicación\nSecretaría General\nSubsecretaría Legal y Técnica\nGuía Servicios\nPortal de trámites\nExpedientes\nSeguridad Vial\nARBA\nBoletín Oficial\nRegistro de las Personas\nContrataciones\nVer Todos\nPolíticas de privacidad\nUso Interno\nWebmail (gba.gob.ar)\nWebmail HORDE\nSistemas\nGDEBA\nPortal del Empleado\nMesa de Ayuda\nSIAPE",
      "tablas": [],
      "montos_extraidos": [],
      "metadata": {
        "longitud_caracteres": 1016,
        "tiene_tablas": false,
        "total_tablas": 0,
        "total_montos": 0
      }
    },
    {
      "id": "2332089",
      "tipo": "decreto",
      "numero": "1170",
      "titulo": "Decreto Nº 1170",
      "fecha": "Carmen de Areco, 29/07/2025",
      "municipio": "Carmen de Areco",
      "url": "https://sibom.slyt.gba.gob.ar/bulletins/14203/contents/2332089",
      "contenido": "Sistema de Boletín Oficial Municipal | Buenos Aires Provincia\nINICIO\nACERCA DEL SIBOM\nBOLETINES\nMUNICIPIOS\nADMINISTRACION\nSistema de Boletines Oficiales Municipales (SIBOM)\nSistema de Boletines Oficiales Municipales (SIBOM)\nSistema de Boletines Oficiales Municipales (SIBOM)\nSistema de Boletines Oficiales Municipales (SIBOM)\nSistema de Boletines Oficiales Municipales (SIBOM)\nBoletines/Carmen de Areco\nDecreto Nº1170\nDecreto Nº 1170\nPublicado en versión extractada\nCarmen de Areco, 29/07/2025\nLa solicitud presentada por la Sra.\nROMERO, CAMILA AYELEN\nRedes Sociales\nContacto\nAutoridad de Aplicación\nSecretaría General\nSubsecretaría Legal y Técnica\nGuía Servicios\nPortal de trámites\nExpedientes\nSeguridad Vial\nARBA\nBoletín Oficial\nRegistro de las Personas\nContrataciones\nVer Todos\nPolíticas de privacidad\nUso Interno\nWebmail (gba.gob.ar)\nWebmail HORDE\nSistemas\nGDEBA\nPortal del Empleado\nMesa de Ayuda\nSIAPE",
      "tablas": [],
      "montos_extraidos": [],
      "metadata": {
        "longitud_caracteres": 906,
        "tiene_tablas": false,
        "total_tablas": 0,
        "total_montos": 0
      }
    },
    {
      "id": "2332093",
      "tipo": "decreto",
      "numero": "1171",
      "titulo": "Decreto Nº 1171",
      "fecha": "Carmen de Areco, 29/07/2025",
      "municipio": "Carmen de Areco",
      "url": "https://sibom.slyt.gba.gob.ar/bulletins/14203/contents/2332093",
      "contenido": "Sistema de Boletín Oficial Municipal | Buenos Aires Provincia\nINICIO\nACERCA DEL SIBOM\nBOLETINES\nMUNICIPIOS\nADMINISTRACION\nSistema de Boletines Oficiales Municipales (SIBOM)\nSistema de Boletines Oficiales Municipales (SIBOM)\nSistema de Boletines Oficiales Municipales (SIBOM)\nSistema de Boletines Oficiales Municipales (SIBOM)\nSistema de Boletines Oficiales Municipales (SIBOM)\nBoletines/Carmen de Areco\nDecreto Nº1171\nDecreto Nº 1171\nPublicado en versión extractada\nCarmen de Areco, 29/07/2025\nLa solicitud presentada por el Sr.\nPEREZ, GONZALO SIMON\nRedes Sociales\nContacto\nAutoridad de Aplicación\nSecretaría General\nSubsecretaría Legal y Técnica\nGuía Servicios\nPortal de trámites\nExpedientes\nSeguridad Vial\nARBA\nBoletín Oficial\nRegistro de las Personas\nContrataciones\nVer Todos\nPolíticas de privacidad\nUso Interno\nWebmail (gba.gob.ar)\nWebmail HORDE\nSistemas\nGDEBA\nPortal del Empleado\nMesa de Ayuda\nSIAPE",
      "tablas": [],
      "montos_extraidos": [],
      "metadata": {
        "longitud_caracteres": 904,
        "tiene_tablas": false,
        "total_tablas": 0,
        "total_montos": 0
      }
    },
    {
      "id": "2332094",
      "tipo": "decreto",
      "numero": "1172",
      "titulo": "Decreto Nº 1172",
      "fecha": "Carmen de Areco, 29/07/2025",
      "municipio": "Carmen de Areco",
      "url": "https://sibom.slyt.gba.gob.ar/bulletins/14203/contents/2332094",
      "contenido": "Sistema de Boletín Oficial Municipal | Buenos Aires Provincia\nINICIO\nACERCA DEL SIBOM\nBOLETINES\nMUNICIPIOS\nADMINISTRACION\nSistema de Boletines Oficiales Municipales (SIBOM)\nSistema de Boletines Oficiales Municipales (SIBOM)\nSistema de Boletines Oficiales Municipales (SIBOM)\nSistema de Boletines Oficiales Municipales (SIBOM)\nSistema de Boletines Oficiales Municipales (SIBOM)\nBoletines/Carmen de Areco\nDecreto Nº1172\nDecreto Nº 1172\nPublicado en versión extractada\nCarmen de Areco, 29/07/2025\nLa solicitud presentada por la Sra.\nBARBOZA, CLAUDIA BETIANA\nRedes Sociales\nContacto\nAutoridad de Aplicación\nSecretaría General\nSubsecretaría Legal y Técnica\nGuía Servicios\nPortal de trámites\nExpedientes\nSeguridad Vial\nARBA\nBoletín Oficial\nRegistro de las Personas\nContrataciones\nVer Todos\nPolíticas de privacidad\nUso Interno\nWebmail (gba.gob.ar)\nWebmail HORDE\nSistemas\nGDEBA\nPortal del Empleado\nMesa de Ayuda\nSIAPE",
      "tablas": [],
      "montos_extraidos": [],
      "metadata": {
        "longitud_caracteres": 909,
        "tiene_tablas": false,
        "total_tablas": 0,
        "total_montos": 0
      }
    },
    {
      "id": "2332096",
      "tipo": "decreto",
      "numero": "1173",
      "titulo": "Decreto Nº 1173",
      "fecha": "Carmen de Areco, 29/07/2025",
      "municipio": "Carmen de Areco",
      "url": "https://sibom.slyt.gba.gob.ar/bulletins/14203/contents/2332096",
      "contenido": "Sistema de Boletín Oficial Municipal | Buenos Aires Provincia\nINICIO\nACERCA DEL SIBOM\nBOLETINES\nMUNICIPIOS\nADMINISTRACION\nSistema de Boletines Oficiales Municipales (SIBOM)\nSistema de Boletines Oficiales Municipales (SIBOM)\nSistema de Boletines Oficiales Municipales (SIBOM)\nSistema de Boletines Oficiales Municipales (SIBOM)\nSistema de Boletines Oficiales Municipales (SIBOM)\nBoletines/Carmen de Areco\nDecreto Nº1173\nDecreto Nº 1173\nPublicado en versión extractada\nCarmen de Areco, 29/07/2025\nLa solicitud presentada por el Sr.\nALVAREZ, ANGEL MAXIMILIANO\nRedes Sociales\nContacto\nAutoridad de Aplicación\nSecretaría General\nSubsecretaría Legal y Técnica\nGuía Servicios\nPortal de trámites\nExpedientes\nSeguridad Vial\nARBA\nBoletín Oficial\nRegistro de las Personas\nContrataciones\nVer Todos\nPolíticas de privacidad\nUso Interno\nWebmail (gba.gob.ar)\nWebmail HORDE\nSistemas\nGDEBA\nPortal del Empleado\nMesa de Ayuda\nSIAPE",
      "tablas": [],
      "montos_extraidos": [],
      "metadata": {
        "longitud_caracteres": 910,
        "tiene_tablas": false,
        "total_tablas": 0,
        "total_montos": 0
      }
    },
    {
      "id": "2332097",
      "tipo": "decreto",
      "numero": "1174",
      "titulo": "Decreto Nº 1174",
      "fecha": "Carmen de Areco, 29/07/2025",
      "municipio": "Carmen de Areco",
      "url": "https://sibom.slyt.gba.gob.ar/bulletins/14203/contents/2332097",
      "contenido": "Sistema de Boletín Oficial Municipal | Buenos Aires Provincia\nINICIO\nACERCA DEL SIBOM\nBOLETINES\nMUNICIPIOS\nADMINISTRACION\nSistema de Boletines Oficiales Municipales (SIBOM)\nSistema de Boletines Oficiales Municipales (SIBOM)\nSistema de Boletines Oficiales Municipales (SIBOM)\nSistema de Boletines Oficiales Municipales (SIBOM)\nSistema de Boletines Oficiales Municipales (SIBOM)\nBoletines/Carmen de Areco\nDecreto Nº1174\nDecreto Nº 1174\nPublicado en versión extractada\nCarmen de Areco, 29/07/2025\nLa solicitud presentada por la Sra.\nMARRON, MARIA PIA\nRedes Sociales\nContacto\nAutoridad de Aplicación\nSecretaría General\nSubsecretaría Legal y Técnica\nGuía Servicios\nPortal de trámites\nExpedientes\nSeguridad Vial\nARBA\nBoletín Oficial\nRegistro de las Personas\nContrataciones\nVer Todos\nPolíticas de privacidad\nUso Interno\nWebmail (gba.gob.ar)\nWebmail HORDE\nSistemas\nGDEBA\nPortal del Empleado\nMesa de Ayuda\nSIAPE",
      "tablas": [],
      "montos_extraidos": [],
      "metadata": {
        "longitud_caracteres": 902,
        "tiene_tablas": false,
        "total_tablas": 0,
        "total_montos": 0
      }
    },
    {
      "id": "2332100",
      "tipo": "decreto",
      "numero": "1175",
      "titulo": "Decreto Nº 1175",
      "fecha": "Carmen de Areco, 29/07/2025",
      "municipio": "Carmen de Areco",
      "url": "https://sibom.slyt.gba.gob.ar/bulletins/14203/contents/2332100",
      "contenido": "Sistema de Boletín Oficial Municipal | Buenos Aires Provincia\nINICIO\nACERCA DEL SIBOM\nBOLETINES\nMUNICIPIOS\nADMINISTRACION\nSistema de Boletines Oficiales Municipales (SIBOM)\nSistema de Boletines Oficiales Municipales (SIBOM)\nSistema de Boletines Oficiales Municipales (SIBOM)\nSistema de Boletines Oficiales Municipales (SIBOM)\nSistema de Boletines Oficiales Municipales (SIBOM)\nBoletines/Carmen de Areco\nDecreto Nº1175\nDecreto Nº 1175\nPublicado en versión extractada\nCarmen de Areco, 29/07/2025\nLa solicitud presentada por la Sra.\nNOTO, RUTH NOEMI\nRedes Sociales\nContacto\nAutoridad de Aplicación\nSecretaría General\nSubsecretaría Legal y Técnica\nGuía Servicios\nPortal de trámites\nExpedientes\nSeguridad Vial\nARBA\nBoletín Oficial\nRegistro de las Personas\nContrataciones\nVer Todos\nPolíticas de privacidad\nUso Interno\nWebmail (gba.gob.ar)\nWebmail HORDE\nSistemas\nGDEBA\nPortal del Empleado\nMesa de Ayuda\nSIAPE",
      "tablas": [],
      "montos_extraidos": [],
      "metadata": {
        "longitud_caracteres": 901,
        "tiene_tablas": false,
        "total_tablas": 0,
        "total_montos": 0
      }
    },
    {
      "id": "2332104",
      "tipo": "decreto",
      "numero": "1176",
      "titulo": "Decreto Nº 1176",
      "fecha": "Carmen de Areco, 29/07/2025",
      "municipio": "Carmen de Areco",
      "url": "https://sibom.slyt.gba.gob.ar/bulletins/14203/contents/2332104",
      "contenido": "Sistema de Boletín Oficial Municipal | Buenos Aires Provincia\nINICIO\nACERCA DEL SIBOM\nBOLETINES\nMUNICIPIOS\nADMINISTRACION\nSistema de Boletines Oficiales Municipales (SIBOM)\nSistema de Boletines Oficiales Municipales (SIBOM)\nSistema de Boletines Oficiales Municipales (SIBOM)\nSistema de Boletines Oficiales Municipales (SIBOM)\nSistema de Boletines Oficiales Municipales (SIBOM)\nBoletines/Carmen de Areco\nDecreto Nº1176\nDecreto Nº 1176\nPublicado en versión extractada\nCarmen de Areco, 29/07/2025\nLa solicitud presentada por la Sra.\nBRITOS, ESTEFANIA GABRIELA\nRedes Sociales\nContacto\nAutoridad de Aplicación\nSecretaría General\nSubsecretaría Legal y Técnica\nGuía Servicios\nPortal de trámites\nExpedientes\nSeguridad Vial\nARBA\nBoletín Oficial\nRegistro de las Personas\nContrataciones\nVer Todos\nPolíticas de privacidad\nUso Interno\nWebmail (gba.gob.ar)\nWebmail HORDE\nSistemas\nGDEBA\nPortal del Empleado\nMesa de Ayuda\nSIAPE",
      "tablas": [],
      "montos_extraidos": [],
      "metadata": {
        "longitud_caracteres": 911,
        "tiene_tablas": false,
        "total_tablas": 0,
        "total_montos": 0
      }
    },
    {
      "id": "2332106",
      "tipo": "decreto",
      "numero": "1177",
      "titulo": "Decreto Nº 1177",
      "fecha": "Carmen de Areco, 29/07/2025",
      "municipio": "Carmen de Areco",
      "url": "https://sibom.slyt.gba.gob.ar/bulletins/14203/contents/2332106",
      "contenido": "Sistema de Boletín Oficial Municipal | Buenos Aires Provincia\nINICIO\nACERCA DEL SIBOM\nBOLETINES\nMUNICIPIOS\nADMINISTRACION\nSistema de Boletines Oficiales Municipales (SIBOM)\nSistema de Boletines Oficiales Municipales (SIBOM)\nSistema de Boletines Oficiales Municipales (SIBOM)\nSistema de Boletines Oficiales Municipales (SIBOM)\nSistema de Boletines Oficiales Municipales (SIBOM)\nBoletines/Carmen de Areco\nDecreto Nº1177\nDecreto Nº 1177\nPublicado en versión extractada\nCarmen de Areco, 29/07/2025\nLa necesidad de contratar un Servicio de Mantenimiento web; y Contrátese, retroactivamente, a partir del 28 de Julio de 2025 por el plazo de 5 dias, al Sr.\nNALAR DURGAN, ALBERTO\n,\npara que preste el servicio descripto Ut supra, en un todo de acuerdo con el respectivo contrato que se suscribió a  tal efecto.-\nRedes Sociales\nContacto\nAutoridad de Aplicación\nSecretaría General\nSubsecretaría Legal y Técnica\nGuía Servicios\nPortal de trámites\nExpedientes\nSeguridad Vial\nARBA\nBoletín Oficial\nRegistro de las Personas\nContrataciones\nVer Todos\nPolíticas de privacidad\nUso Interno\nWebmail (gba.gob.ar)\nWebmail HORDE\nSistemas\nGDEBA\nPortal del Empleado\nMesa de Ayuda\nSIAPE",
      "tablas": [],
      "montos_extraidos": [],
      "metadata": {
        "longitud_caracteres": 1158,
        "tiene_tablas": false,
        "total_tablas": 0,
        "total_montos": 0
      }
    },
    {
      "id": "2332108",
      "tipo": "decreto",
      "numero": "1178",
      "titulo": "Decreto Nº 1178",
      "fecha": "Carmen de Areco, 29/07/2025",
      "municipio": "Carmen de Areco",
      "url": "https://sibom.slyt.gba.gob.ar/bulletins/14203/contents/2332108",
      "contenido": "Sistema de Boletín Oficial Municipal | Buenos Aires Provincia\nINICIO\nACERCA DEL SIBOM\nBOLETINES\nMUNICIPIOS\nADMINISTRACION\nSistema de Boletines Oficiales Municipales (SIBOM)\nSistema de Boletines Oficiales Municipales (SIBOM)\nSistema de Boletines Oficiales Municipales (SIBOM)\nSistema de Boletines Oficiales Municipales (SIBOM)\nSistema de Boletines Oficiales Municipales (SIBOM)\nBoletines/Carmen de Areco\nDecreto Nº1178\nDecreto Nº 1178\nPublicado en versión extractada\nCarmen de Areco, 29/07/2025\nLa necesidad de mantener en condiciones las diferentes bombas de agua en la ciudad Tres Sargentos y Gouin, y;  Contrátese, desde el 30 de Julio hasta el 06 de Agosto del corriente año, dado que el Municipio no cuenta en la planta con personal profesional afectado y/o dedicado a la tarea descripta en los vistos del presente, al Sr.\nROSSI, JUAN ANTONIO,\npara realizarlas tareas descriptas ut supra en un todo de acuerdo con el contrato\nRedes Sociales\nContacto\nAutoridad de Aplicación\nSecretaría General\nSubsecretaría Legal y Técnica\nGuía Servicios\nPortal de trámites\nExpedientes\nSeguridad Vial\nARBA\nBoletín Oficial\nRegistro de las Personas\nContrataciones\nVer Todos\nPolíticas de privacidad\nUso Interno\nWebmail (gba.gob.ar)\nWebmail HORDE\nSistemas\nGDEBA\nPortal del Empleado\nMesa de Ayuda\nSIAPE",
      "tablas": [],
      "montos_extraidos": [],
      "metadata": {
        "longitud_caracteres": 1284,
        "tiene_tablas": false,
        "total_tablas": 0,
        "total_montos": 0
      }
    },
    {
      "id": "2332111",
      "tipo": "decreto",
      "numero": "1179",
      "titulo": "Decreto Nº 1179",
      "fecha": "Carmen de Areco, 30/07/2025",
      "municipio": "Carmen de Areco",
      "url": "https://sibom.slyt.gba.gob.ar/bulletins/14203/contents/2332111",
      "contenido": "Sistema de Boletín Oficial Municipal | Buenos Aires Provincia\nINICIO\nACERCA DEL SIBOM\nBOLETINES\nMUNICIPIOS\nADMINISTRACION\nSistema de Boletines Oficiales Municipales (SIBOM)\nSistema de Boletines Oficiales Municipales (SIBOM)\nSistema de Boletines Oficiales Municipales (SIBOM)\nSistema de Boletines Oficiales Municipales (SIBOM)\nSistema de Boletines Oficiales Municipales (SIBOM)\nBoletines/Carmen de Areco\nDecreto Nº1179\nDecreto Nº 1179\nPublicado en versión extractada\nCarmen de Areco, 30/07/2025\nLas actividades programadas en el marco de “VACACIONES DE INVIERNO 2025”, desde el día 21 de julio y hasta el 01 de agosto de 2025, con motivo del receso invernal; y;Contrátese,    el dia 31 de Julio de 2025,  dado que el Municipio no cuenta en la planta con personal profesional afectado y/o dedicado a la tarea descripta en los vistos del presente, al Sr.\nORDEG, ENZO CARLOS\npara efectuar el show musical infantil y juvenil que se llevara a cabo el día 31 de julio a las 14hs en el Cine Teatro Italia, en un todo de acuerdo con el contrato\nRedes Sociales\nContacto\nAutoridad de Aplicación\nSecretaría General\nSubsecretaría Legal y Técnica\nGuía Servicios\nPortal de trámites\nExpedientes\nSeguridad Vial\nARBA\nBoletín Oficial\nRegistro de las Personas\nContrataciones\nVer Todos\nPolíticas de privacidad\nUso Interno\nWebmail (gba.gob.ar)\nWebmail HORDE\nSistemas\nGDEBA\nPortal del Empleado\nMesa de Ayuda\nSIAPE",
      "tablas": [],
      "montos_extraidos": [],
      "metadata": {
        "longitud_caracteres": 1390,
        "tiene_tablas": false,
        "total_tablas": 0,
        "total_montos": 0
      }
    },
    {
      "id": "2332114",
      "tipo": "decreto",
      "numero": "1180",
      "titulo": "Decreto Nº 1180",
      "fecha": "Carmen de Areco, 30/07/2025",
      "municipio": "Carmen de Areco",
      "url": "https://sibom.slyt.gba.gob.ar/bulletins/14203/contents/2332114",
      "contenido": "Sistema de Boletín Oficial Municipal | Buenos Aires Provincia\nINICIO\nACERCA DEL SIBOM\nBOLETINES\nMUNICIPIOS\nADMINISTRACION\nSistema de Boletines Oficiales Municipales (SIBOM)\nSistema de Boletines Oficiales Municipales (SIBOM)\nSistema de Boletines Oficiales Municipales (SIBOM)\nSistema de Boletines Oficiales Municipales (SIBOM)\nSistema de Boletines Oficiales Municipales (SIBOM)\nBoletines/Carmen de Areco\nDecreto Nº1180\nDecreto Nº 1180\nPublicado en versión extractada\nCarmen de Areco, 30/07/2025\nLa solicitud presentada por la Sra.\nJORDAN, SILVANA BELEN\nRedes Sociales\nContacto\nAutoridad de Aplicación\nSecretaría General\nSubsecretaría Legal y Técnica\nGuía Servicios\nPortal de trámites\nExpedientes\nSeguridad Vial\nARBA\nBoletín Oficial\nRegistro de las Personas\nContrataciones\nVer Todos\nPolíticas de privacidad\nUso Interno\nWebmail (gba.gob.ar)\nWebmail HORDE\nSistemas\nGDEBA\nPortal del Empleado\nMesa de Ayuda\nSIAPE",
      "tablas": [],
      "montos_extraidos": [],
      "metadata": {
        "longitud_caracteres": 906,
        "tiene_tablas": false,
        "total_tablas": 0,
        "total_montos": 0
      }
    },
    {
      "id": "2332118",
      "tipo": "decreto",
      "numero": "1181",
      "titulo": "Decreto Nº 1181",
      "fecha": "Carmen de Areco, 30/07/2025",
      "municipio": "Carmen de Areco",
      "url": "https://sibom.slyt.gba.gob.ar/bulletins/14203/contents/2332118",
      "contenido": "Sistema de Boletín Oficial Municipal | Buenos Aires Provincia\nINICIO\nACERCA DEL SIBOM\nBOLETINES\nMUNICIPIOS\nADMINISTRACION\nSistema de Boletines Oficiales Municipales (SIBOM)\nSistema de Boletines Oficiales Municipales (SIBOM)\nSistema de Boletines Oficiales Municipales (SIBOM)\nSistema de Boletines Oficiales Municipales (SIBOM)\nSistema de Boletines Oficiales Municipales (SIBOM)\nBoletines/Carmen de Areco\nDecreto Nº1181\nDecreto Nº 1181\nPublicado en versión extractada\nCarmen de Areco, 30/07/2025\nDispóngase  abonarle al Sr.\nRODRIGUEZ, JUAN CARLOS,\nel pago de la retribución especial establecida en el Art. 72 inc. F de la Ley 14656 equivalente a seis mensualidades del básico de la categoría en que revista.-\nRedes Sociales\nContacto\nAutoridad de Aplicación\nSecretaría General\nSubsecretaría Legal y Técnica\nGuía Servicios\nPortal de trámites\nExpedientes\nSeguridad Vial\nARBA\nBoletín Oficial\nRegistro de las Personas\nContrataciones\nVer Todos\nPolíticas de privacidad\nUso Interno\nWebmail (gba.gob.ar)\nWebmail HORDE\nSistemas\nGDEBA\nPortal del Empleado\nMesa de Ayuda\nSIAPE",
      "tablas": [],
      "montos_extraidos": [],
      "metadata": {
        "longitud_caracteres": 1061,
        "tiene_tablas": false,
        "total_tablas": 0,
        "total_montos": 0
      }
    },
    {
      "id": "2332188",
      "tipo": "decreto",
      "numero": "1182",
      "titulo": "Decreto Nº 1182",
      "fecha": "Carmen de Areco, 30/07/2025",
      "municipio": "Carmen de Areco",
      "url": "https://sibom.slyt.gba.gob.ar/bulletins/14203/contents/2332188",
      "contenido": "Sistema de Boletín Oficial Municipal | Buenos Aires Provincia\nINICIO\nACERCA DEL SIBOM\nBOLETINES\nMUNICIPIOS\nADMINISTRACION\nSistema de Boletines Oficiales Municipales (SIBOM)\nSistema de Boletines Oficiales Municipales (SIBOM)\nSistema de Boletines Oficiales Municipales (SIBOM)\nSistema de Boletines Oficiales Municipales (SIBOM)\nSistema de Boletines Oficiales Municipales (SIBOM)\nBoletines/Carmen de Areco\nDecreto Nº1182\nDecreto Nº 1182\nPublicado en versión extractada\nCarmen de Areco, 30/07/2025\nLa solicitud presentada por la Sra.\nMORAN, MYRIAM MARIA\nRedes Sociales\nContacto\nAutoridad de Aplicación\nSecretaría General\nSubsecretaría Legal y Técnica\nGuía Servicios\nPortal de trámites\nExpedientes\nSeguridad Vial\nARBA\nBoletín Oficial\nRegistro de las Personas\nContrataciones\nVer Todos\nPolíticas de privacidad\nUso Interno\nWebmail (gba.gob.ar)\nWebmail HORDE\nSistemas\nGDEBA\nPortal del Empleado\nMesa de Ayuda\nSIAPE",
      "tablas": [],
      "montos_extraidos": [],
      "metadata": {
        "longitud_caracteres": 904,
        "tiene_tablas": false,
        "total_tablas": 0,
        "total_montos": 0
      }
    },
    {
      "id": "2332191",
      "tipo": "decreto",
      "numero": "1183",
      "titulo": "Decreto Nº 1183",
      "fecha": "Carmen de Areco, 30/07/2025",
      "municipio": "Carmen de Areco",
      "url": "https://sibom.slyt.gba.gob.ar/bulletins/14203/contents/2332191",
      "contenido": "Sistema de Boletín Oficial Municipal | Buenos Aires Provincia\nINICIO\nACERCA DEL SIBOM\nBOLETINES\nMUNICIPIOS\nADMINISTRACION\nSistema de Boletines Oficiales Municipales (SIBOM)\nSistema de Boletines Oficiales Municipales (SIBOM)\nSistema de Boletines Oficiales Municipales (SIBOM)\nSistema de Boletines Oficiales Municipales (SIBOM)\nSistema de Boletines Oficiales Municipales (SIBOM)\nBoletines/Carmen de Areco\nDecreto Nº1183\nDecreto Nº 1183\nPublicado en versión extractada\nCarmen de Areco, 30/07/2025\nLo dispuesto por el art. 130 bis de la Ley Orgánica de las Municipalidades, introducido por la ley 11.838.-\n:\nCompensase las deudas fiscales de los contribuyentes con las acreencias que a su vez tales contribuyentes tienen para percibir de este Municipio, hasta la suma menor, según el detalle que consta en el ANEXO I\nRedes Sociales\nContacto\nAutoridad de Aplicación\nSecretaría General\nSubsecretaría Legal y Técnica\nGuía Servicios\nPortal de trámites\nExpedientes\nSeguridad Vial\nARBA\nBoletín Oficial\nRegistro de las Personas\nContrataciones\nVer Todos\nPolíticas de privacidad\nUso Interno\nWebmail (gba.gob.ar)\nWebmail HORDE\nSistemas\nGDEBA\nPortal del Empleado\nMesa de Ayuda\nSIAPE",
      "tablas": [],
      "montos_extraidos": [],
      "metadata": {
        "longitud_caracteres": 1167,
        "tiene_tablas": false,
        "total_tablas": 0,
        "total_montos": 0
      }
    },
    {
      "id": "2332195",
      "tipo": "decreto",
      "numero": "1184",
      "titulo": "Decreto Nº 1184",
      "fecha": "Carmen de Areco, 30/07/2025",
      "municipio": "Carmen de Areco",
      "url": "https://sibom.slyt.gba.gob.ar/bulletins/14203/contents/2332195",
      "contenido": "Sistema de Boletín Oficial Municipal | Buenos Aires Provincia\nINICIO\nACERCA DEL SIBOM\nBOLETINES\nMUNICIPIOS\nADMINISTRACION\nSistema de Boletines Oficiales Municipales (SIBOM)\nSistema de Boletines Oficiales Municipales (SIBOM)\nSistema de Boletines Oficiales Municipales (SIBOM)\nSistema de Boletines Oficiales Municipales (SIBOM)\nSistema de Boletines Oficiales Municipales (SIBOM)\nBoletines/Carmen de Areco\nDecreto Nº1184\nDecreto Nº 1184\nPublicado en versión extractada\nCarmen de Areco, 30/07/2025\nPromulgase la Ordenanza Nº 3292/2025, sancionada por el Honorable Concejo Deliberante de Carmen de Areco con fecha 29/07/2025\nRedes Sociales\nContacto\nAutoridad de Aplicación\nSecretaría General\nSubsecretaría Legal y Técnica\nGuía Servicios\nPortal de trámites\nExpedientes\nSeguridad Vial\nARBA\nBoletín Oficial\nRegistro de las Personas\nContrataciones\nVer Todos\nPolíticas de privacidad\nUso Interno\nWebmail (gba.gob.ar)\nWebmail HORDE\nSistemas\nGDEBA\nPortal del Empleado\nMesa de Ayuda\nSIAPE",
      "tablas": [],
      "montos_extraidos": [],
      "metadata": {
        "longitud_caracteres": 974,
        "tiene_tablas": false,
        "total_tablas": 0,
        "total_montos": 0
      }
    },
    {
      "id": "2332200",
      "tipo": "decreto",
      "numero": "1185",
      "titulo": "Decreto Nº 1185",
      "fecha": "Carmen de Areco, 30/07/2025",
      "municipio": "Carmen de Areco",
      "url": "https://sibom.slyt.gba.gob.ar/bulletins/14203/contents/2332200",
      "contenido": "Sistema de Boletín Oficial Municipal | Buenos Aires Provincia\nINICIO\nACERCA DEL SIBOM\nBOLETINES\nMUNICIPIOS\nADMINISTRACION\nSistema de Boletines Oficiales Municipales (SIBOM)\nSistema de Boletines Oficiales Municipales (SIBOM)\nSistema de Boletines Oficiales Municipales (SIBOM)\nSistema de Boletines Oficiales Municipales (SIBOM)\nSistema de Boletines Oficiales Municipales (SIBOM)\nBoletines/Carmen de Areco\nDecreto Nº1185\nDecreto Nº 1185\nPublicado en versión extractada\nCarmen de Areco, 30/07/2025\nPromulgase la Ordenanza Nº 3293/2025, sancionada por el Honorable Concejo Deliberante de Carmen de Areco con fecha 29/07/2025\nRedes Sociales\nContacto\nAutoridad de Aplicación\nSecretaría General\nSubsecretaría Legal y Técnica\nGuía Servicios\nPortal de trámites\nExpedientes\nSeguridad Vial\nARBA\nBoletín Oficial\nRegistro de las Personas\nContrataciones\nVer Todos\nPolíticas de privacidad\nUso Interno\nWebmail (gba.gob.ar)\nWebmail HORDE\nSistemas\nGDEBA\nPortal del Empleado\nMesa de Ayuda\nSIAPE",
      "tablas": [],
      "montos_extraidos": [],
      "metadata": {
        "longitud_caracteres": 974,
        "tiene_tablas": false,
        "total_tablas": 0,
        "total_montos": 0
      }
    },
    {
      "id": "2332205",
      "tipo": "decreto",
      "numero": "1186",
      "titulo": "Decreto Nº 1186",
      "fecha": "Carmen de Areco, 30/07/2025",
      "municipio": "Carmen de Areco",
      "url": "https://sibom.slyt.gba.gob.ar/bulletins/14203/contents/2332205",
      "contenido": "Sistema de Boletín Oficial Municipal | Buenos Aires Provincia\nINICIO\nACERCA DEL SIBOM\nBOLETINES\nMUNICIPIOS\nADMINISTRACION\nSistema de Boletines Oficiales Municipales (SIBOM)\nSistema de Boletines Oficiales Municipales (SIBOM)\nSistema de Boletines Oficiales Municipales (SIBOM)\nSistema de Boletines Oficiales Municipales (SIBOM)\nSistema de Boletines Oficiales Municipales (SIBOM)\nBoletines/Carmen de Areco\nDecreto Nº1186\nDecreto Nº 1186\nPublicado en versión extractada\nCarmen de Areco, 30/07/2025\nPromulgase la Ordenanza Nº 3294 /2025, sancionada por el Honorable Concejo Deliberante de Carmen de Areco con fecha 29/07/2025\nRedes Sociales\nContacto\nAutoridad de Aplicación\nSecretaría General\nSubsecretaría Legal y Técnica\nGuía Servicios\nPortal de trámites\nExpedientes\nSeguridad Vial\nARBA\nBoletín Oficial\nRegistro de las Personas\nContrataciones\nVer Todos\nPolíticas de privacidad\nUso Interno\nWebmail (gba.gob.ar)\nWebmail HORDE\nSistemas\nGDEBA\nPortal del Empleado\nMesa de Ayuda\nSIAPE",
      "tablas": [],
      "montos_extraidos": [],
      "metadata": {
        "longitud_caracteres": 975,
        "tiene_tablas": false,
        "total_tablas": 0,
        "total_montos": 0
      }
    },
    {
      "id": "2332216",
      "tipo": "decreto",
      "numero": "1187",
      "titulo": "Decreto Nº 1187",
      "fecha": "Carmen de Areco, 30/07/2025",
      "municipio": "Carmen de Areco",
      "url": "https://sibom.slyt.gba.gob.ar/bulletins/14203/contents/2332216",
      "contenido": "Sistema de Boletín Oficial Municipal | Buenos Aires Provincia\nINICIO\nACERCA DEL SIBOM\nBOLETINES\nMUNICIPIOS\nADMINISTRACION\nSistema de Boletines Oficiales Municipales (SIBOM)\nSistema de Boletines Oficiales Municipales (SIBOM)\nSistema de Boletines Oficiales Municipales (SIBOM)\nSistema de Boletines Oficiales Municipales (SIBOM)\nSistema de Boletines Oficiales Municipales (SIBOM)\nBoletines/Carmen de Areco\nDecreto Nº1187\nDecreto Nº 1187\nPublicado en versión extractada\nCarmen de Areco, 30/07/2025\nPromulgase la Ordenanza Nº 3295 /2025, sancionada por el Honorable Concejo Deliberante de Carmen de Areco con fecha 29/07/2025\nRedes Sociales\nContacto\nAutoridad de Aplicación\nSecretaría General\nSubsecretaría Legal y Técnica\nGuía Servicios\nPortal de trámites\nExpedientes\nSeguridad Vial\nARBA\nBoletín Oficial\nRegistro de las Personas\nContrataciones\nVer Todos\nPolíticas de privacidad\nUso Interno\nWebmail (gba.gob.ar)\nWebmail HORDE\nSistemas\nGDEBA\nPortal del Empleado\nMesa de Ayuda\nSIAPE",
      "tablas": [],
      "montos_extraidos": [],
      "metadata": {
        "longitud_caracteres": 975,
        "tiene_tablas": false,
        "total_tablas": 0,
        "total_montos": 0
      }
    },
    {
      "id": "2332224",
      "tipo": "decreto",
      "numero": "1188",
      "titulo": "Decreto Nº 1188",
      "fecha": "Carmen de Areco, 30/07/2025",
      "municipio": "Carmen de Areco",
      "url": "https://sibom.slyt.gba.gob.ar/bulletins/14203/contents/2332224",
      "contenido": "Sistema de Boletín Oficial Municipal | Buenos Aires Provincia\nINICIO\nACERCA DEL SIBOM\nBOLETINES\nMUNICIPIOS\nADMINISTRACION\nSistema de Boletines Oficiales Municipales (SIBOM)\nSistema de Boletines Oficiales Municipales (SIBOM)\nSistema de Boletines Oficiales Municipales (SIBOM)\nSistema de Boletines Oficiales Municipales (SIBOM)\nSistema de Boletines Oficiales Municipales (SIBOM)\nBoletines/Carmen de Areco\nDecreto Nº1188\nDecreto Nº 1188\nPublicado en versión extractada\nCarmen de Areco, 30/07/2025\nLa necesidad de contratar el servicio de construcción de bienes de dominio publico, y;  : Contrátese, por el plazo de 10 días contados a partir del acta de inicio de obra, dado que el Municipio no cuenta en la planta con personal profesional afectado y/o dedicado a la tarea descripta en los vistos del presente,\nVIAL DS S.A,\n,\npara realizar las tareas descriptas ut supra, en un todo de acuerdo con el contrato\nRedes Sociales\nContacto\nAutoridad de Aplicación\nSecretaría General\nSubsecretaría Legal y Técnica\nGuía Servicios\nPortal de trámites\nExpedientes\nSeguridad Vial\nARBA\nBoletín Oficial\nRegistro de las Personas\nContrataciones\nVer Todos\nPolíticas de privacidad\nUso Interno\nWebmail (gba.gob.ar)\nWebmail HORDE\nSistemas\nGDEBA\nPortal del Empleado\nMesa de Ayuda\nSIAPE",
      "tablas": [],
      "montos_extraidos": [],
      "metadata": {
        "longitud_caracteres": 1260,
        "tiene_tablas": false,
        "total_tablas": 0,
        "total_montos": 0
      }
    },
    {
      "id": "2332228",
      "tipo": "decreto",
      "numero": "1189",
      "titulo": "Decreto Nº 1189",
      "fecha": "Carmen de Areco, 30/07/2025",
      "municipio": "Carmen de Areco",
      "url": "https://sibom.slyt.gba.gob.ar/bulletins/14203/contents/2332228",
      "contenido": "Sistema de Boletín Oficial Municipal | Buenos Aires Provincia\nINICIO\nACERCA DEL SIBOM\nBOLETINES\nMUNICIPIOS\nADMINISTRACION\nSistema de Boletines Oficiales Municipales (SIBOM)\nSistema de Boletines Oficiales Municipales (SIBOM)\nSistema de Boletines Oficiales Municipales (SIBOM)\nSistema de Boletines Oficiales Municipales (SIBOM)\nSistema de Boletines Oficiales Municipales (SIBOM)\nBoletines/Carmen de Areco\nDecreto Nº1189\nDecreto Nº 1189\nPublicado en versión extractada\nCarmen de Areco, 30/07/2025\nLa solicitud presentada por la Sra.\nBERRETTA, CAMILA BELEN\nRedes Sociales\nContacto\nAutoridad de Aplicación\nSecretaría General\nSubsecretaría Legal y Técnica\nGuía Servicios\nPortal de trámites\nExpedientes\nSeguridad Vial\nARBA\nBoletín Oficial\nRegistro de las Personas\nContrataciones\nVer Todos\nPolíticas de privacidad\nUso Interno\nWebmail (gba.gob.ar)\nWebmail HORDE\nSistemas\nGDEBA\nPortal del Empleado\nMesa de Ayuda\nSIAPE",
      "tablas": [],
      "montos_extraidos": [],
      "metadata": {
        "longitud_caracteres": 907,
        "tiene_tablas": false,
        "total_tablas": 0,
        "total_montos": 0
      }
    },
    {
      "id": "2332232",
      "tipo": "decreto",
      "numero": "1190",
      "titulo": "Decreto Nº 1190",
      "fecha": "Carmen de Areco, 30/07/2025",
      "municipio": "Carmen de Areco",
      "url": "https://sibom.slyt.gba.gob.ar/bulletins/14203/contents/2332232",
      "contenido": "Sistema de Boletín Oficial Municipal | Buenos Aires Provincia\nINICIO\nACERCA DEL SIBOM\nBOLETINES\nMUNICIPIOS\nADMINISTRACION\nSistema de Boletines Oficiales Municipales (SIBOM)\nSistema de Boletines Oficiales Municipales (SIBOM)\nSistema de Boletines Oficiales Municipales (SIBOM)\nSistema de Boletines Oficiales Municipales (SIBOM)\nSistema de Boletines Oficiales Municipales (SIBOM)\nBoletines/Carmen de Areco\nDecreto Nº1190\nDecreto Nº 1190\nPublicado en versión extractada\nCarmen de Areco, 30/07/2025\nLa solicitud presentada por la Sra.\nCASCO, VANESA ALEJANDRA\nRedes Sociales\nContacto\nAutoridad de Aplicación\nSecretaría General\nSubsecretaría Legal y Técnica\nGuía Servicios\nPortal de trámites\nExpedientes\nSeguridad Vial\nARBA\nBoletín Oficial\nRegistro de las Personas\nContrataciones\nVer Todos\nPolíticas de privacidad\nUso Interno\nWebmail (gba.gob.ar)\nWebmail HORDE\nSistemas\nGDEBA\nPortal del Empleado\nMesa de Ayuda\nSIAPE",
      "tablas": [],
      "montos_extraidos": [],
      "metadata": {
        "longitud_caracteres": 908,
        "tiene_tablas": false,
        "total_tablas": 0,
        "total_montos": 0
      }
    },
    {
      "id": "2332251",
      "tipo": "decreto",
      "numero": "1191",
      "titulo": "Decreto Nº 1191",
      "fecha": "Carmen de Areco, 30/07/2025",
      "municipio": "Carmen de Areco",
      "url": "https://sibom.slyt.gba.gob.ar/bulletins/14203/contents/2332251",
      "contenido": "Sistema de Boletín Oficial Municipal | Buenos Aires Provincia\nINICIO\nACERCA DEL SIBOM\nBOLETINES\nMUNICIPIOS\nADMINISTRACION\nSistema de Boletines Oficiales Municipales (SIBOM)\nSistema de Boletines Oficiales Municipales (SIBOM)\nSistema de Boletines Oficiales Municipales (SIBOM)\nSistema de Boletines Oficiales Municipales (SIBOM)\nSistema de Boletines Oficiales Municipales (SIBOM)\nBoletines/Carmen de Areco\nDecreto Nº1191\nDecreto Nº 1191\nPublicado en versión extractada\nCarmen de Areco, 30/07/2025\nLa solicitud presentada por el Sr.\nRIVERO, JAVIER ANTONIO\nRedes Sociales\nContacto\nAutoridad de Aplicación\nSecretaría General\nSubsecretaría Legal y Técnica\nGuía Servicios\nPortal de trámites\nExpedientes\nSeguridad Vial\nARBA\nBoletín Oficial\nRegistro de las Personas\nContrataciones\nVer Todos\nPolíticas de privacidad\nUso Interno\nWebmail (gba.gob.ar)\nWebmail HORDE\nSistemas\nGDEBA\nPortal del Empleado\nMesa de Ayuda\nSIAPE",
      "tablas": [],
      "montos_extraidos": [],
      "metadata": {
        "longitud_caracteres": 906,
        "tiene_tablas": false,
        "total_tablas": 0,
        "total_montos": 0
      }
    },
    {
      "id": "2332266",
      "tipo": "decreto",
      "numero": "1192",
      "titulo": "Decreto Nº 1192",
      "fecha": "Carmen de Areco, 30/07/2025",
      "municipio": "Carmen de Areco",
      "url": "https://sibom.slyt.gba.gob.ar/bulletins/14203/contents/2332266",
      "contenido": "Sistema de Boletín Oficial Municipal | Buenos Aires Provincia\nINICIO\nACERCA DEL SIBOM\nBOLETINES\nMUNICIPIOS\nADMINISTRACION\nSistema de Boletines Oficiales Municipales (SIBOM)\nSistema de Boletines Oficiales Municipales (SIBOM)\nSistema de Boletines Oficiales Municipales (SIBOM)\nSistema de Boletines Oficiales Municipales (SIBOM)\nSistema de Boletines Oficiales Municipales (SIBOM)\nBoletines/Carmen de Areco\nDecreto Nº1192\nDecreto Nº 1192\nPublicado en versión extractada\nCarmen de Areco, 30/07/2025\nLa solicitud presentada por el Sr.\nIBALO, CARLOS ADOLFO\nRedes Sociales\nContacto\nAutoridad de Aplicación\nSecretaría General\nSubsecretaría Legal y Técnica\nGuía Servicios\nPortal de trámites\nExpedientes\nSeguridad Vial\nARBA\nBoletín Oficial\nRegistro de las Personas\nContrataciones\nVer Todos\nPolíticas de privacidad\nUso Interno\nWebmail (gba.gob.ar)\nWebmail HORDE\nSistemas\nGDEBA\nPortal del Empleado\nMesa de Ayuda\nSIAPE",
      "tablas": [],
      "montos_extraidos": [],
      "metadata": {
        "longitud_caracteres": 904,
        "tiene_tablas": false,
        "total_tablas": 0,
        "total_montos": 0
      }
    },
    {
      "id": "2332273",
      "tipo": "decreto",
      "numero": "1193",
      "titulo": "Decreto Nº 1193",
      "fecha": "Carmen de Areco, 30/07/2025",
      "municipio": "Carmen de Areco",
      "url": "https://sibom.slyt.gba.gob.ar/bulletins/14203/contents/2332273",
      "contenido": "Sistema de Boletín Oficial Municipal | Buenos Aires Provincia\nINICIO\nACERCA DEL SIBOM\nBOLETINES\nMUNICIPIOS\nADMINISTRACION\nSistema de Boletines Oficiales Municipales (SIBOM)\nSistema de Boletines Oficiales Municipales (SIBOM)\nSistema de Boletines Oficiales Municipales (SIBOM)\nSistema de Boletines Oficiales Municipales (SIBOM)\nSistema de Boletines Oficiales Municipales (SIBOM)\nBoletines/Carmen de Areco\nDecreto Nº1193\nDecreto Nº 1193\nPublicado en versión extractada\nCarmen de Areco, 30/07/2025\nLa solicitud presentada por la Sra.\nSANZ, GRACIELA ALEJANDRA\nRedes Sociales\nContacto\nAutoridad de Aplicación\nSecretaría General\nSubsecretaría Legal y Técnica\nGuía Servicios\nPortal de trámites\nExpedientes\nSeguridad Vial\nARBA\nBoletín Oficial\nRegistro de las Personas\nContrataciones\nVer Todos\nPolíticas de privacidad\nUso Interno\nWebmail (gba.gob.ar)\nWebmail HORDE\nSistemas\nGDEBA\nPortal del Empleado\nMesa de Ayuda\nSIAPE",
      "tablas": [],
      "montos_extraidos": [],
      "metadata": {
        "longitud_caracteres": 909,
        "tiene_tablas": false,
        "total_tablas": 0,
        "total_montos": 0
      }
    },
    {
      "id": "2332324",
      "tipo": "decreto",
      "numero": "1194",
      "titulo": "Decreto Nº 1194",
      "fecha": "Carmen de Areco, 30/07/2025",
      "municipio": "Carmen de Areco",
      "url": "https://sibom.slyt.gba.gob.ar/bulletins/14203/contents/2332324",
      "contenido": "Sistema de Boletín Oficial Municipal | Buenos Aires Provincia\nINICIO\nACERCA DEL SIBOM\nBOLETINES\nMUNICIPIOS\nADMINISTRACION\nSistema de Boletines Oficiales Municipales (SIBOM)\nSistema de Boletines Oficiales Municipales (SIBOM)\nSistema de Boletines Oficiales Municipales (SIBOM)\nSistema de Boletines Oficiales Municipales (SIBOM)\nSistema de Boletines Oficiales Municipales (SIBOM)\nBoletines/Carmen de Areco\nDecreto Nº1194\nDecreto Nº 1194\nPublicado en versión extractada\nCarmen de Areco, 30/07/2025\nAdjudicase a el Sr. TORRETTA, WALTER JAVIER el Concurso de Precios Nº 3/2025, para la  “\nADQUISICIÓN DE SUELO SELECCIONADO TOSCA”\n, efectuada por  Decreto N° 1051/2025;\nRedes Sociales\nContacto\nAutoridad de Aplicación\nSecretaría General\nSubsecretaría Legal y Técnica\nGuía Servicios\nPortal de trámites\nExpedientes\nSeguridad Vial\nARBA\nBoletín Oficial\nRegistro de las Personas\nContrataciones\nVer Todos\nPolíticas de privacidad\nUso Interno\nWebmail (gba.gob.ar)\nWebmail HORDE\nSistemas\nGDEBA\nPortal del Empleado\nMesa de Ayuda\nSIAPE",
      "tablas": [],
      "montos_extraidos": [],
      "metadata": {
        "longitud_caracteres": 1017,
        "tiene_tablas": false,
        "total_tablas": 0,
        "total_montos": 0
      }
    },
    {
      "id": "2332325",
      "tipo": "decreto",
      "numero": "1195",
      "titulo": "Decreto Nº 1195",
      "fecha": "Carmen de Areco, 30/07/2025",
      "municipio": "Carmen de Areco",
      "url": "https://sibom.slyt.gba.gob.ar/bulletins/14203/contents/2332325",
      "contenido": "Sistema de Boletín Oficial Municipal | Buenos Aires Provincia\nINICIO\nACERCA DEL SIBOM\nBOLETINES\nMUNICIPIOS\nADMINISTRACION\nSistema de Boletines Oficiales Municipales (SIBOM)\nSistema de Boletines Oficiales Municipales (SIBOM)\nSistema de Boletines Oficiales Municipales (SIBOM)\nSistema de Boletines Oficiales Municipales (SIBOM)\nSistema de Boletines Oficiales Municipales (SIBOM)\nBoletines/Carmen de Areco\nDecreto Nº1195\nDecreto Nº 1195\nPublicado en versión extractada\nCarmen de Areco, 30/07/2025\nLa solicitud presentada por la Sra.\nTABERNE, MERCEDES\nRedes Sociales\nContacto\nAutoridad de Aplicación\nSecretaría General\nSubsecretaría Legal y Técnica\nGuía Servicios\nPortal de trámites\nExpedientes\nSeguridad Vial\nARBA\nBoletín Oficial\nRegistro de las Personas\nContrataciones\nVer Todos\nPolíticas de privacidad\nUso Interno\nWebmail (gba.gob.ar)\nWebmail HORDE\nSistemas\nGDEBA\nPortal del Empleado\nMesa de Ayuda\nSIAPE",
      "tablas": [],
      "montos_extraidos": [],
      "metadata": {
        "longitud_caracteres": 902,
        "tiene_tablas": false,
        "total_tablas": 0,
        "total_montos": 0
      }
    },
    {
      "id": "2332327",
      "tipo": "decreto",
      "numero": "1196",
      "titulo": "Decreto Nº 1196",
      "fecha": "Carmen de Areco, 31/07/2025",
      "municipio": "Carmen de Areco",
      "url": "https://sibom.slyt.gba.gob.ar/bulletins/14203/contents/2332327",
      "contenido": "Sistema de Boletín Oficial Municipal | Buenos Aires Provincia\nINICIO\nACERCA DEL SIBOM\nBOLETINES\nMUNICIPIOS\nADMINISTRACION\nSistema de Boletines Oficiales Municipales (SIBOM)\nSistema de Boletines Oficiales Municipales (SIBOM)\nSistema de Boletines Oficiales Municipales (SIBOM)\nSistema de Boletines Oficiales Municipales (SIBOM)\nSistema de Boletines Oficiales Municipales (SIBOM)\nBoletines/Carmen de Areco\nDecreto Nº1196\nDecreto Nº 1196\nPublicado en versión extractada\nCarmen de Areco, 31/07/2025\nLa necesidad de adquirir tosca para nuestra  ciudad, y;  Contrátese al Sr.\nTORRETTA, WALTER JAVIER ,\npor el plazo total de 15 días posteriores a la solicitud y al lugar que designe el Secretario de Obras Publicas\n,\npara realizar las tareas descriptas ut supra, en un todo de acuerdo con el contrato\nRedes Sociales\nContacto\nAutoridad de Aplicación\nSecretaría General\nSubsecretaría Legal y Técnica\nGuía Servicios\nPortal de trámites\nExpedientes\nSeguridad Vial\nARBA\nBoletín Oficial\nRegistro de las Personas\nContrataciones\nVer Todos\nPolíticas de privacidad\nUso Interno\nWebmail (gba.gob.ar)\nWebmail HORDE\nSistemas\nGDEBA\nPortal del Empleado\nMesa de Ayuda\nSIAPE",
      "tablas": [],
      "montos_extraidos": [],
      "metadata": {
        "longitud_caracteres": 1147,
        "tiene_tablas": false,
        "total_tablas": 0,
        "total_montos": 0
      }
    },
    {
      "id": "2332556",
      "tipo": "decreto",
      "numero": "1197",
      "titulo": "Decreto Nº 1197",
      "fecha": "Carmen de Areco, 31/07/2025",
      "municipio": "Carmen de Areco",
      "url": "https://sibom.slyt.gba.gob.ar/bulletins/14203/contents/2332556",
      "contenido": "Sistema de Boletín Oficial Municipal | Buenos Aires Provincia\nINICIO\nACERCA DEL SIBOM\nBOLETINES\nMUNICIPIOS\nADMINISTRACION\nSistema de Boletines Oficiales Municipales (SIBOM)\nSistema de Boletines Oficiales Municipales (SIBOM)\nSistema de Boletines Oficiales Municipales (SIBOM)\nSistema de Boletines Oficiales Municipales (SIBOM)\nSistema de Boletines Oficiales Municipales (SIBOM)\nBoletines/Carmen de Areco\nDecreto Nº1197\nDecreto Nº 1197\nPublicado en versión extractada\nCarmen de Areco, 31/07/2025\nAdjudicase a\nJAYA CONSTRUCCIONES S.R.L\nla Licitación Pública Nº 1/2025, para la\n“\nADQUISICION DE 4.000 TN DE PIEDRA PARTIDA 6/20 O ESCORIA 10/30”\n, efectuada por  Decreto N° 1021/2025\nRedes Sociales\nContacto\nAutoridad de Aplicación\nSecretaría General\nSubsecretaría Legal y Técnica\nGuía Servicios\nPortal de trámites\nExpedientes\nSeguridad Vial\nARBA\nBoletín Oficial\nRegistro de las Personas\nContrataciones\nVer Todos\nPolíticas de privacidad\nUso Interno\nWebmail (gba.gob.ar)\nWebmail HORDE\nSistemas\nGDEBA\nPortal del Empleado\nMesa de Ayuda\nSIAPE",
      "tablas": [],
      "montos_extraidos": [],
      "metadata": {
        "longitud_caracteres": 1032,
        "tiene_tablas": false,
        "total_tablas": 0,
        "total_montos": 0
      }
    },
    {
      "id": "2332559",
      "tipo": "decreto",
      "numero": "1198",
      "titulo": "Decreto Nº 1198",
      "fecha": "Carmen de Areco, 31/07/2025",
      "municipio": "Carmen de Areco",
      "url": "https://sibom.slyt.gba.gob.ar/bulletins/14203/contents/2332559",
      "contenido": "Sistema de Boletín Oficial Municipal | Buenos Aires Provincia\nINICIO\nACERCA DEL SIBOM\nBOLETINES\nMUNICIPIOS\nADMINISTRACION\nSistema de Boletines Oficiales Municipales (SIBOM)\nSistema de Boletines Oficiales Municipales (SIBOM)\nSistema de Boletines Oficiales Municipales (SIBOM)\nSistema de Boletines Oficiales Municipales (SIBOM)\nSistema de Boletines Oficiales Municipales (SIBOM)\nBoletines/Carmen de Areco\nDecreto Nº1198\nDecreto Nº 1198\nPublicado en versión extractada\nCarmen de Areco, 31/07/2025\nLa LICITACIÓN PÚBLICA Nº 1/2025, para la  “\nADQUISICION DE 4.000 TN DE PIEDRA PARTIDA 6/20 O ESCORIA 10/30\n”, efectuada por  Decreto N° 1021/2025 y adjudicada por Decreto 1197/2025,  Contrátese  a  JAYA CONSTRUCCIONES S.R.L, a fin de que cumpla con lo estipulado en la Licitación Pública N° 1/2025.-\nRedes Sociales\nContacto\nAutoridad de Aplicación\nSecretaría General\nSubsecretaría Legal y Técnica\nGuía Servicios\nPortal de trámites\nExpedientes\nSeguridad Vial\nARBA\nBoletín Oficial\nRegistro de las Personas\nContrataciones\nVer Todos\nPolíticas de privacidad\nUso Interno\nWebmail (gba.gob.ar)\nWebmail HORDE\nSistemas\nGDEBA\nPortal del Empleado\nMesa de Ayuda\nSIAPE",
      "tablas": [],
      "montos_extraidos": [],
      "metadata": {
        "longitud_caracteres": 1148,
        "tiene_tablas": false,
        "total_tablas": 0,
        "total_montos": 0
      }
    },
    {
      "id": "2332561",
      "tipo": "decreto",
      "numero": "1199",
      "titulo": "Decreto Nº 1199",
      "fecha": "Carmen de Areco, 31/07/2025",
      "municipio": "Carmen de Areco",
      "url": "https://sibom.slyt.gba.gob.ar/bulletins/14203/contents/2332561",
      "contenido": "Sistema de Boletín Oficial Municipal | Buenos Aires Provincia\nINICIO\nACERCA DEL SIBOM\nBOLETINES\nMUNICIPIOS\nADMINISTRACION\nSistema de Boletines Oficiales Municipales (SIBOM)\nSistema de Boletines Oficiales Municipales (SIBOM)\nSistema de Boletines Oficiales Municipales (SIBOM)\nSistema de Boletines Oficiales Municipales (SIBOM)\nSistema de Boletines Oficiales Municipales (SIBOM)\nBoletines/Carmen de Areco\nDecreto Nº1199\nDecreto Nº 1199\nPublicado en versión extractada\nCarmen de Areco, 31/07/2025\nDeclarase de INTERES MUNICIPAL, la Expo Educativa a realizarse el día 06 de Agosto del corriente año en el Galpón Cultural de nuestra ciudad.-\nRedes Sociales\nContacto\nAutoridad de Aplicación\nSecretaría General\nSubsecretaría Legal y Técnica\nGuía Servicios\nPortal de trámites\nExpedientes\nSeguridad Vial\nARBA\nBoletín Oficial\nRegistro de las Personas\nContrataciones\nVer Todos\nPolíticas de privacidad\nUso Interno\nWebmail (gba.gob.ar)\nWebmail HORDE\nSistemas\nGDEBA\nPortal del Empleado\nMesa de Ayuda\nSIAPE",
      "tablas": [],
      "montos_extraidos": [],
      "metadata": {
        "longitud_caracteres": 991,
        "tiene_tablas": false,
        "total_tablas": 0,
        "total_montos": 0
      }
    },
    {
      "id": "2332564",
      "tipo": "decreto",
      "numero": "1200",
      "titulo": "Decreto Nº 1200",
      "fecha": "Carmen de Areco, 01/08/2025",
      "municipio": "Carmen de Areco",
      "url": "https://sibom.slyt.gba.gob.ar/bulletins/14203/contents/2332564",
      "contenido": "Sistema de Boletín Oficial Municipal | Buenos Aires Provincia\nINICIO\nACERCA DEL SIBOM\nBOLETINES\nMUNICIPIOS\nADMINISTRACION\nSistema de Boletines Oficiales Municipales (SIBOM)\nSistema de Boletines Oficiales Municipales (SIBOM)\nSistema de Boletines Oficiales Municipales (SIBOM)\nSistema de Boletines Oficiales Municipales (SIBOM)\nSistema de Boletines Oficiales Municipales (SIBOM)\nBoletines/Carmen de Areco\nDecreto Nº1200\nDecreto Nº 1200\nPublicado en versión extractada\nCarmen de Areco, 01/08/2025\nLa nota presentada por la ASOCIACION COOPERADORA DEL CEF N°10 de Carmen de Areco – Exp. Adm. N° 4021- 01202-0-2025, y;Otorgase un Subsidio de pesos NOVECIENTOS OCHENTA MIL QUINIENTOS CINCUENTA ($ 980.550,00) al ASOCIACION COOPERADORA DEL CEF N°10 de Carmen de Areco para afectarlo a los gastos establecidos en los considerandos del presente decreto - Exp. Adm. N° 4021- 01202-0-2025\nRedes Sociales\nContacto\nAutoridad de Aplicación\nSecretaría General\nSubsecretaría Legal y Técnica\nGuía Servicios\nPortal de trámites\nExpedientes\nSeguridad Vial\nARBA\nBoletín Oficial\nRegistro de las Personas\nContrataciones\nVer Todos\nPolíticas de privacidad\nUso Interno\nWebmail (gba.gob.ar)\nWebmail HORDE\nSistemas\nGDEBA\nPortal del Empleado\nMesa de Ayuda\nSIAPE",
      "tablas": [],
      "montos_extraidos": [
        {
          "municipio": "Areco",
          "boletin": "0",
          "fecha": "Carmen de Areco, 01/08/2025",
          "norma_tipo": "Decreto",
          "norma_numero": "1200",
          "articulo": "S/N",
          "concepto": "CEF N°10 de Carmen de Areco para afectarlo a los gastos establecidos en los considerandos del presente d",
          "monto": 980550.0,
          "moneda": "ARS",
          "texto_completo": "Boletín 0º | Areco | Decreto Nº1200 [ARTÍCULO S/N: $980.550,00]",
          "fuente_url": "https://sibom.slyt.gba.gob.ar/bulletins/14203/contents/2332564"
        }
      ],
      "metadata": {
        "longitud_caracteres": 1231,
        "tiene_tablas": false,
        "total_tablas": 0,
        "total_montos": 1
      }
    },
    {
      "id": "2332570",
      "tipo": "decreto",
      "numero": "1201",
      "titulo": "Decreto Nº 1201",
      "fecha": "Carmen de Areco, 01/08/2025",
      "municipio": "Carmen de Areco",
      "url": "https://sibom.slyt.gba.gob.ar/bulletins/14203/contents/2332570",
      "contenido": "Sistema de Boletín Oficial Municipal | Buenos Aires Provincia\nINICIO\nACERCA DEL SIBOM\nBOLETINES\nMUNICIPIOS\nADMINISTRACION\nSistema de Boletines Oficiales Municipales (SIBOM)\nSistema de Boletines Oficiales Municipales (SIBOM)\nSistema de Boletines Oficiales Municipales (SIBOM)\nSistema de Boletines Oficiales Municipales (SIBOM)\nSistema de Boletines Oficiales Municipales (SIBOM)\nBoletines/Carmen de Areco\nDecreto Nº1201\nDecreto Nº 1201\nPublicado en versión extractada\nCarmen de Areco, 01/08/2025\nLa necesidad de contratar la plataforma de software MUNICIPIO INTELIGENTE;  y;Contrátese, desde el 01 de agosto de 2025 al 31 de diciembre de 2025, dado que el Municipio no cuenta en la planta con personal profesional afectado y/o dedicado a tal tarea; a\nTECNOLOGIA EN SEGURIDAD Y SERVICIOS SRL\n, preste el servicio de configuración y customizacion de software de la plataforma\nMunicipio Inteligente\n, descripto en los vistos y considerando del presente decreto,  en un todo de acuerdo con el respectivo contrato que se suscribió a  tal efecto.-\nRedes Sociales\nContacto\nAutoridad de Aplicación\nSecretaría General\nSubsecretaría Legal y Técnica\nGuía Servicios\nPortal de trámites\nExpedientes\nSeguridad Vial\nARBA\nBoletín Oficial\nRegistro de las Personas\nContrataciones\nVer Todos\nPolíticas de privacidad\nUso Interno\nWebmail (gba.gob.ar)\nWebmail HORDE\nSistemas\nGDEBA\nPortal del Empleado\nMesa de Ayuda\nSIAPE",
      "tablas": [],
      "montos_extraidos": [],
      "metadata": {
        "longitud_caracteres": 1394,
        "tiene_tablas": false,
        "total_tablas": 0,
        "total_montos": 0
      }
    },
    {
      "id": "2332575",
      "tipo": "decreto",
      "numero": "1202",
      "titulo": "Decreto Nº 1202",
      "fecha": "Carmen de Areco, 01/08/2025",
      "municipio": "Carmen de Areco",
      "url": "https://sibom.slyt.gba.gob.ar/bulletins/14203/contents/2332575",
      "contenido": "Sistema de Boletín Oficial Municipal | Buenos Aires Provincia\nINICIO\nACERCA DEL SIBOM\nBOLETINES\nMUNICIPIOS\nADMINISTRACION\nSistema de Boletines Oficiales Municipales (SIBOM)\nSistema de Boletines Oficiales Municipales (SIBOM)\nSistema de Boletines Oficiales Municipales (SIBOM)\nSistema de Boletines Oficiales Municipales (SIBOM)\nSistema de Boletines Oficiales Municipales (SIBOM)\nBoletines/Carmen de Areco\nDecreto Nº1202\nDecreto Nº 1202\nPublicado en versión extractada\nCarmen de Areco, 01/08/2025\nLa necesidad de contar con un profesional en Educación, Contrátese, desde el 01 de agosto de 2025 y hasta el día 31 de agosto de 2025, a la Sra.\nMARENZI, MARIEL EDITH\n, Profesora para la Enseñanza Primaria\nRedes Sociales\nContacto\nAutoridad de Aplicación\nSecretaría General\nSubsecretaría Legal y Técnica\nGuía Servicios\nPortal de trámites\nExpedientes\nSeguridad Vial\nARBA\nBoletín Oficial\nRegistro de las Personas\nContrataciones\nVer Todos\nPolíticas de privacidad\nUso Interno\nWebmail (gba.gob.ar)\nWebmail HORDE\nSistemas\nGDEBA\nPortal del Empleado\nMesa de Ayuda\nSIAPE",
      "tablas": [],
      "montos_extraidos": [],
      "metadata": {
        "longitud_caracteres": 1054,
        "tiene_tablas": false,
        "total_tablas": 0,
        "total_montos": 0
      }
    },
    {
      "id": "2332579",
      "tipo": "decreto",
      "numero": "1203",
      "titulo": "Decreto Nº 1203",
      "fecha": "Carmen de Areco, 01/08/2025",
      "municipio": "Carmen de Areco",
      "url": "https://sibom.slyt.gba.gob.ar/bulletins/14203/contents/2332579",
      "contenido": "Sistema de Boletín Oficial Municipal | Buenos Aires Provincia\nINICIO\nACERCA DEL SIBOM\nBOLETINES\nMUNICIPIOS\nADMINISTRACION\nSistema de Boletines Oficiales Municipales (SIBOM)\nSistema de Boletines Oficiales Municipales (SIBOM)\nSistema de Boletines Oficiales Municipales (SIBOM)\nSistema de Boletines Oficiales Municipales (SIBOM)\nSistema de Boletines Oficiales Municipales (SIBOM)\nBoletines/Carmen de Areco\nDecreto Nº1203\nDecreto Nº 1203\nPublicado en versión extractada\nCarmen de Areco, 01/08/2025\nLa necesidad de contratar el servicio de Psicóloga; y;  Contrátese, dado que el Municipio no cuenta en la planta con personal profesional afectado y/o dedicado a la tarea descripta en los vistos del presente, desde el 01 de agosto de 2025 y hasta el día 31 de agosto de 2025, a la Sra.\nROMERO, MARIA CECILIA\n, Psicóloga\nRedes Sociales\nContacto\nAutoridad de Aplicación\nSecretaría General\nSubsecretaría Legal y Técnica\nGuía Servicios\nPortal de trámites\nExpedientes\nSeguridad Vial\nARBA\nBoletín Oficial\nRegistro de las Personas\nContrataciones\nVer Todos\nPolíticas de privacidad\nUso Interno\nWebmail (gba.gob.ar)\nWebmail HORDE\nSistemas\nGDEBA\nPortal del Empleado\nMesa de Ayuda\nSIAPE",
      "tablas": [],
      "montos_extraidos": [],
      "metadata": {
        "longitud_caracteres": 1168,
        "tiene_tablas": false,
        "total_tablas": 0,
        "total_montos": 0
      }
    },
    {
      "id": "2332584",
      "tipo": "decreto",
      "numero": "1204",
      "titulo": "Decreto Nº 1204",
      "fecha": "Carmen de Areco, 01/08/2025",
      "municipio": "Carmen de Areco",
      "url": "https://sibom.slyt.gba.gob.ar/bulletins/14203/contents/2332584",
      "contenido": "Sistema de Boletín Oficial Municipal | Buenos Aires Provincia\nINICIO\nACERCA DEL SIBOM\nBOLETINES\nMUNICIPIOS\nADMINISTRACION\nSistema de Boletines Oficiales Municipales (SIBOM)\nSistema de Boletines Oficiales Municipales (SIBOM)\nSistema de Boletines Oficiales Municipales (SIBOM)\nSistema de Boletines Oficiales Municipales (SIBOM)\nSistema de Boletines Oficiales Municipales (SIBOM)\nBoletines/Carmen de Areco\nDecreto Nº1204\nDecreto Nº 1204\nPublicado en versión extractada\nCarmen de Areco, 01/08/2025\nLa necesidad de contratar el servicio de Psicóloga; y Contrátese, dado que el Municipio no cuenta en la planta con personal profesional afectado y/o dedicado a la tarea descripta en los vistos del presente, desde el 01 de agosto de 2025 y hasta el día 31 de agosto de 2025, a la Sra.\nBAINOTTI, MARÍA JULIA\n, Psicóloga\nRedes Sociales\nContacto\nAutoridad de Aplicación\nSecretaría General\nSubsecretaría Legal y Técnica\nGuía Servicios\nPortal de trámites\nExpedientes\nSeguridad Vial\nARBA\nBoletín Oficial\nRegistro de las Personas\nContrataciones\nVer Todos\nPolíticas de privacidad\nUso Interno\nWebmail (gba.gob.ar)\nWebmail HORDE\nSistemas\nGDEBA\nPortal del Empleado\nMesa de Ayuda\nSIAPE",
      "tablas": [],
      "montos_extraidos": [],
      "metadata": {
        "longitud_caracteres": 1166,
        "tiene_tablas": false,
        "total_tablas": 0,
        "total_montos": 0
      }
    },
    {
      "id": "2332595",
      "tipo": "decreto",
      "numero": "1205",
      "titulo": "Decreto Nº 1205",
      "fecha": "Carmen de Areco, 01/08/2025",
      "municipio": "Carmen de Areco",
      "url": "https://sibom.slyt.gba.gob.ar/bulletins/14203/contents/2332595",
      "contenido": "Sistema de Boletín Oficial Municipal | Buenos Aires Provincia\nINICIO\nACERCA DEL SIBOM\nBOLETINES\nMUNICIPIOS\nADMINISTRACION\nSistema de Boletines Oficiales Municipales (SIBOM)\nSistema de Boletines Oficiales Municipales (SIBOM)\nSistema de Boletines Oficiales Municipales (SIBOM)\nSistema de Boletines Oficiales Municipales (SIBOM)\nSistema de Boletines Oficiales Municipales (SIBOM)\nBoletines/Carmen de Areco\nDecreto Nº1205\nDecreto Nº 1205\nPublicado en versión extractada\nCarmen de Areco, 01/08/2025\nLa necesidad de contratar el Servicio de un Abogado para formar parte del equipo y desempeño profesional dentro de la Secretaria de Derechos Humanos; y;  Contrátese, dado que el Municipio no cuenta en la planta con personal profesional afectado y/o dedicado a la tarea descripta en los vistos del presente, desde el 01 de agosto de 2025 y hasta el día 31 de agosto de 2025, a la Sra.\nMILIAN, LILIANA RITA, ABOGADA\nRedes Sociales\nContacto\nAutoridad de Aplicación\nSecretaría General\nSubsecretaría Legal y Técnica\nGuía Servicios\nPortal de trámites\nExpedientes\nSeguridad Vial\nARBA\nBoletín Oficial\nRegistro de las Personas\nContrataciones\nVer Todos\nPolíticas de privacidad\nUso Interno\nWebmail (gba.gob.ar)\nWebmail HORDE\nSistemas\nGDEBA\nPortal del Empleado\nMesa de Ayuda\nSIAPE",
      "tablas": [],
      "montos_extraidos": [],
      "metadata": {
        "longitud_caracteres": 1262,
        "tiene_tablas": false,
        "total_tablas": 0,
        "total_montos": 0
      }
    },
    {
      "id": "2332598",
      "tipo": "decreto",
      "numero": "1206",
      "titulo": "Decreto Nº 1206",
      "fecha": "Carmen de Areco, 01/08/2025",
      "municipio": "Carmen de Areco",
      "url": "https://sibom.slyt.gba.gob.ar/bulletins/14203/contents/2332598",
      "contenido": "Sistema de Boletín Oficial Municipal | Buenos Aires Provincia\nINICIO\nACERCA DEL SIBOM\nBOLETINES\nMUNICIPIOS\nADMINISTRACION\nSistema de Boletines Oficiales Municipales (SIBOM)\nSistema de Boletines Oficiales Municipales (SIBOM)\nSistema de Boletines Oficiales Municipales (SIBOM)\nSistema de Boletines Oficiales Municipales (SIBOM)\nSistema de Boletines Oficiales Municipales (SIBOM)\nBoletines/Carmen de Areco\nDecreto Nº1206\nDecreto Nº 1206\nPublicado en versión extractada\nCarmen de Areco, 01/08/2025\nLa necesidad de contar con una Psicóloga para el servicio local; y;  Contrátese, dado que el Municipio no cuenta en la planta con personal profesional afectado y/o dedicado a la tarea descripta en los vistos del presente, desde el 01 de agosto de 2025 y hasta el día 31 de agosto de 2025, a la Sra.\nFERREYRA, ANDREA LILIANA\n, Psicóloga,\nRedes Sociales\nContacto\nAutoridad de Aplicación\nSecretaría General\nSubsecretaría Legal y Técnica\nGuía Servicios\nPortal de trámites\nExpedientes\nSeguridad Vial\nARBA\nBoletín Oficial\nRegistro de las Personas\nContrataciones\nVer Todos\nPolíticas de privacidad\nUso Interno\nWebmail (gba.gob.ar)\nWebmail HORDE\nSistemas\nGDEBA\nPortal del Empleado\nMesa de Ayuda\nSIAPE",
      "tablas": [],
      "montos_extraidos": [],
      "metadata": {
        "longitud_caracteres": 1185,
        "tiene_tablas": false,
        "total_tablas": 0,
        "total_montos": 0
      }
    },
    {
      "id": "2332601",
      "tipo": "decreto",
      "numero": "1207",
      "titulo": "Decreto Nº 1207",
      "fecha": "Carmen de Areco, 01/08/2025",
      "municipio": "Carmen de Areco",
      "url": "https://sibom.slyt.gba.gob.ar/bulletins/14203/contents/2332601",
      "contenido": "Sistema de Boletín Oficial Municipal | Buenos Aires Provincia\nINICIO\nACERCA DEL SIBOM\nBOLETINES\nMUNICIPIOS\nADMINISTRACION\nSistema de Boletines Oficiales Municipales (SIBOM)\nSistema de Boletines Oficiales Municipales (SIBOM)\nSistema de Boletines Oficiales Municipales (SIBOM)\nSistema de Boletines Oficiales Municipales (SIBOM)\nSistema de Boletines Oficiales Municipales (SIBOM)\nBoletines/Carmen de Areco\nDecreto Nº1207\nDecreto Nº 1207\nPublicado en versión extractada\nCarmen de Areco, 01/08/2025\nLa necesidad de contratar el Servicio de un Abogado para formar parte del equipo y desempeño profesional dentro de la Secretaria de Derechos Humanos; Contrátese, dado que el Municipio no cuenta en la planta con personal profesional afectado y/o dedicado a la tarea descripta en los vistos del presente, desde el 01 de agosto de 2025 y hasta el día 31 de agosto de 2025, a la Sra.\nLEMME, TANIA ELIZABETH, ABOGADA\n,\nRedes Sociales\nContacto\nAutoridad de Aplicación\nSecretaría General\nSubsecretaría Legal y Técnica\nGuía Servicios\nPortal de trámites\nExpedientes\nSeguridad Vial\nARBA\nBoletín Oficial\nRegistro de las Personas\nContrataciones\nVer Todos\nPolíticas de privacidad\nUso Interno\nWebmail (gba.gob.ar)\nWebmail HORDE\nSistemas\nGDEBA\nPortal del Empleado\nMesa de Ayuda\nSIAPE",
      "tablas": [],
      "montos_extraidos": [],
      "metadata": {
        "longitud_caracteres": 1262,
        "tiene_tablas": false,
        "total_tablas": 0,
        "total_montos": 0
      }
    },
    {
      "id": "2332603",
      "tipo": "decreto",
      "numero": "1208",
      "titulo": "Decreto Nº 1208",
      "fecha": "Carmen de Areco, 01/08/2025",
      "municipio": "Carmen de Areco",
      "url": "https://sibom.slyt.gba.gob.ar/bulletins/14203/contents/2332603",
      "contenido": "Sistema de Boletín Oficial Municipal | Buenos Aires Provincia\nINICIO\nACERCA DEL SIBOM\nBOLETINES\nMUNICIPIOS\nADMINISTRACION\nSistema de Boletines Oficiales Municipales (SIBOM)\nSistema de Boletines Oficiales Municipales (SIBOM)\nSistema de Boletines Oficiales Municipales (SIBOM)\nSistema de Boletines Oficiales Municipales (SIBOM)\nSistema de Boletines Oficiales Municipales (SIBOM)\nBoletines/Carmen de Areco\nDecreto Nº1208\nDecreto Nº 1208\nPublicado en versión extractada\nCarmen de Areco, 01/08/2025\nEl Programa Envión y la necesidad de contratar un profesional para formar parte del equipo técnico; y; con el objeto de coordinar las tareas, desarrollar actividades, entre otros; y;  Contrátese, dado que el Municipio no cuenta en la planta con personal profesional afectado y/o dedicado a la tarea descripta en los vistos del presente, desde el 01 de agosto de 2025 y hasta el día 31 de agosto de 2025 al Sr.\nDURAN, EMMANUEL JOSE,\nRedes Sociales\nContacto\nAutoridad de Aplicación\nSecretaría General\nSubsecretaría Legal y Técnica\nGuía Servicios\nPortal de trámites\nExpedientes\nSeguridad Vial\nARBA\nBoletín Oficial\nRegistro de las Personas\nContrataciones\nVer Todos\nPolíticas de privacidad\nUso Interno\nWebmail (gba.gob.ar)\nWebmail HORDE\nSistemas\nGDEBA\nPortal del Empleado\nMesa de Ayuda\nSIAPE",
      "tablas": [],
      "montos_extraidos": [],
      "metadata": {
        "longitud_caracteres": 1280,
        "tiene_tablas": false,
        "total_tablas": 0,
        "total_montos": 0
      }
    },
    {
      "id": "2332605",
      "tipo": "decreto",
      "numero": "1209",
      "titulo": "Decreto Nº 1209",
      "fecha": "Carmen de Areco, 01/08/2025",
      "municipio": "Carmen de Areco",
      "url": "https://sibom.slyt.gba.gob.ar/bulletins/14203/contents/2332605",
      "contenido": "Sistema de Boletín Oficial Municipal | Buenos Aires Provincia\nINICIO\nACERCA DEL SIBOM\nBOLETINES\nMUNICIPIOS\nADMINISTRACION\nSistema de Boletines Oficiales Municipales (SIBOM)\nSistema de Boletines Oficiales Municipales (SIBOM)\nSistema de Boletines Oficiales Municipales (SIBOM)\nSistema de Boletines Oficiales Municipales (SIBOM)\nSistema de Boletines Oficiales Municipales (SIBOM)\nBoletines/Carmen de Areco\nDecreto Nº1209\nDecreto Nº 1209\nPublicado en versión extractada\nCarmen de Areco, 01/08/2025\nEl Programa Envión y la necesidad de contratar un profesional para formar parte del equipo técnico; y; con el objeto de coordinar las tareas, desarrollar actividades, entre otros; y;  Contrátese, dado que el Municipio no cuenta en la planta con personal profesional afectado y/o dedicado a la tarea descripta en los vistos del presente, desde el 01 de agosto de 2025 y hasta el día 31 de agosto de 2025, al Sr.\nHARISTOY, CRISTIAN DAVID\nRedes Sociales\nContacto\nAutoridad de Aplicación\nSecretaría General\nSubsecretaría Legal y Técnica\nGuía Servicios\nPortal de trámites\nExpedientes\nSeguridad Vial\nARBA\nBoletín Oficial\nRegistro de las Personas\nContrataciones\nVer Todos\nPolíticas de privacidad\nUso Interno\nWebmail (gba.gob.ar)\nWebmail HORDE\nSistemas\nGDEBA\nPortal del Empleado\nMesa de Ayuda\nSIAPE",
      "tablas": [],
      "montos_extraidos": [],
      "metadata": {
        "longitud_caracteres": 1284,
        "tiene_tablas": false,
        "total_tablas": 0,
        "total_montos": 0
      }
    },
    {
      "id": "2332609",
      "tipo": "decreto",
      "numero": "1210",
      "titulo": "Decreto Nº 1210",
      "fecha": "Carmen de Areco, 01/07/2025",
      "municipio": "Carmen de Areco",
      "url": "https://sibom.slyt.gba.gob.ar/bulletins/14203/contents/2332609",
      "contenido": "Sistema de Boletín Oficial Municipal | Buenos Aires Provincia\nINICIO\nACERCA DEL SIBOM\nBOLETINES\nMUNICIPIOS\nADMINISTRACION\nSistema de Boletines Oficiales Municipales (SIBOM)\nSistema de Boletines Oficiales Municipales (SIBOM)\nSistema de Boletines Oficiales Municipales (SIBOM)\nSistema de Boletines Oficiales Municipales (SIBOM)\nSistema de Boletines Oficiales Municipales (SIBOM)\nBoletines/Carmen de Areco\nDecreto Nº1210\nDecreto Nº 1210\nPublicado en versión extractada\nCarmen de Areco, 01/07/2025\nEl Programa Envión y la necesidad de contratar un profesional para formar parte del equipo técnico; y; con el objeto de coordinar las tareas, desarrollar actividades, entre otros; y;  Contrátese, dado que el Municipio no cuenta en la planta con personal profesional afectado y/o dedicado a la tarea descripta en los vistos del presente, desde el 01 de agosto de 2025 y hasta el día 31 de agosto de 2025, a la Sra.\nCAMPOS, ANA PAULA\n, Técnica en Acompañante Terapéutico\nRedes Sociales\nContacto\nAutoridad de Aplicación\nSecretaría General\nSubsecretaría Legal y Técnica\nGuía Servicios\nPortal de trámites\nExpedientes\nSeguridad Vial\nARBA\nBoletín Oficial\nRegistro de las Personas\nContrataciones\nVer Todos\nPolíticas de privacidad\nUso Interno\nWebmail (gba.gob.ar)\nWebmail HORDE\nSistemas\nGDEBA\nPortal del Empleado\nMesa de Ayuda\nSIAPE",
      "tablas": [],
      "montos_extraidos": [],
      "metadata": {
        "longitud_caracteres": 1317,
        "tiene_tablas": false,
        "total_tablas": 0,
        "total_montos": 0
      }
    },
    {
      "id": "2332616",
      "tipo": "decreto",
      "numero": "1211",
      "titulo": "Decreto Nº 1211",
      "fecha": "Carmen de Areco, 01/08/2025",
      "municipio": "Carmen de Areco",
      "url": "https://sibom.slyt.gba.gob.ar/bulletins/14203/contents/2332616",
      "contenido": "Sistema de Boletín Oficial Municipal | Buenos Aires Provincia\nINICIO\nACERCA DEL SIBOM\nBOLETINES\nMUNICIPIOS\nADMINISTRACION\nSistema de Boletines Oficiales Municipales (SIBOM)\nSistema de Boletines Oficiales Municipales (SIBOM)\nSistema de Boletines Oficiales Municipales (SIBOM)\nSistema de Boletines Oficiales Municipales (SIBOM)\nSistema de Boletines Oficiales Municipales (SIBOM)\nBoletines/Carmen de Areco\nDecreto Nº1211\nDecreto Nº 1211\nPublicado en versión extractada\nCarmen de Areco, 01/08/2025\nEl Programa Envión y la necesidad de contratar un profesional para formar parte del equipo técnico; y; con el objeto de coordinar las tareas, desarrollar actividades, entre otros; y;  Contrátese,  dado que el Municipio no cuenta en la planta con personal profesional afectado y/o dedicado a la tarea descripta en los vistos del presente, desde el 01 de agosto de 2025 y hasta el día 31 de agosto de 2025, a la Sra.\nBRAVO, MARÍA VICTORIA\n, Técnica en Acompañante Terapéutico,\nRedes Sociales\nContacto\nAutoridad de Aplicación\nSecretaría General\nSubsecretaría Legal y Técnica\nGuía Servicios\nPortal de trámites\nExpedientes\nSeguridad Vial\nARBA\nBoletín Oficial\nRegistro de las Personas\nContrataciones\nVer Todos\nPolíticas de privacidad\nUso Interno\nWebmail (gba.gob.ar)\nWebmail HORDE\nSistemas\nGDEBA\nPortal del Empleado\nMesa de Ayuda\nSIAPE",
      "tablas": [],
      "montos_extraidos": [],
      "metadata": {
        "longitud_caracteres": 1323,
        "tiene_tablas": false,
        "total_tablas": 0,
        "total_montos": 0
      }
    },
    {
      "id": "2332624",
      "tipo": "decreto",
      "numero": "1212",
      "titulo": "Decreto Nº 1212",
      "fecha": "Carmen de Areco, 01/08/2025",
      "municipio": "Carmen de Areco",
      "url": "https://sibom.slyt.gba.gob.ar/bulletins/14203/contents/2332624",
      "contenido": "Sistema de Boletín Oficial Municipal | Buenos Aires Provincia\nINICIO\nACERCA DEL SIBOM\nBOLETINES\nMUNICIPIOS\nADMINISTRACION\nSistema de Boletines Oficiales Municipales (SIBOM)\nSistema de Boletines Oficiales Municipales (SIBOM)\nSistema de Boletines Oficiales Municipales (SIBOM)\nSistema de Boletines Oficiales Municipales (SIBOM)\nSistema de Boletines Oficiales Municipales (SIBOM)\nBoletines/Carmen de Areco\nDecreto Nº1212\nDecreto Nº 1212\nPublicado en versión extractada\nCarmen de Areco, 01/08/2025\nLa necesidad de contar con un profesional que realice, en el Centro de Día, actividades vinculadas a la educación física, Contrátese, desde el 01 de agosto de 2025 y hasta el día 31 de agosto de 2025, al Sr.\nCESTARI, NICOLAS GERMAN, Profesor de Educación Física\nRedes Sociales\nContacto\nAutoridad de Aplicación\nSecretaría General\nSubsecretaría Legal y Técnica\nGuía Servicios\nPortal de trámites\nExpedientes\nSeguridad Vial\nARBA\nBoletín Oficial\nRegistro de las Personas\nContrataciones\nVer Todos\nPolíticas de privacidad\nUso Interno\nWebmail (gba.gob.ar)\nWebmail HORDE\nSistemas\nGDEBA\nPortal del Empleado\nMesa de Ayuda\nSIAPE",
      "tablas": [],
      "montos_extraidos": [],
      "metadata": {
        "longitud_caracteres": 1110,
        "tiene_tablas": false,
        "total_tablas": 0,
        "total_montos": 0
      }
    },
    {
      "id": "2332629",
      "tipo": "decreto",
      "numero": "1213",
      "titulo": "Decreto Nº 1213",
      "fecha": "Carmen de Areco, 01/08/2025",
      "municipio": "Carmen de Areco",
      "url": "https://sibom.slyt.gba.gob.ar/bulletins/14203/contents/2332629",
      "contenido": "Sistema de Boletín Oficial Municipal | Buenos Aires Provincia\nINICIO\nACERCA DEL SIBOM\nBOLETINES\nMUNICIPIOS\nADMINISTRACION\nSistema de Boletines Oficiales Municipales (SIBOM)\nSistema de Boletines Oficiales Municipales (SIBOM)\nSistema de Boletines Oficiales Municipales (SIBOM)\nSistema de Boletines Oficiales Municipales (SIBOM)\nSistema de Boletines Oficiales Municipales (SIBOM)\nBoletines/Carmen de Areco\nDecreto Nº1213\nDecreto Nº 1213\nPublicado en versión extractada\nCarmen de Areco, 01/08/2025\nLa necesidad de contar con Servicio de Psicología para los concurrentes de Centro de Día, con diferentes talleres y proyectos, Contrátese, desde el 01 de agosto de 2025 y hasta el día 31 de agosto de 2025, a la Sra.\nMELINA SOLEDAD ENRIQUE GUAQUINCHAY\n,  Psicóloga,\nRedes Sociales\nContacto\nAutoridad de Aplicación\nSecretaría General\nSubsecretaría Legal y Técnica\nGuía Servicios\nPortal de trámites\nExpedientes\nSeguridad Vial\nARBA\nBoletín Oficial\nRegistro de las Personas\nContrataciones\nVer Todos\nPolíticas de privacidad\nUso Interno\nWebmail (gba.gob.ar)\nWebmail HORDE\nSistemas\nGDEBA\nPortal del Empleado\nMesa de Ayuda\nSIAPE",
      "tablas": [],
      "montos_extraidos": [],
      "metadata": {
        "longitud_caracteres": 1113,
        "tiene_tablas": false,
        "total_tablas": 0,
        "total_montos": 0
      }
    },
    {
      "id": "2332636",
      "tipo": "decreto",
      "numero": "1214",
      "titulo": "Decreto Nº 1214",
      "fecha": "Carmen de Areco, 01/08/2025",
      "municipio": "Carmen de Areco",
      "url": "https://sibom.slyt.gba.gob.ar/bulletins/14203/contents/2332636",
      "contenido": "Sistema de Boletín Oficial Municipal | Buenos Aires Provincia\nINICIO\nACERCA DEL SIBOM\nBOLETINES\nMUNICIPIOS\nADMINISTRACION\nSistema de Boletines Oficiales Municipales (SIBOM)\nSistema de Boletines Oficiales Municipales (SIBOM)\nSistema de Boletines Oficiales Municipales (SIBOM)\nSistema de Boletines Oficiales Municipales (SIBOM)\nSistema de Boletines Oficiales Municipales (SIBOM)\nBoletines/Carmen de Areco\nDecreto Nº1214\nDecreto Nº 1214\nPublicado en versión extractada\nCarmen de Areco, 01/08/2025\nDesígnese en Reemplazo de la\nDIRECTORA  DE LEGALES Y TÉCNICA\n, Dra.\nRABELLINO, GABRIELA ADRIANA\n,  al Sr.\nHUICI TORRETA, CLAUDIO LUCIANO,\ndesde el día 05 de agosto de 2025 hasta el día 11 de agosto de 2025 inclusive\nRedes Sociales\nContacto\nAutoridad de Aplicación\nSecretaría General\nSubsecretaría Legal y Técnica\nGuía Servicios\nPortal de trámites\nExpedientes\nSeguridad Vial\nARBA\nBoletín Oficial\nRegistro de las Personas\nContrataciones\nVer Todos\nPolíticas de privacidad\nUso Interno\nWebmail (gba.gob.ar)\nWebmail HORDE\nSistemas\nGDEBA\nPortal del Empleado\nMesa de Ayuda\nSIAPE",
      "tablas": [],
      "montos_extraidos": [],
      "metadata": {
        "longitud_caracteres": 1064,
        "tiene_tablas": false,
        "total_tablas": 0,
        "total_montos": 0
      }
    },
    {
      "id": "2332646",
      "tipo": "decreto",
      "numero": "1215",
      "titulo": "Decreto Nº 1215",
      "fecha": "Carmen de Areco, 01/08/2025",
      "municipio": "Carmen de Areco",
      "url": "https://sibom.slyt.gba.gob.ar/bulletins/14203/contents/2332646",
      "contenido": "Sistema de Boletín Oficial Municipal | Buenos Aires Provincia\nINICIO\nACERCA DEL SIBOM\nBOLETINES\nMUNICIPIOS\nADMINISTRACION\nSistema de Boletines Oficiales Municipales (SIBOM)\nSistema de Boletines Oficiales Municipales (SIBOM)\nSistema de Boletines Oficiales Municipales (SIBOM)\nSistema de Boletines Oficiales Municipales (SIBOM)\nSistema de Boletines Oficiales Municipales (SIBOM)\nBoletines/Carmen de Areco\nDecreto Nº1215\nDecreto Nº 1215\nPublicado en versión extractada\nCarmen de Areco, 01/08/2025\nLa solicitud presentada por la Sra.\nMOLINA, CAMILA AYELEN\nRedes Sociales\nContacto\nAutoridad de Aplicación\nSecretaría General\nSubsecretaría Legal y Técnica\nGuía Servicios\nPortal de trámites\nExpedientes\nSeguridad Vial\nARBA\nBoletín Oficial\nRegistro de las Personas\nContrataciones\nVer Todos\nPolíticas de privacidad\nUso Interno\nWebmail (gba.gob.ar)\nWebmail HORDE\nSistemas\nGDEBA\nPortal del Empleado\nMesa de Ayuda\nSIAPE",
      "tablas": [],
      "montos_extraidos": [],
      "metadata": {
        "longitud_caracteres": 906,
        "tiene_tablas": false,
        "total_tablas": 0,
        "total_montos": 0
      }
    },
    {
      "id": "2332650",
      "tipo": "decreto",
      "numero": "1216",
      "titulo": "Decreto Nº 1216",
      "fecha": "Carmen de Areco, 01/08/2025",
      "municipio": "Carmen de Areco",
      "url": "https://sibom.slyt.gba.gob.ar/bulletins/14203/contents/2332650",
      "contenido": "Sistema de Boletín Oficial Municipal | Buenos Aires Provincia\nINICIO\nACERCA DEL SIBOM\nBOLETINES\nMUNICIPIOS\nADMINISTRACION\nSistema de Boletines Oficiales Municipales (SIBOM)\nSistema de Boletines Oficiales Municipales (SIBOM)\nSistema de Boletines Oficiales Municipales (SIBOM)\nSistema de Boletines Oficiales Municipales (SIBOM)\nSistema de Boletines Oficiales Municipales (SIBOM)\nBoletines/Carmen de Areco\nDecreto Nº1216\nDecreto Nº 1216\nPublicado en versión extractada\nCarmen de Areco, 01/08/2025\nLa solicitud presentada por la Sra.\nDIAZ, ROCIO MARIBEL\nRedes Sociales\nContacto\nAutoridad de Aplicación\nSecretaría General\nSubsecretaría Legal y Técnica\nGuía Servicios\nPortal de trámites\nExpedientes\nSeguridad Vial\nARBA\nBoletín Oficial\nRegistro de las Personas\nContrataciones\nVer Todos\nPolíticas de privacidad\nUso Interno\nWebmail (gba.gob.ar)\nWebmail HORDE\nSistemas\nGDEBA\nPortal del Empleado\nMesa de Ayuda\nSIAPE",
      "tablas": [],
      "montos_extraidos": [],
      "metadata": {
        "longitud_caracteres": 904,
        "tiene_tablas": false,
        "total_tablas": 0,
        "total_montos": 0
      }
    },
    {
      "id": "2332655",
      "tipo": "decreto",
      "numero": "1217",
      "titulo": "Decreto Nº 1217",
      "fecha": "Carmen de Areco, 01/08/2025",
      "municipio": "Carmen de Areco",
      "url": "https://sibom.slyt.gba.gob.ar/bulletins/14203/contents/2332655",
      "contenido": "Sistema de Boletín Oficial Municipal | Buenos Aires Provincia\nINICIO\nACERCA DEL SIBOM\nBOLETINES\nMUNICIPIOS\nADMINISTRACION\nSistema de Boletines Oficiales Municipales (SIBOM)\nSistema de Boletines Oficiales Municipales (SIBOM)\nSistema de Boletines Oficiales Municipales (SIBOM)\nSistema de Boletines Oficiales Municipales (SIBOM)\nSistema de Boletines Oficiales Municipales (SIBOM)\nBoletines/Carmen de Areco\nDecreto Nº1217\nDecreto Nº 1217\nPublicado en versión extractada\nCarmen de Areco, 01/08/2025\nLa solicitud presentada por la Sra.\nVIVAS, OLGA NOEMI\nRedes Sociales\nContacto\nAutoridad de Aplicación\nSecretaría General\nSubsecretaría Legal y Técnica\nGuía Servicios\nPortal de trámites\nExpedientes\nSeguridad Vial\nARBA\nBoletín Oficial\nRegistro de las Personas\nContrataciones\nVer Todos\nPolíticas de privacidad\nUso Interno\nWebmail (gba.gob.ar)\nWebmail HORDE\nSistemas\nGDEBA\nPortal del Empleado\nMesa de Ayuda\nSIAPE",
      "tablas": [],
      "montos_extraidos": [],
      "metadata": {
        "longitud_caracteres": 902,
        "tiene_tablas": false,
        "total_tablas": 0,
        "total_montos": 0
      }
    },
    {
      "id": "2332661",
      "tipo": "decreto",
      "numero": "1218",
      "titulo": "Decreto Nº 1218",
      "fecha": "Carmen de Areco, 01/08/2025",
      "municipio": "Carmen de Areco",
      "url": "https://sibom.slyt.gba.gob.ar/bulletins/14203/contents/2332661",
      "contenido": "Sistema de Boletín Oficial Municipal | Buenos Aires Provincia\nINICIO\nACERCA DEL SIBOM\nBOLETINES\nMUNICIPIOS\nADMINISTRACION\nSistema de Boletines Oficiales Municipales (SIBOM)\nSistema de Boletines Oficiales Municipales (SIBOM)\nSistema de Boletines Oficiales Municipales (SIBOM)\nSistema de Boletines Oficiales Municipales (SIBOM)\nSistema de Boletines Oficiales Municipales (SIBOM)\nBoletines/Carmen de Areco\nDecreto Nº1218\nDecreto Nº 1218\nPublicado en versión extractada\nCarmen de Areco, 01/08/2025\nLa solicitud presentada por el Sr.\nBARRIOS, OSVALDO OSCAR\nRedes Sociales\nContacto\nAutoridad de Aplicación\nSecretaría General\nSubsecretaría Legal y Técnica\nGuía Servicios\nPortal de trámites\nExpedientes\nSeguridad Vial\nARBA\nBoletín Oficial\nRegistro de las Personas\nContrataciones\nVer Todos\nPolíticas de privacidad\nUso Interno\nWebmail (gba.gob.ar)\nWebmail HORDE\nSistemas\nGDEBA\nPortal del Empleado\nMesa de Ayuda\nSIAPE",
      "tablas": [],
      "montos_extraidos": [],
      "metadata": {
        "longitud_caracteres": 906,
        "tiene_tablas": false,
        "total_tablas": 0,
        "total_montos": 0
      }
    },
    {
      "id": "2332664",
      "tipo": "decreto",
      "numero": "1219",
      "titulo": "Decreto Nº 1219",
      "fecha": "Carmen de Areco, 01/08/2025",
      "municipio": "Carmen de Areco",
      "url": "https://sibom.slyt.gba.gob.ar/bulletins/14203/contents/2332664",
      "contenido": "Sistema de Boletín Oficial Municipal | Buenos Aires Provincia\nINICIO\nACERCA DEL SIBOM\nBOLETINES\nMUNICIPIOS\nADMINISTRACION\nSistema de Boletines Oficiales Municipales (SIBOM)\nSistema de Boletines Oficiales Municipales (SIBOM)\nSistema de Boletines Oficiales Municipales (SIBOM)\nSistema de Boletines Oficiales Municipales (SIBOM)\nSistema de Boletines Oficiales Municipales (SIBOM)\nBoletines/Carmen de Areco\nDecreto Nº1219\nDecreto Nº 1219\nPublicado en versión extractada\nCarmen de Areco, 01/08/2025\nLa solicitud presentada por el Sr.\nQUIROGA, JUAN CARLOS\nRedes Sociales\nContacto\nAutoridad de Aplicación\nSecretaría General\nSubsecretaría Legal y Técnica\nGuía Servicios\nPortal de trámites\nExpedientes\nSeguridad Vial\nARBA\nBoletín Oficial\nRegistro de las Personas\nContrataciones\nVer Todos\nPolíticas de privacidad\nUso Interno\nWebmail (gba.gob.ar)\nWebmail HORDE\nSistemas\nGDEBA\nPortal del Empleado\nMesa de Ayuda\nSIAPE",
      "tablas": [],
      "montos_extraidos": [],
      "metadata": {
        "longitud_caracteres": 904,
        "tiene_tablas": false,
        "total_tablas": 0,
        "total_montos": 0
      }
    },
    {
      "id": "2332667",
      "tipo": "decreto",
      "numero": "1220",
      "titulo": "Decreto Nº 1220",
      "fecha": "Carmen de Areco, 01/08/2025",
      "municipio": "Carmen de Areco",
      "url": "https://sibom.slyt.gba.gob.ar/bulletins/14203/contents/2332667",
      "contenido": "Sistema de Boletín Oficial Municipal | Buenos Aires Provincia\nINICIO\nACERCA DEL SIBOM\nBOLETINES\nMUNICIPIOS\nADMINISTRACION\nSistema de Boletines Oficiales Municipales (SIBOM)\nSistema de Boletines Oficiales Municipales (SIBOM)\nSistema de Boletines Oficiales Municipales (SIBOM)\nSistema de Boletines Oficiales Municipales (SIBOM)\nSistema de Boletines Oficiales Municipales (SIBOM)\nBoletines/Carmen de Areco\nDecreto Nº1220\nDecreto Nº 1220\nPublicado en versión extractada\nCarmen de Areco, 01/08/2025\nLa necesidad de contratar el Servicio Profesional de un Acompañante Terapéutico para el CAPS Dr. Rafael Echenique; y;Contrátese, dado que el Municipio no cuenta en la planta con personal profesional afectado y/o dedicado a la tarea descripta en los vistos y considerando, desde el 01 de agosto de 2025 y hasta el día 31 de agosto de 2025, al Sr.\nCASAL, LAUREANO GUIDO, Acompañante Terapéutico\nRedes Sociales\nContacto\nAutoridad de Aplicación\nSecretaría General\nSubsecretaría Legal y Técnica\nGuía Servicios\nPortal de trámites\nExpedientes\nSeguridad Vial\nARBA\nBoletín Oficial\nRegistro de las Personas\nContrataciones\nVer Todos\nPolíticas de privacidad\nUso Interno\nWebmail (gba.gob.ar)\nWebmail HORDE\nSistemas\nGDEBA\nPortal del Empleado\nMesa de Ayuda\nSIAPE",
      "tablas": [],
      "montos_extraidos": [],
      "metadata": {
        "longitud_caracteres": 1241,
        "tiene_tablas": false,
        "total_tablas": 0,
        "total_montos": 0
      }
    },
    {
      "id": "2332670",
      "tipo": "decreto",
      "numero": "1221",
      "titulo": "Decreto Nº 1221",
      "fecha": "Carmen de Areco, 01/08/2025",
      "municipio": "Carmen de Areco",
      "url": "https://sibom.slyt.gba.gob.ar/bulletins/14203/contents/2332670",
      "contenido": "Sistema de Boletín Oficial Municipal | Buenos Aires Provincia\nINICIO\nACERCA DEL SIBOM\nBOLETINES\nMUNICIPIOS\nADMINISTRACION\nSistema de Boletines Oficiales Municipales (SIBOM)\nSistema de Boletines Oficiales Municipales (SIBOM)\nSistema de Boletines Oficiales Municipales (SIBOM)\nSistema de Boletines Oficiales Municipales (SIBOM)\nSistema de Boletines Oficiales Municipales (SIBOM)\nBoletines/Carmen de Areco\nDecreto Nº1221\nDecreto Nº 1221\nPublicado en versión extractada\nCarmen de Areco, 01/08/2025\nLa necesidad de contratar el Servicio de Enfermería para el CAPS Dr. Norberto Cervi; Contrátese, dado que el Municipio no cuenta en la planta con personal profesional afectado y/o dedicado a la tarea descripta en los vistos del presente, desde el 01 de agosto de 2025 y hasta el día 31 de agosto de 2025, a la Sra.\nTORRETTA, ANGELA AMERICA\n,\nEnfermera\nRedes Sociales\nContacto\nAutoridad de Aplicación\nSecretaría General\nSubsecretaría Legal y Técnica\nGuía Servicios\nPortal de trámites\nExpedientes\nSeguridad Vial\nARBA\nBoletín Oficial\nRegistro de las Personas\nContrataciones\nVer Todos\nPolíticas de privacidad\nUso Interno\nWebmail (gba.gob.ar)\nWebmail HORDE\nSistemas\nGDEBA\nPortal del Empleado\nMesa de Ayuda\nSIAPE",
      "tablas": [],
      "montos_extraidos": [],
      "metadata": {
        "longitud_caracteres": 1200,
        "tiene_tablas": false,
        "total_tablas": 0,
        "total_montos": 0
      }
    },
    {
      "id": "2332674",
      "tipo": "decreto",
      "numero": "1222",
      "titulo": "Decreto Nº 1222",
      "fecha": "Carmen de Areco, 01/08/2025",
      "municipio": "Carmen de Areco",
      "url": "https://sibom.slyt.gba.gob.ar/bulletins/14203/contents/2332674",
      "contenido": "Sistema de Boletín Oficial Municipal | Buenos Aires Provincia\nINICIO\nACERCA DEL SIBOM\nBOLETINES\nMUNICIPIOS\nADMINISTRACION\nSistema de Boletines Oficiales Municipales (SIBOM)\nSistema de Boletines Oficiales Municipales (SIBOM)\nSistema de Boletines Oficiales Municipales (SIBOM)\nSistema de Boletines Oficiales Municipales (SIBOM)\nSistema de Boletines Oficiales Municipales (SIBOM)\nBoletines/Carmen de Areco\nDecreto Nº1222\nDecreto Nº 1222\nPublicado en versión extractada\nCarmen de Areco, 01/08/2025\nLa necesidad de contratar el Servicio Profesional de un médico clínico para el CAPS Dr. Rafael Echenique; y;Contrátese, dado que el Municipio no cuenta en la planta con personal profesional afectado y/o dedicado a la tarea descripta en los vistos y considerando del presente, desde el 01 de agosto de 2025 y hasta el día 31 de agosto de 2025, al Sr.\nSILVA, MIGUEL ANGEL, Médico,\nRedes Sociales\nContacto\nAutoridad de Aplicación\nSecretaría General\nSubsecretaría Legal y Técnica\nGuía Servicios\nPortal de trámites\nExpedientes\nSeguridad Vial\nARBA\nBoletín Oficial\nRegistro de las Personas\nContrataciones\nVer Todos\nPolíticas de privacidad\nUso Interno\nWebmail (gba.gob.ar)\nWebmail HORDE\nSistemas\nGDEBA\nPortal del Empleado\nMesa de Ayuda\nSIAPE",
      "tablas": [],
      "montos_extraidos": [],
      "metadata": {
        "longitud_caracteres": 1227,
        "tiene_tablas": false,
        "total_tablas": 0,
        "total_montos": 0
      }
    }
  ],
  "metadata_boletin": {
    "total_caracteres": 66280,
    "total_tablas": 0,
    "total_montos": 1,
    "fecha_scraping": "2026-01-16T08:01:08Z",
    "version_scraper": "2.0"
  }
}